ವೈನ್‌ನಂತೆಯೇ, "ಜಾನಿ ಡೇಂಜರಸ್ಲಿ" ಪ್ರತಿದಿನವೂ ಉತ್ತಮಗೊಳ್ಳುತ್ತದೆ. ಈ ಬುದ್ಧಿವಂತ, ಹಾಸ್ಯಮಯ, ಉತ್ತಮವಾಗಿ ನಟಿಸಿದ ಚಿತ್ರವು ತನ್ನದೇ ಆದ ಮೇಲೆ ನಿಲ್ಲಬಲ್ಲದು - ಆದರೆ ದರೋಡೆಕೋರ ಪ್ರಕಾರದ ವಿಡಂಬನೆಯಂತೆ, ಇದು ನಿಜಕ್ಕೂ ಮಹೋನ್ನತವಾಗಿದೆ. ವಾಸ್ತವವಾಗಿ, ಇದು ಸ್ಪಷ್ಟವಾಗಿ ಈ ರೀತಿಯ ಅತ್ಯುತ್ತಮ ಚಿತ್ರವಾಗಿದೆ ... ಜನಸಮೂಹ ಚಲನಚಿತ್ರಗಳ ತಮಾಷೆಯ ವಂಚನೆ ಮತ್ತು ಆಯಾ ಅವಧಿಯೂ ಸಹ - ಆದಾಗ್ಯೂ, ಒಪ್ಪಿಕೊಳ್ಳಬೇಕಾದರೆ, ಅದರ ಮುಖ್ಯ ಪ್ರತಿಸ್ಪರ್ಧಿಗಳು ಅಂತಹ ಪ್ರಾಚೀನ, ಅಶ್ಲೀಲ ಮತ್ತು ಮಂದ ಸೂಡೊಕೊಮೆಡಿಗಳಾಗಿದ್ದಾಗ ಈ ಸ್ಥಾನವನ್ನು ಸಾಧಿಸುವುದು ಸುಲಭವಾಗಿದೆ. "ಜೇನ್ ಆಸ್ಟೆನ್ಸ್ ಮಾಫಿಯಾ" ಎಂದು.#1
ಫ್ಲೋಕ್ ಅನ್ನು ಅನ್ಯಾಯವಾಗಿ ಕಡಿಮೆ "ಸೆ 7 ಜೆನ್" ರಿಪ್ಆಫ್ ಎಂದು ನಿಂದಿಸಲಾಗಿದೆ. ಅಂತಿಮ ಮುಖಾಮುಖಿಯಲ್ಲಿನ ಇದೇ ರೀತಿಯ ದೃಶ್ಯಾವಳಿಗಳನ್ನು ಹೊರತುಪಡಿಸಿ ಎರಡನ್ನೂ ಹೋಲಿಸಲು ನಿಜವಾಗಿಯೂ ಯಾವುದೇ ಕಾರಣಗಳಿಲ್ಲ. <br /> <br /> ಈಗ ಅದು ಹೊರಬಂದಿಲ್ಲ, ಕೆಲವು ವಿಷಯಗಳಲ್ಲಿ ಫ್ಲೋಕ್ ಏಕೆ ತುಂಬಾ ಆಸಕ್ತಿದಾಯಕವಾಗಿದೆ ಎಂದು ನಾನು ಹೋಗುತ್ತೇನೆ. ಹೆಚ್ಚಾಗಿ ಇದು ಲೈಂಗಿಕ ಅಪರಾಧಿಗಳನ್ನು ಮೇಲ್ವಿಚಾರಣೆ ಮಾಡುವ ಅತ್ಯಂತ ಜಾಗರೂಕ ಸಮಾಜ ಸೇವಕನ ಬಗ್ಗೆ ಪೂರ್ಣವಾಗಿ ಹಾರಿಬಂದ ಥ್ರಿಲ್ಲರ್ ಗಿಂತ ನಾಟಕದ ತುಣುಕು. ಅವರ ಕೆಲಸವು ಅವನಿಗೆ ಉತ್ತಮವಾಗಿದೆ ಎಂದು ಪ್ರಾರಂಭದಲ್ಲಿಯೇ ನೀವು ಸ್ಪಷ್ಟವಾಗಿ ನೋಡಬಹುದು. ಎರಡು ದೃಶ್ಯಗಳಲ್ಲಿ ಸಾಕ್ಷಿಯಾಗಿದೆ, ಅಲ್ಲಿ ಅವನು ಮೊದಲು ಅಪರಾಧಿಯನ್ನು ಸಂದರ್ಶಿಸುತ್ತಾನೆ ಮತ್ತು ಒಬ್ಬ ಮಹಿಳೆ ಅವನನ್ನು ಎತ್ತಿಕೊಂಡು ಹೋಗಲು ಪ್ರಯತ್ನಿಸಿದಾಗ ಅವನನ್ನು ಕಪಾಳಮೋಕ್ಷ ಮಾಡುತ್ತಾನೆ ಮತ್ತು ಅವನ ಪ್ರಶ್ನಾವಳಿಯಿಂದ ಅವನ ಪ್ರಮಾಣಿತ ಪ್ರಶ್ನೆಗಳೆಂದು ಅವನು ಯೋಚಿಸಬಹುದು. <br /> <br /> ಗೆರೆ ತುಂಬಾ ಒಳ್ಳೆಯದು ಎರ್ರೋಲ್ ಬ್ಯಾಬೇಜ್, ಮೇಲೆ ತಿಳಿಸಿದ ಸಮಾಜ ಸೇವಕ. ಅವನ ಕೆಲಸವನ್ನು ನಿರ್ವಹಿಸುವ ವಿಧಾನವು ಪೊಲೀಸ್ ಅಧಿಕಾರಿಯಂತಲ್ಲ, ಅವನು ಬಂದೂಕನ್ನು ಹೊತ್ತುಕೊಂಡು ನಿರಂತರವಾಗಿ ಪತ್ರಿಕೆಗಳನ್ನು ಪರಿಶೀಲಿಸುತ್ತಿದ್ದಾನೆ ಮತ್ತು ಕಾನೂನು ಅಧಿಕಾರಿಗಳಿಗೆ ತನ್ನ "ಹಿಂಡು" ಕೆಲವು ಲೈಂಗಿಕ ಅಪರಾಧಕ್ಕೆ ಕಾರಣವಾಗಿದ್ದರೆ ಮಾಹಿತಿಯನ್ನು ಒದಗಿಸುತ್ತಾನೆ. ಅವನು ಬದುಕುವ ಎಲ್ಲಾ ಸಂತೋಷವನ್ನು ಕಳೆದುಕೊಂಡಿರುವ ವ್ಯಕ್ತಿಯೂ ಆಗಿದ್ದಾನೆ ಮತ್ತು ಅವನ ಹಿಂಡಿನ ಮೇಲೆ ತನ್ನದೇ ಆದ ಜಾಗರೂಕ ನ್ಯಾಯವನ್ನು ಪಡೆದುಕೊಳ್ಳುವುದರಿಂದ ಅವನ ಏಕೈಕ ಪರಿಹಾರವು ಕಂಡುಬರುತ್ತದೆ. ಎರಡು ಬಾರಿ ನೀವು ಅವನ ಕಿರುನಗೆಯನ್ನು ನೋಡುತ್ತೀರಿ, ಒಮ್ಮೆ ಅವನು ತನ್ನ ಸಂಗಾತಿಗೆ ಅಸಭ್ಯವಾಗಿ ವರ್ತಿಸಿದ್ದಕ್ಕಾಗಿ ಕ್ಷಮೆಯಾಚಿಸಿದಾಗ ಮತ್ತು ಇನ್ನೊಬ್ಬನು ತನ್ನ ಹಿಂಡಿನ ಸದಸ್ಯನನ್ನು ಹೊಡೆದ ನಂತರ. <br /> <br /> ಸಸ್ಪೆನ್ಸ್ ಫ್ಲಿಕ್ ಆಗಿ, ದಿ ಫ್ಲೋಕ್ ಅಷ್ಟೊಂದು ಯಶಸ್ವಿಯಾಗುವುದಿಲ್ಲ. ಸ್ವಲ್ಪ ಗೊಂದಲಮಯವಾಗಿದೆ ಮತ್ತು ಕೆಲವು ಕಿರಿಕಿರಿಯುಂಟುಮಾಡುವ ಕಥಾವಸ್ತುವಿನ ರಂಧ್ರಗಳನ್ನು ಹೊಂದಿದೆ ಆದರೆ ಇದು ಹಲವಾರು ಗಮನಾರ್ಹವಾದ ಸೆಟ್ ತುಣುಕುಗಳನ್ನು ಹೊಂದಿದೆ. <br /> <br /> ಒಟ್ಟಾರೆ ದಿ ಫ್ಲಾಕ್ ಎನ್ನುವುದು ಮನುಷ್ಯನು ಅಮಾನವೀಯ ಕೆಲಸವನ್ನು ಮಾಡುವ ಬಗ್ಗೆ ಒಂದು ಘನ ನಾಟಕವಾಗಿದೆ ಮತ್ತು ಕೊನೆಯಲ್ಲಿ ಅವನು ಕಷ್ಟಪಟ್ಟು ಕೆಲಸ ಮಾಡಬೇಕಾಗುತ್ತದೆ ಅವನು ತನ್ನನ್ನು ಸುತ್ತುವರೆದಿರುವ ಪ್ರಪಾತದಿಂದ ನುಂಗುವುದನ್ನು ತಡೆಯಲು. ನಾವು ವಾಸಿಸುವ ಜಗತ್ತು ಬಹಳ ಅನಾರೋಗ್ಯದ ಸ್ಥಳವಾಗಿದೆ ಮತ್ತು ಮತ್ತಷ್ಟು ಆ ವ್ಯಕ್ತಿಯು ಹೆಚ್ಚು ಸಂತೋಷದಿಂದ ದೂರವಿರಬಹುದು. ಹಿಂಡು ಆ ಹಂತವನ್ನು ಚೆನ್ನಾಗಿ ಪಡೆಯುತ್ತದೆ.#1
ಈ ಚಲನಚಿತ್ರವು ಕೆಟ್ಟದ್ದಾಗಿದೆ ಎಂದು ನಾನು ಹೇಳುವುದಿಲ್ಲ, ಆದರೆ ಅದು ಉತ್ತಮವಾಗಿಲ್ಲ. ನಾನು ಏನಾದರೂ ಒಳ್ಳೆಯದನ್ನು ನಿರೀಕ್ಷಿಸಿದ್ದೇನೆ ಆದರೆ ಹಮ್ ಆಪ್ಕೆ ಹೈ ಕೌನ್ ಇದಕ್ಕಿಂತ ಉತ್ತಮವಾಗಿದೆ ಎಂದು ನಾನು ess ಹಿಸುತ್ತೇನೆ. ಇದು ಸಂಪೂರ್ಣವಾಗಿ ಹಳೆಯ ಶೈಲಿಯಾಗಿತ್ತು. ಈ ಚಿತ್ರದ ಪ್ರತಿಯೊಂದು ಹಂತದಲ್ಲೂ, ನಾನು ಕೆಲವು ತಿರುವುಗಳನ್ನು ನಿರೀಕ್ಷಿಸಿದ್ದೇನೆ ಮತ್ತು ನಾನು ಏನು ಪಡೆಯುತ್ತೇನೆ? ಹುಡುಗಿ ಸುಟ್ಟುಹೋಗುತ್ತದೆ ಮತ್ತು ಚಿಕ್ಕಮ್ಮನ ಪ್ರೀತಿಯನ್ನು ಗೆಲ್ಲುತ್ತದೆ. <br /> <br /> ನಿಶ್ಚಿತಾರ್ಥದ ಹೊರತಾಗಿಯೂ, ಅವರು ಮಾಡುವ ಪ್ರತಿಯೊಂದು ಸಣ್ಣ ನಡೆಯಕ್ಕೂ ಅವರು ಅನುಮತಿ ಪಡೆಯಬೇಕು. ಎಷ್ಟೋ ಸಭೆಗಳ ನಂತರವೂ ಅವರು ತುಂಬಾ ನಾಚಿಕೆಪಡುತ್ತಾರೆ. ಚಿಕ್ಕಮ್ಮ ಅದಕ್ಕಿಂತ ಹೆಚ್ಚು ಕ್ರೂರ ಎಂದು ನಾನು ನಿರೀಕ್ಷಿಸಿದ್ದೆ. ಅವಳು ಮಾಡಿದ್ದನ್ನೆಲ್ಲ ಹುಚ್ಚನಂತೆ ಕೊಟ್ಟಿಗೆ. <br /> <br /> ಹೇ, ನಮಗೂ ಮಕ್ಕಳಿದ್ದಾರೆ, ಆದರೆ ನಾವು ಅವರನ್ನು ನೋಡುವುದಿಲ್ಲ ಮತ್ತು ನಮ್ಮ ಕಣ್ಣಲ್ಲಿ ಯಾವಾಗಲೂ ಕಣ್ಣೀರು ಇರುವುದಿಲ್ಲ. ಈ ಚಿತ್ರ ಒಂದು ಕನಸು. ಸಂತೋಷದ ಕುಟುಂಬ, ಒಬ್ಬ ಕ್ರೂರ ಮಹಿಳೆ, ಒಳ್ಳೆಯ ಮಾವ ಮತ್ತು ಅವಳನ್ನು ಸಾವಿಗೆ ಪ್ರೀತಿಸುವ ವ್ಯಕ್ತಿ. HAHK ನಲ್ಲಿ ಅನುಪಮ್ ಖೇರ್ ಬಡ ವಧುವಿನ ತಂದೆ ಮತ್ತು ಈಗ ಅದು ತದ್ವಿರುದ್ದವಾಗಿದೆ. ಮತ್ತು ಈ ಚಿತ್ರದಲ್ಲಿ ಮೊಹ್ನೀಶ್ ಬೆಹ್ಲ್ ಇರುತ್ತಾರೆ ಎಂದು ನನಗೆ ಹೇಗಾದರೂ ತಿಳಿದಿತ್ತು. ಹೇಗಾದರೂ ನಾನು ನನ್ನ ಸಮಯವನ್ನು ವ್ಯರ್ಥ ಮಾಡಿದ್ದೇನೆ ಎಂದು ನಾನು ನಂಬುತ್ತೇನೆ. ನಾನು ಅದನ್ನು 2/10 ನೀಡುತ್ತೇನೆ.#0
ಒಂದು ರೀತಿಯಲ್ಲಿ, ಈ ಚಿತ್ರವು ನನಗೆ "ಜಂಪಿಂಗ್ ಜ್ಯಾಕ್ ಫ್ಲ್ಯಾಶ್" ಅನ್ನು ನೆನಪಿಸಿತು. ಚೂರುಚೂರು ಯಂತ್ರದಲ್ಲಿ ವೂಪಿ ಗೋಲ್ಡ್ ಬರ್ಗ್ ನೆನಪಿದೆಯೇ? ವೂಪಿ ನೆಮ್ಮದಿಗಳನ್ನು ಹೊರಹಾಕಿದ್ದೀರಾ? ವೂಪಿ ಬ್ಲೈಂಡ್ ನಿಂಬೆ ಮತ್ತು ಮಿಕ್ ಜಾಗರ್ ಅನ್ನು ಅನುಕರಿಸುವುದು? ಚಲನಚಿತ್ರದಲ್ಲಿ ಉತ್ತಮ ಕ್ಷಣಗಳನ್ನು ಸೆರೆಹಿಡಿಯಲಾಗಿದೆ ಆದರೆ ಚಲನಚಿತ್ರವು ಇನ್ನೂ ಒಂದು ರೀತಿಯ ಹೀರಿಕೊಳ್ಳುತ್ತದೆ, ಸರಿ? "ರಿಚ್ ಇನ್ ಲವ್" ಬಗ್ಗೆ ನಾನು ಹೇಗೆ ಭಾವಿಸುತ್ತೇನೆ. ಒಬ್ಬ ಮನುಷ್ಯನು ತನ್ನ ಹೆಂಡತಿಯನ್ನು ಮೊದಲ ಬಾರಿಗೆ ಹಾಡುವುದನ್ನು ಕೇಳುತ್ತಾನೆ. ನಂತರದ ಕಾಯಿಲೆಯ ಹದಿಹರೆಯದವರು ಪ್ರೀತಿಯ ಸ್ವರೂಪದ ಬಗ್ಗೆ ಮಾತನಾಡುತ್ತಾರೆ. ಆಲ್ಬರ್ಟ್ ಫಿನ್ನೆ ಐಸ್ ಕ್ರೀಮ್ ಅನ್ನು ಬಕೆಟ್ನಿಂದ ತಿನ್ನುತ್ತಾನೆ ಮತ್ತು ಮತ್ತೊಂದು ದೃಶ್ಯದಲ್ಲಿ, ಅವನ ಗೈರುಹಾಜರಿಯ ಹೆಂಡತಿಯ ಬಗ್ಗೆ ಸುಂದರವಾದ ಎಚ್ಚರಗೊಳ್ಳುವ ಕ್ಷಣವನ್ನು ಹೊಂದಿದ್ದಾನೆ. ಆಲ್ಫ್ರೆ ವುಡಾರ್ಡ್ ತನ್ನ ನಟನಾ ವಾರ್ಡ್ರೋಬ್ಗೆ ಮತ್ತೊಂದು ವರ್ಣರಂಜಿತ ಪಾತ್ರವನ್ನು ಸೇರಿಸುತ್ತಾನೆ. ಆದರೆ ಇಲ್ಲಿ ಕಥಾವಸ್ತುವಿನ ಪಿಸುಮಾತು ಮಾತ್ರ ಇದೆ ಮತ್ತು ಅದು ಚಲಿಸುವವರೆಗೆ ನೀವು ಕಾಯಲು ಸಾಧ್ಯವಿಲ್ಲ. ಮಾಜಿ-ಗೋ-ಗೊಸ್ನ ಷಾರ್ಲೆಟ್ ಕೆಫೆಯ ದಿ ಗ್ರೇಸಸ್ ಒಂದು ದೊಡ್ಡ ಪಾಪ್ ಹಾಡನ್ನು ಪುನರುಜ್ಜೀವನಗೊಳಿಸಿದಾಗ ಮಾತ್ರ ಚಿತ್ರ ಎಚ್ಚರಗೊಳ್ಳುತ್ತದೆ ... ಮತ್ತು ಅದು ಮುಗಿದಿದೆ! <br /> <br /> ಈ ಚಿತ್ರವು ಬೇಸಿಗೆಯ ದಿನಕ್ಕೆ ಸೋಮಾರಿಯಾದ ದಿನಕ್ಕೆ ಸಮಾನವಾಗಿರುತ್ತದೆ ಆಳವಾದ ಅಮೇರಿಕನ್ ದಕ್ಷಿಣ.#1
ನಾನು ಜೋಕ್ಗಳನ್ನು ಚೆನ್ನಾಗಿ ಅರ್ಥಮಾಡಿಕೊಂಡಿದ್ದೇನೆ, ಅವು ಉತ್ತಮವಾಗಿಲ್ಲ. ಪ್ರದರ್ಶನ ಭಯಾನಕವಾಗಿದೆ. ನಾನು ಅದನ್ನು ಅರ್ಥಮಾಡಿಕೊಂಡಿದ್ದೇನೆ ಮತ್ತು ಅದು ಅದರ ಬಗ್ಗೆ ಮತ್ತೊಂದು ಭಯಾನಕ ವಿಷಯವಾಗಿದೆ. ಪ್ರದರ್ಶನದಲ್ಲಿದ್ದ ಏಕೈಕ ತಂಪಾದ ಪಾತ್ರವೆಂದರೆ ಆ ಒಂದು ಸಂಚಿಕೆಯಲ್ಲಿ ಒಂದು ಹೋಬೋ, ಆದರೆ ನಂತರ ನಾನು ಆ ಎಪಿಸೋಡ್ ಸೇರಿದಂತೆ ಇತರ ಎಪಿಸೋಡ್ ಅನ್ನು ನೋಡುತ್ತೇನೆ ಮತ್ತು ಪ್ರದರ್ಶನವು ಭಯಾನಕವಾಗಿದೆ. ಇದು ತಮಾಷೆಯಲ್ಲ, ತಮಾಷೆಯಾಗಿಲ್ಲ! ಜನರು "ಸ್ಮಾರ್ಟ್ ಜನರು ಮಾತ್ರ ಅದನ್ನು ಪಡೆಯುತ್ತಾರೆ" ಎಂದು ಹೇಳುವುದನ್ನು ನಾನು ಬಯಸುವುದಿಲ್ಲ ಏಕೆಂದರೆ ಅವರು ತುಂಬಾ ಸ್ಮಾರ್ಟ್ ಆಗಿದ್ದರೆ ಅವರು ತಿಳಿದಿಲ್ಲದ ಜನರನ್ನು ಏಕೆ ನಿರ್ಣಯಿಸುತ್ತಾರೆ ಮತ್ತು ಅವರು ಅದನ್ನು ಅರ್ಥಮಾಡಿಕೊಳ್ಳುವಷ್ಟು ಬುದ್ಧಿವಂತರು ಅಥವಾ ಬುದ್ಧಿಜೀವಿಗಳಲ್ಲ ಎಂದು ಹೇಳುತ್ತಾರೆ? ಇದು "ಆಕಾಶವು ಕೆಂಪು" ಎಂದು ಹೇಳುವಂತಿದೆ ಆದರೆ ಹೊರಗೆ ಎಂದಿಗೂ ನೋಡುವುದಿಲ್ಲ. ಹೇಗಾದರೂ, ಇದು ನನ್ನ ಜೀವನದಲ್ಲಿ ನಾನು ಕಂಡ ಅತ್ಯಂತ ಕೆಟ್ಟ ಪ್ರದರ್ಶನವಾಗಿದೆ, ಹಾಸ್ಯಗಳು ಭಯಾನಕವಾಗಿವೆ, ಅಂದರೆ, ನೀವು ಅವುಗಳನ್ನು ಅರ್ಥಮಾಡಿಕೊಳ್ಳಬಹುದು, ಅವು ಕೇವಲ ಭಯಂಕರವಾಗಿವೆ, ಅವಳ ವಿವಾದವು ತುಂಬಾ ಕುಂಟಾಗಿದೆ, ಅವಳ ದೂರದ ಹಾಸ್ಯಗಳು ಮತ್ತು ದೈಹಿಕ ಇತರ ಹಾಸ್ಯಗಳು ದ್ರವಗಳು ನಿಜವಾಗಿಯೂ ಮೂಕ ಮತ್ತು ಸಾಮಾನ್ಯವಾಗಿ ಕೆಟ್ಟ ನಟನೆಯನ್ನು ಒಳಗೊಂಡಿರುತ್ತವೆ. ಈ ಪ್ರದರ್ಶನದಲ್ಲಿ ಈ "ಸ್ಮಾರ್ಟ್" ಜನರು ಏನು ನೋಡುತ್ತಾರೆಂದು ನನಗೆ ಖಚಿತವಿಲ್ಲ, ಆದರೆ ನಮ್ಮಲ್ಲಿ ಯಾರ ಬಗ್ಗೆಯೂ ಏನೂ ತಿಳಿದಿಲ್ಲದಿದ್ದಾಗ ಇತರರನ್ನು ನಿರ್ಣಯಿಸುವುದು ನಿಖರವಾಗಿ ಒಂದು ಉತ್ತಮ ಕಾಮೆಂಟ್ ಅಲ್ಲ.#0
ನಾನು ಹತ್ತು ಸ್ಟಾರ್ ರೇಟಿಂಗ್‌ಗಳನ್ನು ಸುಲಭವಾಗಿ ಹಸ್ತಾಂತರಿಸುವುದಿಲ್ಲ. ಒಂದು ಚಲನಚಿತ್ರವು ನಿಜವಾಗಿಯೂ ನನ್ನನ್ನು ಮೆಚ್ಚಿಸಬೇಕಾಗಿದೆ, ಮತ್ತು ದಿ ಬೌರ್ನ್ ಅಲ್ಟಿಮೇಟಮ್ ಅದನ್ನು ಮೀರಿದೆ. ಇದಲ್ಲದೆ, ಈ ಟ್ರೈಲಾಜಿ ತುಂಬಾ ಚೆನ್ನಾಗಿ ಸೇರಿಕೊಂಡಿದೆ, ಇದು ನಮ್ಮ ಕಾಲದ ಶ್ರೇಷ್ಠ ಚಲನೆಯ ಚಿತ್ರ ಟ್ರೈಲಾಜಿಗಳಲ್ಲಿ ಒಂದಾಗಿದೆ ಎಂದು ನಾನು ನಂಬುತ್ತೇನೆ. ಈ ಮೂರೂ ಚಿತ್ರಗಳು ಲುಡ್ಲಮ್ ಕಾದಂಬರಿಗಳಿಗಿಂತ ಹೆಚ್ಚು ಭಿನ್ನವಾಗಿರಲು ಸಾಧ್ಯವಾಗದಿದ್ದರೂ, ಅವು ಇನ್ನೂ ಸಿನಿಮೀಯ ಸಾಧನೆಯಲ್ಲಿ ಪ್ರಬಲ ಹೆಗ್ಗುರುತಾಗಿ ನಿಂತಿವೆ. ಬೌರ್ನ್ ಅಲ್ಟಿಮೇಟಮ್ ಸರಣಿಯು ಪೂರ್ಣಗೊಂಡಿದೆ ಎಂದು ಅಳಲು ಬಯಸಿದೆ, ಆದರೂ ನನಗೆ ಗಂಟೆಗಟ್ಟಲೆ ನಗುವುದನ್ನು ನಿಲ್ಲಿಸಲು ಸಹ ಸಾಧ್ಯವಾಗಲಿಲ್ಲ. <br /> <br /> ಆರಂಭಿಕ ಶೀರ್ಷಿಕೆ ಕಾಣಿಸಿಕೊಂಡ ಕ್ಷಣದಿಂದ, ನಾವು ಒಂದು ಸವಾರಿ. ಪಾಲ್ ಗ್ರೀನ್‌ಗ್ರಾಸ್ ಅದನ್ನು ಮತ್ತೆ ಮಾಡಿದ್ದಾರೆ. ಹಿಂದಿನ ಬೌರ್ನ್ ಚಿತ್ರಗಳಿಂದ ನಾವು ಇಷ್ಟಪಡುವ ಎಲ್ಲವೂ ಮತ್ತೊಮ್ಮೆ ಇಲ್ಲಿದೆ: ಆಕ್ಷನ್, ಸಂಭಾಷಣೆ ಮತ್ತು ಸಹಜವಾಗಿ ಅಲುಗಾಡುವ ಕ್ಯಾಮೆರಾ. ಆದರೆ ನನಗೆ, ಕೊನೆಯದು ಎಂದಿಗೂ ಸಮಸ್ಯೆಯಾಗಿರಲಿಲ್ಲ. ಇದು ಸಸ್ಪೆನ್ಸ್ ಅನ್ನು ಹೆಚ್ಚಿಸುತ್ತದೆ ಎಂದು ನಾನು ಭಾವಿಸುತ್ತೇನೆ. <br /> <br /> ಈ ಚಿತ್ರವನ್ನು ಡಿವಿಡಿಯಲ್ಲಿ ಬಿಡುಗಡೆ ಮಾಡುವ ಮೊದಲು ನಾನು ಹಲವಾರು ಬಾರಿ ಹಿಂತಿರುಗುತ್ತೇನೆ, ಏಕೆಂದರೆ ಅದು ಪ್ರತಿಭೆ. ಇದು ಸಂಪೂರ್ಣವಾಗಿ ತೃಪ್ತಿಕರವಾದ ತೀರ್ಮಾನವಾಗಿದೆ, ಮತ್ತು ಸಮಯದ ಪರೀಕ್ಷೆಯನ್ನು ಅದ್ಭುತ ಚಲನಚಿತ್ರವಾಗಿ ಮತ್ತು ಒಟ್ಟಾರೆಯಾಗಿ, ಮರೆಯಲಾಗದ ಟ್ರೈಲಾಜಿಯಾಗಿ ನಿಲ್ಲಬೇಕು.#1
ಹಿಂದಿನ ಕಾಮೆಂಟ್ ಅನ್ನು ನಾನು ಒಪ್ಪುತ್ತೇನೆ, ಚಲನಚಿತ್ರದ ಪ್ರಾರಂಭವು ತುಂಬಾ ಒಳ್ಳೆಯದು, ಮತ್ತು ನೀವು ಏನು ಬರಬೇಕೆಂದು ಅಲೆದಾಡುತ್ತಿದ್ದೀರಿ ....... ಇದು ಏನೂ ಅಲ್ಲ. ಎಲ್ಲಾ ತೆರೆದ ಕಥೆಯ ಸಾಲುಗಳು ತೆರೆದಿರುತ್ತವೆ; ಮೊದಲಿಗೆ ಅವರು ಕೆಲವು ಪ್ರಾಮುಖ್ಯತೆಯನ್ನು ಹೊಂದಿರಬಹುದು ಎಂದು ತೋರುತ್ತಿರುವ ಎರಡು ಪಾತ್ರಗಳು ಚಿತ್ರದಿಂದ ಸಂಪೂರ್ಣವಾಗಿ ಹೊರಗುಳಿದಿವೆ, 1 ಅಥವಾ 2 ಬಹಳ ಕಡಿಮೆ ದೃಶ್ಯಗಳನ್ನು ಉಳಿಸಿ. ಇಲ್ಯಾ ಅವರನ್ನು ಸಂಪೂರ್ಣವಾಗಿ ಹೊರಗಿಡಲು ಉತ್ತಮವಾಗಿ ಮಾಡದಿದ್ದರೆ ನಾನು ಅಲೆದಾಡುತ್ತೇನೆ .... ಉಳಿದಿರುವ ಒಂದು ಪಾತ್ರಕ್ಕೆ ಸಂಬಂಧಿಸಿದಂತೆ, ಅವಳೊಂದಿಗೆ ಏನೂ ಮಾಡಲಾಗುವುದಿಲ್ಲ. ಅವಳು ಕೆಲವು ದೇವರ ಭೀಕರವಾದ ಸ್ಥಳಕ್ಕೆ ಭೇಟಿ ನೀಡುತ್ತಾಳೆ, ಮತ್ತು ಇದ್ದಕ್ಕಿದ್ದಂತೆ ಚಲನಚಿತ್ರವು ಅವಳ ಬಗ್ಗೆ ಅಲ್ಲ, ಆದರೆ ಕೆಲವು ವಯಸ್ಸಾದ ಮಾಟಗಾತಿಯರು ತಮ್ಮ ದಿನಗಳನ್ನು ಗೊಂಬೆಗಳನ್ನು ಬ್ರೆಡ್ನಿಂದ ತಯಾರಿಸುವುದು, ಮನೆಯಲ್ಲಿ ತಯಾರಿಸಿದ ವೊಡ್ಕಾವನ್ನು ಕುಡಿಯುವುದು ಮತ್ತು ಸ್ಪಷ್ಟವಾಗಿ ಪರಸ್ಪರ ಮಿನುಗುವ ಬಗ್ಗೆ ಕಳೆಯುತ್ತಾರೆ. ಐಎಫ್‌ಎಫ್‌ಆರ್‌ನ ನ್ಯಾಯಾಧೀಶರಂತೆ ಸಮಾಜವು ಕುಸಿಯುತ್ತಿರುವಂತೆ ತೋರಿಸುವುದರಲ್ಲಿ ಚಲನಚಿತ್ರವು ಉತ್ತಮವಾಗಿದೆ ಎಂದು ಕೆಲವರು ಹೇಳಬಹುದು, ಆದರೆ ನನಗೆ ಇದು ಕೇವಲ ಕೆಟ್ಟ ಅಭಿರುಚಿ, ಕೆಟ್ಟ ಕ್ಯಾಮೆರಾ-ಕೆಲಸ, ಕೊಳಕಾದ ಸ್ಕ್ರಿಪ್ಟ್ ಮತ್ತು ಭಯಾನಕ ಕೆಟ್ಟ ನಿರ್ದೇಶನ. ಆದ್ದರಿಂದ ಶ್ರೇಣೀಕರಣಕ್ಕೆ ಬಂದಾಗ ನನ್ನ ಹಿಂದಿನವರಂತೆ ನಾನು ಉದಾರವಾಗಿರಲು ಸಾಧ್ಯವಿಲ್ಲ: 1!#0
ಪಮೇಲಾ ಸ್ಪ್ರಿಂಗ್‌ಸ್ಟೀನ್ ಪೂರ್ಣ ಸಮಯದ ographer ಾಯಾಗ್ರಾಹಕರಾಗಲು ನಟನೆಯನ್ನು ತ್ಯಜಿಸಿದರೂ ಆಶ್ಚರ್ಯವಿಲ್ಲ; ಒಂದರ ಮುಂದೆ ಇರುವುದಕ್ಕಿಂತ ಅವಳನ್ನು ಕ್ಯಾಮೆರಾದ ಹಿಂದೆ ಇಟ್ಟುಕೊಳ್ಳುವುದು ಉತ್ತಮ ಉಪಾಯ. ಈ ಚಲನಚಿತ್ರವು ಅದರ ಆಸಕ್ತಿದಾಯಕ ಅಂಶಗಳಿಲ್ಲದಿದ್ದರೂ (ನರಕದಿಂದ ಮಲ್ಲೆಟ್ಗಳು, ಇತ್ಯಾದಿ), ಇದು ನ್ಯೂನತೆಗಳನ್ನು ಮೀರಿಸುತ್ತದೆ. ಒಂದು ವಿಷಯವೆಂದರೆ, ಕೊಲೆಗಾರ ಸಲಹೆಗಾರ ಏಂಜೆಲಾ ಶಿಬಿರಾರ್ಥಿಗಳ ವಯಸ್ಸಿನಷ್ಟೇ. ಹಳೆಯ, ಹೆಚ್ಚು ಬೆದರಿಕೆ ಹಾಕುವ ಕ್ಯಾಂಪ್ ನಿರ್ದೇಶಕರನ್ನು ಹೊಂದಿದ್ದರೆ ಚಿತ್ರಕ್ಕಾಗಿ ಸಾಕಷ್ಟು ಕೆಲಸ ಮಾಡುತ್ತಿದ್ದೆ. ತದನಂತರ ನೀವು ಕೊಲೆ ದೃಶ್ಯಗಳನ್ನು ಹೊಂದಿದ್ದೀರಿ. ಅವುಗಳಲ್ಲಿ ಹೆಚ್ಚಿನದನ್ನು ಸರಿಯಾಗಿ ಕಾರ್ಯಗತಗೊಳಿಸಲು ಬಜೆಟ್ ತುಂಬಾ ಕಡಿಮೆಯಾಗಿದೆ (ಯಾವುದೇ ಶ್ಲೇಷೆಯ ಉದ್ದೇಶವಿಲ್ಲ), ಹೊರಗಡೆ ಶೌಚಾಲಯದಲ್ಲಿ ಯಾರನ್ನಾದರೂ ಮುಳುಗಿಸುವುದು ಖಂಡಿತವಾಗಿಯೂ ಮೂಲವಾಗಿದೆ. ಆದರೆ ಒಟ್ಟಾರೆಯಾಗಿ, ನಿಮ್ಮ ಜೀವನದ ಒಂದು ಗಂಟೆ ಮತ್ತು ಒಂದು ಅರ್ಧದಷ್ಟು ಸಮಯವನ್ನು ಕಳೆಯಲು ಭಯಾನಕ / ಹೆಚ್ಚು ಮೋಜಿನ ಚಲನಚಿತ್ರಗಳು ಒಂದು ಟನ್ ಇವೆ.#0
