ನಾನು ಐಎಮ್‌ಡಿಬಿಯಲ್ಲಿ ಕಾಮೆಂಟ್‌ಗಳನ್ನು ಬರೆಯುತ್ತಿದ್ದೆ, ಆದರೆ ನಾನು ಇನ್ನು ಮುಂದೆ ಹಾಗೆ ಮಾಡುವುದಿಲ್ಲ. ಐಎಮ್‌ಡಿಬಿ ಬೃಹತ್ ಪ್ರಮಾಣದಲ್ಲಿ ಮಾರ್ಪಟ್ಟಿದೆ ಮತ್ತು ಇದರ ಪರಿಣಾಮವಾಗಿ ವ್ಯಕ್ತಿನಿಷ್ಠತೆಯು ಸ್ಕೋರ್‌ಗಳನ್ನು ಹಾಳುಮಾಡಿದೆ. ನಾನು ಏನು ಹೇಳುತ್ತೇನೆ? ಸಿನೆಮಾವನ್ನು ವಿಶೇಷವಾಗಿ ಇಷ್ಟಪಡದ ಮತ್ತು ವಿಷಯದ ಬಗ್ಗೆ ಯಾವುದೇ ಪರಿಣತಿಯನ್ನು ಹೊಂದಿರದ ಯಾರಾದರೂ, ಕೆಲವು ಲದ್ದಿಗಳನ್ನು (ಅಥವಾ ಇದಕ್ಕೆ ವಿರುದ್ಧವಾಗಿ) ವೀಕ್ಷಿಸುತ್ತಾರೆ, ಮತ್ತು ಅವನು ಅದನ್ನು ಇಷ್ಟಪಟ್ಟರೆ, 10 ಅನ್ನು ತಲುಪಿಸುತ್ತಾನೆ, ಮತ್ತು ಅವನು ಇಲ್ಲದಿದ್ದರೆ ಅವನು ಒಂದು 1. ಇದು ಸಹಜವಾಗಿ, ಯಾವುದನ್ನೂ ಸರಿಯಾಗಿ ಅಳೆಯಲು ಸಾಧ್ಯವಿಲ್ಲ. ಈಗ ಚಿತ್ರಕ್ಕಾಗಿ. ಕೆಲವು 10 ಚಿತ್ರಗಳಿಗೆ ಯಾವುದೇ 10 ಸೆಗಳನ್ನು ತಲುಪಿಸಿದ್ದಕ್ಕಾಗಿ ನಾನು ನಿಜವಾಗಿಯೂ ವಿಷಾದಿಸುತ್ತೇನೆ, ಏಕೆಂದರೆ ನಾನು ಇದನ್ನು 12 ಅಥವಾ 13 ರೊಂದಿಗೆ ಸ್ಕೋರ್ ಮಾಡಬೇಕು, ಅದು ಸಾಧ್ಯವಿಲ್ಲ. ಈ ಸಾಕ್ಷ್ಯಚಿತ್ರವು ನನ್ನ ಇಡೀ ಜೀವನದಲ್ಲಿ ಬೇರೆ ಯಾವುದೇ ಚಿತ್ರದಲ್ಲಿ ನೋಡಬೇಕೆಂದು ನಾನು ನಿರೀಕ್ಷಿಸುವುದಿಲ್ಲ. ಇದು ಸರಳವಾಗಿ ಸಮ್ಮೋಹನಗೊಳಿಸುವಂತಿದೆ, ಮತ್ತು ಇದು ಕೇವಲ ಹೇಳುವ ವಿಧಾನವಲ್ಲ; ಅದು ನಿಜವಾಗಿಯೂ. ಕೊನೆಯ 25 ನಿಮಿಷಗಳಲ್ಲಿ ಸಾಕಷ್ಟು ಶಕ್ತಿ, ದೃಶ್ಯ ಸಂತೋಷ ಮತ್ತು ಬುದ್ಧಿವಂತಿಕೆ ಇದೆ - ನಟಿಸಿದ ವ್ಯಕ್ತಿಗಳು ಮಾತನಾಡುವ ಪದಗಳು-, ಅದು ನಿಜವಾಗಿಯೂ ... ಯಾವುದೇ ಹೊಂದಾಣಿಕೆ ಇಲ್ಲ. ನಾನು ಚಲನಚಿತ್ರಗಳನ್ನು ಇಟ್ಟುಕೊಳ್ಳುವುದಿಲ್ಲ, ವಿರಳವಾಗಿ ಹಾಗೆ ಮಾಡುವುದರಲ್ಲಿ ನನಗೆ ಯಾವುದೇ ಅರ್ಥವಿಲ್ಲ, ಆದರೆ ಇದು ನೀವು ಖರೀದಿಸಬೇಕಾದ ಮತ್ತು ಇಟ್ಟುಕೊಳ್ಳಬೇಕಾದ ಚಲನಚಿತ್ರವಾಗಿದೆ ಮತ್ತು ಕಾಲಕಾಲಕ್ಕೆ ನೋಡಬೇಕು, ವರ್ಷಗಳು ಕಳೆದಂತೆ 10 ಅಥವಾ 20 ಬಾರಿ ಇರಬಹುದು. ನನಗೆ ಹೆಚ್ಚು ಹೇಳಲು ಏನೂ ಸಿಕ್ಕಿಲ್ಲ. ಇದು ನನಗೆ ನಿಜವಾದ, ವಸ್ತುನಿಷ್ಠ 10 ಆಗಿದೆ.#1
ಕಿಲ್ಲರ್ ಟೊಮ್ಯಾಟೋಸ್ ಚಲನಚಿತ್ರಗಳು ಈ ವಿಶೇಷ ರೀತಿಯ ಹಾಸ್ಯವನ್ನು ಹೊಂದಿವೆ - ನೀವು ಅದನ್ನು ಪ್ರೀತಿಸುತ್ತೀರಿ ಅಥವಾ ದ್ವೇಷಿಸುತ್ತೀರಿ. ನಾನು ವೈಯಕ್ತಿಕವಾಗಿ ಇಷ್ಟಪಡುತ್ತೇನೆ, ಆದರೆ ಈ ನಾಲ್ಕನೇ ಚಲನಚಿತ್ರದಲ್ಲಿ ಭಾವನೆ ಹೋಗಿದೆ. ಟೊಮ್ಯಾಟೊ ಒಂದೇ ಅಲ್ಲ, ಜೋಕ್ ಕುಂಟ, ನಟರು ಕೂಡ ತಮಾಷೆಯಾಗಿಲ್ಲ. ಏಕೆಂದರೆ ಈ ರೀತಿಯ ಚಲನಚಿತ್ರಗಳು ಇರಬೇಕಾದ ಏಕೈಕ ವಿಷಯವೆಂದರೆ - ತಮಾಷೆ. <br /> <br /> ಆದ್ದರಿಂದ ಈಗ ನಗಿಸಲು ಮಾಡಿದ ಕಥಾವಸ್ತುವನ್ನು ಅನುಸರಿಸುವುದು ಕಿರಿಕಿರಿ. ಅವರು ನಿಜವಾಗಿಯೂ ಕಿಲ್ಲರ್ ಟೊಮ್ಯಾಟೋಸ್ ಟ್ರೈಲಾಜಿಗೆ ನಾಲ್ಕನೇ ಭಾಗವನ್ನು ಮಾಡಬಾರದು.#0
ನನ್ನ ಹಣವನ್ನು ನನಗೆ ಹಿಂದಿರುಗಿಸಿ! ನನ್ನ ಜೀವನವನ್ನು ನನಗೆ ಮರಳಿ ನೀಡಿ! ನನಗೆ ಸ್ವಲ್ಪ ಕ್ರೆಡಿಟ್ ನೀಡಿ. ಈ ಚಲನಚಿತ್ರ ವಾಂತಿ ಯೋಗ್ಯವಾಗಿತ್ತು. ಅನುಪಯುಕ್ತ ಮತ್ತು ಸಮಯ ತೆಗೆದುಕೊಳ್ಳುತ್ತದೆ. ಎಂತಹ ಶಕ್ತಿಯ ವ್ಯರ್ಥ ಮತ್ತು ಸಂಪೂರ್ಣವಾಗಿ ಅರ್ಥಹೀನ. ಸರಿ ನಾನು ಪ್ರಮೇಯ ಮತ್ತು ಕಲ್ಪನೆಯ ಧ್ವನಿಯನ್ನು ಅರ್ಥಮಾಡಿಕೊಂಡಿದ್ದೇನೆ ಆದರೆ, ನಮಗೆ ವಿರಾಮ ನೀಡಿ! ಮುಂದಿನ ಬಾರಿ ನನಗೆ ಹಣವನ್ನು ನೀಡಿ ಮತ್ತು ಅದನ್ನು ಖರ್ಚು ಮಾಡೋಣ. ಕಳೆದುಹೋದ ಮಗು, ತಾಯಂದಿರು ಪಶ್ಚಾತ್ತಾಪ ಪಡುತ್ತಾರೆ, ಗಂಡನನ್ನು ದೂಷಿಸುತ್ತಾರೆ! ಕ್ಲೀಷೆ ಹೌದು ~! ಜೀವನವನ್ನು ಪಡೆಯಿರಿ! ಕ್ಷಮಿಸಿ ಆದರೆ ಈ ಚಲನಚಿತ್ರವು ನನ್ನ ಸಮಯ, ನನ್ನ ಹಣ ಮತ್ತು ನನ್ನ ಅಸ್ತಿತ್ವದ ಒಟ್ಟು ವ್ಯರ್ಥವಾಗಿದೆ. ನಾನು ಮೊಟ್ಟೆಗಳನ್ನು ಬೇಯಿಸುವುದನ್ನು ನೋಡುತ್ತೇನೆ! ಇದು ಏಕೆ ಸಂಭವಿಸಿತು ಎಂಬುದಕ್ಕೆ ನಿಜವಾದ ವಿವರಣೆಯಿಲ್ಲ. ಜೈಲು? ಏಕೆ? ನಷ್ಟ? ಸ್ಪಷ್ಟ ಆದರೆ ಏಕೆ? ನಟನೆ ಅರ್ಹವಾಗಿದೆ ನಾನು ಇಲ್ಲಿ ಏನು ಮಾಡುತ್ತಿದ್ದೇನೆ ಆಸ್ಕರ್ ಮತ್ತು mat ಾಯಾಗ್ರಹಣ ನಾನು ನಾನು ವೇತನಕ್ಕಾಗಿ ಇದನ್ನು ಮಾಡುತ್ತಿದ್ದೇನೆ? ಈ ಚಲನಚಿತ್ರ ಎಷ್ಟು ಮಾಡಿದೆ? ಸರಿ ಈ ಸಿಲ್ಲಿ ಮೂರ್ಖನು ನಕಲನ್ನು ನೇಮಿಸಿಕೊಂಡ. ಸಾಕಷ್ಟು ಹೇಳಿದರು#0
ನನ್ನ ಹೆಂಡತಿ ಮತ್ತು ನಾನು ಈ ಚಿತ್ರವು ಹೆಚ್ಚು ಅತೃಪ್ತಿಕರವಾಗಿದೆ ಎಂದು ಕಂಡುಕೊಂಡೆವು. ಕಥಾವಸ್ತುವು ನಿಮಗೆ ಏನಾಗುತ್ತಿದೆ ಎಂದು ಆಶ್ಚರ್ಯ ಮತ್ತು ಕಾರ್ಯನಿರತವಾಗಿದ್ದರೂ, ನೀವು ರಂಗಮಂದಿರವನ್ನು ತೊರೆದಾಗ, ಸಾಕಷ್ಟು ಸಡಿಲವಾದ ತುದಿಗಳಿವೆ, ಅದು ಯಾವುದೇ ಅರ್ಥವಿಲ್ಲ. (SPOILERS AHEAD) NY ಬ್ಯಾಂಕಿನ ಅಗಾಧ ಶ್ರೀಮಂತ ಮುಖ್ಯಸ್ಥ ಕ್ರಿಸ್ಟೋಫರ್ ಪ್ಲಮ್ಮರ್ ಭಯಾನಕ ಗುಪ್ತ ರಹಸ್ಯವನ್ನು ಹೊಂದಿದ್ದಾನೆ. ಡಬ್ಲ್ಯುಡಬ್ಲ್ಯುಐ II ರ ಲಾಭವು ನಾಜಿಗಳೊಂದಿಗೆ ವ್ಯವಹರಿಸುತ್ತದೆ ಮತ್ತು ಯಹೂದಿಗಳಿಂದ ಕದ್ದ ಲೂಟಿಯನ್ನು ಮರೆಮಾಡುತ್ತದೆ, ಅವನು ತನ್ನ ಬ್ಯಾಂಕಿನಲ್ಲಿರುವ ಸುರಕ್ಷತಾ ಠೇವಣಿ ಪೆಟ್ಟಿಗೆಯಲ್ಲಿ ಪುರಾವೆಗಳನ್ನು (ವಜ್ರಗಳು ಮತ್ತು ನಾಜಿ ಸ್ವಸ್ತಿಕಾದ ದಾಖಲೆಗಳನ್ನು ಒಳಗೊಂಡಂತೆ) ಇಡುತ್ತಾನೆ. ಏಕೆ? ಇದನ್ನು ಎಂದಿಗೂ ಬಹಿರಂಗಪಡಿಸಬಾರದು ಎಂದು ಅವರು ಬಯಸಿದರೆ, ವರ್ಷಗಳ ಹಿಂದೆ ಅವರು ಏಕೆ ದಾಖಲೆಗಳನ್ನು ಸುಟ್ಟು ನಾಶಪಡಿಸಲಿಲ್ಲ? ಮತ್ತು ವಜ್ರಗಳು? ನಿಸ್ಸಂಶಯವಾಗಿ, ಅವನಿಗೆ ಅವು ಅಗತ್ಯವಿಲ್ಲ - ಅವುಗಳನ್ನು ವಿಲೇವಾರಿ ಮಾಡುವ ಬದಲು ಏಕೆ ಇಟ್ಟುಕೊಳ್ಳಬೇಕು? ಬ್ಯಾಂಕ್ ದರೋಡೆಕೋರರು ಆತನ ರಹಸ್ಯವನ್ನು ಹೇಗೆ ಕಂಡುಕೊಂಡರು? ಈ ಸುರಕ್ಷತಾ ಠೇವಣಿ ಪೆಟ್ಟಿಗೆಯ  232 ಅನ್ನು ಶೂನ್ಯಗೊಳಿಸಲು ಅವರಿಗೆ ಹೇಗೆ ಗೊತ್ತು? ಏಸ್ ಡಿಟೆಕ್ಟಿವ್ ಡೆನ್ಜೆಲ್ ವಾಷಿಂಗ್ಟನ್ ಸಹ ಬ್ಯಾಂಕ್ ದಾಖಲೆಗಳು ಎಸ್ಡಿ ಬಾಕ್ಸ್ ನಂ 231 ಮತ್ತು 233 ಅನ್ನು ತೋರಿಸುತ್ತದೆ, ಆದರೆ  232 ಇಲ್ಲ. ಕುತೂಹಲ. ಈ ಒಂದು ಕುತೂಹಲಕಾರಿ ಸಂಗತಿಯನ್ನು ಬಹಿರಂಗಪಡಿಸಲು ಬ್ಯಾಂಕ್ ದಾಖಲೆಗಳ ಬಳಲಿಕೆಯ ಹುಡುಕಾಟವನ್ನು ಮಾಡಲು ಅವರು ಹೇಗಾದರೂ ಸಮಯವನ್ನು ಕಂಡುಕೊಂಡರು. ಕೆಂಪು ಬಿಸಿ ಒತ್ತೆಯಾಳು ಪರಿಸ್ಥಿತಿ ಮತ್ತು ಬ್ಯಾಂಕ್ ದರೋಡೆಕೋರರು ವ್ಯವಹರಿಸುವಾಗ ಅವುಗಳನ್ನು ಕ್ಷಣಾರ್ಧದಲ್ಲಿ ಕಾರ್ಯಗತಗೊಳಿಸಲು ಪ್ರಾರಂಭಿಸುತ್ತೇವೆ. ಅದ್ಭುತ! ಪತ್ತೇದಾರಿಗಾಗಿ ಸೂಪರ್ ಪವರ್‌ಗಳ ಬಗ್ಗೆ ಮಾತನಾಡಿ. <br /> <br /> ಬ್ಯಾಂಕ್ ದರೋಡೆಕೋರರು ಲಕ್ಷಾಂತರ ಡಾಲರ್‌ಗಳನ್ನು ಸಡಿಲವಾದ ಕರೆನ್ಸಿಯನ್ನು ಅವರು ತೆರೆದ ವಾಲ್ಟ್‌ನಲ್ಲಿ ಬಿಡುತ್ತಾರೆ. ಅವರು ಎಸ್ಡಿ ಬಾಕ್ಸ್  232 ರ ವಿಷಯಗಳನ್ನು ಮಾತ್ರ ತೆಗೆದುಕೊಳ್ಳುತ್ತಾರೆ, ಬ್ಯಾಂಕ್ ಅಧ್ಯಕ್ಷರನ್ನು ಬ್ಲ್ಯಾಕ್ ಮೇಲ್ ಮಾಡುವ ಉದ್ದೇಶದಿಂದ. ಈ ಚಿತ್ರವು ಕ್ರಿಮಿನಲ್ ಮಾಸ್ಟರ್ ಮೈಂಡ್ ಅಥವಾ ಕಡಿಮೆ ಮಿದುಳುಗಳನ್ನು ಹೊಂದಿರುವ ಅವನ ಸಹಾಯಕರಿಗೆ ತಾರ್ಕಿಕ ವಿವರಣೆಯಲ್ಲಿನ ಯಾವುದೇ ತರ್ಕಬದ್ಧ ಪ್ರಯತ್ನವನ್ನು ನಿರಾಕರಿಸುತ್ತದೆ. <br /> <br /> ಜೋಡಿ ಫೋಸ್ಟರ್, ಎನ್ವೈಸಿ ಮೇಯರ್ ಅವರ ರಾಜಕೀಯ ಸಂಪರ್ಕಗಳನ್ನು ಬಳಸಿಕೊಂಡು ಅನುಮತಿಯನ್ನು ಪಡೆಯುತ್ತಾರೆ ಅನೇಕ ಒತ್ತೆಯಾಳುಗಳನ್ನು ಹಿಡಿದಿಟ್ಟುಕೊಳ್ಳುವಾಗ ಬ್ಯಾಂಕ್ ದರೋಡೆಕೋರರ ನಿಯಂತ್ರಣದಲ್ಲಿರುವ ಬ್ಯಾಂಕನ್ನು ಪ್ರವೇಶಿಸಲು. ಮುಖ್ಯ ಬ್ಯಾಂಕ್ ದರೋಡೆಕೋರನಿಗೆ ಈಗ ಕೈಯಲ್ಲಿರುವ ದಾಖಲೆಗಳನ್ನು ಮರಳಿ ಖರೀದಿಸಲು ಅವಳು ಒಪ್ಪಂದವನ್ನು ನೀಡುತ್ತಾಳೆ, ಆದರೆ ಅವನು ಆಸಕ್ತಿ ಹೊಂದಿಲ್ಲ. ಹಾಗಾದರೆ ಅವರ ನಿಲುವು ಏನು (ಯಾವುದಾದರೂ ಇದ್ದರೆ?). <br /> <br /> ಕ್ರಿಸ್ಟೋಫರ್ ಪ್ಲಮ್ಮರ್ (ಬ್ಯಾಂಕ್ ಅಧ್ಯಕ್ಷ), ಡೆನ್ಜೆಲ್ ವಾಷಿಂಗ್ಟನ್ (ಏಸ್ ಡಿಟೆಕ್ಟಿವ್), ಮತ್ತು ಜೋಡಿ ಫೋಸ್ಟರ್ ಎಲ್ಲ ಆಟಗಾರರ ದುರಹಂಕಾರದಿಂದ ನನ್ನ ಹೆಂಡತಿ ಮನನೊಂದಿದ್ದರು. ಹೆಚ್ಚಿನ ಶಕ್ತಿಯ ಸಮಸ್ಯೆಗಳಿಗೆ ಶೂಟರ್. <br /> <br /> ನಾನು ನೋಡಿದ ಕೊನೆಯ ಜೋಡಿ ಫೋಸ್ಟರ್ ಚಲನಚಿತ್ರ "ಫ್ಲೈಟ್ ಪ್ಲ್ಯಾನ್" ಸಹ ರಂಧ್ರಗಳಿಂದ ಕೂಡಿದೆ, ಅದು ಯಾವುದೇ ಅರ್ಥವಿಲ್ಲ. ನಾನು ಜೋಡಿ ಫೋಸ್ಟರ್ ಅನ್ನು ಇಷ್ಟಪಟ್ಟಿದ್ದೇನೆ ಎಂದು ನಾನು ಭಾವಿಸಿದೆವು, ಆದರೆ ನಾನು ಬಹುಶಃ ಅವರ ಮುಂದಿನ ಚಲನಚಿತ್ರಗಳನ್ನು ತಪ್ಪಿಸುತ್ತೇನೆ. <br /> <br /> ಈಗ ನನ್ನ ಸಮಸ್ಯೆ ಎಂದರೆ ನನ್ನ ಹೆಂಡತಿಯನ್ನು ಚಲನಚಿತ್ರಗಳಿಗೆ ಹೋಗಲು ಮನವೊಲಿಸುವುದು ಅಪರೂಪ. ಈ ವಿಷಯದಲ್ಲಿ ನಾನು ಅವಳೊಂದಿಗೆ ಭಿನ್ನಾಭಿಪ್ರಾಯ ಹೊಂದಲು ಸಾಧ್ಯವಿಲ್ಲ ... "ಹಣದ ವ್ಯರ್ಥ, ಮತ್ತು ಸಮಯದ ವ್ಯರ್ಥ." ಮುನ್ಸೂಚನೆ ನೀಡಿ. ಉತ್ತಮವಾಗಿ ರಚಿಸಲಾದ ಚಿತ್ರ, ಉತ್ತಮ ನಟರು, ಕೊಳಕಾದ ಸ್ಕ್ರಿಪ್ಟ್ ಬರವಣಿಗೆ.#0
"ಮೆನ್ ಇನ್ ವೈಟ್" ಚಲನಚಿತ್ರವು ಖಂಡಿತವಾಗಿಯೂ ತಮಾಷೆಯ ಚಿತ್ರಗಳಲ್ಲಿ ಒಂದಾಗಿದೆ, ಇಲ್ಲದಿದ್ದರೆ ನಾನು ನೋಡಿದ ತಮಾಷೆಯ, ಹಾಸ್ಯ ಚಲನಚಿತ್ರಗಳು! (ಮತ್ತು ನಾನು ಸಾಕಷ್ಟು ನೋಡಿದ್ದೇನೆ!) ಇದು ಇಬ್ಬರು ಕಸಕಡ್ಡಿಗಳ ಬಗ್ಗೆ, ಅವರು "ಮೆನ್ ಇನ್ ವೈಟ್" ಆಗುತ್ತಾರೆ ಮತ್ತು ನಂತರ ಬಾಹ್ಯಾಕಾಶದಿಂದ ಆಕ್ರಮಣವನ್ನು ನಿಲ್ಲಿಸುತ್ತಾರೆ. ಇದು "ಮೆನ್ ಇನ್ ಬ್ಲ್ಯಾಕ್", "ಸ್ಟಾರ್ ವಾರ್ಸ್" ಅಥವಾ "ಡಾ. ಸ್ಟ್ರಾಂಜೆಲೋವ್" ನಂತಹ ಸಾಕಷ್ಟು ಕ್ಲಾಸಿಕ್ ಚಲನಚಿತ್ರಗಳ ವಿಡಂಬನೆಯಾಗಿದೆ. ಈ ಚಲನಚಿತ್ರವು ತೆವಳುವಂತಿದೆ ಎಂದು ಯಾರಾದರೂ ಹೇಳಿದರೆ ಅವರ ತಲೆಯಲ್ಲಿ ಏನಾದರೂ ತೊಂದರೆ ಇದೆ. ಇಲ್ಲಿ ಹಲವಾರು ತಮಾಷೆ ತಮಾಷೆಗಳು ಮತ್ತು ಹಾಸ್ಯಗಳಿವೆ, ಮತ್ತು ನೀವು ತುಂಬಾ ಕಷ್ಟಪಟ್ಟು ನಗುವುದರಿಂದ ನಿಮ್ಮ ಬಾಯಿಗೆ ಗಾಯವಾಗಬಹುದು (ಅದು ನನಗೆ ಸಂಭವಿಸಿದೆ!). ನೀವು ಈ ಚಲನಚಿತ್ರವನ್ನು ಟಿವಿಯಲ್ಲಿ ವೀಕ್ಷಿಸಬಹುದಾದರೆ, ಇದೀಗ ನೋಡಿ - ನೀವು ಖಂಡಿತವಾಗಿಯೂ ವಿಷಾದಿಸುವುದಿಲ್ಲ!#1
ಈ ಚಿತ್ರವು ರಾಬರ್ಟ್ ಬ್ಲಾಚ್ (ಸೈಕೋ ಲೇಖಕ) ಬರೆದ ಸಾಕಷ್ಟು ಮನರಂಜನೆಯ ಭಯಾನಕ ಸಂಕಲನ ಚಿತ್ರವಾಗಿದೆ (ಟೇಲ್ಸ್ ಫ್ರಮ್ ದಿ ಕ್ರಿಪ್ಟ್‌ನ ಮಾರ್ಗದಲ್ಲಿ). ಭಯಾನಕ ಅಭಿಮಾನಿಗಳಿಗೆ ಇದು ಉತ್ತಮ ಮೋಜು ಮತ್ತು ಅತ್ಯುತ್ತಮ ಪಾತ್ರವರ್ಗವನ್ನು ಹೊಂದಿದೆ. ಜಾನ್ ಪರ್ಟ್ವೀ (ಮೂರನೆಯ ಡಾಕ್ಟರ್) ಅಸಭ್ಯ ಮತ್ತು ಅಸಹ್ಯಕರ ಭಯಾನಕ ತಾರೆಯಾಗಿ ಮನೋರಂಜನಾ ಪಾತ್ರವನ್ನು ಹೊಂದಿರುವುದರಿಂದ ಈ ಚಲನಚಿತ್ರವನ್ನು ಡಾಕ್ಟರ್ ಹೂ ಅಭಿಮಾನಿಗಳಿಗೆ ನೋಡುವ ಅವಶ್ಯಕತೆಯಿದೆ!#1
ಅಲ್ ಪಸಿನೊ ಓವರ್ ನಟಿಸಿದ್ದಾರೆ ಎಂದು ಬಹಳಷ್ಟು ಜನರು ಹೇಳುತ್ತಿದ್ದಾರೆ ಆದರೆ ಈ ರೀತಿಯ ಚಲನಚಿತ್ರ ಪಾತ್ರಕ್ಕಾಗಿ ನಾನು ಸಾಮಾನ್ಯವಾಗಿ ಸಾಮಾನ್ಯ ಎಂದು ಅರ್ಥ - ಕ್ಯೂಬನ್ ಡ್ರಗ್ ಲಾರ್ಡ್ ಆ ಕ್ಯೂಬನ್ ಉಚ್ಚಾರಣೆಯೊಂದಿಗೆ ಈ ಪಾತ್ರದಲ್ಲಿ ನಟಿಸಲು ನಿಮಗೆ ಸ್ವಲ್ಪ ಬೇಕು. ಒಟ್ಟಾರೆ ಈ ಚಲನಚಿತ್ರವು ನಿಜವಾಗಿಯೂ ಒಳ್ಳೆಯ ಚಲನಚಿತ್ರವಾಗಿದ್ದು, ನಾನು 10/10 ಎಂದು ರೇಟ್ ಮಾಡಿದ್ದೇನೆ. ಈ ಚಲನಚಿತ್ರವನ್ನು ವೀಕ್ಷಿಸಲು ಜನರನ್ನು ನಾನು ಹೆಚ್ಚು ಶಿಫಾರಸು ಮಾಡುತ್ತೇನೆ.#1
ಈ ಚಲನಚಿತ್ರವು ಅದ್ಭುತವಾಗಿದೆ. ಇದು ಪ್ರಾರಂಭದಿಂದ ಕೊನೆಯವರೆಗೆ ಮನರಂಜನೆ ನೀಡುತ್ತದೆ, ಇಡೀ ಚಲನಚಿತ್ರದುದ್ದಕ್ಕೂ ನೀವು ಯಾವಾಗಲೂ ನಿಮ್ಮ ಆಸನದ ತುದಿಯಲ್ಲಿರುತ್ತೀರಿ. ನನ್ನ ಅಭಿಪ್ರಾಯದಲ್ಲಿ ಈ ಚಲನಚಿತ್ರವನ್ನು ವಿಮರ್ಶಕರು ಹೆಚ್ಚು ಅಂದಾಜು ಮಾಡಿದ್ದಾರೆ. <br /> <br /> ಉತ್ತಮ ತರಬೇತಿ ಪಡೆದ ಪರ್ವತ-ಪಾರುಗಾಣಿಕಾ ವ್ಯಕ್ತಿ ಗೇಬ್ ವಾಕರ್ ಪಾತ್ರಕ್ಕೆ ಸ್ಲೈ ಸಂಪೂರ್ಣವಾಗಿ ಹೊಂದಿಕೊಳ್ಳುತ್ತದೆ. ಅವರೊಂದಿಗೆ ಮೈಕೆಲ್ ರೂಕರ್ ಹಾಲ್ ಟಕರ್ ಆಗಿ ಉತ್ತಮವಾಗಿ ಕಾಣಿಸಿಕೊಂಡಿದ್ದಾರೆ. ತದನಂತರ, ನಾನು ಅವನನ್ನು ಖಳನಾಯಕನಾಗಿ ನೋಡಿದ ಅತ್ಯುತ್ತಮ ಪ್ರದರ್ಶನಗಳಲ್ಲಿ ಒಂದಾದ ಜಾನ್ ಲಿಥ್ಗೋ. <br /> <br /> ಮತ್ತು 75% ಚಲನಚಿತ್ರವು ಪರ್ವತದಲ್ಲಿ ನಡೆಯುತ್ತದೆ ಎಂಬುದು ಬಹಳಷ್ಟು ಕೆಟ್ಟ ವ್ಯಕ್ತಿಗಳೊಂದಿಗೆ ಅದರ ಮೇಲೆ ಬಹಳಷ್ಟು ಕ್ರಮಗಳಿಗೆ ದಾರಿ ಮಾಡಿಕೊಡುತ್ತದೆ! <br /> <br /> ಅದ್ಭುತ ಚಲನಚಿತ್ರ!#1
ನಾನು ಜೋಶುವಾ ಚಿತ್ರವನ್ನು ಆನಂದಿಸಲಿಲ್ಲ. ಬಹುಶಃ ಅದು 2 ದಿನಗಳ ಮೊದಲು ಅನಾಥ ಶೀರ್ಷಿಕೆಯ ಮತ್ತೊಂದು ಉತ್ತಮವಾದ ಚಿತ್ರವನ್ನು ನಾನು ನೋಡಿದ್ದೇನೆ ಆದರೆ ಬಹುಶಃ ಅದು ನಿಜವಾಗಿಯೂ ಈ ಚಿತ್ರವು ಉತ್ತಮವಾಗಿಲ್ಲದ ಕಾರಣ. ನಾನು ಏಣಿಯೊಂದಿಗೆ ಹೋಗುತ್ತಿದ್ದೇನೆ. ಖಚಿತವಾಗಿ, ದುಷ್ಟ ಮಗುವಿನ ಕಥಾವಸ್ತುವು ನಿಖರವಾಗಿ ಮೂಲವಲ್ಲ ಆದರೆ ಚಿತ್ರ ಯಶಸ್ವಿಯಾಗಲು ಸಾಧ್ಯವಿಲ್ಲ ಎಂದು ಇದರ ಅರ್ಥವಲ್ಲ. ಇದು ಸಸ್ಪೆನ್ಸ್ ಮತ್ತು ಮನರಂಜನೆ ಮತ್ತು ತಣ್ಣಗಾಗಬಹುದು ಆದರೆ ಬದಲಾಗಿ ಅದು ನಿಧಾನವಾದ ಕಟ್ಟಡ, ನೀರಸ, ಆವಿಷ್ಕಾರ ಮತ್ತು ನಿಜವಾಗಿಯೂ ಅದು ಮುಗಿದ ನಂತರ 'ಅದು ತುಂಬಾ ಒಳ್ಳೆಯದಲ್ಲ' ಎನ್ನುವುದಕ್ಕಿಂತ ಹೆಚ್ಚಿನದನ್ನು ಯೋಚಿಸುವುದನ್ನು ಬಿಡಲಿಲ್ಲ. <br /> <br /> ಕೊನೆಯಲ್ಲಿ, ಜೋಶುವಾ ಅವರ ಪ್ರೇರಣೆಗಳು ಬಹಿರಂಗಗೊಳ್ಳುತ್ತವೆ. ನಾನು ಅದನ್ನು ಬಿಟ್ಟುಕೊಡುವುದಿಲ್ಲ ಆದರೆ ವಾಸ್ತವವೆಂದರೆ, ವೆರಾ ಫಾರ್ಮಿಗಾ ಅವರ ತಾಯಿ ಅಬ್ಬಿ, ಚಲನಚಿತ್ರದ ಮೂಲಕ 3/4 ನಷ್ಟು ಕಣ್ಮರೆಯಾಗಿದ್ದರಿಂದ, ಅವನು ನಿಜವಾಗಿಯೂ ತನ್ನ ಗುರಿಗಳನ್ನು ಸಾಧಿಸಲಿಲ್ಲ, ಎಲ್ಲಾ ಬಾಣಗಳು ಶೀಘ್ರದಲ್ಲೇ ಮನೆಗೆ ಮರಳುವತ್ತ ಬೊಟ್ಟು ಮಾಡುತ್ತವೆ. ಅವಳು ಮನಸ್ಸನ್ನು ಕಳೆದುಕೊಳ್ಳುತ್ತಿದ್ದ ಕಾರಣ ಅವಳು ಮಾನಸಿಕ ಸಂಸ್ಥೆಗೆ ಬದ್ಧಳಾಗಿದ್ದಳು ಆದರೆ ನಂತರ ಜೋಶುವಾ ಅವರ ತಂದೆ / ಅವಳ ಪತಿ ತನ್ನ ation ಷಧಿಗಳನ್ನು ಹಾಳುಗೆಡವಿದ್ದಾರೆ ಎಂದು ಆರೋಪಿಸಲಾಯಿತು, ಇದು ಪ್ರೇಕ್ಷಕರಿಗೆ ಹೇಳುತ್ತದೆ, ಅವಳು ನಿಜವಾಗಿಯೂ ಮಾನಸಿಕ ಅಸ್ವಸ್ಥನಲ್ಲ ಆದರೆ ವೈದ್ಯಕೀಯವಾಗಿ ಡೋಸ್ ಮಾಡಲಾಗುತ್ತಿದೆ ಎಂದು ಸಂಸ್ಥೆ ಅರಿತುಕೊಂಡಿದೆ. ಹಾಗಾದರೆ .. ಅವಳು ಬೇಗ ಮನೆಗೆ ಬರಬೇಕಲ್ಲವೇ? ಜೋಶುವಾ ವಿಫಲರಾಗುವುದಿಲ್ಲವೇ? ಅವನ ತಾಯಿ ಅವನ ಮತ್ತು ಅವನ ಸಹೋದರಿಯೊಂದಿಗೆ ಮತ್ತು ಬಹುಶಃ ಅವನ ತಂದೆಯೊಂದಿಗೆ ಶೀಘ್ರದಲ್ಲೇ ವಾಸಿಸುತ್ತಿಲ್ಲವೇ? ತಂದೆಯ ಭವಿಷ್ಯವು ಮುಕ್ತ ಮುಕ್ತವಾಗಿರುವುದರಿಂದ ನಾನು ಅವರನ್ನು ಪ್ರಶ್ನಿಸುತ್ತೇನೆ. <br /> <br /> ದಿನದ ಕೊನೆಯಲ್ಲಿ, ನಾನು ಪಾತ್ರಗಳ ಬಗ್ಗೆ ಕಾಳಜಿ ವಹಿಸಲಿಲ್ಲ. ದುಷ್ಟ ರಾಕ್ಷಸ ಮಗು ಜೋಶುವಾ ನಿಜವಾಗಿಯೂ ಭಯಾನಕವಲ್ಲ. ಕಥಾಹಂದರವು ನಿಧಾನವಾಗಿ ಚಲಿಸಿತು ಮತ್ತು ಅದನ್ನು ಎತ್ತಿದಾಗ ಅದು ಇನ್ನೂ ನೀರಸವಾಗಿತ್ತು. ಪ್ರತಿ ಬಾರಿಯೂ ಸಸ್ಪೆನ್ಸ್ ಸಮತಟ್ಟಾಗುತ್ತದೆ. ಅದು ಮುಗಿದ ನಂತರ ನಾನು ಇಡೀ ವಿಷಯದ ಮೂಲಕ ಕುಳಿತುಕೊಂಡಿದ್ದೇನೆ ಎಂದು ನಂಬಲು ಸಾಧ್ಯವಾಗಲಿಲ್ಲ. <br /> <br /> 4/10 ಪೋಷಕರಿಂದ ವಿಶೇಷವಾಗಿ ವೆರಾ ಫಾರ್ಮಿಗಾ ತಾಯಿಯಾಗಿ ನಟನೆ ಉತ್ತಮವಾಗಿತ್ತು ಆದರೆ ನೀವು ದುಷ್ಟ 'ಮಗುವಿನ' ಬಗ್ಗೆ ಚಲನಚಿತ್ರವನ್ನು ನೋಡಲು ಬಯಸಿದರೆ ಅನಾಥರನ್ನು ನೋಡಿ. ಈಗ ಅದು ಅನಧಿಕೃತ ಪರಿಕಲ್ಪನೆಯನ್ನು ತೆಗೆದುಕೊಂಡು ಅದ್ಭುತ ಚಲನಚಿತ್ರವನ್ನು ರಚಿಸಿದ ಚಲನಚಿತ್ರವಾಗಿದೆ.#0
