ಈ ಚಲನಚಿತ್ರವು ಕೇವಲ ಕೆಟ್ಟದ್ದಲ್ಲ, ಕಾರ್ನಿ ಮಾತ್ರವಲ್ಲ, ಅದು ಹಿಮ್ಮೆಟ್ಟಿಸುತ್ತದೆ. ದಾಫ್ನೆ ಬಗ್ಗೆ, ತೆವಳುವ ಕರೆ-ಹುಡುಗಿಯ ಬಗ್ಗೆ, ಇಡೀ ಡ್ಯಾಮ್ ಬಗ್ಗೆ (ಮತ್ತು ನಾನು ಪದವನ್ನು ಅಕ್ಷರಶಃ ಬಳಸುತ್ತೇನೆ) ಚಲನಚಿತ್ರವು ವೇಶ್ಯಾಗೃಹದ ಪ್ರೇಯಸಿಯನ್ನು ಅಪರಾಧ ಮಾಡುವ ವಿಡಂಬನೆಯನ್ನು ಹೊರಸೂಸುತ್ತದೆ. ಈ ಚಿತ್ರವು ನನ್ನ ಚರ್ಮವನ್ನು ಕ್ರಾಲ್ ಮಾಡುತ್ತದೆ, ಸಂತಾನೋತ್ಪತ್ತಿ ಅಂಗಗಳನ್ನು ಹೊಂದಿದೆಯೆಂದು ನನಗೆ ವಿಷಾದವನ್ನುಂಟುಮಾಡುತ್ತದೆ ಮತ್ತು ನನಗೆ ಅಶುದ್ಧವಾಗಿದೆ. <br /> <br /> ಈ ಚಲನಚಿತ್ರದ ಬಗ್ಗೆ ನನಗೆ ಹೆಚ್ಚು ತೊಂದರೆಯಾಗುವ ವಿಷಯವೆಂದರೆ ಅವರು ಅಂತಹ ಉತ್ತಮ ಪರಿಕಲ್ಪನೆಯನ್ನು ಬಳಸಿದ್ದಾರೆ. ಕ್ಲೀಷೆ ವರ್ಸ್ಟ್ ನೈಟ್ಮೇರ್ ಮತ್ತು ಮಿತಿಮೀರಿದ ಟ್ವಿಸ್ಟೆಡ್ ವಿಶ್ಗಿಂತ ಹೆಚ್ಚಾಗಿ ವಿನಾಶಕಾರಿ ಫಲಿತಾಂಶಗಳೊಂದಿಗೆ ಫ್ಯಾಂಟಸಿಗಳನ್ನು ಮಾಡುವ ಜೀವಿ ನಿಜವಾಗಿಯೂ ಆಕರ್ಷಕ ಚಲನಚಿತ್ರ ಕಲ್ಪನೆಯಾಗಿದೆ. <br /> <br /> ಚಿಂತನೆ: ಹಬ್ಬೊಬ್ಲಿನ್‌ಗಳನ್ನು ದಿನಕ್ಕಿಂತ ಮೊದಲು ಕೊಲ್ಲಬೇಕಾದ ಕಾರಣವೆಂದರೆ ಅವರು ಪ್ರಕಾಶಮಾನವಾದ ದೀಪಗಳಿಗೆ ಆಕರ್ಷಿತರಾಗುತ್ತಾರೆ. ಹಗಲಿನಲ್ಲಿ, ಪ್ರಕಾಶಮಾನವಾದ ದೀಪಗಳು ಚೆನ್ನಾಗಿ ಕಾಣಿಸುವುದಿಲ್ಲ, ಆದ್ದರಿಂದ ಅವು ಎಲ್ಲಿ ಬೇಕಾದರೂ ಹೋಗಬಹುದು. ಚಲನಚಿತ್ರದ ಉದ್ದಕ್ಕೂ ಆಟಿಕೆಗಳನ್ನು ಕೊಲ್ಲಲಾಗುತ್ತದೆ. <br /> <br /> ಚರ್ಚೆಯ ಪ್ರಶ್ನೆ: ನೀವು ಚುರುಕಾದ, ಬೇಡಿಕೆಯಿರುವ, ಮೆಚ್ಚುಗೆಯಿಲ್ಲದ ಗೆಳತಿಯನ್ನು ಹೊಂದಿದ್ದರೆ, ನೀವು ಮಿಲಿಟರಿ ಚಂಕ್‌ಹೆಡ್‌ನೊಂದಿಗೆ ಉದ್ಯಾನ-ಸಾಧನ-ಯುದ್ಧವನ್ನು ಪ್ರವೇಶಿಸುತ್ತೀರಾ? ವಿವರಿಸಿ.#0
ಈ ಚಲನಚಿತ್ರವು ತುಂಬಾ ಕೆಟ್ಟದಾಗಿ ಬರೆಯಲ್ಪಟ್ಟಿದೆ, ನಿರ್ದೇಶಿಸಲ್ಪಟ್ಟಿದೆ ಮತ್ತು ನಟಿಸಿತು ಅದು ಭಿಕ್ಷುಕರ ನಂಬಿಕೆಯನ್ನು ಹೊಂದಿದೆ. ಇದನ್ನು ಉತ್ತಮ ಸ್ಕ್ರಿಪ್ಟ್, ನಿರ್ದೇಶಕ ಮತ್ತು ಎರಕದ ಸೇವೆಯೊಂದಿಗೆ ಮರುರೂಪಿಸಬೇಕು. ಕೆಟ್ಟ ಸಮಸ್ಯೆ ನಟನೆ. ನೀವು ಒಂದು ಕಡೆ ಜೆನ್ನಿಫರ್ ಬೀಲ್ಸ್ ಅನ್ನು ಹೊಂದಿದ್ದೀರಿ, ಅವರು ಪಾಲಿಶ್, ವೃತ್ತಿಪರ ಮತ್ತು ಸಂಪೂರ್ಣವಾಗಿ ನಂಬಲರ್ಹರು, ಮತ್ತು ಮತ್ತೊಂದೆಡೆ, ರಿಚಾರ್ಡ್, ಅವರು ದುಃಖಕರವಾಗಿ ತಪ್ಪಾಗಿ ಪ್ರಸಾರ ಮಾಡಿದ್ದಾರೆ ಮತ್ತು ಈ ನಿರ್ದಿಷ್ಟ ತುಣುಕಿನಲ್ಲಿ ಕುಣಿಯುತ್ತಾರೆ. ಪೀಟರ್ ಗಲ್ಲಾಘರ್ ಮತ್ತು ಜೆನ್ನಿ ಲೆವಿನ್ ಗುಲಾಮರನ್ನು ಹೊಂದಿರುವ (ಮತ್ತು ಇಟ್ಟುಕೊಳ್ಳುವ) ದಂಪತಿಗಳಂತೆ ಭೀಕರರಾಗಿದ್ದಾರೆ, ಆದರೂ ಇಬ್ಬರೂ ಸಾಮಾನ್ಯವಾಗಿ ಉತ್ತಮ ಕೆಲಸ ಮಾಡುತ್ತಾರೆ. ನಟರು (ಮತ್ತು ನಿರ್ದೇಶಕರು) ಉಚ್ಚಾರಣೆಯನ್ನು ಮಾಡಲು ಪ್ರಯತ್ನಿಸಬಾರದು - ಅವರು ಅಸಮಂಜಸ ಮತ್ತು ನಂಬಲಾಗದವರು. ನಿಜವಾದ ಇಂಗ್ಲಿಷ್‌ನಲ್ಲಿ ಉತ್ತಮ ಕೆಲಸ ಮಾಡುವತ್ತ ಗಮನಹರಿಸುವುದು ಉತ್ತಮ. ಬಿತ್ತರಿಸುವಿಕೆಯು ಹಾಸ್ಯಾಸ್ಪದವಾಗಿದೆ. "ಆಫ್ರಿಕನ್" ವ್ಯಾಪಾರಿಯ ಮಕ್ಕಳನ್ನು (ಆದ್ದರಿಂದ ಜೆನ್ಸ್ ಡಿ ಕೌಲೂರ್ ಸಮಾಜಕ್ಕೆ ಕಡಿಮೆ ಸಾಮಾಜಿಕವಾಗಿ ಅಪೇಕ್ಷಣೀಯವಾಗಿದೆ) ತುಂಬಾ ಮಸುಕಾದ ಚರ್ಮದ ನಟರೊಂದಿಗೆ ನಟಿಸಲಾಗಿದೆ, ಆದರೆ ಸಾಮಾಜಿಕವಾಗಿ ಅಪೇಕ್ಷಣೀಯವೆಂದು ಭಾವಿಸಲಾದ ಮಾರ್ಸೆಲ್, ಸ್ಪಷ್ಟವಾಗಿ ಬಣ್ಣಬಣ್ಣದ ಹೊಂಬಣ್ಣದ "ಫ್ರೊ" ಸೇರಿದಂತೆ ಆಫ್ರಿಕನ್ ವೈಶಿಷ್ಟ್ಯಗಳನ್ನು ಉಚ್ಚರಿಸಿದ್ದಾರೆ. ಎರಕಹೊಯ್ದ ನಿರ್ದೇಶಕರು ತಾವು ಬಿತ್ತರಿಸುವ ಸ್ಕ್ರಿಪ್ಟ್ ಅನ್ನು ಓದಲು ಮತ್ತು ಅತ್ಯಂತ ಪ್ರತಿಭಾವಂತ ಮತ್ತು ದೈಹಿಕವಾಗಿ ವೈವಿಧ್ಯಮಯ ಬಣ್ಣದ ನಟರ ದೊಡ್ಡ ಕೊಳದಿಂದ ಸೂಕ್ತ ನಟರನ್ನು ಆಯ್ಕೆ ಮಾಡಲು ತೊಂದರೆಯಾಗುವುದಿಲ್ಲ. ಇದು ತುಂಬಾ ವಿಲಕ್ಷಣವಾಗಿದೆ! ಇದು ಉತ್ತಮ ಚಲನಚಿತ್ರವಾಗಬಹುದು ಮತ್ತು ಅದನ್ನು ಮರು-ನಿರ್ಮಿಸಬೇಕು, ಆದರೆ ವಸ್ತುವನ್ನು ಗೌರವಿಸುವ ಮತ್ತು ಸೂಕ್ತ ಮತ್ತು ನುರಿತ ನಟರನ್ನು ಆಯ್ಕೆ ಮಾಡುವ ಜನರೊಂದಿಗೆ. ಅಲ್ಲಿ ಸಾಕಷ್ಟು ಉತ್ತಮ ನಟರಿದ್ದಾರೆ, ಮತ್ತು ಜೆನ್ನಿಫರ್ ಬೀಲ್ಸ್, ಡೇನಿಯಲ್ ಸುಂಜಾತಾ ಮತ್ತು ಗ್ಲೋರಿಯಾ ರೂಬೆನ್ ಸೂಕ್ತ ಪಾತ್ರ, ಉತ್ತಮ ಚಿತ್ರಕಥೆ ಮತ್ತು ಯೋಗ್ಯ ನಿರ್ದೇಶನದೊಂದಿಗೆ ಹೇಗೆ ಮಾಡುತ್ತಾರೆ ಎಂಬುದನ್ನು ನೋಡಲು ಖುಷಿಯಾಗುತ್ತದೆ.#0
ನಾನು ಈ ಚಲನಚಿತ್ರವನ್ನು ನಿಜವಾಗಿಯೂ ಆನಂದಿಸಿದೆ. ಈ ಚಲನಚಿತ್ರ ಹೊರಬಂದಾಗ ನನಗೆ ಹದಿನೈದು ವರ್ಷ ಮತ್ತು ನಾನು ಸಂಬಂಧಿಸಬಲ್ಲೆ. ಇದು ನನ್ನ ಮಕ್ಕಳಿಗೆ ತಿಳಿಸಲು ನಾನು ತೋರಿಸುವ ಚಲನಚಿತ್ರವಾಗಿರುತ್ತದೆ, ಅವರು ಹೊಂದಿರುವ ಭಾವನೆಗಳು ಸಾಮಾನ್ಯವಾಗಿದೆ. ಇಷ್ಟು ಚಿಕ್ಕ ವಯಸ್ಸಿನಲ್ಲಿ ನಾವು ಹೇಗೆ ಇಷ್ಟು ಅಪಮೌಲ್ಯಗೊಳಿಸಬಹುದು ಎಂದು ನೋಡುವುದು ತಮಾಷೆಯಾಗಿದೆ..ನಾವು ಮತ್ತೆ ಪುಟಿಯುತ್ತೇವೆ ಎಂದು ಯಾರು ತಿಳಿದಿದ್ದರು .... ಮತ್ತೆ ಮತ್ತೆ .... ಅದ್ಭುತ ಚಲನಚಿತ್ರ !!!!#1
ಈ ಕಾಮೆಂಟ್‌ನಲ್ಲಿ ಕೆಲವು ಸ್ಪಾಯ್ಲರ್ಗಳಿವೆ !! <br /> <br /> ನಾನು ನೇಟಿವ್‌ಟೆಕ್ಸ್ 4 ಯು ಮತ್ತು ಇತರ ಕೆಲವರು ಓದಿದ ಕಾಮೆಂಟ್‌ಗಳಿಗೆ ವಿರುದ್ಧವಾಗಿ, ನಾನು ಚಲನಚಿತ್ರವನ್ನು ನಿಜವಾಗಿಯೂ ಇಷ್ಟಪಟ್ಟೆ ಮತ್ತು ಅದನ್ನು ಸಾಪ್ತಾಹಿಕ ಸರಣಿಯಾಗಿ ನೋಡಲು ಇಷ್ಟಪಡುತ್ತೇನೆ. <Br /> <br /> ನಾನು ಜಡ್ಸನ್ ಮಿಲ್ಸ್ ಅಭಿಮಾನಿಯಾಗಿದ್ದೇನೆ ಆದರೆ ದೊಡ್ಡ ಚಕ್ ನಾರ್ರಿಸ್ ಅಭಿಮಾನಿಯಾಗಿದ್ದೇನೆ ಮತ್ತು ಕೆಲವು ಆಕ್ಷನ್ ದೃಶ್ಯಗಳು ಸ್ವಲ್ಪ ರೇಖೆಯನ್ನು ವಿಸ್ತರಿಸಿರಬಹುದು ಎಂದು ನಾನು ಒಪ್ಪಿಕೊಳ್ಳುತ್ತೇನೆ, ಕಥಾಹಂದರವು ಇತರ ಸಾಪ್ತಾಹಿಕ ಸರಣಿಗಳೊಂದಿಗೆ ಸರಿಹೊಂದುತ್ತದೆ ಪ್ರಸ್ತುತ ಪ್ರಸಾರವಾಗುತ್ತಿದೆ. <br /> <br /> ತಮ್ಮ ಕ್ಷಿಪಣಿಗಳನ್ನು ಸ್ಫೋಟಿಸಿದ ನಂತರ ಕೆಟ್ಟ ವ್ಯಕ್ತಿಗಳಿಂದ ಡಿಕೆ ಓಡುವ ಆರಂಭಿಕ ಹದಿನೈದು ನಿಮಿಷಗಳು ಬಹಳ ಆಕ್ಷನ್ ಪ್ಯಾಕ್ ಆಗಿದ್ದವು. ಎಷ್ಟು "ವೃತ್ತಿಪರರು" ಚಲಿಸುವ ಗುರಿಯನ್ನು ಹೊಡೆಯಲು ಸಾಧ್ಯವಾಗಲಿಲ್ಲ ಎಂಬುದನ್ನು ನೋಡಲು ನಾನು ವಿಫಲವಾಗಿದ್ದೇನೆ, ಆದರೆ ಆಕ್ಷನ್ ಖಂಡಿತವಾಗಿಯೂ ಇತ್ತು ಮತ್ತು ನಾಯಕನಾಗಿರುವ ಡಿಕೆ ಬದುಕುಳಿಯಬೇಕಾಯಿತು. <br /> <br /> ಕಾಮೆಂಟ್‌ಗೆ ಸಂಬಂಧಿಸಿದಂತೆ "ಪ್ಲೇಆಫ್‌ಗಳ ನಂತರ ಸಮಯ ಸ್ಲಾಟ್ ತುಂಬಲು ಚಲನಚಿತ್ರವನ್ನು ಕ್ಯಾನ್‌ನಲ್ಲಿ ಪಡೆದುಕೊಳ್ಳುವ" ಬಗ್ಗೆ. ಈ ಚಲನಚಿತ್ರವನ್ನು ಮೂಲತಃ ಜನವರಿ ಪ್ರಸಾರಕ್ಕಾಗಿ ಸಿಬಿಎಸ್ ನಿಗದಿಪಡಿಸಿರಲಿಲ್ಲ ಮತ್ತು ಯುಎಸ್ ವಿರುದ್ಧದ ಭಯೋತ್ಪಾದಕ ದಾಳಿಗೆ 4 ತಿಂಗಳ ಮೊದಲು 2001 ರ ಮೇ ತಿಂಗಳಲ್ಲಿ ಚಿತ್ರೀಕರಣ ಪೂರ್ಣಗೊಂಡಿತು. <br /> <br /> ಕಾಮೆಂಟ್ ಬರೆದವರು ಗಮನ ಹರಿಸಿದ್ದರೆ ಚಲನಚಿತ್ರವನ್ನು ತಪ್ಪಿಸಲು ಪ್ರಯತ್ನಿಸುವ ಬದಲು, ಅವರು ಕಥೆಯ ಕಥಾವಸ್ತುವನ್ನು ಅರಿತುಕೊಂಡಿರಬಹುದು: ರಶೀದ್, ಬಿನ್ ಲಾಡೆನ್ ನಂತಹ ಪಾತ್ರ, ಯುನೈಟೆಡ್ ಸ್ಟೇಟ್ಸ್ನಲ್ಲಿ ಪರಮಾಣು ಸಾಧನವನ್ನು ಹೊಂದಿಸಲು ಯೋಜಿಸಿದೆ. ಸಮಸ್ಯೆಯನ್ನು ಪತ್ತೆಹಚ್ಚಲು ಮತ್ತು ನಿವಾರಿಸಲು ಅಧ್ಯಕ್ಷರ ಮನುಷ್ಯನನ್ನು ಕರೆಸಲಾಯಿತು. <br /> <br /> ಬಹುಶಃ ಲೇಖಕನು ಚಲನಚಿತ್ರವನ್ನು ಕಾಮೆಂಟ್ ಮಾಡಲು ಪ್ರಯತ್ನಿಸುವ ಮೊದಲು ಅದನ್ನು ನೋಡಬೇಕು. <br /> <br />#1
ಸ್ಟೀವನ್ ಸೆಗಲ್ ಚಲನಚಿತ್ರಗಳು ಹೋದಂತೆ ಇದು ಬ್ಯಾರೆಲ್ನ ಕೆಳಭಾಗದಲ್ಲಿದೆ. ಬೇಸರಗೊಂಡ ಹದಿಹರೆಯದವರಿಗೆ ಮೇವು ಕೇವಲ ಮೇವು. ಇದು ಮಾಪಕಗಳನ್ನು ಸುಳಿವು ನೀಡುತ್ತದೆ, ನಂತರ ಉದುರಿಹೋಗುತ್ತದೆ. ಅಕ್ಷರಗಳು ಎಲ್ಲಾ ರಟ್ಟಿನವು. ಕಥೆ ಡಬಲ್ ಲೇಮ್ ಆಗಿದೆ. ಅಂತ್ಯವನ್ನು ಹೇಳುವ ಮೂಲಕ ನಾನು ಅದನ್ನು ಹಾಳು ಮಾಡಲು ಸಾಧ್ಯವಿಲ್ಲ. ನೀವು ಒಂದನ್ನು ನೋಡಿದ್ದರೆ ಎಲ್ಲಾ ಸ್ಟೀವನ್ ಸೆಗಲ್ ಚಲನಚಿತ್ರಗಳು ಹೇಗೆ ಕೊನೆಗೊಳ್ಳುತ್ತವೆ ಎಂಬುದು ನಿಮಗೆ ಈಗಾಗಲೇ ತಿಳಿದಿದೆ. ಇಲ್ಲಿ ಹೋಗುತ್ತದೆ. ಅವರು ಸೂಪರ್-ಡೂಪರ್ ಸರ್ಕಾರಿ ಏಜೆಂಟರಾಗಿದ್ದು, ಅವರು ಸಡಿಲಗೊಳ್ಳಲು ಹೆಚ್ಚು ತಿಳಿದಿದ್ದಾರೆ, ಆದ್ದರಿಂದ ಅವರು ಅವನನ್ನು ಕೊಲ್ಲುವ ಬದಲು, ಅವನ ಮೆದುಳನ್ನು ಡೋಪ್ ಮಾಡಲು ನಿರ್ಧರಿಸುತ್ತಾರೆ. ಅವನು ತಪ್ಪಿಸಿಕೊಳ್ಳುತ್ತಾನೆ, ಖಂಡಿತವಾಗಿಯೂ ಬಂಧನಕ್ಕೊಳಗಾಗುತ್ತಾನೆ ಮತ್ತು ಅವನ ಹಳೆಯ ಜನರಲ್‌ನಿಂದ ನೆಲೆಗೊಂಡಿದ್ದಾನೆ, ಒಬ್ಬ ರಹಸ್ಯ ವಿಮಾನವನ್ನು ಹಿಂತಿರುಗಿಸಲು ಒಂದು ಮಿಲಿಯನ್ ಅನುಭವದ ಒಬ್ಬ ಮನುಷ್ಯನ ಅವಶ್ಯಕತೆಯಿದೆ, ಅದನ್ನು ಅಫ್ಘಾನಿಸ್ತಾನದ ಭಯೋತ್ಪಾದಕ ಗ್ಯಾಂಗ್‌ಗೆ ಹಸ್ತಾಂತರಿಸಿರುವ ರಾಕ್ಷಸ ವಾಯುಪಡೆಯ ಪೈಲಟ್, ಆಶ್ಚರ್ಯಪಡುತ್ತಾನೆ , ಆಶ್ಚರ್ಯ, ಸೆಗಲ್ ತರಬೇತಿ ಪಡೆದ. ಸೆಗಲ್ ಪಾತ್ರ ಮತ್ತು ಅವನ ಮುಸ್ಸಂಜೆಯ ಗೆಳತಿ ಹೊರತುಪಡಿಸಿ ಎಲ್ಲಾ ನಾಯಕರು ವೀರರಂತೆ ಸಾಯುತ್ತಾರೆ ಮತ್ತು ಸ್ಟೀವ್-ಬೇಬಿ ಇಡೀ ಜಗತ್ತನ್ನು ಒಂದೇ ಉಬ್ಬರವಿಳಿತದಲ್ಲಿ ಉಳಿಸುತ್ತಾರೆ, ಅಥವಾ ಬೀಳುತ್ತಾರೆ. ಏನಾದರೂ. ಕೆಲವು ಹೆಚ್ಚುವರಿ ವಾಯುಪಡೆ ಮತ್ತು ನೌಕಾಪಡೆಯ ಹಾರುವ ಚಿತ್ರದೊಂದಿಗೆ ತಯಾರಿಸಲಾಗುತ್ತದೆ. ಮತ್ತು ಬಹಳಷ್ಟು ಬೂಮ್-ಬೂಮ್ಗಳು. ಬದಲಾಗಿ ಕೆಲವು ಪಾಪ್ಐಯ್ಸ್ ವ್ಯಂಗ್ಯಚಿತ್ರಗಳನ್ನು ಪಡೆಯಿರಿ.#0
ಪೂರ್ವ ಲಂಡನ್‌ನಲ್ಲಿ ವಾಸಿಸುವ ಬಾಲ್ಯದಲ್ಲಿ ನಾನು ಇದನ್ನು ಮೊದಲು ನೋಡಿದೆ. ಹಿಟ್ಲರ್ಸ್ ಲುಫ್ಟ್‌ವಾಫ್‌ನ ಚರ್ಮವು ತುಂಬಾ ಸ್ಪಷ್ಟವಾಗಿತ್ತು ಮತ್ತು ಚಲನಚಿತ್ರದ ಭೂದೃಶ್ಯವು ನಮ್ಮ ಬೀದಿಯನ್ನು ನೆನಪಿಸುತ್ತದೆ. ನಾನು ಅದನ್ನು ನೋಡಿದ ನಂತರ ದುಃಸ್ವಪ್ನಗಳನ್ನು ಹೊಂದಿದ್ದೇನೆ. ವಿಚಿತ್ರವೆಂದರೆ, ಸಿನೆಮಾ ಕಾದಂಬರಿಯಲ್ಲಿ ಸಾಮಾಜಿಕ ಇತಿಹಾಸದ ಒಂದು ಭಾಗವಾಗಿ ನೋಡಿದರೆ ಅದು ನಿಜವಾಗಿಯೂ ದಿನಾಂಕವನ್ನು ಹೊಂದಿಲ್ಲ. <br /> <br /> ಜಾಗತಿಕವಾಗಿ ವಿನಾಶಕಾರಿ ಯುದ್ಧದ ಹೊರತಾಗಿ, ಯಂತ್ರಗಳ ಪ್ರಮಾಣವು ಕೆಟ್ಟದಾಗಿದೆ, ಈಗ ಹೆಚ್ಚು ನ್ಯಾನೊ-ತಂತ್ರಜ್ಞಾನ, ಆದರೆ ಒಟ್ಟಾರೆಯಾಗಿ, ಅತ್ಯುತ್ತಮ ಮತ್ತು ಉತ್ತಮವಾಗಿ ರಚಿಸಲಾದ ಕೆಲಸ. ಆಗ ಬಾಹ್ಯಾಕಾಶ ಪ್ರಯಾಣವನ್ನು ಹೇಗೆ ಗ್ರಹಿಸಲಾಗಿದೆಯೆಂದು ನೋಡಲು ಆಸಕ್ತಿದಾಯಕವಾಗಿತ್ತು. ದೈತ್ಯಾಕಾರದ ಬಂದೂಕಿನಿಂದ ಬಾಹ್ಯಾಕಾಶ ನೌಕೆಗೆ ಗುಂಡು ಹಾರಿಸುವುದು ಗಗನಯಾತ್ರಿಗಳನ್ನು ಕೊಲ್ಲುತ್ತದೆ ಎಂದು ನಾನು ಭಾವಿಸುತ್ತೇನೆ. ಆದಾಗ್ಯೂ, ಹೆಚ್ಚು ಸರಿಯಾಗಿತ್ತು. ಮನುಷ್ಯರು ಯುದ್ಧದ ಆಸೆ, ಮನುಷ್ಯನಿಗೆ ಅಮಾನವೀಯತೆ. ಅಭಿವೃದ್ಧಿಯ ವೇಗವರ್ಧಕವಾಗಿ ಯುದ್ಧದ ಸಾಧನಗಳು. <br /> <br />#1
ಇದು ಕ್ರಿ.ಪೂ.ದಲ್ಲಿ ಚಿತ್ರೀಕರಿಸಿದ ಅತ್ಯಂತ ದುಬಾರಿ ಕೆನಡಾದ ಚಿತ್ರ ಮಾತ್ರವಲ್ಲ, ಆದರೆ ಅತ್ಯಂತ ಕೆಟ್ಟದಾಗಿದೆ, ದಿನದ ಬೆಳಕನ್ನು ಎಂದಿಗೂ ನೋಡಲಿಲ್ಲ. ನಿರ್ದೇಶಕರು ಕೆನಡಿಯನ್ ಅಲ್ಲ, ಆದರೆ ಬ್ರಿಟಿಷ್, ಮತ್ತು ಹುಡುಗ ಅದನ್ನು ತೋರಿಸುತ್ತಾನೆ. ನಾವೆಲ್ಲರೂ ಅತಿಯಾದ ಲೈಂಗಿಕತೆಯ ಡೋಪ್ ದೆವ್ವಗಳು ಮತ್ತು ಮೂರ್ಖರ ಗುಂಪಾಗಿ ಹೊರಹೊಮ್ಮಿದ್ದೇವೆ. ಕೆನಡಿಯನ್ ಎಂದು ಅರ್ಥೈಸುವ ಮನೋಭಾವವು ಇಲ್ಲವಾಗಿದೆ, ಮತ್ತು ನಾವು ಈ ಬಂಕ್‌ಗೆ ಹಣ ಒದಗಿಸಲು ಇದು ಕಾರಣವಾಗಿದೆ. ಸಹಜವಾಗಿ ಬ್ರಿಟಿಷ್ ಪಾತ್ರ ಸಾಮಾನ್ಯವಾಗಿದೆ. ಉಳಿದವು ಸಿಟ್ಕಾಮ್ ಸ್ಟೀರಿಯೊಟೈಪ್ನ ಬೆಳೆ - ನೀವು "ನಾರ್ಮ್ !!" ಎಂದು ಹೇಳಬಹುದೇ? Mat ಾಯಾಗ್ರಹಣವು ಸಾಕಷ್ಟು ಪೋಸ್ಟ್‌ಕಾರ್ಡ್ ಚಿತ್ರಗಳಿಂದ ಮರ್ಕಿ ಒಳಾಂಗಣ ಸಿಲೂಯೆಟ್‌ಗಳವರೆಗೆ ಇರುತ್ತದೆ. ನಟರು ಯಾವಾಗಲೂ ಚಡಪಡಿಸುತ್ತಿದ್ದಾರೆಂದು ತೋರುತ್ತದೆ. ಅವರು ವೀಕ್ಷಕರಂತೆ ಬೇಸರಗೊಂಡಿದ್ದಾರೆಯೇ ಅಥವಾ ಇದು ನಿರ್ದೇಶಕರ ಚಿತ್ರರಂಗದ ಕಲ್ಪನೆಯೇ? ಈ ಅವ್ಯವಸ್ಥೆಯನ್ನು ತಪ್ಪಿಸಿ ಮತ್ತು ಕೆಲವು ಬ್ರೂಸ್ ಮೆಕ್‌ಡೊನಾಲ್ಡ್ಸ್ ಚಲನಚಿತ್ರಗಳನ್ನು ಪರಿಶೀಲಿಸಿ. ಸಿನಿಮೀಯವಾಗಿ ಹೇಳಲು ಮೂಲವನ್ನು ಹೊಂದಿರುವ ನಿಜವಾದ ಕೆನಡಾದ ಹುಡುಗ. 10 ನಿಮಿಷಗಳ ನಂತರ ನೀವು ಅವರ ಚಲನಚಿತ್ರಗಳಲ್ಲಿ ಹೊರನಡೆಯಲು ಒತ್ತಾಯಿಸಲಾಗುವುದಿಲ್ಲ.#0
