ಇದು ಸಂಪೂರ್ಣವಾಗಿ ಭಯಾನಕ ಚಲನಚಿತ್ರವಾಗಿತ್ತು. ಕ್ರಿಸ್ಟೋಫರ್ ವಾಲ್ಕೆನ್ ಅಥವಾ ಮೈಕೆಲ್ ಐರನ್‌ಸೈಡ್‌ನಿಂದ ಆಮಿಷಕ್ಕೆ ಒಳಗಾಗಬೇಡಿ. ಇಬ್ಬರೂ ಶ್ರೇಷ್ಠ ನಟರು, ಆದರೆ ಇದು ಇತಿಹಾಸದಲ್ಲಿ ಅವರ ಕೆಟ್ಟ ಪಾತ್ರವಾಗಿರಬೇಕು. ಅವರ ಶ್ರೇಷ್ಠ ನಟನೆ ಕೂಡ ಈ ಚಿತ್ರದ ಹಾಸ್ಯಾಸ್ಪದ ಕಥಾಹಂದರವನ್ನು ಪುನಃ ಪಡೆದುಕೊಳ್ಳಲು ಸಾಧ್ಯವಾಗಲಿಲ್ಲ. ಈ ಚಲನಚಿತ್ರವು ತೊಂಬತ್ತರ ದಶಕದ ಆರಂಭದ ಯುಎಸ್ ಪ್ರಚಾರದ ತುಣುಕು. ಕೊಲಂಬಿಯಾದ ಬಂಡುಕೋರರು ಕ್ರಾಂತಿಗಳಿಗಾಗಿ ತಮ್ಮ ಪ್ರಕರಣಗಳನ್ನು ಮಾಡುತ್ತಿರುವಾಗ ಅತ್ಯಂತ ಕರುಣಾಜನಕ ದೃಶ್ಯಗಳು. ಮಾರಿಯಾ ಕೊಂಚಿತಾ ಅಲೋನ್ಸೊ ಫೋನಿ ಆಗಿ ಕಾಣಿಸಿಕೊಂಡರು, ಮತ್ತು ವಾಲ್ಕೆನ್ ಅವರೊಂದಿಗಿನ ಅವರ ಹುಸಿ-ಪ್ರೇಮ ಸಂಬಂಧವು ಯಾವುದೇ ನೈಜ ಅರ್ಥವಿಲ್ಲದ ಚಲನಚಿತ್ರದಲ್ಲಿನ ಕರುಣಾಜನಕ ಭಾವನಾತ್ಮಕ ಪ್ಲಗ್ ಮಾತ್ರವಲ್ಲ. ಕ್ರಿಸ್ಟೋಫರ್ ವಾಲ್ಕೆನ್‌ರಂತಹ ನಟರ ಒಳ್ಳೆಯ ಹೆಸರನ್ನು ಹಾಳುಮಾಡುವ ಈ ರೀತಿಯ ಚಲನಚಿತ್ರಗಳಿವೆ ಎಂದು ನನಗೆ ನಿರಾಶೆಯಾಗಿದೆ. ನಾನು ಅದರ ಮೂಲಕ ಕುಳಿತುಕೊಳ್ಳಲು ಸಾಧ್ಯವಾಗಲಿಲ್ಲ.#0
ಚಲನಚಿತ್ರಗಳ ಸಮಯದಲ್ಲಿ ನಾನು ನಿದ್ರಿಸುತ್ತಿದ್ದೇನೆ ಎಂದು ತಿಳಿದುಬಂದಿದೆ, ಆದರೆ ಇದು ಸಾಮಾನ್ಯವಾಗಿ ದಣಿದಿರುವುದು, ಸೆಟ್ಟೆಯಲ್ಲಿ ಬೆಚ್ಚಗಿರುತ್ತದೆ ಮತ್ತು ಆರಾಮದಾಯಕವಾಗುವುದು ಮತ್ತು ಸಾಕಷ್ಟು ತಿನ್ನುವುದು ಸೇರಿದಂತೆ ವಸ್ತುಗಳ ಸಂಯೋಜನೆಯಿಂದಾಗಿ. ಆದರೆ ಈ ಸಂದರ್ಭದಲ್ಲಿ ನಾನು ನಿದ್ರೆಗೆ ಜಾರಿದ್ದೇನೆ ಏಕೆಂದರೆ ಚಿತ್ರ ಕಸವಾಗಿದೆ. ಕಥಾವಸ್ತುವಿನ ಅಭಿವೃದ್ಧಿ ಸ್ಥಿರವಾಗಿತ್ತು. ನಿರಂತರವಾಗಿ ನಿಧಾನ ಮತ್ತು ನೀರಸ. ಸಂಗತಿಗಳು ಸಂಭವಿಸಿದಂತೆ ತೋರುತ್ತಿತ್ತು, ಆದರೆ ಅವುಗಳಿಗೆ ಕಾರಣವೇನು ಅಥವಾ ಏಕೆ ಎಂಬುದರ ಕುರಿತು ಯಾವುದೇ ವಿವರಣೆಯಿಲ್ಲದೆ. ನಾನು ಒಪ್ಪಿಕೊಳ್ಳುತ್ತೇನೆ, ನಾನು ಚಿತ್ರದ ಭಾಗವನ್ನು ಕಳೆದುಕೊಂಡಿರಬಹುದು, ಆದರೆ ನಾನು ಅದರಲ್ಲಿ ಹೆಚ್ಚಿನದನ್ನು ನೋಡಿದ್ದೇನೆ ಮತ್ತು ಎಲ್ಲವೂ ಬೇರೆ ಯಾವುದಕ್ಕೂ ನಿಜವಾದ ಕಾಳಜಿಯಿಲ್ಲದೆ ತನ್ನದೇ ಆದ ರೀತಿಯಲ್ಲಿ ಸಂಭವಿಸುತ್ತಿದೆ. ನಾನು ಈ ಚಿತ್ರವನ್ನು ಶಿಫಾರಸು ಮಾಡಲು ಸಾಧ್ಯವಿಲ್ಲ.#0
ಮನ್ ಆಲ್ಬರ್ಟಾ ರಾಕಿ ಪರ್ವತಗಳನ್ನು ಅದ್ಭುತ ಶೈಲಿಯಲ್ಲಿ s ಾಯಾಚಿತ್ರ ಮಾಡುತ್ತಾನೆ, ಮತ್ತು ಜಿಮ್ಮಿ ಸ್ಟೀವರ್ಟ್ ಮತ್ತು ವಾಲ್ಟರ್ ಬ್ರೆನ್ನನ್ ಅವರು ಯಾವಾಗಲೂ ಮಾಡುವಂತೆ ಆನಂದದಾಯಕ ಪ್ರದರ್ಶನಗಳನ್ನು ನೀಡುತ್ತಾರೆ. <br /> <br /> ಆದರೆ ಹಾಲಿವುಡ್‌ಗೆ ಬನ್ನಿ - ಯುಕಾನ್‌ನ ಡಾಸನ್ ನಗರದ ಜನರಿಗೆ ತಮ್ಮನ್ನು ಮಾರ್ಷಲ್ (ಹೌದು ಮಾರ್ಷಲ್!) ಎಂದು ಆಯ್ಕೆ ಮಾಡಿಕೊಳ್ಳಲು ಮತ್ತು ಕಾನೂನನ್ನು ಜಾರಿಗೆ ತರಲು ಹೇಳುವ ಮೌಂಟಿ, ನಂತರ ಗನ್‌ಫೈಟರ್‌ಗಳು ಅದನ್ನು ಬೀದಿಗಳಲ್ಲಿ ಹೋರಾಡುತ್ತಿದ್ದಾರೆ ಪಟ್ಟಣದ ನಿಯಂತ್ರಣ? <br /> <br /> ಕ್ಲೋಂಡಿಕೆ ಚಿನ್ನದ ರಶ್ ಸಮಯದಲ್ಲಿ ಗಡಿಯ ಕೆನಡಾದ ಭಾಗದಲ್ಲಿ ಸಂಭವಿಸಿದ ಯಾವುದನ್ನೂ ಸಹ ದೂರದಿಂದ ಹೋಲುತ್ತದೆ. ಶ್ರೀ ಮಾನ್ ಮತ್ತು ಕಂಪನಿಯು ಅಮೆರಿಕನ್ ವೈಲ್ಡ್ ವೆಸ್ಟ್ನ ಕೆನಡಿಯನ್ ನಾರ್ತ್ ಡೆಡ್ವುಡ್ಗಾಗಿ ಡಾಸನ್ ಸಿಟಿಯನ್ನು ತಪ್ಪಾಗಿ ಗ್ರಹಿಸಿದಂತೆ ಕಂಡುಬರುತ್ತದೆ. ಅಸಹ್ಯವಾಗಿ ನಿಮ್ಮ ತಲೆ ಅಲ್ಲಾಡಿಸಲು.#0
ಹಿಮಭರಿತ ಭಾನುವಾರ ಮಧ್ಯಾಹ್ನಕ್ಕೆ ಇದು ಒಂದು ರೀತಿಯ ಚಿತ್ರವಾಗಿದ್ದು, ನೀವು ದೊಡ್ಡ ತೋಳು-ಕುರ್ಚಿಗೆ ಇಳಿಯುವಾಗ ಮತ್ತು ಒಂದೆರಡು ಗಂಟೆಗಳ ಕಾಲ ಮಧುರವಾಗಿರುವಾಗ ಉಳಿದ ಪ್ರಪಂಚವು ತನ್ನದೇ ಆದ ವ್ಯವಹಾರದೊಂದಿಗೆ ಮುಂದುವರಿಯಬಹುದು. ಚೆರ್ ಮತ್ತು ನಿಕೋಲಸ್ ಕೇಜ್ ಅವರ ಅದ್ಭುತ ಪ್ರದರ್ಶನಗಳು (ಯಾವಾಗಲೂ ಹಾಗೆ) ಕಥಾವಸ್ತುವನ್ನು ನಿಧಾನವಾಗಿ ಸಾಲುಗಟ್ಟುತ್ತವೆ. ದಾಟಲು ಯಾವುದೇ ರಾಪಿಡ್‌ಗಳಿಲ್ಲ, ಅಪಾಯಕಾರಿ ನೀರಿಲ್ಲ, ನ್ಯೂಯಾರ್ಕ್ ಜೀವನದ ಮೂಲಕ ಕೇವಲ ಬೆಚ್ಚಗಿನ ಮತ್ತು ಹಾಸ್ಯದ ಪ್ಯಾಡಲ್. ಪ್ರತಿ ಅರ್ಥದಲ್ಲಿ ಒಂದು ಕುಟುಂಬ ಚಿತ್ರ ಮತ್ತು ಅದು ಪಡೆದ ಪ್ರಶಂಸೆಗೆ ಅರ್ಹವಾಗಿದೆ.#1
ಇತರರು ಹೇಳಿದಂತೆ, ಈ ಚಿತ್ರದಲ್ಲಿ ನಗ್ನವಾಗಿ ಹೋಗುವ ಎಲ್ಲ ಮಹಿಳೆಯರು ಹೆಚ್ಚಾಗಿ ಬಹುಕಾಂತೀಯರು. ಕಥಾವಸ್ತುವು ಸ್ತ್ರೀ ಕಾಮಾಸಕ್ತಿಯ ಬೂಟಾಟಿಕೆಯನ್ನು ತೋರಿಸುತ್ತದೆ. ಪುರುಷರು ಸುತ್ತಲೂ ಇರುವಾಗ ಅವರನ್ನು ಹಿಂಬಾಲಿಸಲು ಬಯಸುತ್ತಾರೆ, ಆದರೆ "ಪುರುಷರು" ಇಲ್ಲದಿದ್ದಾಗ, ಅವರು 14 ವರ್ಷದ ಹುಡುಗನನ್ನು ಹಿಂಬಾಲಿಸುತ್ತಾರೆ. ಮತ್ತು ಹುಡುಗ ನಿಜವಾಗಿಯೂ ವೇಗವಾಗಿ ಮನುಷ್ಯನಾಗುತ್ತಾನೆ (ಈ ವಯಸ್ಸಿನಲ್ಲಿ ನಾವೆಲ್ಲರೂ ತುಂಬಾ ಅದೃಷ್ಟಶಾಲಿಯಾಗಿರಬೇಕು!). ನಂತರ ಅವನು ತನ್ನ ನಿಜವಾದ ಪ್ರೀತಿಯನ್ನು ಅನುಸರಿಸುವ ಧೈರ್ಯವನ್ನು ಪಡೆಯುತ್ತಾನೆ.#1
ಇದು ಆಸಕ್ತಿ ಹೊಂದಿರುವ, ಪರಿಣಾಮ ಬೀರುವ ಅಥವಾ ತಿನ್ನುವ ಕಾಯಿಲೆಯಿಂದ ಬಳಲುತ್ತಿರುವ ಯಾರಾದರೂ ನೋಡಬೇಕಾದ ಚಿತ್ರ. ಇದು ಹದಿಹರೆಯದ ಹುಡುಗಿಯಲ್ಲಿನ ಬುಲಿಮಿಯಾ, ಅದರ ಕಾರಣಗಳು ಮತ್ತು ರೋಗಲಕ್ಷಣಗಳ ವಿಸ್ಮಯಕಾರಿಯಾಗಿ ನಿಖರ ಮತ್ತು ಸೂಕ್ಷ್ಮ ಚಿತ್ರಣವಾಗಿದೆ. ಈ ಹುಡುಗಿಯನ್ನು ಇಂದು ಸಿನೆಮಾದಲ್ಲಿ ಕೆಲಸ ಮಾಡುವ ಅತ್ಯಂತ ಅದ್ಭುತ ಯುವ ನಟಿಯರಲ್ಲಿ ಒಬ್ಬರು, ಅಲಿಸನ್ ಲೋಹ್ಮಾನ್, ನಂತರ 'ವೇರ್ ದಿ ಟ್ರುತ್ ಲೈಸ್' ನಲ್ಲಿ ತುಂಬಾ ಅದ್ಭುತವಾಗಿದ್ದರು. ಈ ಚಲನಚಿತ್ರವನ್ನು ಎಲ್ಲಾ ಶಾಲೆಗಳಲ್ಲಿ ತೋರಿಸಬೇಕೆಂದು ನಾನು ಶಿಫಾರಸು ಮಾಡುತ್ತೇನೆ, ಏಕೆಂದರೆ ಈ ವಿಷಯದ ಬಗ್ಗೆ ನೀವು ಎಂದಿಗೂ ಉತ್ತಮವಾಗಿ ಕಾಣುವುದಿಲ್ಲ. ಅಲಿಸನ್ ಲೋಹ್ಮಾನ್ ಸಂಪೂರ್ಣವಾಗಿ ಮಹೋನ್ನತವಾದುದು, ಮತ್ತು ಈ ಕಂಪಲ್ಸಿವ್ ಡಿಸಾರ್ಡರ್‌ನಿಂದ ಬಳಲುತ್ತಿರುವ ಹುಡುಗಿಯ ದುಃಖವನ್ನು ತಿಳಿಸುವ ಸಾಮರ್ಥ್ಯದಲ್ಲಿ ಒಬ್ಬರು ಆಶ್ಚರ್ಯ ಪಡುತ್ತಾರೆ. ಮಾಪಕಗಳು ನಮಗೆ ಗಾಳಿಯ ಒತ್ತಡವನ್ನು ಹೇಳಿದರೆ, ಅಲಿಸನ್ ಲೋಹ್ಮಾನ್ ಭಾವನಾತ್ಮಕ ಒತ್ತಡವನ್ನು ಅದೇ ಮಟ್ಟದ ನಿಖರತೆಯೊಂದಿಗೆ ನಮಗೆ ಹೇಳುತ್ತಾನೆ. ಅವಳ ಭಾವನಾತ್ಮಕ ವ್ಯಾಪ್ತಿಯು ತುಂಬಾ ನಿಖರವಾಗಿದೆ, ಪ್ರತಿ ದೃಶ್ಯವನ್ನು ಅದರ ಆಘಾತದ ಹಂತಗಳಿಗಾಗಿ ಸೂಕ್ಷ್ಮದರ್ಶಕವಾಗಿ ಅಳೆಯಬಹುದು, ಹೆಚ್ಚುತ್ತಿರುವ ಉನ್ಮಾದ ಮತ್ತು ಹತಾಶೆಯ ಪ್ರಮಾಣದಲ್ಲಿ ಇದು ಅಸಹನೀಯ ತೀವ್ರತೆಯನ್ನು ತಲುಪುತ್ತದೆ. ಮಾರೆ ವಿನ್ನಿಂಗ್ಹ್ಯಾಮ್ ತನ್ನ ತಾಯಿಯನ್ನು ಆಡಲು ಸೂಕ್ತವಾದ ಆಯ್ಕೆಯಾಗಿದೆ, ಮತ್ತು ಅಪಾರವಾದ ಸಹಾನುಭೂತಿ ಮತ್ತು ಹಲವಾರು ಭಾವನೆಗಳೊಂದಿಗೆ ಲೋಹ್ಮಾನ್ ಅವರಂತೆಯೇ ಉತ್ತಮವಾಗಿ ಟ್ಯೂನ್ ಮಾಡುತ್ತಾರೆ. ಒಟ್ಟಾಗಿ, ಅವರು ಪರಸ್ಪರ ಭಾವನಾತ್ಮಕ ಆಂದೋಲಕಗಳನ್ನು ಪರಸ್ಪರ ಅನುರಣನದಲ್ಲಿ ಕಂಪಿಸುವಂತೆ ಮಾಡುತ್ತಾರೆ. ಈ ಚಿತ್ರ ನಿಜಕ್ಕೂ ಆಶ್ಚರ್ಯಕರ ಸಾಧನೆಯಾಗಿದ್ದು, ನಿರ್ದೇಶಕ ಕ್ಯಾಟ್ ಶಿಯಾ ಇದರ ಬಗ್ಗೆ ಹೆಮ್ಮೆ ಪಡಬೇಕು. ನೀವು ಜನರ ಬಗ್ಗೆ ಆಸಕ್ತಿ ಹೊಂದಿಲ್ಲದಿದ್ದರೆ ಅದನ್ನು ನೋಡದಿರಲು ಒಂದೇ ಕಾರಣ. ಆದರೆ ನೀವು ಪ್ರಕೃತಿ ಚಲನಚಿತ್ರಗಳನ್ನು ಹೆಚ್ಚು ಇಷ್ಟಪಡುತ್ತಿದ್ದರೂ ಸಹ, ಇದು ಎಲ್ಲಾ ಪ್ರಾಣಿಗಳ ನಡವಳಿಕೆಯ ನಂತರ ತೀಕ್ಷ್ಣವಾದ ತುದಿಯಲ್ಲಿರುತ್ತದೆ. ಬುಲಿಮಿಯಾ ಎನ್ನುವುದು ಹಿಂಸೆಗೊಳಗಾದ ಆತ್ಮವು ತನ್ನ ದೇಹವನ್ನು ಹತಾಶೆಯ ಉನ್ಮಾದದಲ್ಲಿ ಹೇಗೆ ನಾಶಪಡಿಸುತ್ತದೆ ಎಂಬುದರ ವಿಪರೀತ ಆವೃತ್ತಿಯಾಗಿದೆ. ಮತ್ತು ಹತಾಶೆಯ ಆಳದಿಂದ ಬಳಲುತ್ತಿರುವ ಜನರ ಬಗ್ಗೆ ನಾವು ಸಹಾನುಭೂತಿ ತೋರಿಸದಿದ್ದರೆ, ನಾವು ಒಳಗೆ ಸತ್ತಿದ್ದೇವೆ.#1
ಸರಿ, ನೀವು ಹೊಂದಿದ್ದೀರಿ: <br /> <br /> ಪೆನೆಲೋಪ್ ಕೀತ್ ಮಿಸ್ ಹೆರಿಂಗ್ಬೋನ್-ಟ್ವೀಡ್ ಆಗಿ, ಬಿ.ಬಿ.ಇ. (ಇಂಗ್ಲೆಂಡ್‌ನ ಬೆನ್ನೆಲುಬು.) ಮೊದಲ ದೃಶ್ಯದಲ್ಲಿ ಅವಳು ಕೊಲ್ಲಲ್ಪಟ್ಟಳು - ಅದು ಸರಿ, ಜನರಾಗಿದ್ದರು; ಈ ಪ್ರದರ್ಶನಕ್ಕೆ ಬೆನ್ನೆಲುಬು ಇಲ್ಲ! <br /> <br /> ಮೊದಲ ಯುದ್ಧದಿಂದ ಓಲ್ ಕರ್ನಲ್ ಕ್ರಿಕೆಟ್ ಆಗಿ ಪೀಟರ್ ಒ ಟೂಲ್ ಮತ್ತು ಈಗ ಲಾರ್ಡ್ ಆಫ್ ದಿ ಮ್ಯಾನರ್. <br /> <br /> ಜೊವಾನ್ನಾ ಲುಮ್ಲೆ ಅವರು ಮೋಹಕವಾದ ಲೇಡಿ ಆಗಿ ಮ್ಯಾನರ್, ಕರ್ನಲ್ಗಿಂತ 20 ವರ್ಷ ಕಿರಿಯ ಮತ್ತು ತನ್ನದೇ ಆದ ಅವಿಭಾಜ್ಯವನ್ನು ಕಳೆದ 20 ವರ್ಷಗಳು ಆದರೆ ಇನ್ನೂ ಮನಮೋಹಕ (ಬ್ರಿಟ್ ಕಾಗುಣಿತ, ನನ್ನದಲ್ಲ) ಆಟಿಕೆ ಹುಡುಗನನ್ನು ಹೊಂದಲು ಸಾಕಷ್ಟು ಸಾಕು. ಇದು ಸರಿಯಾಗಿದೆ, ಅವರು ಕರ್ನಲ್ ಕ್ರಿಕೆಟ್‌ನ ಸಂಪೂರ್ಣ ಜ್ಞಾನ ಮತ್ತು ಒಪ್ಪಿಗೆಯನ್ನು ಹೊಂದಿದ್ದಾರೆ (ಅವರು ಕ್ರಿಸ್‌ಮಸ್‌ಗಾಗಿ ಸುತ್ತಾಡುತ್ತಾರೆ!) ಆದರೂ, ಆಟಿಕೆ-ಹುಡುಗನಿಗೆ ತನ್ನ ವಯಸ್ಸಿನಷ್ಟೇ ಹೇಳುವಷ್ಟು ಕರ್ನಲ್‌ನ ಬಗ್ಗೆ ಅವಳು ಪರಿಗಣಿಸುತ್ತಾಳೆ (ಏನು ಗ್ಯಾಲ್!) <br /> <br /> ಆಟಿಕೆ-ಹುಡುಗ ಹೇಳಿದಂತೆ ಡೇವಿಡ್ ಮೆಕಲಮ್, ಅವನ ಸ್ಕ್ವೀ ze ್‌ನಂತೆಯೇ ಅರ್ಥಹೀನವಾಗಿ ಮನಮೋಹಕ. ಕಥೆಯೊಳಗೆ ಪಿಲ್ಚರ್‌ಗೆ ಯಾವುದೇ ಕವರ್ ನೀಡಲು ಸಾಧ್ಯವಾಗಲಿಲ್ಲ, ಆದ್ದರಿಂದ ಅವಳು ಅವನಿಗೆ ಸರ್ಕಸ್‌ನಲ್ಲಿ ಹಶ್-ಹಶ್ ಕೆಲಸವನ್ನು ಕೊಟ್ಟಳು. <br /> <br /> ಮತ್ತು ಅಂತಿಮವಾಗಿ: <br /> <br /> ಸುಸಾನ್ ಹ್ಯಾಂಪ್‌ಶೈರ್ ಪೂಜ್ಯ ಬಾಲಕಿಯರ ಬೋರ್ಡಿಂಗ್-ಶಾಲೆಯ ಪೂಜ್ಯ ಮುಖ್ಯೋಪಾಧ್ಯಾಯಿಯಾಗಿದ್ದ ಮಿಸ್ ಪೊಲೊನಿಯಾ ಟೀಕಪ್ಸ್, ಪದವೀಧರರಾಗುವ ಮುನ್ನ ಹೊರಗಿನ ಪ್ರಪಂಚದ ಜೀವನಕ್ಕಾಗಿ ಆಳವಾದ, ಕಟುವಾದ ಸಲಹೆಯೊಂದಿಗೆ ತನ್ನ ಕಚೇರಿಯಲ್ಲಿ ಚಹಾವನ್ನು ಬಡಿಸುತ್ತಿದ್ದಾರೆ. ಅವರ ಅತ್ಯುತ್ತಮ ಸಲಹೆ: "ನಾನು ಒಮ್ಮೆ ಮಾತ್ರ ನ್ಯಾಂಚೆರೋ (ಸ್ಥಳೀಯ ಸ್ಟೇಟ್‌ಲಿ ಹೋಮ್ ಆಫ್ ಇಂಗ್ಲೆಂಡ್) ಗೆ ಹೋಗಿದ್ದೆ. ಅದು ತುಂಬಾ ಸುಂದರವಾಗಿದೆ ಎಂದು ನಾನು ಭಾವಿಸಿದ್ದೆ ಆದರೆ ಹೇಗಾದರೂ, ನೈಜ ಪ್ರಪಂಚದ ಭಾಗವಲ್ಲ." ಅವರು ನಮಗೆ ಎಚ್ಚರಿಕೆ ನೀಡಿಲ್ಲ ಎಂದು ನಾವು ಹೇಳಲಾರೆವು. <br /> <br /> ಆಹ್, ಸುಸಾನ್ - ಸಮಯ, ನಿಮ್ಮ ಪಾತ್ರವು ಇಡೀ ಪ್ರದರ್ಶನವನ್ನು ನಡೆಸುತ್ತಿತ್ತು. ಅವರು ಇನ್ನು ಮುಂದೆ ಹಾಗೆ ಬರೆಯುವುದಿಲ್ಲ. ನಮ್ಮ ನಷ್ಟ, ನಿಮ್ಮದಲ್ಲ. <br /> <br /> ಆದ್ದರಿಂದ - ಈ ರೀತಿಯ ಎರಕಹೊಯ್ದ ಮತ್ತು ಸೆಟ್ಟಿಂಗ್‌ನೊಂದಿಗೆ, ನೀವು "ಬ್ರೈಡ್‌ಹೆಡ್ ರಿವಿಸಿಟೆಡ್" ನ ಮರು-ತಯಾರಿಕೆಗಳನ್ನು ಹೊಂದಿದ್ದೀರಾ? <br /> <br /> ತಪ್ಪಾಗಿದೆ! ಅವರು ಈ 1-ಆಯಾಮದ ಪೋಷಕ ಪಾತ್ರಗಳನ್ನು ತೆಗೆದುಕೊಂಡರು ಏಕೆಂದರೆ ಅವರು ತುಂಬಾ ಚೆನ್ನಾಗಿ ಪಾವತಿಸಿದ್ದಾರೆ. ಎಲ್ಲಾ ನಂತರ, ನಟನೆ ಅಲ್ಲಿರುವ ಅತ್ಯಂತ ಹಳೆಯ ಟೆಂಪ್-ಉದ್ಯೋಗಗಳಲ್ಲಿ ಒಂದಾಗಿದೆ (ನೀವು ಇನ್ನೊಂದನ್ನು ಹೆಸರಿಸಿ!) <br /> <br /> ಮೊದಲ ಎಚ್ಚರಿಕೆ ಚಿಹ್ನೆ: ಸಾಕಷ್ಟು ಮತ್ತು ಸಾಕಷ್ಟು ಬ್ಯಾಕ್‌ಲೈಟಿಂಗ್. ಹೊರಾಂಗಣದಲ್ಲಿ ಚಿತ್ರೀಕರಣ ಮಾಡುವ ಮೂಲಕ ಅವರು ಅದರ ಸುತ್ತಲೂ ಹೋಗುತ್ತಾರೆ - "ಹೇ, ಇದು ಕೇವಲ ಸೂರ್ಯನ ಬೆಳಕು!" <br /> <br /> ಎರಡನೇ ಎಚ್ಚರಿಕೆ ಚಿಹ್ನೆ: ಲೀಡಿಂಗ್ ಲೇಡಿ ತುಂಬಾ ಅಳುತ್ತಾಳೆ. ಅಳದಿದ್ದಾಗ ಅವಳ ಕಣ್ಣುಗಳು ತೇವವಾಗಿರುತ್ತದೆ. ಅದು ಪ್ರಣಯ ಕಾದಂಬರಿಗಳ ನಿಯಮ: ಲೀಡಿಂಗ್ ಲೇಡಿ "ಇಬ್ಬನಿ ಕಣ್ಣುಗಳು." <br /> <br /> ಇನ್ನು ಮುಂದೆ, ಲೀಡಿಂಗ್ ಲೇಡಿಯನ್ನು ಎಲ್ಎಲ್ ಎಂದು ಕರೆಯಲಾಗುತ್ತದೆ. <br /> <br /> ಮೂರನೇ ಎಚ್ಚರಿಕೆ ಚಿಹ್ನೆ: ಎಲ್ಎಲ್ ವಾಸ್ತವವಾಗಿ ನಕ್ಷತ್ರಗಳನ್ನು ಹೊಂದಿದೆ ಅವಳು ಪ್ರೀತಿಸುತ್ತಿರುವಾಗ ಅವಳ ಕಣ್ಣುಗಳು. ಆದರೂ, ನಾನು ಎಮಿಲಿ ಮಾರ್ಟಿಮರ್‌ಗೆ ಅವಳ ದೃಷ್ಟಿಯಲ್ಲಿ ಆ ಸ್ಪಾಟ್‌ಲೈಟ್‌ನೊಂದಿಗೆ ವರ್ತಿಸಿದ್ದಕ್ಕಾಗಿ ಪ್ರಶಸ್ತಿ ನೀಡುತ್ತೇನೆ (ನನಗೆ ಆಶ್ಚರ್ಯ. ಅವರು ಸಂಪರ್ಕಗಳನ್ನು ಬಳಸಿದ್ದಾರೆಯೇ?) <br /> <br /> ಮತ್ತು ಕೊನೆಯದಾಗಿ, ನಾಲ್ಕನೇ ಎಚ್ಚರಿಕೆ ಚಿಹ್ನೆ: ತೆರೆಯ ಮೇಲೆ ಇಲ್ಲ ಸ್ತ್ರೀ ಪಾತ್ರ "ಶ್ರೀಮತಿ" ಅವಳು "ಮಿಸ್" ಅಥವಾ "ಲೇಡಿ." <br /> <br /> ಎಲ್ಲವನ್ನೂ ಹೇಳಿದಾಗ ಮತ್ತು ಮುಗಿಸಿದಾಗ, ಯಾರು ಯಾರನ್ನು ಮತ್ತು ಏಕೆ ಅನುಸರಿಸುತ್ತಿದ್ದಾರೆಂದು ನನಗೆ ಇನ್ನೂ ಹೇಳಲಾಗಲಿಲ್ಲ. ಹೇಳಿದ್ದನ್ನು ಮತ್ತು ಮಾಡಿದ್ದನ್ನು ನಾನು ನಿಮಗೆ ಹೇಳಲಾರೆ. <br /> <br /> ಒಟ್ಟಾರೆಯಾಗಿ ಹೇಳುವುದಾದರೆ: ಅವರೆಲ್ಲರೂ ಎರಡನೆಯ ಮಹಾಯುದ್ಧದ ಮೂಲಕ ಅವರಿಗೆ ಏನೂ ಆಗದೆ ಬದುಕುತ್ತಾರೆ. <br /> <br /> ಸರಿ, ಕೊನೆಯಲ್ಲಿ, ಎಲ್ಎಲ್ ತನ್ನ ಪೋಷಕರನ್ನು ಜಪಾನಿನ ಜೈಲು ಶಿಬಿರಗಳಿಗೆ ಕಳೆದುಕೊಂಡಿರುವುದನ್ನು ಕಂಡುಕೊಂಡಳು ಮತ್ತು ಬೇಬಿ ಸಿಸ್ ಮನೆಗೆ ಕ್ಯಾಟಟೋನಿಕ್ ಬರುತ್ತದೆ. ಏತನ್ಮಧ್ಯೆ (ಯಾವಾಗಲೂ "ಅಷ್ಟರಲ್ಲಿ" ಇದೆ) ಕೆಲವು ಯುವಕ ಎಲ್ಎಲ್ ಗೆ ಮೋಹವಿತ್ತು (ಯಾವಾಗ, ನನಗೆ ಗೊತ್ತಿಲ್ಲ) ಕೆಲವು ಯುದ್ಧಕಾಲದ ಕಠಿಣ ಸ್ಥಳದಿಂದ ಮನೆಗೆ ಬರುತ್ತಾನೆ ಮತ್ತು ಲೇಡಿ ಆಫ್ ದಿ ಮ್ಯಾನರ್ ಬೀದಿಯಲ್ಲಿ ವಾಸಿಸುತ್ತಿರುವುದು ಕಂಡುಬರುತ್ತದೆ (ಕೆಲವು ಇರಬೇಕು ಅವಳು ಅಲ್ಲಿ ಅವನನ್ನು ಹುಡುಕಲು ಹೋದರೆ ರಸ್ತೆ.) ನಾಂಚೆರೋದಲ್ಲಿ ಚೇತರಿಸಿಕೊಳ್ಳಲು ಎರಡೂ ಯುದ್ಧ ಸಾವುನೋವುಗಳನ್ನು ದೂರವಿಡಲಾಗುತ್ತದೆ (ಈ ಪ್ರಣಯ ಕಥೆಗಳಲ್ಲಿ ಕೆಲವು "ಯಾರನ್ನಾದರೂ" ಪೊರಕೆ ಹಿಡಿಯಬೇಕು "! <br /> <br /> ಅದ್ಭುತ ನಾಟಕ.#0
ಈ ಚಿತ್ರವು 1950 ರ ನಿಜವಾದ ಕಾದಂಬರಿಯನ್ನು ಆಧರಿಸಿದೆ. <br /> <br /> ಪತ್ರಕರ್ತ ಕಾಲಿನ್ ಮ್ಯಾಕ್‌ಇನ್ನೆಸ್ ಮೂರು "ಲಂಡನ್ ಕಾದಂಬರಿಗಳ" ಒಂದು ಗುಂಪನ್ನು ಬರೆದಿದ್ದಾರೆ: "ಸಂಪೂರ್ಣ ಬಿಗಿನರ್ಸ್", "ಸಿಟಿ ಆಫ್ ಸ್ಪೇಡ್ಸ್" ಮತ್ತು "ಮಿಸ್ಟರ್ ಲವ್ ಅಂಡ್ ಜಸ್ಟೀಸ್". ನಾನು ಮೂರನ್ನೂ ಓದಿದ್ದೇನೆ. ಮೊದಲ ಎರಡು ಅತ್ಯುತ್ತಮವಾಗಿವೆ. ಕೊನೆಯ, ಬಹುಶಃ ಹೊರಬರದ ಪ್ರಯೋಗ. ಆದರೆ ಮ್ಯಾಕ್ಇನ್ನೆಸ್ ಅವರ ಕೆಲಸವು ಹೆಚ್ಚು ಪ್ರಶಂಸೆಗೆ ಪಾತ್ರವಾಗಿದೆ; ಮತ್ತು ಸರಿಯಾಗಿ. ಈ ಸಂಗೀತವು ಕಾದಂಬರಿಕಾರನ ಅಂತಿಮ ದುಃಸ್ವಪ್ನವಾಗಿದೆ - ಒಬ್ಬರ ಮನಸ್ಸಿನ ಫಲವನ್ನು 1950 ರ ಲಂಡನ್‌ನ ಚೈತನ್ಯವನ್ನು ಸೆರೆಹಿಡಿಯುತ್ತದೆ ಮತ್ತು ಯಾವುದೇ ರೀತಿಯ ಕೆಲಸ ಮಾಡುವುದಿಲ್ಲ ಎಂದು ಹೇಳುವ ಚಲನಚಿತ್ರವೊಂದರ ಹೊಳಪುಳ್ಳ, ಕೆಟ್ಟದಾಗಿ ವರ್ತಿಸಿದ, ಸೊಪೊರಿಫಿಕ್ ಒಂದು ಆಯಾಮದ ಕ್ಷಮೆಯಾಚನೆಯಾಗಿರುವುದನ್ನು ನೋಡಲು. <br /> <br /> ಒಳ್ಳೆಯತನಕ್ಕೆ ಧನ್ಯವಾದಗಳು ಕಾಲಿನ್ ಮ್ಯಾಕ್‌ಇನ್ನೆಸ್ ಇದಕ್ಕೆ ಸಾಕ್ಷಿಯಾಗಲು ಜೀವಂತವಾಗಿರಲಿಲ್ಲ.#0
