ಎಂಪಿಎಎ: ಹಿಂಸೆ, ಭಾಷೆ, ನಗ್ನತೆ ಮತ್ತು ಸಂಕ್ಷಿಪ್ತ ಮಾದಕವಸ್ತು ಬಳಕೆಗಾಗಿ ಆರ್. ಕ್ವಿಬೆಕ್ ರೇಟಿಂಗ್: 13+ ಕೆನಡಿಯನ್ ಹೋಮ್ ವಿಡಿಯೋ ರೇಟಿಂಗ್: 18 ಎ <br /> <br /> ನಾನು ಇಂದು ಕೂನ್ಸ್ಕಿನ್ ಅನ್ನು ನೋಡಿದೆ. ಈ ಚಿತ್ರವನ್ನು ಬಸ್ಟಿನ್ and ಟ್ ಮತ್ತು ಸ್ಟ್ರೀಟ್ ಫೈಟ್ ಎಂದೂ ಕರೆಯುತ್ತಾರೆ. ಫ್ರಿಟ್ಜ್ ದಿ ಕ್ಯಾಟ್ ಅನ್ನು ನೋಡಿದ ನಂತರ, ನಾನು ಬಾಷ್ಕಿಯ ಹೆಚ್ಚಿನ ಚಲನಚಿತ್ರಗಳನ್ನು ನೋಡಲು ಬಯಸುತ್ತೇನೆ ನಾನು ಕೂಲ್ ವರ್ಲ್ಡ್ ಅನ್ನು ನೋಡಿದೆ ಮತ್ತು ಇದು ಸಾಧಾರಣವೆಂದು ನಾನು ಭಾವಿಸಿದೆ ಮತ್ತು ನಾನು ಇದನ್ನು ನೋಡಿದೆ. ಇದು ಮೊದಲು ಬಿಡುಗಡೆಯಾದಾಗ, ಈ ಚಿತ್ರವು ತುಂಬಾ ವಿವಾದಾತ್ಮಕವಾಗಿತ್ತು. ಇದನ್ನು ವರ್ಣಭೇದ ನೀತಿಯೆಂದು ಪರಿಗಣಿಸಲಾಗಿತ್ತು ಮತ್ತು ಅಲ್ ಶಾರ್ಪ್ಟನ್ ಚಲನಚಿತ್ರವನ್ನು ನಿಷೇಧಿಸಬೇಕೆಂದು ಬಯಸಿದ್ದರು, ಅವರು ಚಿತ್ರ ಇರುವ ಚಿತ್ರಮಂದಿರದ ಹೊರಗೆ ಪ್ರತಿಭಟನೆಗಳನ್ನು ನಡೆಸಿದರು ಈ ಚಿತ್ರವನ್ನು ವಿಎಚ್‌ಎಸ್‌ನಲ್ಲಿ "ಸ್ಟ್ರೀಟ್ ಫೈಟ್" ಶೀರ್ಷಿಕೆಯಡಿಯಲ್ಲಿ ಮಾತ್ರ ಬಿಡುಗಡೆ ಮಾಡಲಾಯಿತು .ಇದನ್ನು ಈಗ ಕಲ್ಟ್-ಕ್ಲಾಸಿಕ್ ಚಿತ್ರವೆಂದು ಪರಿಗಣಿಸಲಾಗಿದೆ ಮತ್ತು ಆಫ್ರಿಕನ್-ಅಮೇರಿಕನ್ ಪ್ರಸಿದ್ಧ ವ್ಯಕ್ತಿಗಳಾದ ಹಾಸ್ಯನಟ ರಿಚರ್ಡ್ ಪ್ರೈಯರ್, ನಿರ್ದೇಶಕ ಸ್ಪೈಕ್ ಲೀ ಮತ್ತು ರಾಪ್ ಗುಂಪು ದಿ ವು-ಟ್ಯಾಂಗ್ ಕ್ಲಾನ್ ಈ ಚಿತ್ರವನ್ನು ಆನಂದಿಸಿದ್ದೇನೆ ಎಂದು ಹೇಳಲಾಗಿದೆ. ಫ್ರಿಟ್ಜ್ ದಿ ಕ್ಯಾಟ್ ಹೆಚ್ಚು ಉತ್ತಮವಾದ ಚಿತ್ರ ಎಂದು ನಾನು ವೈಯಕ್ತಿಕವಾಗಿ ಭಾವಿಸಿದ್ದೆ ಆದರೆ ಇದು ತುಂಬಾ ಆನಂದದಾಯಕವಾಗಿದೆ. ಬಾಷ್ಕಿ ಅಥವಾ ಬ್ಲ್ಯಾಕ್ಸ್‌ಪ್ಲೋಯಿಟೇಶನ್ ಚಲನಚಿತ್ರ ಅಭಿಮಾನಿಗಳನ್ನು ನೋಡುವುದು ಯೋಗ್ಯವಾಗಿದೆ. ಈ ಚಿತ್ರವು ಲೈವ್ ಆಕ್ಷನ್ ಮತ್ತು ಆನಿಮೇಷನ್ ರೀತಿಯನ್ನು ಹೂ ಫ್ರೇಮ್ಡ್ ರೋಜರ್ ಚಿತ್ರದಂತೆ ಬೆರೆಸುತ್ತದೆ. ಮೊಲ. ನಾನು ಅದನ್ನು ಪೂರ್ಣ ಅನಿಮೇಶನ್‌ನಲ್ಲಿ ಆದ್ಯತೆ ನೀಡುತ್ತಿದ್ದೆ ಆದರೆ wh ಹೇಗಾದರೂ. ಈ ಚಿತ್ರವು ಅವರ ಇಬ್ಬರು ಸ್ನೇಹಿತರನ್ನು ಜೈಲಿನಿಂದ ರಕ್ಷಿಸಲು ಪೂಜ್ಯ ಮತ್ತು ಇನ್ನೊಬ್ಬ ವ್ಯಕ್ತಿಯೊಂದಿಗೆ ಓಡುತ್ತದೆ. ಕೈದಿಗಳು ಕಾಯುತ್ತಿರುವಾಗ, ಹಿರಿಯನು ತನಗೆ ತಿಳಿದ ಮೂರು ಪುರುಷರ ಕಥೆಯನ್ನು ಹೇಳುತ್ತಾನೆ. ಚಲನಚಿತ್ರವು ಅನಿಮೇಷನ್ ಸ್ವರೂಪಕ್ಕೆ ಬದಲಾಗುತ್ತದೆ, ನಾವು ಮೂರು ನೋಡುತ್ತೇವೆ ಈ ಮನುಷ್ಯನಿಗೆ ತಮ್ಮ ಮನೆಯನ್ನು ಮಾರಿದ ಕಪ್ಪು ಪುರುಷರು. ಅವರು ಹಾರ್ಲೆಮ್‌ನಲ್ಲಿ ತಮ್ಮನ್ನು ತಾವು ಹೆಸರಿಸಲು ನಿರ್ಧರಿಸುತ್ತಾರೆ.ಆದ್ದರಿಂದ ನಾಯಕ, ಕಪ್ಪು ಮೊಲ, ಹಾರ್ಲೆಮ್‌ನಲ್ಲಿ ದೊಡ್ಡ ಆಟಗಾರನನ್ನು ಕೊಲ್ಲುತ್ತಾನೆ ಮತ್ತು ಅವನು ಮೂಲತಃ ದೊಡ್ಡ ಹೊಡೆತವಾಗುತ್ತಾನೆ. ಈ ಚಿತ್ರವು ಇಟಾಲಿಯನ್ ಮಾಫಿಯಾದಂತೆ ಚಲಿಸುತ್ತದೆ ಅವನನ್ನು ಹೊರಹಾಕಲು ಬಯಸುತ್ತೇನೆ. ಮಾಫಿಯಾದಲ್ಲಿ ಗಾಡ್ ಫಾದರ್, ಅವರ ಮೂವರು ಗಂಡು ಮಕ್ಕಳು ಸಲಿಂಗಕಾಮಿ ಮತ್ತು ಇಟಾಲಿಯನ್ ಕೋಡಂಗಿ ಸೇರಿದ್ದಾರೆ. ಕೂನ್ಸ್ಕಿನ್ ಒಂದು ಮನರಂಜನೆಯ ಆನಿಮೇಟೆಡ್ ಚಲನಚಿತ್ರವಾಗಿದ್ದು, ನೀವು ಅದನ್ನು ಕಂಡುಹಿಡಿಯಲು ಸಾಧ್ಯವಾದರೆ ಅದನ್ನು ಪರಿಶೀಲಿಸುವುದು ಯೋಗ್ಯವಾಗಿದೆ.#1
ಇದು ರು - ಟಿ !! ಇದು t.v. ಗಾಗಿ ತಯಾರಿಸಿದ್ದಕ್ಕಿಂತ ಕೆಟ್ಟದಾಗಿದೆ. ಚಲನಚಿತ್ರ. ಮತ್ತು ಉತ್ತರಭಾಗವು ಸಹ ಸಮಾಧಾನಗೊಂಡಿದೆ ಮತ್ತು ಫಲಿತಾಂಶಗಳು ಎಂದು ಯೋಚಿಸಲು ನಾನು ಶಟರ್ ... ಯುದ್ಧವು ಇದಕ್ಕಿಂತ ಸುಂದರವಾಗಿರುತ್ತದೆ. ಜೀನ್ ಕ್ಲೌಡ್ ವ್ಯಾನ್ ಅವಮಾನ ಮತ್ತೆ ಅದನ್ನು ಮಾಡಿದೆ ಮತ್ತು ಅವರ ವೃತ್ತಿಜೀವನವು ಈಗ ಎಲ್ಲಿದೆ ಎಂದು ಅವರು ಆಶ್ಚರ್ಯ ಪಡುತ್ತಾರೆ. ಯಾವುದೇ ಸ್ಕ್ರಿಪ್ಟ್ ಇಲ್ಲ, ಕಥೆ ಇಲ್ಲ ಮತ್ತು ಸಮಯವನ್ನು ವ್ಯರ್ಥ ಮಾಡಬಾರದು. ನನ್ನ ಪ್ರಕಾರ. 10 ರಲ್ಲಿ 1 ತುಂಬಾ ಹೆಚ್ಚಾಗಿದೆ, ದಾರಿ ತುಂಬಾ ಹೆಚ್ಚಾಗಿದೆ. ಇದಕ್ಕಾಗಿ ಗೋಲ್ಡ್ ಬರ್ಗ್ ಅನ್ನು ಜಾಕ್ ಹ್ಯಾಮರ್ ಮಾಡಬೇಕು. ವ್ಯಾನ್ ಅವಮಾನ ಯಾವುದೇ ನಟನಲ್ಲ.#0
ವಿಕ್ಟರ್ ಮೆಕ್ಲಾಗ್ಲೆನ್ ಅವರ ಅಭಿನಯವು ಚಲನಚಿತ್ರ ಇತಿಹಾಸದಲ್ಲಿ ಅತ್ಯುತ್ತಮವಾದದ್ದು. <br /> <br /> ನಾವೆಲ್ಲರೂ "ಜಿಪೋ" ಗಾಗಿ ಅನುಭವಿಸಬಹುದು ಎಂದು ನಾನು ಭಾವಿಸುತ್ತೇನೆ ಏಕೆಂದರೆ ನಾವೆಲ್ಲರೂ ಸರಿ ಮತ್ತು ಯಾವುದು ತಪ್ಪು ಮತ್ತು ತಪ್ಪಾಗಿದೆ ಎಂದು ಹೆಣಗಾಡುತ್ತೇವೆ. ಅಮೆರಿಕದ ಪ್ರಮುಖ ಚಲನಚಿತ್ರ ಸ್ಟುಡಿಯೋ (ಆರ್‌ಕೆಒ ರೇಡಿಯೊ ಪಿಕ್ಚರ್ಸ್) ಬಿಡುಗಡೆ ಮಾಡಿದ ಮೊದಲ ಆರ್ಟ್-ಹೌಸ್ ಚಿತ್ರಗಳಲ್ಲಿ ಇದು ಒಂದು. <br /> <br /> ಜೋಸೆಫ್ ಹೆಚ್. ಆಗಸ್ಟ್ ಅವರ mat ಾಯಾಗ್ರಹಣ ಇಲ್ಲಿ ಅತ್ಯುತ್ತಮವಾಗಿದೆ. ಆದಾಗ್ಯೂ, ಆಗಸ್ಟ್‌ನ ಬೆರಗುಗೊಳಿಸುತ್ತದೆ ಭಾಗವನ್ನು ಹೆಚ್ಚಾಗಿ ಕಡೆಗಣಿಸಲಾಗಿಲ್ಲ; ಅವರು ಸರಿಯಾಗಿ ಅರ್ಹವಾದ ಆಸ್ಕರ್ ನಾಮನಿರ್ದೇಶನವನ್ನು ಸ್ವೀಕರಿಸಲಿಲ್ಲ. <br /> <br /> ಇದು ಮಾನಸಿಕ ನಾಟಕವಾಗಿದ್ದು, ಚಿಂತನೆ, ತತ್ವಶಾಸ್ತ್ರ, ದುಃಖ, ಇವೆಲ್ಲವೂ ಸಾಧ್ಯವಾದಷ್ಟು ಕಡಿಮೆ ಪದಗಳೊಂದಿಗೆ ತಿಳಿಸಲ್ಪಡುತ್ತವೆ.#1
ಖಂಡಿತ, ಇದು ಉತ್ತಮ ಚಿತ್ರದ ಕೆಲವು ಮೇಕಿಂಗ್‌ಗಳನ್ನು ಹೊಂದಿತ್ತು. ಕಥಾಹಂದರವು ಒಳ್ಳೆಯದು, ಸ್ವಲ್ಪ ಸಪ್ಪೆ ಮತ್ತು ನಟನೆ ಸಾಕಷ್ಟು ಉತ್ತಮವಾಗಿದ್ದರೂ ಒಲಿವಿಯಾ ಡಿ ಅಬೊ ಅವರ ಪಾತ್ರವನ್ನು ಯುಎಸ್ನಲ್ಲಿ ಬೆಳೆಸಬೇಕೆಂದು ಭಾವಿಸಿದ್ದರೆ ಆಸ್ಟ್ರೇಲಿಯಾದ ಉಚ್ಚಾರಣೆಯನ್ನು ಏಕೆ ಉಚ್ಚರಿಸಲಾಗಿದೆ ಎಂದು ನನಗೆ ಅರ್ಥವಾಗಲಿಲ್ಲ. ನನ್ನ ದೊಡ್ಡ ಸಮಸ್ಯೆ, ಆದಾಗ್ಯೂ, ವಾರ್ಡ್ರೋಬ್ನೊಂದಿಗೆ. ನಿಯಮದಂತೆ ನನಗೆ ತಿಳಿದಿದೆ, ಸರಾಸರಿ ಅಮೆರಿಕನ್ನರನ್ನು ಯಾವುದೇ ಸ್ವಾಭಿಮಾನಿ ಯುರೋಪಿಯನ್ ಅವರು ಮುಂಗೋಪದ ಡ್ರೆಸ್ಸರ್ ಎಂದು ಪರಿಗಣಿಸುತ್ತಾರೆ ಆದರೆ ಇದು ಅದನ್ನು ಮೀರಿದೆ. ಅಣ್ಣಾ ಅವರ ಬಣ್ಣ ಸಂಯೋಜನೆಗಳು ಧನಾತ್ಮಕವಾಗಿ ಭಯಂಕರವಾಗಿದ್ದವು !! ಮತ್ತು ಆಲೂಗೆಡ್ಡೆ ಚೀಲದಂತಹ, ಚಿತ್ರದುದ್ದಕ್ಕೂ ಅವಳು ಧರಿಸಿದ್ದ ಕೋಟ್‌ಗೆ ದುಃಖದ ಕ್ಷಮಿಸಿ ನನ್ನನ್ನು ಜೇನುಗೂಡುಗಳಲ್ಲಿ ಮುರಿಯುವಂತೆ ಮಾಡಿತು. ಕಲ್ಪನೆಯು ಸಾಧ್ಯವಾದಷ್ಟು ನೈಜವಾಗಿರಬೇಕು ಎಂದು ನಾನು ಭಾವಿಸುತ್ತೇನೆ (ಪ್ರಾಡಾದಲ್ಲಿ ಎಷ್ಟು ಶಾಲಾ ಶಿಕ್ಷಕರು ತಿರುಗಾಡುತ್ತಾರೆ?) ಆದರೆ ಸರಳ ಎಂದರೆ ಅಭಿರುಚಿಯ ಸಂಪೂರ್ಣ ಕೊರತೆ ಎಂದರ್ಥವಲ್ಲ. ಬುದ್ಧಿವಂತರಿಗೆ ಒಂದು ಮಾತು ...#0
ವಿಡಿಯೋ ಟೇಪ್ ಹೊಂದಿರುವ ಆನುವಂಶಿಕ ಸಂಶೋಧನೆಯ ಫಲಿತಾಂಶಗಳನ್ನು ಮರಳಿ ಪಡೆಯಲು ಇಬ್ಬರು ಹಳೆಯ ಸ್ನೇಹಿತರನ್ನು ಜಪಾನ್‌ಗೆ ಕಳುಹಿಸಲಾಗುತ್ತದೆ, ಇದನ್ನು ಚಲನಚಿತ್ರದ ಆರಂಭದಲ್ಲಿ ಕಪ್ಪು ಸೂಟ್ ನಿಂಜಾಗಳು ಕದ್ದಿದ್ದಾರೆ. ಮೊದಲು ಅವರು ಕೆಲವು ನಿಂಜಾ ಕೌಶಲ್ಯವನ್ನು ಕಲಿಯಬೇಕಾಗಿದೆ, ಏಕೆಂದರೆ "ನಿಂಜಾ ಮಾತ್ರ ನಿಂಜಾವನ್ನು ಸೋಲಿಸಬಲ್ಲದು." <br /> <br /> ಸಕುರಾ ಕೊಲೆಗಾರರು ಆನಂದದಾಯಕವಾದ ನಿಂಜಾ-ಫ್ಲಿಕ್ ಆಗಲು ಕಷ್ಟಪಟ್ಟು ಪ್ರಯತ್ನಿಸುತ್ತಾರೆ ಆದರೆ ಅದು ಕೆಟ್ಟದಾಗಿ ವಿಫಲಗೊಳ್ಳುತ್ತದೆ. ಇಡೀ ಚಲನಚಿತ್ರವು ತುಂಬಾ ಟೊಳ್ಳು ಮತ್ತು able ಹಿಸಬಹುದಾದದು, ಅದರ ಬಗ್ಗೆ ಏನನ್ನೂ ಹೇಳುವುದು ಕಷ್ಟ: ಒಂದೇ ಕಥಾವಸ್ತುವನ್ನು ಈ ಮೊದಲು ಹಲವಾರು ಬಾರಿ ವಿಭಿನ್ನ ಮಾರ್ಪಾಡುಗಳಲ್ಲಿ ನೋಡಲಾಗಿದೆ, ಪಾತ್ರಗಳು ತುಂಬಾ ಸಂಕ್ಷಿಪ್ತವಾಗಿ ಚಿತ್ರಿಸಲ್ಪಟ್ಟಿವೆ, ನಿರ್ದೇಶನವು ಮಂದವಾಗಿದೆ ಮತ್ತು ಸ್ಕ್ರಿಪ್ಟ್ ಆಶ್ಚರ್ಯಕರವಾದದ್ದನ್ನು ನೀಡುವುದಿಲ್ಲ, ಚಲನಚಿತ್ರದ (ಅನುಪಯುಕ್ತ) ಮೌಲ್ಯವನ್ನು ತಾನೇ ಕಡಿಮೆಗೊಳಿಸಿದ ಕೊನೆಯ ದೃಶ್ಯದಲ್ಲಿಯೂ ಸಹ. <br /> <br /> ಕಸ-ಸಿನೆಮಾಗಳ ಸೌಂದರ್ಯವನ್ನು ಅರ್ಥಮಾಡಿಕೊಳ್ಳುವ 80 ರ ನಿಂಜಾ-ಫ್ಲಿಕ್-ಫ್ಯಾನ್ ಸಹ, ಈ ಚಲನಚಿತ್ರವನ್ನು ಕೇವಲ ಆನಂದದಾಯಕವಾಗಿ ಕಂಡುಹಿಡಿಯುವುದು ಕಷ್ಟ . ಇದು ದೃಷ್ಟಿಗೋಚರ ಮಟ್ಟದಲ್ಲಿ ಅಥವಾ ಕಥಾವಸ್ತುವಿನಲ್ಲಿ ವೀಕ್ಷಕರಿಗೆ ಹೊಸದನ್ನು ನೀಡುವುದಿಲ್ಲ. ಷುರಿಕನ್‌ಗಳನ್ನು ಎಸೆಯಲಾಗುತ್ತದೆ ಮತ್ತು ಕಟಾನಾಗಳು ಸ್ವಿಂಗ್ ಆಗುತ್ತಿವೆ, ಆದರೆ ಇದು ಇರಬೇಕಾದ ಚಲನಚಿತ್ರ ನಿರ್ದೇಶನವನ್ನು ಮುನ್ನಡೆಸಲು ಸಾಕಾಗುವುದಿಲ್ಲ ಮತ್ತು ಇದೇ ರೀತಿಯ ಹೋರಾಟದ ದೃಶ್ಯಗಳನ್ನು ಪುನರಾವರ್ತಿಸುತ್ತದೆ ಮತ್ತು ಮೊದಲ 30 ನಿಮಿಷಗಳ ನಂತರ ಹೆಚ್ಚು ನಿಷ್ಠುರ ವೀಕ್ಷಕರನ್ನು ಸಹ ನಿಶ್ಚೇಷ್ಟಗೊಳಿಸುತ್ತದೆ. <br /> <br /> ಶಿಫಾರಸು ಮಾಡುವುದು ಕಷ್ಟ ಯಾರಿಗಾದರೂ ಚಲನಚಿತ್ರ. "ಎಂಟರ್ ದಿ ನಿಂಜಾ" ನಲ್ಲಿ ಫ್ರಾಂಕೊ ನೀರೋ ಅವರ ನಾಜೂಕಿಲ್ಲದ ಪ್ರದರ್ಶನವು ಸಕುರಾ ಕೊಲೆಗಾರನ ಅಮೇರಿಕನ್-ನಿಂಜಾಗಳ ಹಿಂದೆ ಬರುತ್ತದೆ. ದೃಶ್ಯ ಮಟ್ಟದ ಚಲನಚಿತ್ರದಲ್ಲಿ ಸಹ ಯಾವುದೇ ಚೆಂಡುಗಳಿಲ್ಲ ಮತ್ತು ಈ ಚಲನಚಿತ್ರದಲ್ಲಿ ಯಾವುದೇ ಉತ್ತಮ ಹೋರಾಟದ ದೃಶ್ಯಗಳನ್ನು ಕಂಡುಹಿಡಿಯಲು ಪ್ರಯತ್ನಿಸುವುದು ಸಮಯ ವ್ಯರ್ಥ: ಯಾವುದೂ ಇಲ್ಲ. ಒಟ್ಟಾರೆಯಾಗಿ, ನಾನು ನೋಡಿದ ಅತ್ಯಂತ ನಿರರ್ಥಕ ನಿಂಜಾ-ಫ್ಲಿಕ್ಸ್. ಕುತೂಹಲಕ್ಕೂ ಆಸಕ್ತಿ ಇಲ್ಲ. ಇದರ ಮೇಲೆ ನನ್ನನ್ನು ನಂಬಿರಿ. <br /> <br /> 10 ರಲ್ಲಿ 10.#0
ಆಮಿ ಹೆಕರ್ಲಿಂಗ್ ಅವರ ಎರಡನೇ ಚಿತ್ರ ಜಾನಿ ಡೇಂಜರಸ್ಲಿ 1930 ರ ವಾರ್ನರ್ ಬ್ರದರ್ಸ್ ಸಂಪ್ರದಾಯದಲ್ಲಿ ಮಾಡಿದ ದರೋಡೆಕೋರ ಚಲನಚಿತ್ರಗಳ ವಿಡಂಬನೆಯಾಗಿದೆ. ಮೈಕೆಲ್ ಕೀಟನ್ 1935 ರಲ್ಲಿ ತನ್ನ ಮುದ್ದಿನ ಅಂಗಡಿಯಿಂದ ಏನನ್ನಾದರೂ ಕದಿಯಲು ಪ್ರಯತ್ನಿಸುತ್ತಿದ್ದ ಮಗುವನ್ನು ಹಿಡಿದಾಗ ಮಧ್ಯವಯಸ್ಕ ದರೋಡೆಕೋರನಾಗಿ ಹಿಂತಿರುಗಿ ನೋಡುತ್ತಾನೆ. ಕೀಟನ್‌ನ ತಾಯಿ (ಮೌರೀನ್ ಸ್ಟ್ಯಾಪ್ಲೆಟನ್) ಆರೋಗ್ಯ ಸಮಸ್ಯೆಗಳನ್ನು ಮುಂದುವರೆಸುತ್ತಿದ್ದಾನೆ, ಆದ್ದರಿಂದ ಕೀಟನ್ ಅಪರಾಧದಲ್ಲಿ ಸಿಲುಕುತ್ತಾನೆ ಪೀಟರ್ ಬೊಯೆಲ್ ಮೂಲಕ ಚಿಕ್ಕ ವಯಸ್ಸು. ಏತನ್ಮಧ್ಯೆ, ಫಾರ್ಗನ್ ರಿಚರ್ಡ್ ಡಿಮಿಟ್ರಿ ಬೊಯೆಲ್ಗೆ ಪ್ರತಿಸ್ಪರ್ಧಿ ಅಪರಾಧ ಪ್ರಭು ಪಾತ್ರವನ್ನು ವಹಿಸುತ್ತಾನೆ ಮತ್ತು ಕೀಟನ್ ಅಂತಿಮವಾಗಿ ಶ್ರೇಯಾಂಕಗಳ ಮೂಲಕ ಏರುತ್ತಾನೆ. ಜೋ ಪಿಸ್ಕೋಪೊ ಡ್ಯಾನಿ ವರ್ಮಿನ್ ನಂತೆ ಉಲ್ಲಾಸದ ತಿರುವನ್ನು ಹೊಂದಿದ್ದಾನೆ, ಹೌದು ಅದು ಸರಿ, ವರ್ಮಿನ್! ಗ್ರಿಫಿನ್ ಡುನ್ನೆ ಕೀಟನ್ ಅವರ ಕಿರಿಯ ಸಹೋದರ ಜಿಲ್ಲಾ ವಕೀಲರಾಗಿದ್ದಾರೆ, ಗ್ಲಿನ್ನಿಸ್ ಒ'ಕಾನ್ನರ್ ಅವರ ಪತ್ನಿ, ಮತ್ತು ಮರಿಲು ಹೆನ್ನರ್ ಕೀಟನ್ ಅವರ ಮೋಲ್ ಪಾತ್ರದಲ್ಲಿದ್ದಾರೆ. ಚಿತ್ರವು ಕುಖ್ಯಾತ ಅಗ್ಗವಾಗಿ ಕಾಣುತ್ತದೆ, ಇದು ನಾಟಕೀಯ ಚಿತ್ರದ ಬದಲು ಟೆಲಿವಿಷನ್ ಕಾರ್ಯಕ್ರಮದಂತೆ ತೋರುತ್ತದೆ. <br /> <br /> ಚಿತ್ರವು ಉತ್ತಮವಾಗಿ ಪ್ರಾರಂಭವಾಗುತ್ತದೆ ಮತ್ತು ನಂತರ ಮೊದಲ ಅರ್ಧ ಘಂಟೆಯ ನಂತರ ನಿರೀಕ್ಷೆಯಂತೆ ನಿಧಾನವಾಗುತ್ತದೆ. ಸಂಭಾಷಣೆ ಮತ್ತು ತಮಾಷೆಗಳ ಸಂಯೋಜನೆಯಿಂದಾಗಿ, ಚಿತ್ರವು ಮೊದಲಾರ್ಧದಲ್ಲಿ ತನ್ನದೇ ಆದದ್ದನ್ನು ಹೊಂದಿದೆ, ಆದರೆ ನಂತರ ಅದು ವೇಗವಾಗಿ ಹಬೆಯನ್ನು ಕಳೆದುಕೊಳ್ಳುತ್ತದೆ ಮತ್ತು ದ್ವಿತೀಯಾರ್ಧದಲ್ಲಿ ಸಾಧಾರಣತೆ ಮತ್ತು ಅಶ್ಲೀಲತೆಗೆ ಇಳಿಯುತ್ತದೆ. ಕೀಟನ್ ತನ್ನ ಅತ್ಯುತ್ತಮ ಜೇಮ್ಸ್ ಕಾಗ್ನಿ ಅನಿಸಿಕೆ ಮಾಡುವ ದೃಶ್ಯಾವಳಿಗಳನ್ನು ಅಗಿಯುತ್ತಾನೆ. ಸ್ಟ್ಯಾಪ್ಲೆಟನ್ ಹಲವಾರು ಅಶ್ಲೀಲ ರೇಖೆಗಳನ್ನು ಹೊಂದಿದ್ದು ಅದು ಕೇವಲ ಅಸಹ್ಯಕರವಾಗಿದೆ, ತಮಾಷೆಯಾಗಿಲ್ಲ. ಪಿಸ್ಕೋಪೊ "ಒಮ್ಮೆ" ಬಿಟ್ ಅನ್ನು ಒಂದು ಬಾರಿ ಹೆಚ್ಚು ಮಾಡುತ್ತದೆ. ಹಲವಾರು ಪೋಷಕ ನಟರು ಕೋಟೆಯನ್ನು ಡ್ಯಾನಿ ಡಿವಿಟೊ, ಡೊಮ್ ಡೆಲ್ಯುಯಿಸ್, ಬೀದಿ ಮಾರಾಟಗಾರರಾಗಿ ರೇ ವಾಲ್ಸ್ಟನ್, ಅಲನ್ ಹೇಲ್, ಜೂನಿಯರ್ ಮೇಜಿನ ಸಾರ್ಜೆಂಟ್ ಆಗಿ ಮತ್ತು ಸೂಡಿ ಬಾಂಡ್ ಅವರನ್ನು ನಿರ್ಲಜ್ಜ ಸ್ವಚ್ cleaning ಗೊಳಿಸುವ ಮಹಿಳೆಯಾಗಿ ಹಿಡಿದಿಡಲು ಪ್ರಯತ್ನಿಸುತ್ತಾರೆ. ದ್ವಿತೀಯಾರ್ಧವು ಹಿಟ್ ಅಥವಾ ಮಿಸ್ ಟೆಲಿವಿಷನ್ ಶೋ ಟೈಪ್ ಟೋನ್ ಆಗಿ ವಿಕಸನಗೊಳ್ಳುತ್ತದೆ ಮತ್ತು ಎಂದಿಗೂ ಚೇತರಿಸಿಕೊಳ್ಳುವುದಿಲ್ಲ. ದಿ ರೋರಿಂಗ್ ಇಪ್ಪತ್ತರ ದಶಕವನ್ನು ಬಳಸುವ ಮುಕ್ತಾಯದ ದೃಶ್ಯವು ದಿ ಕಾಲ್ ಆಫ್ ದಿ ವೈಲ್ಡ್ ಕ್ಲಾರ್ಕ್ ಗೇಬಲ್ ಫಿಲ್ಮ್ನ ಹಿಂದಿನ ಚಿತ್ರದಲ್ಲಿ ಮಾರ್ಕ್ಯೂನಲ್ಲಿ ಕಾಣಿಸಿಕೊಂಡಿದೆ. ಉದ್ದೇಶಿತ ಪ್ರೇಕ್ಷಕರು ಖಂಡಿತವಾಗಿಯೂ ದಿ ರೋರಿಂಗ್ ಇಪ್ಪತ್ತರ ದಶಕದ ನಿಜವಾದ 1939 ರ ಬಿಡುಗಡೆಯ ದಿನಾಂಕದ ಬಗ್ಗೆ ತಿಳಿದಿರುವುದರಿಂದ ಹೆಕರ್ಲಿಂಗ್‌ಗೆ ಚೆನ್ನಾಗಿ ತಿಳಿದಿರಬೇಕು ಎಂದು ನಾನು ಭಾವಿಸುತ್ತೇನೆ. * 4 ನಕ್ಷತ್ರಗಳಲ್ಲಿ 1/2.#0
"ಆತ್ಮಗಳ ಮನೆ" ಸಾಕಷ್ಟು ಭೀಕರವಾಗಿದೆ. ನಾನು ದಕ್ಷಿಣ ಅಮೆರಿಕಾದಲ್ಲಿ ವಾಸಿಸುತ್ತಿದ್ದೇನೆ, ಚಲನಚಿತ್ರವು ವಿವರಿಸಲು ಪ್ರಯತ್ನಿಸಿದಂತೆಯೇ ಮಿಲಿಟರಿ ಸರ್ವಾಧಿಕಾರವನ್ನು ಅನುಭವಿಸಿದ ದೇಶದಲ್ಲಿ, ಮತ್ತು ಚಲನಚಿತ್ರಗಳು ವಾಸ್ತವದಿಂದ ದೂರವಿರಬಹುದು ಎಂದು ಎಲ್ಲರಿಗೂ ತಿಳಿದಿದ್ದರೂ ಸಹ, ಈ ನಿರ್ದಿಷ್ಟ ಚಲನಚಿತ್ರವು ವೀಕ್ಷಕರನ್ನು ಅಜ್ಞಾನ ಮತ್ತು ಮೂರ್ಖ ಎಂದು ಪರಿಗಣಿಸುತ್ತದೆ. ಇಲ್ಲಿ ಕಂಡುಬರುವಂತೆ ವಿಷಯಗಳು ಅಷ್ಟು ಸರಳ ಮತ್ತು ರೇಖಾತ್ಮಕವಾಗಿಲ್ಲ, ಮತ್ತು ರಾಜಕೀಯ ಪ್ರಕ್ರಿಯೆಯು ಹೆಚ್ಚು ಸಂಕೀರ್ಣ ಮತ್ತು ಆಸಕ್ತಿದಾಯಕವಾಗಿದ್ದು, "ದಿ ಹೌಸ್ ..." ನಲ್ಲಿನ ಕಥಾವಸ್ತು. ಪರದೆಯ ಮೇಲೆ ಸಂಕೀರ್ಣತೆಯನ್ನು ನಿಮಗೆ ತೋರಿಸಲು ಸಾಧ್ಯವಾಗದಿದ್ದರೆ ಚಲನಚಿತ್ರವನ್ನು ಮಾಡದಿರುವುದು ಉತ್ತಮ. ಎಷ್ಟೊಂದು ಸಾಮಾನ್ಯ ಸ್ಥಳಗಳಿಲ್ಲದೆ, ಸಿನೆಮಾದಲ್ಲಿ ರಾಜಕೀಯವನ್ನು ಹೇಗೆ ಗಂಭೀರವಾಗಿ ಪರಿಗಣಿಸಬಹುದು ಎಂಬುದಕ್ಕೆ ಸಾಕಷ್ಟು ಉದಾಹರಣೆಗಳಿವೆ. ಕೆಲವು ಭಾಗಗಳಲ್ಲಿ ಕಾರ್ಮೆನ್ ಮಿರಾಂಡಾ ಗಿಳಿಗಳು ಮತ್ತು ತಾಳೆ ಮರಗಳಲ್ಲಿ ಕಾಣಿಸಿಕೊಳ್ಳಬಹುದು ಎಂದು ನಾನು ಭಾವಿಸಿದೆ. ನೀವು ಕೆಲವು ವಿಷಯಗಳ ಬಗ್ಗೆ ಮಾತನಾಡುವಾಗ ನೀವು ಜಾಗರೂಕರಾಗಿರಬೇಕು ಆದರೆ ನಿಮ್ಮ ಸಾರ್ವಜನಿಕರ ಬುದ್ಧಿಮತ್ತೆಯನ್ನು ಗೌರವಿಸಬೇಕು.#0
ಒಳ್ಳೆಯ ಹಳೆಯ ಫ್ಯಾಷನ್ ಸ್ಪೂಕಿ ಚಿತ್ರಗಳ ನಿರ್ಮಾಣವನ್ನು ನಾನು ನಿಜವಾಗಿಯೂ ತಪ್ಪಿಸಿಕೊಳ್ಳುತ್ತೇನೆ. ಇಸ್ಮಾಯಿಲ್ ಮರ್ಚೆಂಟ್ ಮತ್ತು ಜೇಮ್ಸ್ ಐವರಿ ಅವರಿಗೆ ಅಂತಹ ಚಲನಚಿತ್ರವನ್ನು ನಿರ್ಮಿಸುವ ಕೆಲಸವನ್ನು ನೀಡಲಾಗಿದ್ದರೆ, ಇದು ಇದಾಗಿರಬಹುದು, ಅಂತರರಾಷ್ಟ್ರೀಯ ಮಟ್ಟದಲ್ಲಿ ಪ್ರಸಿದ್ಧವಾದ, ಉನ್ನತ ಡ್ರಾಯರ್ ಪಾತ್ರವರ್ಗದ ಕೊರತೆಯನ್ನು ಉಳಿಸಿ. ಕತ್ತಲೆಯಾದ ಸಂಜೆ ಪಿಜ್ಜಾ ಮತ್ತು ಕೆಲವು ಪಾಪ್‌ಕಾರ್ನ್‌ಗಳೊಂದಿಗೆ ನೀವು ಏಕಾಂಗಿಯಾಗಿ ನೋಡುವ ಚಲನಚಿತ್ರಗಳಲ್ಲಿ ಇದು ಒಂದು, ಮತ್ತು ನೀವು ಕವರ್‌ಗಳ ಕೆಳಗೆ ಮರೆಮಾಡಲು ಬಯಸುವ ಕಾರಣ ಬೆಳಿಗ್ಗೆ ತನಕ ಭಕ್ಷ್ಯಗಳನ್ನು ಮಾಡುವುದನ್ನು ಸಹ ನೀವು ಚಿಂತಿಸುವುದಿಲ್ಲ. ನಿರ್ದೇಶಕ ಹರ್ಬರ್ಟ್ ವೈಸ್, ಬರಹಗಾರರಾದ ಸುಸಾನ್ ಹಿಲ್ ಮತ್ತು ನಿಗೆಲ್ ನೀಲೆಗೆ ಬ್ರಾವೋ, ಜಾನ್ ಬಂಕರ್ ಅವರ ಉನ್ನತ ಉತ್ಪಾದನಾ ವಿನ್ಯಾಸ, ಜಾನ್ ರಾಲ್ಫ್ ಅವರ ಕಲಾ ನಿರ್ದೇಶನ ಮತ್ತು ನಾನು ಹೆಚ್ಚು ಜನಸಂಖ್ಯೆ ಹೊಂದಿರುವ ನಗರಗಳಲ್ಲಿ ವಾಸಿಸುತ್ತಿದ್ದರೂ ಸಹ ನನ್ನನ್ನು ನಡುಗುವಂತೆ ಮತ್ತು ಪ್ರತ್ಯೇಕವಾಗಿ ಅನುಭವಿಸುವ ಅತ್ಯುತ್ತಮ ಪಾತ್ರವರ್ಗ 21 ನೇ ಶತಮಾನದ ಆರಂಭದಲ್ಲಿ ಜಗತ್ತಿನಲ್ಲಿ. ನಾನು ಅದನ್ನು "10" ರಲ್ಲಿ "9" ನೀಡಿದ್ದೇನೆ ಏಕೆಂದರೆ ದೂರದರ್ಶನದ ಉತ್ಪಾದನೆ ಮತ್ತು ಬಜೆಟ್ ನಿರ್ಬಂಧಗಳೊಂದಿಗೆ, ಅವರು ನಿಜವಾಗಿಯೂ ಉತ್ತಮ ಪ್ರದರ್ಶನವನ್ನು ಎಳೆದರು.#1
