ಆಂಡಿ ಮೆಕ್‌ಡೊವೆಲ್ 40-ಇಶ್ ಮಹಿಳೆಯಾಗಿ ಸುಂದರವಾಗಿದ್ದಾಳೆ, ಅವರ ಗಂಭೀರ ಸಂಬಂಧದ ತಡವಾಗಿ ಪ್ರಾರಂಭವು ಅವಳನ್ನು ಗಣನೀಯವಾಗಿ ಕಿರಿಯ ಪುರುಷನತ್ತ ಕರೆದೊಯ್ಯುತ್ತದೆ ಮತ್ತು ನಂತರದ 2 ದೀರ್ಘಕಾಲದ ಅತ್ಯುತ್ತಮ ಗೆಳತಿಯರ ಜೊತೆ ಬೀಳುತ್ತದೆ. <br /> <br /> ಗಿಗೋಲೊವನ್ನು ನೋಡುವುದು / ಪ್ರಾಮಾಣಿಕ ಯುವಕನಲ್ಲಿ ಚಿನ್ನ-ಅಗೆಯುವವನು, "ಹೆಣ್ಣು-ಸ್ನೇಹಿತರು", ಈ "ಸಿಲ್ಲಿ ಸಂಬಂಧವನ್ನು" ಕೊನೆಗೊಳಿಸುವುದರಲ್ಲಿ ಸತ್ತಿದ್ದಾನೆ, ತಮ್ಮ ಸ್ನೇಹಿತನನ್ನು "ಸಹಾಯ ಮಾಡುವಲ್ಲಿ" ಕರ್ತವ್ಯದ ಕರೆಗೆ ಮೀರಿ ಹೋಗಿ (ಈ ಗಿಗೋಲೊದಿಂದ ಅವರು ಕುರುಡರಾಗಿದ್ದಾರೆ) ಟ್ರಿಕಿ ಗೇಮ್ ". <br /> <br /> ಸನ್ನಿವೇಶಗಳ ಒಂದು ಸಣ್ಣ ಅನುಕ್ರಮವು ಸಂಪೂರ್ಣವಾಗಿ ಹಾಸ್ಯಾಸ್ಪದವಾಗಿದೆ. ಇನ್ನು ಮುಂದೆ ಅದನ್ನು ಒಳಗೊಳ್ಳುವುದಿಲ್ಲ. ಈ ನಂಬಲಾಗದ ದೃಶ್ಯಗಳಿಲ್ಲದೆ, ಒಂದು ಸಿಹಿ ಪ್ರೇಮಕಥೆಯ ಬಗ್ಗೆ ಭರವಸೆ ಇದ್ದಿರಬಹುದು. ಬದಲಾಗಿ, ಎಲ್ಲಾ ವೀಕ್ಷಕರು ಉಳಿದಿರುವುದು ಅನೈಚ್ ary ಿಕವಾಗಿ ತಲೆ ಅಲ್ಲಾಡಿಸುವುದು - ಈ ಸಂಗತಿಗಳು ಆಗುವುದಿಲ್ಲ! ಬಂಡೆಯ ಹ್ಯಾಂಗರ್ ವಿವರಗಳನ್ನು ನೀಡದೆ, ಈ ಚಿತ್ರಕ್ಕಾಗಿ ಹೆಚ್ಚಿನ ನಿರೀಕ್ಷೆಗಳನ್ನು ಹೊಂದಿರುವಂತೆ ನಾನು ವೀಕ್ಷಕರಿಗೆ ಎಚ್ಚರಿಕೆ ನೀಡುತ್ತೇನೆ; ಹೆಚ್ಚಿನವರು (ನನ್ನಂತೆ) ತುಂಬಾ ನಿರಾಶೆಗೊಳ್ಳುತ್ತಾರೆ. 1 ರಿಂದ 10 ರ ಸ್ಕೇಲ್, ಇದು ನನ್ನೊಂದಿಗೆ ದುರ್ಬಲ 4 ನೇ ಸ್ಥಾನದಲ್ಲಿದೆ. ಅಲ್ಲಿ ಉತ್ತಮವಾದ ವಸ್ತುಗಳಿವೆ. ಇದು ಒಂದು ನಿಮ್ಮ ಸಮಯಕ್ಕೆ ಯೋಗ್ಯವಾಗಿಲ್ಲ.#0
ನಟಾಲ್ ವಾರ್ಡ್‌ನಲ್ಲಿ (ಮತ್ತು ಕಠಿಣ ಪ್ರಕರಣಗಳಲ್ಲಿ ಒಂದು) ಹೊಂದಿಸಲಾದ "ಜನರಲ್ ಹಾಸ್ಪಿಟಲ್" ನ ಅತ್ಯಂತ ಪ್ರಾಚೀನ ಪ್ರಸಂಗದಂತೆ ವಿಂಗಡಿಸಿ, ವೇಗವಾಗಿ ಚಲಿಸುವ ಈ ಪ್ರೋಗ್ರಾಮರ್ ತೃಪ್ತಿಕರವಾದ ಭಾವನಾತ್ಮಕ ಪರಿಣಾಮವನ್ನು ಬೀರುತ್ತದೆ - ಮುಖ್ಯವಾಗಿ ಎರಿಕ್ ಲಿಂಡೆನ್, ವಿಚಲಿತರಾದ ಯುವ ಗಂಡನಾಗಿ ಮುಖ್ಯ ಕಥಾವಸ್ತುವು ಸ್ಪಷ್ಟವಾಗಿ ಧ್ವಂಸವಾಗಿದೆ ಮತ್ತು ಅಂತಹ ಉತ್ತಮ ಕಾರಣದೊಂದಿಗೆ. ಅವನ ನಿರೀಕ್ಷಿತ ಪತ್ನಿ ಲೊರೆಟ್ಟಾ ಯಂಗ್‌ನನ್ನು 20 ವರ್ಷಗಳ ಜೈಲು ಶಿಕ್ಷೆಯ ಆರಂಭದಲ್ಲಿ ವಾರ್ಡ್‌ಗೆ ಕರೆತರಲಾಗುತ್ತದೆ. ಮಿಸ್ ಯಂಗ್, ಯಾವಾಗಲೂ, ಪ್ರೇಕ್ಷಕರ ಸಹಾನುಭೂತಿಯನ್ನು ನಿರಾಕರಿಸಲು ಏನನ್ನೂ ಮಾಡುವುದಿಲ್ಲ, ಮತ್ತು ಅವಳು ನಿಜವಾಗಲು ಸ್ವಲ್ಪ ಹೆಚ್ಚು ಒಳ್ಳೆಯದು, ಸಹಾನುಭೂತಿ ಮತ್ತು ನೋಡಲು ಸುಂದರವಾಗಿದ್ದರೂ ಸಹ. ಅವಳ ಕಷ್ಟಕರವಾದ ಗರ್ಭಧಾರಣೆ ಮತ್ತು ವಾರ್ಡ್‌ನ ಇತರ ಹುಡುಗಿಯರೊಂದಿಗಿನ ಸಂಬಂಧಗಳು ಚಲನಚಿತ್ರದ ಹೃದಯವನ್ನು ರೂಪಿಸುತ್ತವೆ, ಮತ್ತು ಫಲಿತಾಂಶವು - ಸಂಪೂರ್ಣವಾಗಿ ಸಂತೋಷದಾಯಕವಲ್ಲ - ಸರಿ ಎಂದು ಭಾವಿಸುತ್ತದೆ. ಚಲನಚಿತ್ರ ಇತಿಹಾಸಕಾರ ಡೇವಿಡ್ ಥಾಮ್ಸನ್ ಅವರ ಸೂಕ್ತವಾದ ಮಾತುಗಳಲ್ಲಿ "ಸಿನೆಮಾದ ಕೆಲವೇ ಪರಿಪೂರ್ಣ ನಟಿಯರಲ್ಲಿ ಒಬ್ಬರಾದ" ಅಲೈನ್ ಮ್ಯಾಕ್ ಮಹೊನ್, ಮುಖ್ಯ ದಾದಿಯಾಗಿ ಉಷ್ಣತೆ ಮತ್ತು ಅಧಿಕಾರವನ್ನು ಹೊರಹಾಕುತ್ತಾರೆ, ಮತ್ತು ಗ್ಲೆಂಡಾ ಫಾರೆಲ್, ಅವಳಿ ಮಕ್ಕಳಲ್ಲಿ ಯಾರೂ ಹೆಚ್ಚು ಇಷ್ಟಪಡದ ಹೊಸ ತಾಯಿಯಾಗಿ, ಕ್ರೂನ್ "ಫ್ರಾಂಕಿ ಮತ್ತು ಜಾನಿ" ಕುಡುಕ ಲಾಲಿ ಆಗಿ. ಮತ್ತೊಂದು ಸಬ್‌ಲಾಟ್‌ನಲ್ಲಿ ಫ್ರಾಂಕ್ ಮೆಕ್‌ಹಗ್ ಅಂಕಿಅಂಶಗಳು, ಮತ್ತು ವಾರ್ನರ್ಸ್ ಸಾಮಾನ್ಯವಾಗಿ ಅವನಿಗೆ ಅನುಮತಿಸಿದ್ದಕ್ಕಿಂತ ಹೆಚ್ಚಿನ ಶ್ರೇಣಿಯನ್ನು ಅವನು ತೋರಿಸುತ್ತಾನೆ. ಇದು ಅಳೆಯಲ್ಪಟ್ಟಿದೆ ಮತ್ತು ಸಾಧಾರಣವಾಗಿ ಗತಿಯಾಗಿದೆ, ಮತ್ತು ಲಿಂಡೆನ್ ಅವರ ನಿರೀಕ್ಷೆಯ-ತಂದೆಯ ಭೀತಿ ನಿಮ್ಮೊಂದಿಗೆ ದಿನಗಳವರೆಗೆ ಇರುತ್ತದೆ - ಈ ರೀತಿಯ ಭಾಗವನ್ನು ಹೆಚ್ಚಾಗಿ ನಗುವಿಗಾಗಿ ಆಡಲಾಗುತ್ತಿತ್ತು, ಆದರೆ ಆತ ಭಯಭೀತರಾದ ಚಿಕ್ಕ ಮಗು, ಮತ್ತು ತುಂಬಾ ಮನವೊಲಿಸುವವನು.#1
ಪ್ರಸಿದ್ಧ ಕಾಂಕ್ವಿಸ್ಟಡಾರ್ ಹೆರ್ನಾಂಡೊ ಕೊರ್ಟೆಸ್ ಅವರು ಅಜ್ಟೆಕ್ ಅನ್ನು ತೆಗೆದುಕೊಳ್ಳುವ ಮೊದಲು ಮೆಕ್ಸಿಕೊಕ್ಕೆ ಪ್ರಾಥಮಿಕ ಸ್ಕೌಟಿಂಗ್ ದಂಡಯಾತ್ರೆ ಮಾಡಿದ್ದಾರೆ ಎಂದು ನಿಮ್ಮಲ್ಲಿ ಯಾರಿಗೂ ತಿಳಿದಿಲ್ಲ ಎಂದು ನಾನು ಬಾಜಿ ಮಾಡುತ್ತೇನೆ. ಅವರು ಮಾಡಿದ ಒಳ್ಳೆಯ ಕೆಲಸವೆಂದರೆ, ಒಂದು ನಿರ್ದಿಷ್ಟ ಕಣಿವೆಯಲ್ಲಿ ವಾಸಿಸುತ್ತಿದ್ದ ಟಿ ರೆಕ್ಸ್ ಬಗ್ಗೆ ಅವರು ಎಂದಿಗೂ ತಿಳಿದಿರಲಿಲ್ಲ, ಅಲ್ಲಿ ಸ್ಥಳೀಯರು ಅವರನ್ನು ದೇವರುಗಳೆಂದು ಗೌರವಿಸಿದರು. <br /> <br /> ಅದು ಅರ್ಥವಾಗುವಂತಹದ್ದಾಗಿತ್ತು. ನೀಲಿ ಕಣ್ಣಿನ ಇಯಾನ್ ier ಿಯರಿಂಗ್ ಅವರನ್ನು ಕೊರ್ಟೆಸ್ ಆಗಿ ಬಿತ್ತರಿಸುವುದು ಏನು ಅಲ್ಲ. ಬೆವರ್ಲಿ ಹಿಲ್ಸ್ 90210 ಬಣ್ಣಬಣ್ಣದ ಕಪ್ಪು ಬಣ್ಣದಲ್ಲಿ ಪ್ರಸಿದ್ಧವಾದ ಹೊಂಬಣ್ಣದ ಕೂದಲಿನೊಂದಿಗೆ ಸಹ, ಇಯಾನ್ ಧನಾತ್ಮಕವಾಗಿ ಹಾಸ್ಯಾಸ್ಪದವಾಗಿ ಕಾಣಿಸುತ್ತಾನೆ. ಕನಿಷ್ಠ ಅವರು ಸ್ಪ್ಯಾನಿಷ್ ಉಚ್ಚಾರಣೆಯಲ್ಲಿ ಯಾವುದೇ ಪ್ರಯತ್ನ ಮಾಡಲಿಲ್ಲ. <br /> <br /> ಟೈರನ್ನೊಸಾರಸ್ ಅಜ್ಟೆಕಾದ ನಿಜವಾದ ನಾಯಕ ಮಾರ್ಕೊ ಸ್ಯಾಂಚೆ z ್ ದೂರದರ್ಶನ ಸರಣಿಯ ತಡವಾಗಿ ವಾಕರ್ ಟೆಕ್ಸಾಸ್ ರೇಂಜರ್‌ನಲ್ಲಿ ಅರೆ-ಮರುಕಳಿಸುವ ಪಾತ್ರವನ್ನು ಡಲ್ಲಾಸ್‌ನ ಡಿಟೆಕ್ಟಿವ್ ಸ್ಯಾಂಡೋವಲ್ ಆಗಿ ಪಿಡಿ. ಅವರು ಅಜ್ಟೆಕ್ ರಾಜಕುಮಾರಿಯೊಂದಿಗಿನ ನಿಜವಾದ ಪ್ರೀತಿಯನ್ನು ಕಂಡುಕೊಳ್ಳುತ್ತಾರೆ ಮತ್ತು ಸ್ಥಳೀಯರು ಪೂಜಿಸುವ ಆ ತೊಂದರೆಗೊಳಗಾದ ಇತಿಹಾಸಪೂರ್ವ ಮೃಗಗಳಿಗೆ ಅದು ಇಲ್ಲದಿದ್ದರೆ ಜೀವನವು ಪರಿಪೂರ್ಣವಾಗಿರುತ್ತದೆ. <br /> <br /> ಟೈರನ್ನೊಸಾರಸ್ ಅಜ್ಟೆಕಾ ಅವರು ಪ್ರಸಿದ್ಧ ಸಿಡ್ ಮತ್ತು ಮಾರ್ಟಿ ಕ್ರಾಫ್ಟ್ ಸರಣಿಯ ಕೆಲವು t ಟ್‌ಟೇಕ್‌ಗಳನ್ನು ಬಳಸಿದಂತೆ ಕಾಣುತ್ತದೆ ಕಳೆದುಹೋದ ಭೂಮಿ. ಗೋಚರಿಸಲು ಬೇಕಾಗಿರುವುದು ಕೆಲವು ಸ್ಲೀಸ್ಟಾಕ್. ನಂತರ ಪ್ರಯತ್ನಿಸಿ ಮತ್ತು ಅದರ ಮೂಲಕ ನೇರ ಮುಖದಿಂದ ಕುಳಿತುಕೊಳ್ಳಿ.#0
ಈ ದುಃಖದ "ಸಾಕ್ಷ್ಯಚಿತ್ರ" ಗಾಗಿ ಅಗಾಧವಾದ ಆರಾಧನೆಯ ಹೊರತಾಗಿಯೂ, ನಮ್ಮ ಪಕ್ಷವನ್ನು ಉಪಯುಕ್ತವಾದ ಮಾಹಿತಿಗಿಂತ ಹೆಚ್ಚು ದುಃಖಕರವಾದ ಶೋಷಣೆಯ ತುಣುಕಾಗಿ ಹೊಡೆದ ಚಲನಚಿತ್ರವನ್ನು ಸೌಹಾರ್ದಯುತವಾಗಿ ಅಸಹ್ಯಪಡಿಸಿದ್ದನ್ನು ನಾನು ಒಪ್ಪಿಕೊಳ್ಳಬೇಕು. ಅದರಿಂದ, ಭವ್ಯವಾದ ಸ್ಟೇಜ್ ಮ್ಯೂಸಿಕಲ್ ಅನ್ನು ನೋಡಿದ ನಂತರ, ಈ ಚಿತ್ರವು ಖಚಿತವಾದ ಕೈಯಲ್ಲಿರಬಹುದೆಂದು ಪ್ರಶಂಸಿಸಬಹುದು. <br /> <br /> ಚಿತ್ರದ ಮೂಲಕ ಸಕ್ರಿಯವಾಗಿ ಬಳಲುತ್ತಿರುವ ನಮ್ಮಲ್ಲಿ ಅನೇಕರು ಯಾವುದೇ ಕ್ಯಾಂಪಿಯನ್ನು ಹೊಂದಿರಬಹುದೆಂದು ಒಬ್ಬರು ಶಂಕಿಸಿದ್ದಾರೆ, ನಮ್ಮಲ್ಲಿ ಅನೇಕರು - ಅಥವಾ ನಮಗೆ ತಿಳಿದಿರುವವರು - ಕೇವಲ ಒಂದು ಮಾತ್ರ ಎಂಬ ಅನಾನುಕೂಲ ಅನುಮಾನದಿಂದ ಅದರ ಕ್ರೂಲರ್ ಅಭಿಮಾನಿಗಳು ನಾಶವಾಗಿದ್ದಾರೆ. ತಪ್ಪಾಗಿ ಅಥವಾ ಎರಡು ದೂರದಲ್ಲಿ ಚಿತ್ರಿಸಿರುವ ಇಬ್ಬರು ಹುಚ್ಚು ಮಹಿಳೆಯರ ದುಃಖಕರ ಅವಸ್ಥೆಯಿಂದ ಅವರು ನಿಯಂತ್ರಿಸಲು ಅಥವಾ ತಪ್ಪಿಸಿಕೊಳ್ಳಲು ಅಸಮರ್ಥರು ಎಂದು ತೋರುತ್ತದೆ. <br /> <br /> ಯಾವುದೇ ವ್ಯಕ್ತಿಯು ಹೇಗೆ ಇರಬಹುದೆಂದು ಈ ಚಿತ್ರ ವೀಕ್ಷಕನನ್ನು ತೀವ್ರವಾಗಿ ಆಶ್ಚರ್ಯಗೊಳಿಸುತ್ತದೆ ಈ ಮಟ್ಟದ ಅವನತಿಗೆ ಜಾರಿದೆ ಮತ್ತು ಸಂಗೀತದಂತಲ್ಲದೆ, ಯಾವುದೇ ಎಚ್ಚರಿಕೆಯ ಸುಳಿವು ಅಥವಾ ವಿವರಣೆಯನ್ನು ನೀಡುವುದಿಲ್ಲ, ಹಾಸ್ಯ ಅಥವಾ ಒಳನೋಟದಿಂದ red ಹಿಸಲಾಗದ ಭಯಾನಕ ಪ್ರದರ್ಶನ ಮಾತ್ರ. <br /> <br /> ಚಿತ್ರದ ಚಪ್ಪಟೆಯನ್ನು ಪುಡಿಮಾಡುವ ಈ ಆತ್ಮವು ಹಂತದ ಆವೃತ್ತಿಯ ಸಾಧನೆಯನ್ನು ಮಾಡುತ್ತದೆ (ಅಂತಿಮವಾಗಿ ಕೇಬಲ್‌ಗಾಗಿ ಚಿತ್ರೀಕರಿಸಲಾಗುವುದು ಎಂದು ಆಶಿಸುತ್ತೇವೆ). ಆಕ್ಟ್ II ಚಿತ್ರದ ಪ್ರತಿಯೊಂದು ವಿವರಗಳಲ್ಲೂ ಚರ್ಚೆಯಲ್ಲಿದೆ ಆದರೆ ವಿಚಿತ್ರವೆಂದರೆ, ದುಃಖದ ಕೈದಿಗಳ ಅವಸ್ಥೆಯನ್ನು ಸಂಗೀತಕ್ಕೆ ಹೊಂದಿಸುವುದು, ಮಾನವ ದುರಂತವನ್ನು ಕಲೆಗೆ ಹೆಚ್ಚಿಸುತ್ತದೆ. ಇನ್ನೂ ಮುಖ್ಯವಾದುದು, ಈ ಕೃತ್ಯವು ಉತ್ತಮವಾದ ಕಾಯ್ದೆ I ಯಿಂದ ಮುಂಚಿತವಾಗಿರುತ್ತದೆ, ಅಲ್ಲಿ ನಾವು ಮಹಿಳೆಯರನ್ನು ಪರಸ್ಪರ ಶಕ್ತಗೊಳಿಸುವ ಹುಚ್ಚುತನಕ್ಕೆ ಮುಂಚಿತವಾಗಿ ಭೇಟಿಯಾಗುತ್ತೇವೆ ಮತ್ತು ಅವರ ಪ್ರತ್ಯೇಕ ಶುದ್ಧೀಕರಣವು ಹೇಗೆ ಬಂದಿತು ಎಂಬುದರ ಸುಳಿವುಗಳನ್ನು ನೀಡಲಾಗುತ್ತದೆ. ಸಂಕ್ಷಿಪ್ತವಾಗಿ ಹೇಳುವುದಾದರೆ, ಫಿಲ್ಮ್‌ನ ಕೊರತೆಯಿರುವ ಎಲ್ಲವೂ. <br /> <br /> ಚಲನಚಿತ್ರ ನಿರ್ಮಾಪಕರ ಕ್ರೆಡಿಟ್‌ಗೆ (ಅಥವಾ ಅವರ ಉತ್ತರಾಧಿಕಾರಿಗಳಿಗೆ), ಅತ್ಯುತ್ತಮ ಮಾನದಂಡ ಡಿವಿಡಿ ಬಿಡುಗಡೆಯು ಮುಖ್ಯ ಚಲನಚಿತ್ರವನ್ನು ಭಾಗಶಃ ಪುನಃ ಪಡೆದುಕೊಳ್ಳುವ -ಟ್-ಟೇಕ್ಸ್ ಮತ್ತು ಬೋನಸ್ ವಸ್ತುಗಳನ್ನು ಒಳಗೊಂಡಿದೆ. ದೃಶ್ಯಗಳ s ಾಯಾಚಿತ್ರಗಳು, ಸಂದರ್ಶನಗಳು ಮತ್ತು ವ್ಯಾಖ್ಯಾನ - ಕೆಲವು ಖಾಲಿ ತಾಣಗಳನ್ನು ಭರ್ತಿ ಮಾಡುವುದರಿಂದ ಮೂಲ ಸಂಪಾದನೆಯು ಪ್ರಜ್ಞಾಪೂರ್ವಕವಾಗಿ ಭಯಾನಕ ಮತ್ತು ಖಿನ್ನತೆಗೆ ತನ್ನ ಡ್ರೈವ್ ಅನ್ನು ಬಿಟ್ಟುಬಿಡಲು ನಿರ್ಧರಿಸಿದೆ. ಅವರು ಹವ್ಯಾಸಿ ಚಲನಚಿತ್ರವನ್ನು ತೃಪ್ತಿಕರವಾಗಿಸಲು ಸಾಧ್ಯವಿಲ್ಲ, ಆದರೆ ಅವರು ಅದನ್ನು ಸ್ವಲ್ಪ ಹೆಚ್ಚು ಗ್ರಹಿಸುವಂತೆ ಮಾಡಬಹುದು. <br /> <br /> ಅಂತಿಮವಾಗಿ, ಇದು ಪುಸ್ತಕ ಬರಹಗಾರ ಡೌಗ್ ರೈಟ್, ಸಂಯೋಜಕ ಸ್ಕಾಟ್ ಫ್ರಾಂಕೆಲ್ ಮತ್ತು ಗೀತರಚನೆಕಾರ ಮೈಕೆಲ್ ಕೋರಿ ಅವರಿಂದ ಸ್ಫೂರ್ತಿ ಪಡೆದ ಮತ್ತು ಚಿತ್ರಿಸಲ್ಪಟ್ಟ ಗಮನಾರ್ಹ ಹಂತದ ತುಣುಕು ಮಾತ್ರ, ಇದು ಮೂಲ ಗ್ರೇ ಗಾರ್ಡನ್‌ಗಳ ರೇಟಿಂಗ್ ಅನ್ನು ಒಂದೇ ಮೇಲೆ ಹೆಚ್ಚಿಸುತ್ತದೆ ( ಉದಾರ) ನಕ್ಷತ್ರ.#0
ನಾನು ಈ ಚಿತ್ರವನ್ನು ಕರುಣೆಯಿಂದ 3 ಎಂದು ಮಾತ್ರ ರೇಟಿಂಗ್ ಮಾಡುತ್ತಿದ್ದೇನೆ ಏಕೆಂದರೆ ಅದು ಉಪಯುಕ್ತವಾಗಲು ಪ್ರಯತ್ನಿಸುತ್ತದೆ. ನಾನು ಒಂದು ದೊಡ್ಡ ಚಲನಚಿತ್ರವನ್ನು ಹೊಗಳಲು ಇಷ್ಟಪಡುತ್ತೇನೆ ಮತ್ತು ನಾನು "ಪುರುಷ" ಚಲನಚಿತ್ರಗಳ ಬಗ್ಗೆ ಪಕ್ಷಪಾತ ಹೊಂದಿಲ್ಲ. ಕಾನೂನುಬದ್ಧವಾಗಿ ಹೊಂಬಣ್ಣವು ಅತ್ಯುತ್ತಮ ಚಿತ್ರವಾಗಿತ್ತು. ಮತ್ತೊಂದೆಡೆ ಜಾರ್ಜಿಯಾ ನಿಯಮವು ಅಸ್ತವ್ಯಸ್ತಗೊಂಡ, ದುರ್ಬಲವಾದ, ಕಳಪೆಯಾಗಿ ಬರೆಯಲ್ಪಟ್ಟ, ಚಲನಚಿತ್ರ ನಿರ್ಮಾಣದ ಅತ್ಯಂತ ಅವಾಸ್ತವಿಕ ಉದಾಹರಣೆಯಾಗಿದೆ. ಚಿತ್ರದ ಅಂತ್ಯದ ವೇಳೆಗೆ ಯಾರು ಸುಳ್ಳು ಹೇಳುತ್ತಿದ್ದಾರೆ ಅಥವಾ ಏನನ್ನಾದರೂ ಪರಿಹರಿಸಲಾಗಿದೆಯೆ ಎಂದು ನಾನು ಲೆಕ್ಕಿಸಲಿಲ್ಲ. <br /> <br /> ಚಲನಚಿತ್ರದಲ್ಲಿನ ಪ್ರಮುಖ ವಿಷಯವೆಂದರೆ ಉತ್ತಮ ಕಥೆ. ಈ ಕಥೆ ದುರ್ಬಲವಾಗಿದೆ ಮತ್ತು ಎಂದಿಗೂ ಅಭಿವೃದ್ಧಿಯಾಗುವುದಿಲ್ಲ (ವಿಷಯವು ಆಳವಾದ ಕಾರಣ, ಕಥೆ ಉತ್ತಮವಾಗಿದೆ ಎಂದಲ್ಲ). ಒಳ್ಳೆಯ ಕಥೆಯಲ್ಲಿ ಕ್ರಿಯಾತ್ಮಕ ಪಾತ್ರಗಳಿವೆ. ಕ್ರಿಯಾತ್ಮಕ ಪಾತ್ರವು ಒಂದು ಪ್ರಮುಖ ಪಾತ್ರ ಬದಲಾವಣೆಯನ್ನು ಅನುಭವಿಸುತ್ತದೆ, ಮತ್ತು ಚಲನಚಿತ್ರದ ಅವಧಿಯಲ್ಲಿನ ಆ ಬದಲಾವಣೆಗೆ ಆದ್ಯತೆ ನೀಡಲಾಗುತ್ತದೆ. ಜಾರ್ಜಿಯಾ ನಿಯಮದಲ್ಲಿ, ಪಾತ್ರದ ಬದಲಾವಣೆಗಳು ಹಠಾತ್ ಮತ್ತು ಅಭಿವೃದ್ಧಿಯಾಗಲಿಲ್ಲ. ಎರಡನೆಯದಾಗಿ, ಹಲವಾರು ಅಟೆಂಪ್ಟೆಡ್ ಡೈನಾಮಿಕ್ ಅಕ್ಷರಗಳು ಇದ್ದವು. ಒಳ್ಳೆಯ ಡೈನಾಮಿಕ್ ಪಾತ್ರವನ್ನು ಎಳೆಯುವುದು ಕಠಿಣ ಕೆಲಸ ಮತ್ತು ಸಮಯ ತೆಗೆದುಕೊಳ್ಳುತ್ತದೆ (ನಿಮಗೆ ಚಲನಚಿತ್ರದಲ್ಲಿ ಕೇವಲ ಎರಡು ಗಂಟೆಗಳ ಸಮಯ ಸಿಕ್ಕಿದೆ). ಇದರರ್ಥ ಹಲವಾರು ಪ್ರಯತ್ನಿಸಿದ ಕ್ರಿಯಾತ್ಮಕ ಪಾತ್ರಗಳು ಅವರ ವೈಯಕ್ತಿಕ ಬದಲಾವಣೆಯ ಬಗ್ಗೆ ಹೆಚ್ಚು ಗಮನ ಹರಿಸುವುದಿಲ್ಲ. ಕಳಪೆ ಲಿಖಿತ ಕಥೆಯನ್ನು ಮತ್ತು ದುರ್ಬಲ ಕ್ರಿಯಾತ್ಮಕ ಪಾತ್ರಗಳ ಕಸವನ್ನು ನಾನು ನಿರ್ಲಕ್ಷಿಸಿದರೂ, ನಾನು ಯಾರನ್ನೂ ಇಷ್ಟಪಟ್ಟೆ ಎಂದು ಹೇಳಲು ಸಾಧ್ಯವಿಲ್ಲ. ಪ್ರತಿಯೊಂದು ಪಾತ್ರವೂ ಗೊಂದಲಮಯವಾಗಿತ್ತು. ನೀವು ಅಮೇರಿಕನ್ ಬ್ಯೂಟಿ ಬರೆಯುತ್ತಿದ್ದರೆ ಅದು ಒಳ್ಳೆಯದು ಆದರೆ ನೀವು ನಾಟಕೀಯ ಹಾಸ್ಯವನ್ನು ಪ್ರಯತ್ನಿಸುತ್ತಿರುವಾಗ ಅಲ್ಲ. ಜಾರ್ಜಿಯಾ ಭಯಂಕರ ತಾಯಿಯಾಗಿದ್ದಳು, ಅವಳ ಮಗಳು ಭಯಂಕರ ತಾಯಿ ಮತ್ತು ಮಗಳಾಗಿದ್ದಳು, ಮತ್ತು ಲೋಹನ್ ಮನುಷ್ಯನಿಗೆ ಭಯಾನಕ ಕ್ಷಮಿಸಿತ್ತು (ಇಲ್ಲ ನಾನು ಅವಳನ್ನು ಯಾವುದೇ ಸಡಿಲಗೊಳಿಸುತ್ತಿಲ್ಲ ಏಕೆಂದರೆ ಅವಳು ಕಿರುಕುಳಕ್ಕೊಳಗಾಗಿದ್ದಳು, ಎಲ್ಲರಿಗೂ ಲದ್ದಿ ಸಂಭವಿಸುತ್ತದೆ ಮತ್ತು ನಾವೆಲ್ಲರೂ ಜವಾಬ್ದಾರರು ನಮ್ಮ ಸ್ವಂತ ಕಾರ್ಯಗಳಿಗಾಗಿ). "ಡಡ್ಲಿ ಡು ರೈಟ್" ಮಾರ್ಮನ್ ಮಗು ತನ್ನ ಧರ್ಮ ಮತ್ತು ಬದ್ಧತೆಗಳನ್ನು ರಾಜಿ ಮಾಡಿಕೊಳ್ಳದಿರಲು ಧೈರ್ಯವನ್ನು ಹೊಂದಿರಬೇಕು ... ಮತ್ತು ಸೈಮನ್, ನಾನು ಗಂಭೀರವಾಗಿ ಅರ್ಥೈಸುತ್ತೇನೆ, ಕಿರುಕುಳಕ್ಕೊಳಗಾದ 17 ವರ್ಷದ ಬಾಲಕಿಯನ್ನು ಸಾಂದರ್ಭಿಕವಾಗಿ ಉಳಿಯಲು ಯಾವ ರೀತಿಯ ವ್ಯಕ್ತಿ ಅನುಮತಿಸುತ್ತಾನೆ (ಅವನು ಹೊರತು ನಟ ಅಥವಾ ರಾಜಕಾರಣಿ). ಯಾವ ಉತ್ತಮ ಚಲನಚಿತ್ರ ತಯಾರಿಕೆ ಅಲ್ಲ ಎಂಬುದನ್ನು ನೀವೇ ನೆನಪಿಸಿಕೊಳ್ಳಬೇಕಾದರೆ ಈ ಚಲನಚಿತ್ರವನ್ನು ನೋಡುವುದು ಯೋಗ್ಯವಾಗಿದೆ!#0
ವಿಕ್ಟರ್ ವರ್ಗಾಸ್ ಅನ್ನು ಬೆಳೆಸುವುದು ಅದು ಹೆಚ್ಚು ಪ್ರಯತ್ನಿಸುವುದರಲ್ಲಿ ಭೀಕರವಾಗಿ ವಿಫಲಗೊಳ್ಳುತ್ತದೆ: ನಿಜ. ದುರದೃಷ್ಟವಶಾತ್, ಈ ಚಿತ್ರಕ್ಕೆ ಯಾವುದೇ ವಾಸ್ತವವಿಲ್ಲ. ಪಾತ್ರಗಳು ಮತ್ತು ಸನ್ನಿವೇಶಗಳು ಸಂಪೂರ್ಣವಾಗಿ ಕೃತಕ ಮತ್ತು ನಕಲಿ ಎಂದು ಭಾವಿಸುತ್ತವೆ. <br /> <br /> ಕಾರಣ? ಕೆಟ್ಟ ನಿರ್ದೇಶನ. ಪೀಟರ್ ಸೊಲೆಟ್ ತನ್ನ ಶಸ್ತ್ರಾಗಾರದಲ್ಲಿ ಎಲ್ಲಾ ತಪ್ಪು ಸಾಧನಗಳನ್ನು ಬಳಸುತ್ತಾನೆ. ಶ್ರೀ ಸೊಲೆಟ್ ಎಲ್ಲೋ ಓದಿದ್ದಾರೆಂದು ತೋರುತ್ತದೆ, ಅವರ ಚಲನಚಿತ್ರವನ್ನು ಬೆಳಗಿಸದಿರುವುದು ಅದಕ್ಕೆ ಅಧಿಕೃತ ಅನುಭವವನ್ನು ನೀಡುತ್ತದೆ. ತಪ್ಪಾಗಿದೆ! ಅದು ಕೆಟ್ಟದಾಗಿ ಮಾಡಿದ ಅನುಭವವನ್ನು ನೀಡುತ್ತದೆ. ಅಂತೆಯೇ, ಕ್ಯಾಮೆರಾವನ್ನು ಅಲುಗಾಡಿಸುವುದು ನಿಮ್ಮ ಚಿತ್ರಕ್ಕೆ ಸಾಕ್ಷ್ಯಚಿತ್ರ ಶೈಲಿಯನ್ನು ನೀಡುವುದಿಲ್ಲ, ಇದು ಪ್ರೇಕ್ಷಕರಿಗೆ ತಲೆನೋವು ನೀಡುತ್ತದೆ ಮತ್ತು ಅದನ್ನು ವರ್ಧಿಸುವ ಬದಲು ಪರದೆಯ ಮೇಲೆ ಇರುವುದನ್ನು ದೂರವಿರಿಸುತ್ತದೆ. <br /> <br /> ಖಂಡಿತವಾಗಿಯೂ, ಪರದೆಯಲ್ಲಿ ಏನಿದೆ ಎಂಬುದು ತುಂಬಾ ನೋವಿನಿಂದ ಕೂಡಿದೆ ನಕಲಿ, ಶ್ರೀ ಸೊಲೆಟ್ ತನ್ನ ಸ್ಕ್ರಿಪ್ಟ್ ಅನ್ನು ತನ್ನ ಸನ್ಡಾನ್ಸ್ ಗೆಳೆಯರಿಗೆ "ಹಿಪ್" ಆಗಿ ನೋಡಲು ಪ್ರಯತ್ನಿಸುವ ಏಕೈಕ ಗುರಿಯೊಂದಿಗೆ ಬರೆದಿದ್ದಾನೆ ಮತ್ತು ಅವನು ಒಬ್ಬ ಚಲನಚಿತ್ರ ನಿರ್ಮಾಪಕನನ್ನು "ಹರಿತ" ಎಂದು ತೋರಿಸುತ್ತಾನೆ. <br /> <br /> ಒಟ್ಟಾರೆಯಾಗಿ, ಶಾಶ್ವತವಾದ ಅನಿಸಿಕೆ ಈ ಚಿತ್ರವು ನಿಮ್ಮನ್ನು ಬಿಟ್ಟು ಹೋಗುತ್ತದೆ. ಕೆಟ್ಟ ನಿರ್ದೇಶಕ ಶ್ರೀ ಸೊಲೆಟ್. ಮುಂದಿನ ಬಾರಿ, ಕೆಲವು ಬರವಣಿಗೆ ಮತ್ತು ನಿರ್ದೇಶನ ತರಗತಿಗಳನ್ನು ತೆಗೆದುಕೊಳ್ಳುವುದು ಹೇಗೆ?#0
