ಡ್ರಗ್ಸ್ ಮತ್ತು ಕೊಲೆಗಳಲ್ಲಿ ಭಾಗಿಯಾಗಿ 14 ಇಂಚಿನ ಕೋಕ್ಡ್ ಅಶ್ಲೀಲ ತಾರೆ ಮತ್ತು ನಂತರ ಏಡ್ಸ್ ನಿಂದ ಮರಣ ಹೊಂದಿದ ನೀವು ಏನು ಮಾಡುತ್ತೀರಿ? ನೀವು ಖಂಡಿತವಾಗಿಯೂ ಚಲನಚಿತ್ರ ಮಾಡುತ್ತೀರಿ. ಇದನ್ನು ಮೊದಲೇ ಮಾಡದಿರಲು ಕಾರಣವೆಂದರೆ ಎಡ್ಡಿ ನ್ಯಾಶ್ ಅದರ ಉತ್ಪಾದನೆಯ ಹಾದಿಯಲ್ಲಿರಬಹುದು. ಆದ್ದರಿಂದ ನ್ಯಾಶ್ ಅವರನ್ನು ಜೈಲಿಗೆ ಕಳುಹಿಸಿದ ಸ್ವಲ್ಪ ಸಮಯದ ನಂತರ ಈ ಚಿತ್ರವನ್ನು ನಿರ್ಮಿಸಲಾಗಿದೆ ಎಂಬುದು ಕಾಕತಾಳೀಯವಲ್ಲ. <br /> <br /> ಚಲನಚಿತ್ರದ ಅತ್ಯುತ್ತಮ ವಿಷಯವೆಂದರೆ ಅದರ ತ್ವರಿತ ಗತಿ. ಅನಗತ್ಯ ಲದ್ದಿಗಾಗಿ ಸಮಯ ವ್ಯರ್ಥವಾಗುವುದಿಲ್ಲ. ಮತ್ತು ಅದು ಏಕೆ? ಮಂದ ಫಿಲ್ಲರ್ ದೃಶ್ಯಗಳ ಅಗತ್ಯವಿರುವಷ್ಟು ಉತ್ತಮವಾದ ವಸ್ತುಗಳು ಇಲ್ಲಿವೆ. ಎರಕಹೊಯ್ದವು ಉತ್ತಮವಾಗಿದೆ. ಕಿಲ್ಮರ್ ಚಲನಚಿತ್ರಗಳ ಸರಣಿಯಲ್ಲಿ ಸಾಧಾರಣನಾಗಿರುತ್ತಾನೆ, ಆದ್ದರಿಂದ ಅಂತಿಮವಾಗಿ ಅಂತಿಮವಾಗಿ ಅವನಿಗೆ ಸಾಕಷ್ಟು ಸೂಕ್ತವಾದ ಪಾತ್ರವಿದೆ. ಬೋಸ್‌ವರ್ತ್ ಮುದ್ದಾಗಿರುತ್ತಾಳೆ, ಆದ್ದರಿಂದ ಅವಳು ಹೇಗೆ ವರ್ತಿಸುತ್ತಾಳೆ (ಅವಳು ಗಟ್ಟಿಯಾಗಿರುತ್ತಾಳೆ) ಎಂಬುದು ಅಪ್ರಸ್ತುತ, ಮತ್ತು ಸಾಕಷ್ಟು ಕಿರಿಕಿರಿಯುಂಟುಮಾಡುವ ಮೆಕ್‌ಡರ್ಮೊಟ್ ದೊಡ್ಡ ಮಟ್ಟಿಗೆ ಒಳ್ಳೆಯದು, ಏಕೆಂದರೆ ಅವನು ತುಂಬಾ ಮುಖದ ಕೂದಲನ್ನು ಧರಿಸಿದ್ದರಿಂದ ನಾನು ಅವನನ್ನು ಮೊದಲು ಗುರುತಿಸಲಿಲ್ಲ. (ಪ್ರತಿ ಚಲನಚಿತ್ರದಲ್ಲೂ ಅವರು ಕ್ರೂಸ್‌ಗೆ ಹಾಗೆ ಮಾಡಬೇಕೆಂದು ನಾನು ಬಯಸುತ್ತೇನೆ, ಆದ್ದರಿಂದ ನಾನು ಅವನ ಮೂಕ ಮುಖವನ್ನು ನೋಡಬೇಕಾಗಿಲ್ಲ.) ಕ್ರಿಸ್ಟಿನಾ ಆಪಲ್‌ಗೇಟ್‌ನನ್ನು ಗುರುತಿಸುವಲ್ಲಿ ನಾನು ಸಂಪೂರ್ಣವಾಗಿ ವಿಫಲವಾಗಿದೆ, ಮತ್ತು ಅವಳು ಅದರಲ್ಲಿರುವುದನ್ನು ತಿಳಿದಿರಲಿಲ್ಲ, ನಾನು ಅವಳ ಹೆಸರನ್ನು ನೋಡದಿದ್ದರೆ ಅಂತಿಮ ಸಾಲಗಳು. ಕುಡ್ರೊ ಎಂದಿನಂತೆ ಆಕರ್ಷಕವಾಗಿದ್ದಾಳೆ, ನಾಟಕೀಯ ಪಾತ್ರದಲ್ಲಿ ಅವಳನ್ನು ನೋಡಲು ಸ್ವಲ್ಪ ಅಸಾಮಾನ್ಯ. . ನಾನು ಪ್ಯಾರಿಸ್ ಹಿಲ್ಟನ್ ಅವರನ್ನು ಸೇರಿಸಬೇಕೆಂದು ನೀವು ಭಾವಿಸಿದ್ದೀರಿ, ಅಲ್ಲವೇ? ಇಲ್ಲ, ಮೂಕ ವೇಶ್ಯೆಯಂತೆ ತನ್ನ 10 ಸೆಕೆಂಡುಗಳ ನೋಟದಲ್ಲಿ ಹಿಲ್ಟನ್ ಸೂಕ್ತ ಆಯ್ಕೆಯಾಗಿದೆ ಎಂದು ನಾನು ಭಾವಿಸುತ್ತೇನೆ. ಏಕೆಂದರೆ ಚಿತ್ರವು ಅವನತಿಯ ಬಗ್ಗೆ, ಇತರ ವಿಷಯಗಳ ಬಗ್ಗೆ ?? ಮತ್ತು ಅಶ್ಲೀಲ ನಟನ ಬಗ್ಗೆ ?? ಅವಳು ಸಂಪೂರ್ಣವಾಗಿ ಹೊಂದಿಕೊಳ್ಳುತ್ತಾಳೆ.#1
ಈ ಚಲನಚಿತ್ರವನ್ನು ತಮಾಷೆಯಾಗಿ ಕಾಣಲು ನನಗೆ ಇನ್ನೂ ಸಾಕಷ್ಟು ಮೆದುಳು ಉಳಿದಿದೆ ಎಂದು ನಾನು ess ಹಿಸುತ್ತೇನೆ. -ಮತ್ತೆ ಹಾಸ್ಯನಟರು - ಆದರೆ ತುಂಬಾ ಕಳಪೆ ಚಲನಚಿತ್ರ! "ಅತ್ಯುತ್ತಮ" ಪ್ರದರ್ಶನ ಇನ್ನೂ ನಿನಾ ಹ್ಯಾಗನ್ <br /> <br /> ಟ್ರಿವಿಯಾ: ಇದು "ನೈಜ ಪ್ರಪಂಚ" ದೃಶ್ಯಗಳು (ಹ್ಯಾಂಬರ್ಗ್‌ನಲ್ಲಿ) ಕಾರುಗಳು ಬಹುತೇಕ ಹೊಸ ಬಿಎಂಡಬ್ಲ್ಯುಗಳು ಎಂದು ನಿಮಗೆ ತಿಳಿದಿದೆಯೇ ?? <br /> <br /> ಈ ಚಲನಚಿತ್ರವನ್ನು ತಮಾಷೆಯಾಗಿ ಕಾಣಲು ನನಗೆ ಇನ್ನೂ ಸಾಕಷ್ಟು ಮೆದುಳು ಉಳಿದಿದೆ ಎಂದು ನಾನು ess ಹಿಸುತ್ತೇನೆ. -ಮತ್ತೆ ಹಾಸ್ಯನಟರು - ಆದರೆ ತುಂಬಾ ಕಳಪೆ ಚಲನಚಿತ್ರ! "ಅತ್ಯುತ್ತಮ" ಪ್ರದರ್ಶನ ಇನ್ನೂ ನಿನಾ ಹ್ಯಾಗನ್ <br /> <br /> ಟ್ರಿವಿಯಾ: ಇದು "ನೈಜ ಪ್ರಪಂಚ" ದೃಶ್ಯಗಳು (ಹ್ಯಾಂಬರ್ಗ್‌ನಲ್ಲಿ) ಕಾರುಗಳು ಬಹುತೇಕ ಹೊಸ ಬಿಎಂಡಬ್ಲ್ಯುಗಳು ಎಂದು ನಿಮಗೆ ತಿಳಿದಿದೆಯೇ ??#0
ನಾನು ಪ್ರಾಣಿ ಸಿನೆಮಾಗಳ ಅಭಿಮಾನಿ. ನೀವು ಕಥಾವಸ್ತುವನ್ನು ತೆಗೆದುಕೊಂಡು ಪ್ರಾಣಿಗಳನ್ನು ಮುಖ್ಯ ನಟರನ್ನಾಗಿ ಮಾಡಲು ಸಾಧ್ಯವಾದರೆ ನೀವು ಸಾಮಾನ್ಯವಾಗಿ ನನ್ನನ್ನು ಗೆಲ್ಲುತ್ತೀರಿ. ಹೋಮ್ವರ್ಡ್ ಬೌಂಡ್ ಇದನ್ನು ಮಾಡಿದೆ. ಅವರು ಸಮಯದಷ್ಟು ಹಳೆಯದಾದ ಕಥಾವಸ್ತುವನ್ನು ತೆಗೆದುಕೊಂಡು ಅದಕ್ಕೆ ಹೊಸ ಸ್ಪಿನ್ ಹಾಕಿದರು. ಇದು ಸಂಪೂರ್ಣ ಯಶಸ್ಸನ್ನು ಕಂಡಿತು. ಇದು ತುಂಬಾ ಪುರಾತನ ಚಲನಚಿತ್ರವಾಗಿದೆ. ನೀವು ಬುದ್ಧಿವಂತ (ತಾರ್ಕಿಕ) ಗುಂಪಿನ (ನೆರಳು) ಒಬಿ-ವಾನ್ ಅನ್ನು ಹೊಂದಿದ್ದೀರಿ, ನಿಮಗೆ ಪ್ರೀತಿಯ ಆದರೆ ಪ್ರಚೋದಕ ಮತ್ತು ಅಪನಂಬಿಕೆಯ ಅವಕಾಶವಿದೆ, ಮತ್ತು ಅವಳು ಮುದ್ದು ಮತ್ತು ಪ್ರಶಂಸೆಗೆ ಒಳಗಾಗಬೇಕೆಂದು ಭಾವಿಸುವ ಪ್ರಿಸ್ಸಿ ರಾಜಕುಮಾರಿ. ಈ ಮೂವರು ವ್ಯಕ್ತಿಗಳು ಒಬ್ಬರಿಗೊಬ್ಬರು ಚೆನ್ನಾಗಿ ಪುಟಿಯುತ್ತಾರೆ. ಅವರು ಚಾನ್ಸ್ ಮತ್ತು ಸ್ಯಾಸ್ಸಿಯನ್ನು ಅಂತಹ ಕ್ರಿಯಾತ್ಮಕ ಪಾತ್ರಗಳನ್ನು ಹೇಗೆ ಮಾಡಿದ್ದಾರೆಂದು ನಾನು ಇಷ್ಟಪಡುತ್ತೇನೆ ಮತ್ತು ಅವರು ಅದನ್ನು ಮಿತಿಮೀರಿ ಮಾಡಲಿಲ್ಲ. ಇದು ಉತ್ತಮವಲ್ಲ ಎಂದು ಹೆಚ್ಚಿನ ಜನರು ಹೇಳುತ್ತಾರೆ ಏಕೆಂದರೆ ಇದು ಮಕ್ಕಳ ಚಿತ್ರ ಹೆಚ್ಚು. ಅವರು ಮರೆಯುವ ಸಂಗತಿಯೆಂದರೆ, ಇದು ಮಕ್ಕಳ ಚಿತ್ರವಾಗಿರಬೇಕಿದೆ, ಮತ್ತು ಇದು ಇನ್ನೂ ತೀವ್ರವಾದ ಚಲನಚಿತ್ರದಿಂದ ದೂರವಾಗುವುದಿಲ್ಲ. ನೀವು ಬೇಸರಗೊಂಡಾಗ ವೀಕ್ಷಿಸಲು ಇದು ಉತ್ತಮ ಚಲನಚಿತ್ರವಾಗಿದೆ ಮತ್ತು ನೀವು ಚಲನಚಿತ್ರವನ್ನು ನೋಡಲು ಬಯಸುತ್ತೀರಿ. ಇದು ವ್ಯಂಗ್ಯಚಿತ್ರಗಳಿಲ್ಲದ ಡಿಸ್ನಿ ಚಲನಚಿತ್ರವಾಗಿದೆ, ಉತ್ತಮ ಕಥಾವಸ್ತುವನ್ನು ಹೊಂದಿರುವ ಗಾಳಿ ಮೊಗ್ಗು ಚಲನಚಿತ್ರವಾಗಿದೆ. ನಾನು ನಿಸ್ಸಂದೇಹವಾಗಿ, ಅದನ್ನು ವೀಕ್ಷಿಸಲು ಸಲಹೆ ನೀಡುತ್ತೇನೆ.#1
ನ್ಯೂಯಾರ್ಕ್ ದೊಡ್ಡ ನಕಲಿ ಎಂದು ನಾನು ಭಾವಿಸುತ್ತೇನೆ, ಅಂದರೆ ಈ ಪ್ರದರ್ಶನದ ಅವಳ ಸಂಪೂರ್ಣ ಮಾರ್ಗಸೂಚಿಗಳು ಅವಿವೇಕಿ. ನಾನು ಸುವಾಸನೆಯನ್ನು ಹೆಚ್ಚು ಚೆನ್ನಾಗಿ ಆನಂದಿಸಿದೆ, ಅವಳು ಸೂಳೆನಂತೆ ವರ್ತಿಸುತ್ತಾಳೆ ಮತ್ತು ಒಂದು ಹೂವನ್ನು ಒಟ್ಟಿಗೆ ಸೇರಿಸಿದ್ದಾಳೆ. ಅವಳ ತಾಯಿ ಈ ಪ್ರಪಂಚದಿಂದ ಹೊರಗಿದ್ದಾಳೆ, ಅವಳು ದೆವ್ವಗಳ ಮಗಳು ಎಂದು ನಾನು ಭಾವಿಸುತ್ತೇನೆ. ನನ್ನ ಪ್ರಕಾರ ಅವಳು ಈ ಪುರುಷರು ಈಗಾಗಲೇ ಹುಡುಗಿಯರನ್ನು ಹೊಂದಿದ್ದಾರೆಂದು ಅವಳು ಏನು ಯೋಚಿಸುತ್ತಾಳೆ ಮತ್ತು ನೀವು ಅವಳೊಂದಿಗೆ ಇದ್ದ ನಂತರ ನಿಮ್ಮ ಹುಡುಗಿಯ ಬಳಿಗೆ ಹಿಂತಿರುಗಲು ನೀವು ನಾಚಿಕೆಪಡುತ್ತೀರಿ ಎಂದು ನಾನು ನಂಬುತ್ತೇನೆ. ಅವಳು ಅಸಹ್ಯ, ಹಾಳಾದ ಮತ್ತು ದೊಡ್ಡ ಕೊಬ್ಬಿನ ನಕಲಿ. ಪ್ರದರ್ಶನವು ನೋಡಲು ತುಂಬಾ ಆಸಕ್ತಿದಾಯಕವಾಗಿದೆ, ಈ ಭೀಕರವಾದ ಪ್ರದರ್ಶನವನ್ನು ಮಾಡಲು ಅವಳು ಎಷ್ಟು ಹಣವನ್ನು ಪಡೆಯುತ್ತಿದ್ದಾಳೆ, ಮತ್ತು ಅವಳ ತಾಯಿಯೊಂದಿಗೆ ಏನಿದೆ, ನಾನು ಅವಳನ್ನು ಮತ್ತು ಹೊಸ ಯಾರ್ಕ್ ಅನ್ನು ಹೊಂದಿಲ್ಲ ಎಂದು ನಾನು ಭಾವಿಸಿದೆವು, ಆದರೆ ಈಗ ಅವಳು ತನ್ನ ಹುಚ್ಚು ಮಗಳಂತೆಯೇ ನಕಲಿಯಾಗಿದ್ದಾಳೆಂದು ತೋರುತ್ತದೆ. ಮತ್ತು ಪತಿ ಎಂದು ಕರೆಯಲ್ಪಡುವವನು ಎಲ್ಲಿದ್ದಾನೆ, ಅವನು ಎಲ್ಲಿ ಸಿಗುವುದಿಲ್ಲ, ನಾನು ಅವರೊಂದಿಗೆ ಇರಬಾರದು.#0
ನಾನು ನಿಜವಾಗಿಯೂ ಈ ಪ್ರದರ್ಶನವನ್ನು ಆನಂದಿಸಿದೆ. ಯುವಕನಾಗಿದ್ದಾಗಲೂ ನಾನು ಎಲ್ಲಾ ಕ್ರೀಡೆಗಳಲ್ಲಿ ಆಸಕ್ತಿ ಹೊಂದಿದ್ದೆ ಮತ್ತು ಅದರಲ್ಲಿ ಕುದುರೆ ಓಟವೂ ಸೇರಿತ್ತು. ರೇಸಿಂಗ್ ಭ್ರಷ್ಟಾಚಾರವನ್ನು ಆಧರಿಸಿ ಸರಣಿಯನ್ನು ಮಾಡುವುದು ಯಾವಾಗಲೂ ಕಷ್ಟಕರವಾಗಿರುತ್ತದೆ ಮತ್ತು ಅದೇ ಸಮಯದಲ್ಲಿ ಈ ವಿವಾದಾತ್ಮಕ ವಿಷಯದ ಬಗ್ಗೆ ಚಿತ್ರೀಕರಣವನ್ನು ರೆಕಾರ್ಡ್ ಮಾಡಲು ರೇಸ್ ಟ್ರ್ಯಾಕ್‌ಗಳಿಂದ ಅನುಮತಿ ಪಡೆಯಿರಿ. ಕುದುರೆಯ ಸುತ್ತಲೂ ಕೇಂದ್ರೀಕೃತವಾಗಿರುವ ಒಂದು ಎಪಿಸೋಡ್ ದೊಡ್ಡ ಓಟವನ್ನು ಗೆಲ್ಲುವ ನಿರೀಕ್ಷೆಯಿದೆ, ಅದು ಸ್ವಲ್ಪ ಬಣ್ಣವನ್ನು ಕಾಣುತ್ತದೆ. ಸ್ಥಿರವಾದ ನೆಲದಲ್ಲಿ ಸಿರಿಂಜ್ ಕಂಡುಬಂದಿದೆ ಮತ್ತು ಎಲ್ಲರೂ ಇದನ್ನು ಮಾದಕವಸ್ತು ಎಂದು ಭಾವಿಸಿದ್ದರು ಆದರೆ ರಕ್ತ ಪರೀಕ್ಷೆಗಳಲ್ಲಿ ಏನೂ ತೋರಿಸಲಿಲ್ಲ. ತಡವಾಗಿ ಅವರು ಕುದುರೆಯನ್ನು ಡೋಪ್ ಮಾಡಲಾಗಿಲ್ಲ ಆದರೆ ಅದರ ಮೊಣಕಾಲಿನ ಕಾರ್ಟಿಲೆಜ್ ಅನ್ನು ತೆಗೆದುಹಾಕಿದ್ದಾರೆಂದು ಅವರು ಅರಿತುಕೊಂಡರು. ಎಣ್ಣೆ ಇಲ್ಲದ ಕಾರನ್ನು ಓಡಿಸುತ್ತಿದ್ದಂತೆ ಮತ್ತು ಎಂಜಿನ್ ಅನ್ನು ವಶಪಡಿಸಿಕೊಂಡಂತೆ, ಕುದುರೆ ದುರಂತ ಪರಿಣಾಮಗಳೊಂದಿಗೆ ಮುರಿದುಹೋಯಿತು.#1
ಸಾಮಾನ್ಯವಾಗಿ ನಾನು ಬೆಳಕು ಮತ್ತು ವಿನೋದವನ್ನು ಇಷ್ಟಪಡುತ್ತೇನೆ, ಆದ್ದರಿಂದ ಈ ಚಿತ್ರವು ನನಗೆ ಇಷ್ಟವಾಗಬಾರದು. ಆದರೆ ಅದು ಮೊದಲಿನಿಂದಲೂ ನನ್ನನ್ನು ಸೆಳೆಯಿತು. ಕುಟುಂಬದ ಆಯ್ಕೆಗಳು ಮತ್ತು ಸವಾಲುಗಳ ಕಥೆ ಸ್ಪಷ್ಟವಾಗಿ ತೋರುತ್ತದೆ, ಆದರೆ ಇದು ಪದೇ ಪದೇ ಪ್ರಶ್ನೆಯನ್ನು ಹುಟ್ಟುಹಾಕುತ್ತದೆ: "ಇದು ನನ್ನ ಕುಟುಂಬವಾಗಿದ್ದರೆ ಏನು? ನನ್ನ ಆಯ್ಕೆ?" ಅವರು ಹಾಗೆ ಮಾಡಿದಾಗ ನಾನು ಅಳುತ್ತಿದ್ದೆ ಮತ್ತು ನಕ್ಕಿದ್ದೇನೆ ಏಕೆಂದರೆ ಅದರಲ್ಲಿ ತೊಡಗಿರುವ ಜನರು ಏನು ಭಾವಿಸಿದ್ದಾರೆಂದು ನಾನು ಭಾವಿಸಿದೆ. ಇದು ವೀಕ್ಷಿಸಲು ಕಷ್ಟಕರವಾದ ಸ್ಥಳಗಳಲ್ಲಿತ್ತು, ಆದರೆ ದೂರ ತಿರುಗುವುದು ಹೆಚ್ಚು ಕಷ್ಟ. ಕಥೆ ನಿಜ, ಮತ್ತು ಜೀವನವನ್ನು ಕೆಲವೊಮ್ಮೆ ನೋಡುವುದು ಕಷ್ಟ! ಚಲನಚಿತ್ರ ನಿರ್ಮಾಪಕರು ಲೈಂಗಿಕತೆ, ಹಿಂಸೆ ಅಥವಾ ವಿಶೇಷ ಪರಿಣಾಮಗಳಿಲ್ಲದೆ ಏನು ಮಾಡಬಹುದು ಎಂಬುದನ್ನು ಇದು ತೋರಿಸುತ್ತದೆ: ಒಳ್ಳೆಯ ಕಥೆ ಒಂದು ಒಳ್ಳೆಯ ಕಥೆ. ಅತ್ಯುತ್ತಮ ಮತ್ತು ಅತ್ಯಂತ ಅನಿರೀಕ್ಷಿತ ಕಥೆಗಳು ಎಲ್ಲಾ ನಿಜವಾದ ಕಥೆಗಳು. ನಿಜ ಜೀವನದಂತೆ, ಮುಂದೆ ಏನಾಗಬಹುದು ಎಂದು ನಿಮಗೆ ನಿಜವಾಗಿಯೂ ತಿಳಿದಿಲ್ಲ, ಅಥವಾ ಜನರು ತಾವು ಮಾಡುವ ಕೆಲಸಗಳನ್ನು ಏಕೆ ಮಾಡುತ್ತಾರೆ!#1
ವಿಕ್ಟರ್ ವರ್ಗಾಸ್ ಅನ್ನು ಬೆಳೆಸುವುದು ನೀವು ಖಂಡಿತವಾಗಿ ನೋಡಬೇಕಾದ ಚಲನಚಿತ್ರವಾಗಿದೆ. ಇದು ತುಂಬಾ ಹೃದಯದ ಭಾವನೆ ಹೊಂದಿತ್ತು ಮತ್ತು ಬಹಳಷ್ಟು ಹಾಸ್ಯವನ್ನು ಹೊಂದಿದ್ದು ಅದು ನಿಮ್ಮನ್ನು ಸರಿಯಾಗಿ ಹೀರಿಕೊಳ್ಳುತ್ತದೆ. ಇದು ನಿಜ ಜೀವನದಂತೆಯೇ ಹದಿಹರೆಯದವರು ಏನು ಮಾಡಬೇಕೆಂಬುದನ್ನು ಹೊಂದಿದೆ. ವಿಕ್ಟರ್, ಕೋಕಿ ಹದಿಹರೆಯದವನು, ಆದರೆ ಕೊನೆಯಲ್ಲಿ ಉತ್ತಮ ಹೃದಯದಿಂದ ಹುಡುಗಿಯರು ಮತ್ತು ಕುಟುಂಬದೊಂದಿಗೆ ವ್ಯವಹರಿಸುವ ಎಲ್ಲಾ ಸರಿಯಾದ ಸ್ಥಳಗಳಲ್ಲಿ ಪ್ರೀತಿಯೊಂದಿಗೆ ವ್ಯವಹರಿಸುತ್ತಾನೆ. ಕೊನೆಯಲ್ಲಿ ವಿಕ್ಟರ್ ಹಳೆಯ ಶೈಲಿಯ ಅಜ್ಜಿಯೊಂದಿಗೆ ವ್ಯವಹರಿಸಿದ ನಂತರ ಪ್ರೀತಿಯ ನಿಜವಾದ ಅರ್ಥವನ್ನು ಕಲಿಯುತ್ತಾನೆ ಮತ್ತು ಅವನು ಬಳಸಲು ಬಯಸುವ ಹುಡುಗಿ ಅವನನ್ನು ಸಹ ಬಳಸುತ್ತಿದ್ದಾನೆ. ಈ ಚಲನಚಿತ್ರವನ್ನು ವೀಕ್ಷಿಸಲು ನಾನು ಜನರನ್ನು ಶಿಫಾರಸು ಮಾಡುತ್ತೇನೆ ಏಕೆಂದರೆ ನೀವು ನಿಜವಾದ ಕುಟುಂಬವನ್ನು ನೋಡುತ್ತಿರುವಂತೆಯೇ ಇರುತ್ತದೆ. ಈ ಚಲನಚಿತ್ರವು ಎಷ್ಟು ಭಾವನೆಯನ್ನು ಹೊಂದಿದೆ. ವಿಕ್ಟರ್ನ ಅಜ್ಜಿ ಸರಳವಾದ ವಿಷಯದ ಮೇಲೆ ವಿಜಯಶಾಲಿಯನ್ನು ಹೊರಹಾಕಿದಾಗ ಒಂದು ಹೃದಯವು ಒಂದು ಕ್ಷಣವಾಗಿದೆ. ವಿಕ್ಟರ್ ನಿಜವಾಗಿಯೂ ಹೃದಯ ಮತ್ತು ಅವಳು ಅಂತಹದನ್ನು ಮಾಡುತ್ತಾಳೆ ಎಂದು ನಂಬಲು ಸಾಧ್ಯವಾಗಲಿಲ್ಲ. ಅದು ನಿಜವೆಂದು ನನಗೆ ಅವನ ಬಗ್ಗೆ ನಿಜವಾದ ವಿಷಾದವಾಯಿತು. ಒಟ್ಟಾರೆಯಾಗಿ ನಾನು ಈ ಚಲನಚಿತ್ರಕ್ಕೆ ಬಿ + ನೀಡುತ್ತೇನೆ#1
ಮತ್ತೊಮ್ಮೆ ಜೆಟ್ ಲಿ ತನ್ನ ವರ್ಚಸ್ವಿ ಉಪಸ್ಥಿತಿಯನ್ನು ಬ್ಲ್ಯಾಕ್ ಮಾಸ್ಕ್ ಚಿತ್ರದಲ್ಲಿ ಚಲನಚಿತ್ರ ಪರದೆಯ ಮೇಲೆ ತರುತ್ತಾನೆ. ಈ ಚಿತ್ರದಲ್ಲಿ ಲಿ ಸೂಪರ್ ಸೈನಿಕರ ಕಾರ್ಯಕ್ರಮದಿಂದ ತಪ್ಪಿಸಿಕೊಳ್ಳುವ ತ್ಸುಯಿ ಪಾತ್ರವನ್ನು ನಿರ್ವಹಿಸುತ್ತಾನೆ, ಅವರು ಆ ಕಾರ್ಯಕ್ರಮವು ಅವನಿಂದ ತೆಗೆದುಕೊಂಡ ಮಾನವೀಯತೆಯನ್ನು ಮರಳಿ ಪಡೆಯಲು ಪ್ರಯತ್ನಿಸುತ್ತಾರೆ. ಇದನ್ನು ಮಾಡಲು ತ್ಸುಯಿ ಸಾಮಾನ್ಯ ಮತ್ತು ಶಾಂತಿಯುತ ಜೀವನವನ್ನು ನಡೆಸಲು ಗ್ರಂಥಪಾಲಕನಾಗಲು ನಿರ್ಧರಿಸುತ್ತಾನೆ, ಆದರೆ ಅದೃಷ್ಟವು ಶಾಂತಿಯನ್ನು ಹುಡುಕುವುದನ್ನು ಮುಂದುವರೆಸುವ ಮೊದಲು ಅವನು ತನ್ನ ಹಿಂದಿನ ಸಮಸ್ಯೆಗಳನ್ನು ಸ್ವಚ್ clean ಗೊಳಿಸಬೇಕೆಂದು ಒತ್ತಾಯಿಸುತ್ತಾನೆ. ಸೂಪರ್ ಸೈನಿಕ ಕಾರ್ಯಕ್ರಮದ ಇತರ ಸದಸ್ಯರು ತ್ಸುಯಿ ಅವರಂತೆಯೇ ತಪ್ಪಿಸಿಕೊಂಡಿದ್ದರು, ಆದರೆ ಅವರು ಆಂತರಿಕ ಶಾಂತಿಯನ್ನು ಕಂಡುಕೊಳ್ಳುವ ಬದಲು ಪ್ರಪಂಚದೊಂದಿಗೆ ಸಹ ಪಡೆಯಲು ಬಯಸುತ್ತಾರೆ. ಹೀಗೆ ಅನೇಕ ಮುಗ್ಧ ಜನರ ಜೀವನವನ್ನು ಕಳೆದುಕೊಳ್ಳುವಂತಹ ಮಾಹಿತಿಯನ್ನು ಬಿಡುಗಡೆ ಮಾಡುವುದರಿಂದ ತನ್ನ ಮಾಜಿ ತಂಡದ ಸಹ ಆಟಗಾರರನ್ನು ತಡೆಯುವ ಏಕೈಕ ವಿಷಯವೆಂದರೆ ತ್ಸುಯಿ. ಈ ಚಿತ್ರವು ಪರದೆಯಾದ್ಯಂತ ಉದ್ರಿಕ್ತ ವೇಗದಲ್ಲಿ ಕಿರುಚುತ್ತದೆ ಮತ್ತು ಅದರ ಪ್ರೇಕ್ಷಕರನ್ನು ಎಂದಿಗೂ ಹೋಗಲು ಬಿಡುವುದಿಲ್ಲ. ಸಮರ ಕಲೆಗಳು ಅದ್ಭುತವಾದವು, ಆದರೆ ಇದು ತಂತಿಗಳನ್ನು ಬಳಸುವುದರಿಂದ ಅದು ಅಮೆರಿಕಾದ ಪ್ರೇಕ್ಷಕರಿಂದ ಅರ್ಹವಾದಷ್ಟು ಮೆಚ್ಚುಗೆ ಪಡೆಯುವುದಿಲ್ಲ. ನೀವು ಆಸಕ್ತಿದಾಯಕ ಕಥೆಯನ್ನು ಹೊಂದಿರುವ ಆಕ್ಷನ್ ಚಲನಚಿತ್ರಗಳನ್ನು ಬಯಸಿದರೆ ಮತ್ತು ಉತ್ತಮ ನಟನಾ ಪ್ರದರ್ಶನಗಳನ್ನು ಅವರು ಮಾನಸಿಕ ಮತ್ತು ದೈಹಿಕ ಘರ್ಷಣೆಗಳೊಂದಿಗೆ ನಿಭಾಯಿಸುತ್ತಾರೆ ಎಂದು ಬಯಸಿದರೆ, ಬ್ಲ್ಯಾಕ್ ಮಾಸ್ಕ್ ನಿಮಗಾಗಿ. ಜೆಟ್ ಲಿ ಅವರ ಕೆಲವು ಚಲನಚಿತ್ರಗಳು ಅಂತಿಮವಾಗಿ ಯುನೈಟೆಡ್ ಸ್ಟೇಟ್ಸ್ನಲ್ಲಿ ಮುಖ್ಯ ಸ್ಟ್ರೀಮ್ ಬಿಡುಗಡೆಯನ್ನು ಪಡೆಯುತ್ತಿರುವುದನ್ನು ನೋಡಿ ನನಗೆ ಸಂತೋಷವಾಗಿದೆ ಮತ್ತು ಆ ಬಿಡುಗಡೆಯ ಅಗತ್ಯವಿರುವ ಬದಲಾವಣೆಗಳು (ಡಬ್ಬಿಂಗ್ ಮತ್ತು ಧ್ವನಿಪಥದಂತಹವುಗಳು) ಚಿತ್ರದ ಮೇಲೆ ಹೇಗೆ ಪರಿಣಾಮ ಬೀರುತ್ತವೆ ಎಂಬುದನ್ನು ಎದುರು ನೋಡುತ್ತಿದ್ದೇನೆ. ಇದು ಲಿ ಅವರ ಅತ್ಯುತ್ತಮ ಚಿತ್ರಗಳಲ್ಲಿ ಒಂದಾಗಿದೆ, ಮೇ 14 ರಂದು ಅಮೆರಿಕದಲ್ಲಿ ಬಿಡುಗಡೆಯಾದಾಗ ಹೊರಗೆ ಹೋಗಿ ನೋಡಿ.#1
ಈ ಚಲನಚಿತ್ರವು ತುಂಬಾ ಉತ್ತಮವಾಗಿಲ್ಲ. ಇದು ನೀರಸ, ಮತ್ತು ಭಯಾನಕ ಚಿತ್ರಕ್ಕಾಗಿ ಹೆಚ್ಚು ರಕ್ತವಲ್ಲ. ಕಥಾವಸ್ತುವು ಹೆಚ್ಚು ನಡೆಯುತ್ತಿಲ್ಲ. ಮತ್ತು ಸ್ತ್ರೀ ರಕ್ತಪಿಶಾಚಿ ತುಂಬಾ ದಡ್ಡ ಎಂದು ನಾನು ಭಾವಿಸುತ್ತೇನೆ. ರಕ್ತಪಿಶಾಚಿ ಬೇಟೆಗಾರರನ್ನು ಕೊಲ್ಲಲು ಅವಳು ಅನೇಕ ಅವಕಾಶಗಳನ್ನು ಹೊಂದಿದ್ದಳು, ಏಕೆಂದರೆ ಅವಳು ಪ್ರತಿವರ್ತನದಂತೆ ಬೆಳಕನ್ನು ಹೊಂದಿದ್ದಾಳೆ. ಆದರೆ, ಅವಳು ಅವುಗಳಲ್ಲಿ ಒಂದನ್ನು ಪಿನ್ ಮಾಡಿದಾಗ, ಅವಳು ತನ್ನ ಸಮಯವನ್ನು ತೆಗೆದುಕೊಳ್ಳುತ್ತಾಳೆ ಮತ್ತು ಅವಳು ಯಾವಾಗಲೂ ಅವುಗಳನ್ನು ಕಚ್ಚದ ಸ್ಥಳದಲ್ಲಿ ಏನಾದರೂ ಸಂಭವಿಸುತ್ತದೆ. ಇದು ನೇರವಾಗಿ ಕೇಬಲ್‌ಗೆ ಹೋದರೆ ಆಶ್ಚರ್ಯವಿಲ್ಲ. <br /> <br /> ಅಂತಿಮ ಪರಿಶೀಲನೆ: ಮೊದಲ ರಕ್ತಪಿಶಾಚಿ ಚಲನಚಿತ್ರದಷ್ಟು ಉತ್ತಮವಾಗಿ ಎಲ್ಲಿಯೂ ಇಲ್ಲ. ಇದಕ್ಕಾಗಿ ನಿಮ್ಮ ಸಮಯವನ್ನು ವ್ಯರ್ಥ ಮಾಡಿದರೆ ನೀವು ಸಕ್ಕರ್ ಆಗಿದ್ದೀರಿ.#0
