ಬಿಬಿಸಿಯಲ್ಲಿ ಕೆಲಸ ಮಾಡುವ ಮೈಕೆಲ್ ವಿಲಿಯಮ್ಸ್, ಹೇಗಾದರೂ ಪ್ರಭಾವಶಾಲಿ ಇಟಾಲಿಯನ್ ಚಿತ್ರವನ್ನು ಕಂಡುಕೊಳ್ಳುತ್ತಾನೆ, ಅದು ತನ್ನ ಪ್ರಸ್ತುತ ಕಾರ್ಯದ ಡಯಾಬೊಲಿಕಲ್ ಆರ್ಟ್: ಎ ಡಾಕ್ಯುಮೆಂಟರಿ ಎಂಬ ವಿಷಯದಲ್ಲಿ ಬೆರೆತುಹೋಗುತ್ತದೆ. ಆದರೆ ಅವನ ಹೆಂಡತಿಯ ನಿಗೂ erious ಮರಣದ ನಂತರ ಅವಳ ಮಗಳು ಎಮಿಲಿ ಭಾವನಾತ್ಮಕವಾಗಿ ತೊಂದರೆಗೀಡಾಗಿದ್ದಾಳೆ, ಆದ್ದರಿಂದ ಅವನು ಸ್ಪೋಲೆಟೊಗೆ ಹೋಗುತ್ತಾನೆ, ಅಲ್ಲಿ ಸಮಸ್ಯಾತ್ಮಕ ಚಿತ್ರವಿದೆ, ಅವಳ ಮತ್ತು ಅವಳ ದಾದಿ ಜಿಲ್ ಜೊತೆ. ಮತ್ತು ಒಬ್ಬ ಕೌಂಟೆಸ್ ಇದ್ದಾರೆ, ಅವರು ಅತೀಂದ್ರಿಯರಾಗಿದ್ದಾರೆ, ಮತ್ತು ಎಮಿಲಿಯಾ ಎಂಬ ಯುವ ಮಾಟಗಾತಿಯನ್ನು ಗಲ್ಲಿಗೇರಿಸಲಾಯಿತು ಎಂದು ರಾತ್ರಿಯಲ್ಲಿ ಚಿತ್ರವನ್ನು ಹೇಗಾದರೂ ಮಾಡಲಾಗಿದೆ ಎಂದು ಅವಳು ಅವನಿಗೆ ತಿಳಿಸುತ್ತಾಳೆ. ಮೈಕೆಲ್ ತನ್ನ ಕಥೆಯನ್ನು ನಂಬುವುದಿಲ್ಲ, ಆದರೆ ಅದರ ನಂತರ ಎಮಿಲಿಗೆ ಉನ್ಮಾದದ ​​ಸೆಳೆತವಿದೆ ಮತ್ತು ಜಿಲ್ ಕೊಲ್ಲಲ್ಪಟ್ಟರು ... ಈ ಇಟಾಲಿಯನ್ ಚಲನಚಿತ್ರವು ಖಂಡಿತವಾಗಿಯೂ ಮುಗ್ಧವಾಗಿ ದಿ ಎಕ್ಸಾರ್ಸಿಸ್ಟ್‌ನಿಂದ ಪ್ರಭಾವಿತವಾಗಿದೆ, ಆದರೆ ಇದು ತುಂಬಾ ಅಗ್ಗವಾಗಿದೆ, ಹೆಚ್ಚು ಸರಳವಾಗಿದೆ ಮತ್ತು ಅರ್ಥ, ಹೆಚ್ಚು ಕೊಳಕು. ಮೊದಲನೆಯದಾಗಿ, ಈ ಚಿತ್ರವು ಗೊಂದಲಗಳಿಂದ ಕೂಡಿದೆ ಎಂದು ಹೇಳಬೇಕು. ಉದಾಹರಣೆಗೆ, ಎಮಿಲಿ ಎಮಿಲಿಯಾದ ಪುನರ್ಜನ್ಮ ಎಂದು ಕಥೆ ತೋರಿಸುತ್ತದೆ. ಆದರೆ ಎಮಿಲಿ ಅವಳನ್ನು ಫ್ಲ್ಯಾಷ್‌ಬ್ಯಾಕ್‌ನಲ್ಲಿ ನೋಡಿದಾಗ, ಅವಳು ಅವಳನ್ನು ಪ್ರತ್ಯೇಕವಾಗಿ ಮೂರನೇ ವ್ಯಕ್ತಿಯ ದೃಷ್ಟಿಕೋನದಿಂದ ಗ್ರಹಿಸುತ್ತಾಳೆ. ಆದರೆ ಅವಳು ಎಮಿಲಿಯಾಳ ಪುನರ್ಜನ್ಮವಾಗಿದ್ದರೆ, ಅವಳು ಎಮಿಲಿಯಾಳ ದೃಷ್ಟಿಕೋನದಿಂದ ಹಿಂದಿನದನ್ನು ನೋಡಬೇಕು ಮತ್ತು ನೋಡಬೇಕು. ಚಲನಚಿತ್ರವು ಅನೇಕವನ್ನು ಹೊಂದಿರುವ ಈ ರೀತಿಯ ಗೊಂದಲಗಳು, ಚಲನಚಿತ್ರವು ತನ್ನದೇ ಆದ ಅರೆ-ಫ್ರಾಯ್ಡಿಯನ್ ವಿಷಯವನ್ನು ನಿರ್ದಿಷ್ಟಪಡಿಸಲು, ಅಂದರೆ, ಹದಿಹರೆಯದ ಪೂರ್ವದ ಹುಡುಗಿಯ ಏಕಮುಖ ಅಭದ್ರತೆಯ ಆಶಯವನ್ನು ನಿರ್ದಿಷ್ಟಪಡಿಸಲು, ದ್ವಂದ್ವಾರ್ಥದ ಬದಲು, ತುಂಬಾ ಹೇಡಿತನವಾಗಿದೆ ಎಂಬ ಸಮಸ್ಯಾತ್ಮಕ ಸತ್ಯವನ್ನು ಆಧರಿಸಿದೆ. . ವಿಷಯಗಳನ್ನು ಇನ್ನಷ್ಟು ಹದಗೆಡಿಸಲು, ಈ ಚಲನಚಿತ್ರವು ವಿಶಿಷ್ಟವಾದ ಸಮಸ್ಯೆಯನ್ನು ಸಹ ಹೊಂದಿದೆ (ಗೊಂದಲವಿಲ್ಲದಿದ್ದರೆ); ಪ್ರತಿಯೊಂದು ಪಾತ್ರವೂ ವಾಸ್ತವಿಕ ಮತ್ತು / ಅಥವಾ ನಂಬಲರ್ಹ ಜೀವಂತ ಮನುಷ್ಯನಾಗಿರಲು ತುಂಬಾ ನಿಷ್ಕಪಟ ಮತ್ತು ಅಸಹಾಯಕವಾಗಿದೆ. ಎಮಿಲಿ (ಅಥವಾ ಎಮಿಲಿಯಾ) ಬಗ್ಗೆ, ಅವಳು ಎಲ್ಲಾ ಮಗುವಿನ ನಂತರ, ಮತ್ತು ಮುಖ್ಯವಾಗಿ ಅವಳ ನಿಷ್ಕಪಟತೆ ಮತ್ತು ಅಸಹಾಯಕತೆಗೆ ಅವಳನ್ನು ದೂಷಿಸುವುದು ಕಷ್ಟ ಎಂದು ಒಬ್ಬರು ಹೇಳಬಹುದು. (ಮತ್ತು ಫ್ರಾಯ್ಡಿಯನ್ ಸಿದ್ಧಾಂತದ ಪ್ರಕಾರ, ಪ್ರತಿ ಹುಡುಗಿಯೂ ತನ್ನ ತಂದೆಯ ಮಗುವನ್ನು (ರೆನ್) ತನ್ನದೇ ಆದ ರೀತಿಯಲ್ಲಿ ಹೊಂದಲು ಬಯಸುತ್ತಾಳೆ. ಈ ಅರ್ಥದಲ್ಲಿ, ಎಮಿಲಿ ಪ್ರತ್ಯೇಕವಾಗಿ ರೋಗಶಾಸ್ತ್ರೀಯಳಲ್ಲ; ಇತರ ಮಹಿಳೆಯರನ್ನು ತನ್ನ ತಂದೆಯ ಪ್ರೀತಿಯಿಂದ ಹೊರಗಿಡುವ ವಿಧಾನವು ಸಮಸ್ಯಾತ್ಮಕವಾಗಿ ರೋಗಶಾಸ್ತ್ರೀಯವಾಗಿದೆ. , ನಾನು ಈಗಾಗಲೇ ಹೇಳಿದಂತೆ, ಈ ಚಿತ್ರವು ಫ್ರಾಯ್ಡಿಯನ್ ಆಗಲು ತುಂಬಾ ಹೇಡಿತನವಾಗಿದೆ.) ಸಮಸ್ಯೆಯೆಂದರೆ ವಯಸ್ಕ ಪಾತ್ರಗಳು ಎಮಿಲಿಯಂತೆಯೇ ಬಾಲಿಶ ಮತ್ತು ನಿಷ್ಕಪಟ ಮತ್ತು ಅಸಹಾಯಕರಾಗಿರುತ್ತವೆ. ಮತ್ತು ಈ ವಿಶಿಷ್ಟ ದೌರ್ಬಲ್ಯದಿಂದಾಗಿ ಬಹುತೇಕ ಎಲ್ಲವನ್ನೂ ನೋಡಬಲ್ಲ ಅತೀಂದ್ರಿಯರು ಸಹ ಭೂಮಿಯಿಂದ ಏನನ್ನೂ ಮಾಡಲು ಸಾಧ್ಯವಿಲ್ಲ, ಮತ್ತು ಅದೇ ದೌರ್ಬಲ್ಯದಿಂದಾಗಿ ಚಿತ್ರದ ಕಥೆಯು ಕೆಟ್ಟದಾಗಿ ಪಲಾಯನವಾದಿ ರೀತಿಯಲ್ಲಿ ಕೊನೆಗೊಳ್ಳುತ್ತದೆ. ಇದಲ್ಲದೆ, ಈ ಚಿತ್ರದ ವಿಶೇಷ ಪರಿಣಾಮಗಳು ನಂಬಲಾಗದಷ್ಟು ಅಗ್ಗವಾಗಿದೆ ಮತ್ತು ನಗು ತರಿಸುತ್ತವೆ. ಸ್ಟೆಲ್ವಿಯೊ ಸಿಪ್ರಿಯಾನಿಯವರ ಸಂಗೀತವು ಗಮನಾರ್ಹವಾಗಿ ಸುಂದರವಾಗಿದ್ದರೂ (ನಿಜಕ್ಕೂ ಇದು ತುಂಬಾ ಒಳ್ಳೆಯದು, ಅದು ಏಕಾಂಗಿಯಾಗಿ ಹೊಂದಲು ಯೋಗ್ಯವಾಗಿದೆ ಎಂದು ತೋರುತ್ತದೆ), ಒಟ್ಟಾರೆಯಾಗಿ ಈ ಚಿತ್ರವು ಅಗ್ಗದ ಬಿ-ಫಿಲ್ಮ್ ಮಾತ್ರವಲ್ಲದೆ 1970 ರ ಇಟಾಲಿಯನ್-ಭಯಾನಕ- ಚಲನಚಿತ್ರ ಪ್ರೇಮಿಗಳು.#0
ಚಲನಚಿತ್ರವು ಅಷ್ಟು ಉತ್ತಮವಾಗಿಲ್ಲ. ಪುಸ್ತಕ ಉತ್ತಮವಾಗಿದೆ. ಆದರೆ ಚಲನಚಿತ್ರವು ಅಷ್ಟೊಂದು ಕೆಟ್ಟದ್ದಲ್ಲ. ಕನಿಷ್ಠ ಹೇಳುವುದು ಆಸಕ್ತಿದಾಯಕವಾಗಿತ್ತು. ಕಥಾವಸ್ತುವಿನಲ್ಲಿ ನನ್ನನ್ನು ನೋಡುವುದಕ್ಕೆ ಸಾಕಷ್ಟು ಸಸ್ಪೆನ್ಸ್ ಇತ್ತು, ಆದರೂ ನಾನು ಚಲನಚಿತ್ರದ ಬಗ್ಗೆ ನಿಜವಾಗಿಯೂ ಆಸಕ್ತಿ ಹೊಂದಿದ್ದೇನೆ ಎಂದು ಹೇಳುವುದಿಲ್ಲ. ಜನೈನ್ ಟರ್ನರ್ ಮತ್ತು ಆಂಟೋನಿಯೊ ಸಬಾಟೊ ಜೂನಿಯರ್ ಇಬ್ಬರೂ ನಿಮ್ಮನ್ನು ಗಮನದಲ್ಲಿಟ್ಟುಕೊಳ್ಳುವಷ್ಟು ಸೌಂದರ್ಯವನ್ನು ಹೊಂದಿದ್ದಾರೆ :) ಅವರು ಕೆಲವು ಮುದ್ದಾದ ದೃಶ್ಯಗಳನ್ನು ಹೊಂದಿದ್ದು ಅದು ಪ್ರಣಯವನ್ನು ಆಕರ್ಷಿಸುತ್ತದೆ. ಒಟ್ಟಾರೆಯಾಗಿ ನಾನು ಚಲನಚಿತ್ರಕ್ಕೆ 7 ಅಥವಾ 8 ಅನ್ನು ನೀಡುತ್ತೇನೆ. ಅದು ಕೆಟ್ಟದ್ದಲ್ಲ, ಕಥಾವಸ್ತುವಿನ ಬುದ್ಧಿವಂತಿಕೆಯ ಕೊರತೆಯಿದೆ.#1
ಜೋಡಿ ಫೋಸ್ಟರ್, ಚೆರಿ ಕ್ಯೂರಿ (ಅವರ ಗಮನಾರ್ಹವಾದ ನಟನಾ ಚೊಚ್ಚಲ ಪ್ರದರ್ಶನದಲ್ಲಿ ರನ್‌ವೇಸ್‌ನ ಸೆಮಿನಲ್ ಆಲ್-ಗರ್ಲ್ ರಾಕ್ ಗುಂಪಿನ ಮಾಜಿ ಪ್ರಮುಖ ಗಾಯಕ), ಮರ್ಲಿನ್ ಕಗನ್ ಮತ್ತು ಕ್ಯಾಂಡಿಸ್ ಸ್ಟ್ರೋಹ್ ಏಕರೂಪವಾಗಿ ನಂಬಲರ್ಹರು, ಭವ್ಯವಾದವರು ಮತ್ತು ಶೀರ್ಷಿಕೆ ಕ್ವಾರ್ಟೆಟ್‌ನಂತೆ ಸ್ಪರ್ಶಿಸುತ್ತಿದ್ದಾರೆ, ಅವರು ಬಿಗಿಯಾದವರು ಕ್ಯಾಲಿಫೋರ್ನಿಯಾದ ಉಪನಗರಗಳ ಶ್ರೀಮಂತ ಸ್ಯಾನ್ ಫರ್ನಾಂಡೊ ಕಣಿವೆಯಲ್ಲಿ ತಮ್ಮನ್ನು ತಾವು ಬೆಳೆಸಿಕೊಳ್ಳಲು ಮತ್ತು ತಮ್ಮನ್ನು ತಾವು ರಕ್ಷಿಸಿಕೊಳ್ಳಲು ತಮ್ಮ ಅತ್ಯುತ್ತಮ ಪ್ರಯತ್ನವನ್ನು ಮಾಡುವ ನಿರ್ಲಕ್ಷ್ಯ, ಕಾಳಜಿಯಿಲ್ಲದ, ಸ್ವಯಂ-ಹೀರಿಕೊಳ್ಳುವ ಪೋಷಕರೊಂದಿಗೆ ತೊಂದರೆಗೀಡಾದ, ಉಗ್ರ ನಿಷ್ಠಾವಂತ ಹದಿಹರೆಯದ ಹುಡುಗಿಯರ ಗುಂಪು. ಹೇಳಲಾದ ನಿರ್ಧಾರಗಳ ಹಾನಿಕಾರಕ ಪರಿಣಾಮಗಳನ್ನು ಸಂಪೂರ್ಣವಾಗಿ ಹೊಂದಲು ಸಂಪೂರ್ಣವಾಗಿ ಸಿದ್ಧವಾಗಿಲ್ಲದಿದ್ದಾಗ, ಮೃದುವಾದ ಚಿಕ್ಕ ವಯಸ್ಸಿನಲ್ಲಿಯೇ ಹುಡುಗಿಯರು ಲೈಂಗಿಕತೆ, ಮಾದಕ ವಸ್ತುಗಳು, ಆಲ್ಕೊಹಾಲ್, ಬದ್ಧತೆ ಮತ್ತು ಇನ್ನಿತರ ಬಗ್ಗೆ ಗಂಭೀರ ನಿರ್ಧಾರಗಳನ್ನು ತೆಗೆದುಕೊಳ್ಳುವಂತೆ ಒತ್ತಾಯಿಸಲಾಗುತ್ತದೆ. ಫಾಸ್ಟರ್, ಇಲ್ಲಿಯವರೆಗೆ ತನ್ನ ಅತ್ಯಂತ ಗ್ರಹಿಸುವ, ಪರಿಣಾಮ ಬೀರುವ ಮತ್ತು ಅಂಡರ್ರೇಟೆಡ್ ಪ್ರದರ್ಶನಗಳನ್ನು ನೀಡುತ್ತಾಳೆ, ಮೂಲತಃ ಗುಂಪಿನ ಡೆನ್ ತಾಯಿ ತನ್ನ ಮತ್ತು ಇತರರ ಯೋಗಕ್ಷೇಮದ ಅಧ್ಯಕ್ಷತೆಯನ್ನು ವಹಿಸುತ್ತಾಳೆ; ಅವಳು ವಿಶೇಷವಾಗಿ ಒಳ್ಳೆಯ ಹೃದಯದ, ಆದರೆ ಅಜಾಗರೂಕ ಮತ್ತು ಸ್ವಯಂ-ವಿನಾಶಕಾರಿ ಕ್ಯೂರಿಯ ಬಗ್ಗೆ ಕಾಳಜಿ ವಹಿಸುತ್ತಾಳೆ, ಅವರ ಅಸಡ್ಡೆ ಹೆಡೋನಿಸ್ಟಿಕ್ ಜೀವನಶೈಲಿಯು ಅವಳನ್ನು ಅಕಾಲಿಕ ಅಂತ್ಯವನ್ನು ಪೂರೈಸುವ ಸಾಧ್ಯತೆಯಿದೆ. <br /> <br /> ಈ ಚಿತ್ರವು ಕಟುವಾದ, ಒಳನೋಟವುಳ್ಳ, ಆಗಾಗ್ಗೆ ವಿನಾಶಕಾರಿಯಾದ ವಿಶ್ವಾಸಾರ್ಹ ಮತ್ತು ಉಪನಗರಗಳ ಅಂದವಾಗಿ ಅಂದಗೊಳಿಸಿದ ಮೇಲ್ಮೈ ಮತ್ತು ನೇರವಾಗಿ ಅಂತಹ ಕುಟುಂಬಗಳ ದುರಂತ ನಿವ್ವಳ ಫಲಿತಾಂಶದ ಕೆಳಗೆ ಇರುವ ಮುರಿದ, ನಿಷ್ಕ್ರಿಯ ಕುಟುಂಬಗಳ ಪರೀಕ್ಷೆಯನ್ನು ಸಂಪೂರ್ಣವಾಗಿ ಹೀರಿಕೊಳ್ಳುವುದು: ಕಠಿಣ, ಸ್ಥಿತಿಸ್ಥಾಪಕ, ಆದರೆ ಅತೃಪ್ತಿ ಮತ್ತು ದುರ್ಬಲ ಮಕ್ಕಳು ತಮ್ಮದೇ ಆದ ಮೇಲೆ ಬೆಳೆಯುವ ಪ್ರಯೋಗಗಳು ಮತ್ತು ತೊಂದರೆಗಳನ್ನು ಎದುರಿಸಬೇಕಾಗುತ್ತದೆ ಪೋಷಕರು ತುಂಬಾ ವಿವೇಚನೆಯಿಲ್ಲದವರು ಅಥವಾ ಅಸ್ತಿತ್ವದಲ್ಲಿಲ್ಲ. ಆಡ್ರಿಯನ್ ("ಮಾರಕ ಆಕರ್ಷಣೆ," "ಜಾಕೋಬ್ಸ್ ಲ್ಯಾಡರ್") ಜೆರಾಲ್ಡ್ ಐರೆಸ್ ಅವರ ಸ್ಕ್ರಿಪ್ಟ್ ಸ್ವಲ್ಪ ಗೊಂದಲಮಯವಾಗಿದೆ ಮತ್ತು ಗಲಾಟೆ ಮಾಡುತ್ತಿರುವಾಗ ಲೈನ್ ನಿರ್ದೇಶನವು ಗಟ್ಟಿಮುಟ್ಟಾದ ಮತ್ತು ಗಮನಿಸಬಲ್ಲದು, ಆದರೆ ಒಟ್ಟಾರೆಯಾಗಿ ಅದರ ಸರಾಸರಿ, ಸಮಗ್ರ, ನಿಮ್ಮ ಸರಾಸರಿ ಲಾಚ್ಕಿ ಮಗುವಿನ ನರ-ವಿಪರೀತ ಚಿತ್ರಣದಲ್ಲಿ ನಿಖರವಾಗಿದೆ ಅಸ್ತವ್ಯಸ್ತವಾಗಿರುವ, ವಿಚಿತ್ರವಾದ ಮತ್ತು ಅನಿರೀಕ್ಷಿತ ದೈನಂದಿನ ಜೀವನ. ಲಿಯಾನ್ ಬಿಜೌ ಅವರ ಮೃದುವಾದ, ಇಬ್ಬನಿ, ಬಹುತೇಕ ಗ್ರಾಮೀಣ mat ಾಯಾಗ್ರಹಣವು ಶಾಂತ ಮತ್ತು ಮುಗ್ಧತೆಯ ಸೂಕ್ಷ್ಮ ಮತ್ತು ಸುಲಭವಾಗಿ ಮುರಿಯಬಲ್ಲ ಪ್ರಜ್ಞೆಯನ್ನು ಸರಿಯಾಗಿ ಸೂಚಿಸುತ್ತದೆ. ಜಾರ್ಜಿಯೊ ಮೊರೊಡರ್ ಅತ್ಯುತ್ತಮ ಸ್ಕೋರ್ ಅನ್ನು ವ್ಯವಸ್ಥೆಗೊಳಿಸಿದರು, ಇದು ಡೊನ್ನಾ ಸಮ್ಮರ್‌ನ ಸೊಗಸಾದ "ರೇಡಿಯೊದಲ್ಲಿ" ವಿಶೇಷವಾಗಿ ಪರಿಣಾಮಕಾರಿಯಾಗಿ ಬಳಸುತ್ತದೆ. ಫಾಸ್ಟರ್‌ನ ನರರೋಗ, ಅಸುರಕ್ಷಿತ, ಉತ್ಸಾಹಭರಿತ ತಾಯಿ, ಸ್ಕಾಟ್ ಬಯೋ ಸಿಹಿ ಸ್ಕೇಟ್‌ಬೋರ್ಡರ್ ಸೊಗಸುಗಾರನಾಗಿ, ಕಗನ್‌ನ ಶ್ರೀಮಂತ ಹಳೆಯ ಗೆಳೆಯನಾಗಿ ರ್ಯಾಂಡಿ ಕ್ವಾಯ್ಡ್, ಬ್ರಿಟಿಷ್ 60 ರ ಪಾಪ್ ಗಾಯಕ ಆಡಮ್ ಫೇಯ್ತ್ ಫೋಸ್ಟರ್‌ನ ನಿಷ್ಕಳಂಕ, ಗೈರುಹಾಜರಿ ರಾಕ್ ಪ್ರವರ್ತಕ ತಂದೆಯಾಗಿ ಮತ್ತು ಲೋಯಿಸ್ ಕಗನ್ ನ ಧೂಮಪಾನ, ಅತಿಯಾದ ರಕ್ಷಣಾತ್ಮಕ ತಾಯಿಯಾಗಿ ಸ್ಮಿತ್. ಸಂಕ್ಷಿಪ್ತ ಬಿಟ್‌ಗಳಲ್ಲಿ ಕಾಣಿಸಿಕೊಳ್ಳುವುದು ರಾಬರ್ಟ್ ರೊಮಾನಸ್ (ಮೈಕ್ ಡಾಮೊನ್ "ಫಾಸ್ಟ್ ಟೈಮ್ಸ್ ಅಟ್ ರಿಚ್ಮಾಂಟ್ ಹೈ") ಫೋಸ್ಟರ್‌ನ ಕೆಟ್ಟ ಮಾಜಿ ಗೆಳೆಯರಲ್ಲಿ ಒಬ್ಬನಾಗಿ ಮತ್ತು ಅಸಹ್ಯಕರವಾದ ಪಾರ್ಟಿ ಕ್ರ್ಯಾಶರ್‌ನಂತೆ ಲಾರಾ ಡರ್ನ್ ಎಂಬ ಧೈರ್ಯಶಾಲಿ, ಕಟ್ಟುಪಟ್ಟಿಗಳನ್ನು ಧರಿಸಿದವನು. ಆಶ್ಚರ್ಯಕರವಾಗಿ ಅಧಿಕೃತ, ಮುಳುಗಿಸುವ ಮತ್ತು ಆಳವಾಗಿ ಚಲಿಸುವ (ಕ್ಯೂರಿಯ ಕಠೋರ ಅಂತಿಮ ಭವಿಷ್ಯವು ತುಂಬಾ ಹೃದಯ ಮುರಿಯುವಂತಿದೆ), "ನರಿಗಳು" ಕೇವಲ 80 ರ ದಶಕದ ಹದಿಹರೆಯದ ಬಗ್ಗೆ ಮಾಡಿದ ಅತ್ಯಂತ ಜನಪ್ರಿಯವಲ್ಲದ ಮತ್ತು ಮೆಚ್ಚುಗೆ ಪಡೆದ ಹದಿಹರೆಯದ ಚಲನಚಿತ್ರಗಳಲ್ಲಿ ಒಂದಾಗಿದೆ.#1
ಹುಡುಗಿಯರನ್ನು ಮೋಹಿಸಲು ತನ್ನ ಹೊಸ ವ್ಯಾನ್‌ಗೆ ಹುಡುಗಿಯರನ್ನು ಆಮಿಷವೊಡ್ಡಲು ಪ್ರಯತ್ನಿಸುವ ಒಬ್ಬ ವ್ಯಕ್ತಿಯ ಬಗ್ಗೆ ದಿ ವ್ಯಾನ್ ಒಂದು ಭಾವನಾತ್ಮಕ ಚಿತ್ರವಾಗಿದೆ. ಈ ಚಲನಚಿತ್ರವು ವಿಫಲಗೊಳ್ಳದ ಏಕೈಕ ವಿಷಯವೆಂದರೆ 70 ರ ದಶಕದ ಉತ್ತರಾರ್ಧದಲ್ಲಿ ಯುಎಸ್ನಲ್ಲಿ ವ್ಯಾನ್ ಒಲವನ್ನು ನಿಖರವಾಗಿ ಚಿತ್ರಿಸುವುದು. ಇದು ಸಂಪೂರ್ಣವಾಗಿ ಹವ್ಯಾಸಿಗಳಿಂದ ಮಾಡಲ್ಪಟ್ಟಿದೆ ಎಂದು ತೋರುತ್ತಿದೆ. ಇದು ಕಸ, ಆದರೆ ನಾನು ಅದನ್ನು ಇಷ್ಟಪಟ್ಟೆ! ನಾನು 70 ರ ಕಸದ ಅಭಿಮಾನಿ ಎಂದು ಒಪ್ಪಿಕೊಳ್ಳಬೇಕು! ಇದು ಐಎಮ್‌ಡಿಬಿ ಕೆಳಗಿನ 100 ಕ್ಕೆ ತಲುಪುತ್ತದೆ ಎಂದು ಭಾವಿಸುತ್ತೇವೆ! <br /> <br /> 2#0
ಸ್ಟೀಫನ್ ರಿಡೌ ಈಗಾಗಲೇ "ವೈಲ್ಡ್ ರೀಡ್ಸ್" ನಲ್ಲಿನ ಟೂರ್ ಡಿ ಫೋರ್ಸ್ಗಾಗಿ ಸ್ಟಾರ್ ಆಗಿದ್ದರು ಮತ್ತು ಅವರು ಫ್ರಾನ್ಸ್ನ ಅತಿದೊಡ್ಡ ಇಂಡೀ ತಾರೆಗಳಲ್ಲಿ ಒಬ್ಬರು. ಈ ಚಿತ್ರದಲ್ಲಿ, ಅವರು ಸೆಡ್ರಿಕ್ ಎಂಬ ಸ್ಥಳೀಯ ಹುಡುಗನ ಪಾತ್ರವನ್ನು ನಿರ್ವಹಿಸುತ್ತಾರೆ, ಅವರು ಬೀಚ್‌ನಲ್ಲಿ ವಿಹಾರಕ್ಕೆ ಬರುವ ಮ್ಯಾಥ್ಯೂ (ಹೊಸಬ ಜೇಮೀ ಎಲ್ಕೈಮ್, ಬೆರಗುಗೊಳಿಸುತ್ತದೆ, ಸೂಕ್ಷ್ಮವಾದ, ಅಲೌಕಿಕ ಪ್ರದರ್ಶನದಲ್ಲಿ) ಭೇಟಿಯಾಗುತ್ತಾರೆ. ಮ್ಯಾಥ್ಯೂ ತನ್ನ ಅನಾರೋಗ್ಯದ ತಾಯಿಯೊಂದಿಗೆ ಸಂಕೀರ್ಣ ಸಂಬಂಧವನ್ನು ಹೊಂದಿದ್ದಾಳೆ, ಚಿಕ್ಕಮ್ಮ ಮತ್ತು ಸಹೋದರಿಯನ್ನು ಒತ್ತಾಯಿಸುತ್ತಾನೆ (ಅವರೊಂದಿಗೆ ಸ್ಪರ್ಧಾತ್ಮಕ ಸಂಬಂಧವನ್ನು ಹೊಂದಿದ್ದಾನೆ). ಶೀಘ್ರದಲ್ಲೇ, ಇಬ್ಬರೂ ಪ್ರೀತಿಯಲ್ಲಿ ಬೀಳುತ್ತಾರೆ. <br /> <br /> ಚಿತ್ರದ ಮುರಿತದ ನಿರೂಪಣೆ - ಇದು ಸುದೀರ್ಘವಾದ ಫ್ಲ್ಯಾಷ್-ಬ್ಯಾಕ್ಸ್, ಬಿಟ್‌ಗಳು ಮತ್ತು ವರ್ತಮಾನದ ತುಣುಕುಗಳನ್ನು ಒಳಗೊಂಡಿರುತ್ತದೆ ಮತ್ತು ಭವಿಷ್ಯದಲ್ಲಿ ನೈಜ-ಸಮಯದ ಫಾರ್ವರ್ಡ್-ಚಲನೆಯನ್ನು ಒಳಗೊಂಡಿರುತ್ತದೆ - - ಸ್ವಲ್ಪ ಬೆದರಿಸುವುದು. ನಿರ್ದೇಶಕ ಸೆಬಾಸ್ಟಿಯನ್ ಲಿಫ್ಶಿಟ್ಜ್ ನಾವು ಯಾವ ಸಮಯದ ಅವಧಿಯಲ್ಲಿದ್ದೇವೆ ಎಂಬುದನ್ನು ಸೂಚಿಸುವುದಿಲ್ಲ, ಮತ್ತು ಕಥೆಯ ರೇಖೆಯನ್ನು ಅನುಸರಿಸಲು ಕಷ್ಟವಾಗುತ್ತದೆ. ಆದರೆ ಅದನ್ನು ಹೊರತೆಗೆಯಿರಿ: ಚಿತ್ರದ ಅಂತಿಮ 45 ನಿಮಿಷಗಳು ತುಂಬಾ ಮುಳುಗಿದ್ದು, ನಿಮ್ಮ ಕಣ್ಣುಗಳನ್ನು ಪರದೆಯಿಂದ ತೆಗೆಯಲು ನಿಮಗೆ ಸಾಧ್ಯವಾಗುವುದಿಲ್ಲ. ಹೃದಯ ಮುರಿಯುವ ಮತ್ತು ಉನ್ನತಿಗೇರಿಸುವ ಮೂಲಕ, ಈ ಚಿತ್ರವು "ಬ್ಯೂಟಿಫುಲ್ ಥಿಂಗ್" ನೊಂದಿಗೆ ಸಿನೆಮಾ ನೋಡಲೇಬೇಕು.#1
ಮನೋವಿಕೃತ ಅಶ್ಲೀಲ ಬಾಬ್ಬಿ ಒಬ್ಬ ಪ್ರಮುಖ ವೈದ್ಯರ (ಮೈಕೆಲ್ ಕೇನ್) ರೋಗಿಯನ್ನು (ಎಂಜಿ ಡಿಕಿನ್ಸನ್) ಕೊಲೆ ಮಾಡುತ್ತಾನೆ ಮತ್ತು ನಂತರ ಹೆಚ್ಚಿನ ಬೆಲೆಯ ವೇಶ್ಯೆಯನ್ನು (ನ್ಯಾನ್ಸಿ ಅಲೆನ್) ಹಿಂಬಾಲಿಸುತ್ತಾನೆ, ಅವರು ಲಿಫ್ಟ್‌ನಲ್ಲಿ ಬಾಬ್ಬಿಯ ದರ್ಶನ ಪಡೆದರು. ಲಿಜ್ (ಅಲೆನ್) ಅಪರಾಧದ ಅನುಮಾನಕ್ಕೆ ಒಳಗಾಗುತ್ತಾನೆ ಮತ್ತು ಕೊಲೆಗಾರನನ್ನು ಹಿಡಿಯಲು ರೋಗಿಯ ಮಗ (ಕೀತ್ ಗಾರ್ಡನ್) ಜೊತೆಗೂಡುತ್ತಾನೆ. <br /> <br /> ಇದನ್ನು ಒಂದೆರಡು ಪದಗಳಲ್ಲಿ ಸಂಕ್ಷೇಪಿಸಬಹುದು: ಇದು ತುಂಬಾ ಮಾದಕವಾಗಿದೆ (ಡಿಕಿನ್ಸನ್ ಮತ್ತು ಅಲೆನ್ ಉತ್ತಮವಾಗಿ ಕಾಣುತ್ತಾರೆ), ಇದು ತುಂಬಾ ರಕ್ತಸಿಕ್ತವಾಗಿದೆ - ಸಾಮಾನ್ಯವಾಗಿ ಸ್ಪ್ಲಾಟರ್ ಸಿನೆಮಾಗಳಿಗೆ ಮೀಸಲಾಗಿರುವ ಗೋರ್‌ನೊಂದಿಗೆ, ಮತ್ತು ಹುಡುಗ ಅದನ್ನು ಚೆನ್ನಾಗಿ ಹೆಣೆದಿದ್ದಾನೆ. ಬರಹಗಾರ / ನಿರ್ದೇಶಕ ಡಿ ಪಾಲ್ಮಾ ಅವರ ಚಿತ್ರಕಥೆಯು ಸರಿಯಾಗಿದೆ ಆದರೆ ಇದು ನಿಜವಾಗಿಯೂ ಮನುಷ್ಯನ ಚಲನಚಿತ್ರ ನಿರ್ಮಾಣ ಸಾಮರ್ಥ್ಯಗಳಿಗೆ ಹಿಂಬದಿಯ ಆಸನವನ್ನು ತೆಗೆದುಕೊಳ್ಳುತ್ತದೆ. ಇದು ಒಳಾಂಗಗಳ ಮಟ್ಟದಲ್ಲಿ ಹೆಚ್ಚು ಯಶಸ್ವಿಯಾಗಿದೆ ಮತ್ತು ನಾನು ಈ ಪಾತ್ರಗಳೊಂದಿಗೆ ತೊಡಗಿಸಿಕೊಳ್ಳುತ್ತೇನೆ / ಆಸಕ್ತಿ ಹೊಂದಿದ್ದೇನೆ. ಹಿಚ್ಕಾಕ್ನ / ರಿಫೊಫ್ಗಳಿಗೆ ಸ್ಟ್ಯಾಂಡರ್ಡ್ ಡಿ ಪಾಲ್ಮಾ ಗೌರವಾರ್ಪಣೆಯನ್ನು ನಾನು ಗಮನಿಸಬಹುದು - ಕನಿಷ್ಠ ಮಾಸ್ಟರ್ಸ್ ಚಿತ್ರಗಳಿಂದ. <br /> <br /> ಮತ್ತು ಅದನ್ನೆಲ್ಲ ಮೇಲಕ್ಕೆತ್ತಲು, ಇದು ವೃತ್ತಿಪರ ಮತ್ತು ನಂಬಲರ್ಹವಾದ ಪಾತ್ರವನ್ನು ಹೊಂದಿದೆ. <br /> <br /> ಇದು ಮಾಜಿ ಪತ್ನಿ ನ್ಯಾನ್ಸಿ ಅಲೆನ್ ("ಕ್ಯಾರಿ" ಮತ್ತು "ಹೋಮ್ ಮೂವೀಸ್" ನಂತರ) ಡಿ ಪಾಲ್ಮಾ ಅವರ ಮೂರನೆಯ ಚಲನಚಿತ್ರವಾಗಿದೆ. <br /> <br /> ಅಂದಹಾಗೆ, ನರ್ತಕಿ-ತಿರುಗಿ-ನಟಿ ರಾಚೆಲ್ ಟಿಕೋಟಿನ್ ಒಬ್ಬರು ಉತ್ಪಾದನಾ ಸಹಾಯಕರು. ನಿಮಗಾಗಿ ಸ್ವಲ್ಪ ಕ್ಷುಲ್ಲಕತೆಯಿದೆ. <br /> <br /> ಥ್ರಿಲ್ಲರ್ ಒಂದೇ ಸಮಯದಲ್ಲಿ ಕ್ಲಾಸಿ ಮತ್ತು ರಕ್ತಸಿಕ್ತವಾಗಬಹುದು ಎಂದು ನಾನು ಭಾವಿಸುವುದಿಲ್ಲ ಆದರೆ ಈ ಚಿತ್ರವು ಅದನ್ನು ಎಳೆಯುತ್ತದೆ. <br /> <br /> ಅದರ ಬಗ್ಗೆ ಉತ್ತಮವಾದ ಸಂಗತಿಗಳು ಸಾಮಾನ್ಯವಾಗಿ ಹೊಡೆಯುವ ಪಿನೋ ಡೊನಾಜಿಯೊ ಸಂಗೀತ ಸ್ಕೋರ್ ಆಗಿದೆ. <br /> <br /> 8/10#1
