ಬಿಡುಗಡೆಯ ದಿನಾಂಕಗಳನ್ನು ನಿಗದಿಪಡಿಸಿದ ಬಹಳಷ್ಟು ಚಲನಚಿತ್ರಗಳಿವೆ, ಕೆಲವು ರೀತಿಯ ಕಾನೂನುಬದ್ಧ ಸ್ನಾಫುವಿನ ಕಾರಣದಿಂದಾಗಿ ವಿತರಣೆಯಿಂದ ಎಳೆಯಲು, ತದನಂತರ ದೀರ್ಘಕಾಲದವರೆಗೆ ಅದನ್ನು ನಿವಾರಿಸಲಾಗಿದೆ. "ಸ್ಲಾಕರ್ಸ್" ಕೋಮಾದಲ್ಲಿಯೇ ಉಳಿದುಕೊಂಡಿರುವಂತೆ ಕೊಳೆತ ಚಿತ್ರವೊಂದನ್ನು ಮಾತ್ರ ನೀವು ಬಯಸಬಹುದು, ಅದು ಅತ್ಯಲ್ಪವಾಗಿದೆ. ಈ ನಿಜವಾದ ಭೀಕರವಾದ ಚಲನಚಿತ್ರಕ್ಕಾಗಿ ಬಿಡುಗಡೆಯ ದಿನಾಂಕಗಳನ್ನು ನಿರಂತರವಾಗಿ ಸ್ಥಳಾಂತರಿಸಲಾಗುತ್ತಿತ್ತು, ಅದು ರಾಡಾರ್‌ಗೆ ಅರ್ಹವಾದಂತೆ ನಿದ್ರೆ ಮಾಡುತ್ತದೆ. ಕ್ಯಾಂಪಸ್ ಬಾಂಬ್ ಶೆಲ್ ಏಂಜೆಲಾಕ್ಕೆ ಭಯಾನಕ ಗೀಳನ್ನು ಹೊಂದಿರುವ ತೆವಳುವ ದಡ್ಡತನದ ಎಥಾನ್ ಎಂಬ ಸೋಗಿನಲ್ಲಿ ಪ್ರಮೇಯ ಪ್ರಾರಂಭವಾಗುತ್ತದೆ. ಏಂಜೆಲಾವನ್ನು ಗೆಲ್ಲಲು ಸಹಾಯ ಮಾಡಲು ಬ್ಲ್ಯಾಕ್‌ಮೇಲ್‌ನೊಂದಿಗೆ ಶಾಲೆಯನ್ನು ಹಗರಣ ಮಾಡುತ್ತಿರುವ ಡೇವಿಡ್ ಮತ್ತು ಅವನ ಸ್ನೇಹಿತರ ಸಹಾಯವನ್ನು ಎಥಾನ್ ದೆವ್ವದಿಂದ ದಾಖಲಿಸುತ್ತಾನೆ. ಸ್ಪಾಯ್ಲರ್ಗಳನ್ನು ನೀಡಲು ನಾನು ಇಷ್ಟಪಡುವುದಿಲ್ಲ, ಆದರೆ ಈ ರೀತಿಯ ಲದ್ದಿಗಾಗಿ ನಾನು ವಿನಾಯಿತಿ ನೀಡಬಲ್ಲೆ. ಏಂಜೆಲಾ ಡೇವಿಡ್ಗೆ ಬೀಳುತ್ತಾನೆ, ಎಥಾನ್ ಉದ್ದೇಶಪೂರ್ವಕವಾಗಿ ಎಲ್ಲವನ್ನೂ ತಿರುಗಿಸುತ್ತಾನೆ, ಒಳ್ಳೆಯ ವ್ಯಕ್ತಿಗಳು ಗೆಲ್ಲುತ್ತಾರೆ. ಸಂಕ್ಷಿಪ್ತವಾಗಿ ಹೇಳುವುದಾದರೆ, ಹದಿಹರೆಯದ ಒಟ್ಟು out ಟ್ ಪ್ರಕಾರದ ಮತ್ತೊಂದು ದಣಿದ ಮರುಹಂಚಿಕೆ. ಒಟ್ಟು ಹಾಸ್ಯವು ತಮಾಷೆಯಾಗಿದೆ, ಇದು ಯಾವಾಗಲೂ ಅಮರ ಕ್ಲಾಸಿಕ್ "ಅನಿಮಲ್ ಹೌಸ್" ನ ಕಾಲದಿಂದಲೂ, "ದೇರ್ ಸಮ್ಥಿಂಗ್ ಎಬೌಟ್ ಮೇರಿ" ಮತ್ತು "ರೋಡ್ ಟ್ರಿಪ್" ನಂತಹ ಸಮಕಾಲೀನರಂತಹ ಡಜನ್ಗಟ್ಟಲೆ ಇತರರ ನಡುವೆ ಇದೆ. ಪ್ರಸ್ತಾಪಿಸಲು. ಆದರೆ ನೀವು ಅದನ್ನು ಕಥಾವಸ್ತುವಾಗಿ ಬಳಸಿದಾಗ ನೀವು ಇಲ್ಲಿಯವರೆಗೆ ಮಾತ್ರ ಪಡೆಯಬಹುದು, ಒಂದು ವೇಳೆ, ಎಥಾನ್ ಏಂಜೆಲಾ ಗೊಂಬೆಯನ್ನು ಹೊಂದಿದ್ದು, ಅವಳ ಕೂದಲಿನ ಪ್ರತ್ಯೇಕ ಎಳೆಗಳಿಂದ ಕೂಡಿದೆ, ಅದರಲ್ಲಿ ದೇವರಿಗೆ ಏನು ಗೊತ್ತು. ಸ್ವತಃ ಹಾಡುವಾಗ ಎಥಾನ್ ಶವರ್‌ನಲ್ಲಿ ಮೂತ್ರ ವಿಸರ್ಜಿಸುವುದನ್ನು ವೀಕ್ಷಿಸಲು ಯಾರೂ ಸಾಕ್ಷಿಯನ್ನು ತೆಗೆದುಕೊಳ್ಳಲು ಬಯಸುವುದಿಲ್ಲ. ಯುವಕನು ತನ್ನ ಶಿಶ್ನದ ಮೇಲೆ ಕಾಲ್ಚೀಲದೊಂದಿಗೆ "ಅವಳು ಪರ್ವತದ ಸುತ್ತಲೂ ಬರುತ್ತಾಳೆ" ಎಂದು ಹಾಡಲು ಯಾರೂ ಬಯಸುವುದಿಲ್ಲ. ಆದರೆ 50 ರ ಬಾಂಬ್ ಶೆಲ್ ಮಾಮಿ ವ್ಯಾನ್ ಡೋರೆನ್ ತನ್ನ ಸ್ತನಗಳನ್ನು 71 ವರ್ಷ ವಯಸ್ಸಿನಲ್ಲಿ ನೋಡಿದ ಸಂಪೂರ್ಣ ದೃಶ್ಯ ಆಕ್ರಮಣಕ್ಕೆ ಏನೂ ನಿಮ್ಮನ್ನು ಸಿದ್ಧಪಡಿಸುವುದಿಲ್ಲ. ಇದು ಕಥೆಯ ಸುಸಂಬದ್ಧತೆಯ ಕೊರತೆಯೇ ಎಂದು ನನಗೆ ಗೊತ್ತಿಲ್ಲ, ಅದು ಯಾವುದೇ ಅರ್ಥವಿಲ್ಲದ ದೃಶ್ಯಗಳಿಗೆ ಕತ್ತರಿಸುತ್ತದೆ. ನಿರ್ದೇಶಕ ಡೀವಿ ನಿಕ್ಸ್ ಮಾಜಿ ಫ್ಯಾಷನ್ ographer ಾಯಾಗ್ರಾಹಕರಾಗಿದ್ದರು, ಮತ್ತು ಈ ಚಿತ್ರವನ್ನು ಪರಿಶೀಲಿಸಿದ ನಂತರ, ಅವರು ಮತ್ತೆ ವೃತ್ತಿಗೆ ಹೋಗಬೇಕೆಂದು ನೀವು ಬಯಸಬಹುದು. ಯಾವುದೇ ಚಲನಚಿತ್ರದಲ್ಲಿ ನೀವು ಮಾಡಬಹುದಾದ ಕೆಟ್ಟ ಕೆಲಸವೆಂದರೆ, ನೀವು ಮೋಜು ಮಾಡುತ್ತಿರುವಂತೆ ಕಾಣುವಂತೆ ಮಾಡುವುದು, ಏಕೆಂದರೆ "ಸ್ಲಾಕರ್ಸ್" ಮಾಡುವಂತೆಯೇ ನಿಮ್ಮ ಉದ್ದೇಶಗಳಿಂದ ನೀವು ದೂರವಿರುತ್ತೀರಿ, ಇದರ ಕಥಾವಸ್ತುವಿನ ರೂಪರೇಖೆಯನ್ನು ಒಟ್ಟು g ಟ್ ತಮಾಷೆಗಳ ರಾಶಿಯಡಿಯಲ್ಲಿ ಹೂತುಹಾಕುವುದರ ಮೂಲಕ, ಅರ್ಥಹೀನ ವಿಗ್ನೆಟ್‌ಗಳು ಮತ್ತು ನಿರ್ಮಾಣದ ಕೊರತೆ. ಇದು ಕಾಲೇಜು ವಿದ್ಯಾರ್ಥಿಗಳ ಗುಂಪೊಂದು ಕುಡಿದು, ಒಬ್ಬರ ಕ್ಯಾಮ್‌ಕಾರ್ಡರ್ ತೆಗೆದುಕೊಂಡು, ಯಾದೃಚ್ cra ಿಕ ಲದ್ದಿಯ ಗುಂಪನ್ನು ಹೊಡೆದು ಒಟ್ಟಿಗೆ ಸಂಕಲಿಸಿದಂತಿದೆ. ಹದಿಹರೆಯದ ಒಟ್ಟಾರೆ ಹಾಸ್ಯವನ್ನು ನೀವು ನಿಜವಾಗಿಯೂ ನೋಡಲು ಬಯಸಿದರೆ, ನಾನು "ಅಮೇರಿಕನ್ ಪೈ" ಮತ್ತು "ಅನಿಮಲ್ ಹೌಸ್", ಅಥವಾ "ರೋಡ್ ಟ್ರಿಪ್" ಅನ್ನು ಸೂಚಿಸುತ್ತೇನೆ, ಇದು ಕೇವಲ ಮನರಂಜನೆಯ ಸಂಗತಿಯಾಗಿದೆ ಮತ್ತು "ಸ್ಲಾಕರ್ಸ್" ನಂತಹ ಕೆಟ್ಟದ್ದಲ್ಲ. ಕಾಕತಾಳೀಯವಾಗಿ ಕ್ಯಾಮರೂನ್ ಡಯಾಜ್ ಅವರು "ದಿ ಸ್ವೀಟೆಸ್ಟ್ ಥಿಂಗ್" ನಂತಹ ಮತ್ತೊಂದು ಕೆಟ್ಟ ಚಿತ್ರದಲ್ಲಿ ಮಾಡಿದಂತೆಯೇ, ಈ ಕಥೆಯು ಸಮಗ್ರ ಹಾಸ್ಯವನ್ನು ಮತ್ತೊಂದು ಕಥಾವಸ್ತುವಿನಂತೆ ಪರಿಗಣಿಸುತ್ತದೆ, ಈ ದುರಂತದಂತಹ ಸಾಧನದ ಬದಲು .. ನೀವು ಹಾದು ಹೋದರೆ " ಸ್ಲಾಕರ್‌ಗಳು "ನಿಮ್ಮ ಸ್ಥಳೀಯ ವೀಡಿಯೊ ಅಂಗಡಿಯಲ್ಲಿ, ನಡೆಯುತ್ತಲೇ ಇರಿ, ಮತ್ತು ಅದು ಅರ್ಹವಾದಂತೆ ಶೆಲ್ಫ್‌ನ ಕೆಳಭಾಗದಲ್ಲಿ ಕೊನೆಗೊಳ್ಳಲು ಬಿಡಿ.#0
ಈ ಚಿತ್ರ ನೋಡುವಾಗ ನನಗೆ ಈ ರೀತಿ ಅನಿಸಿತು. ನನಗೆ ಅದು ಬಹಳ ಇಷ್ಟವಾಯಿತು. ಇದು ಉಲ್ಲಾಸದಾಯಕವಾಗಿತ್ತು. ಆದರೆ ನಾನು ಯಾರೊಬ್ಬರ ಮನಸ್ಸಿನಲ್ಲಿ ಸ್ನೀಕಿ ನೋಟವನ್ನು ಪಡೆಯುತ್ತಿದ್ದೇನೆ ಮತ್ತು ಆಸಕ್ತಿದಾಯಕ ವಿಷಯವನ್ನು ಹೇಳಲು ಸುತ್ತಲೂ ತಿರುಚಿದಂತೆ ನಗುತ್ತಿದ್ದೇನೆ ಎಂದು ನಾನು ಭಾವಿಸಿದೆ. ಸ್ನೇಹಿತರೊಬ್ಬರು ಈ ರೀತಿ ಹೇಳುತ್ತಾರೆ: <br /> <br /> "ನಾವು ಯಾರೊಬ್ಬರ ಮನೆಗೆ ನುಗ್ಗಿ ಈಗ ಅವರ ಅರಿವಿಲ್ಲದೆ ಅವರ ಭೀಕರವಾದ ಮನೆಯ ವೀಡಿಯೊಗಳನ್ನು ನೋಡುತ್ತಿದ್ದೇವೆ ಎಂದು ನನಗೆ ಅನಿಸುತ್ತದೆ". <br /> <br /> ಆ ಸಂಗತಿಯ ಮತ್ತೊಂದು ಚಿತ್ರದ ಕಾದಂಬರಿ ತುಣುಕುಗಳಿಗಿಂತ ಅಪರಿಚಿತವಾಗಿದೆ. "ಗ್ರೂವಿನ್ ಗ್ಯಾರಿ", ಮೂಲ "ಬೀವರ್ ಕಿಡ್", ಒಂದು ಸಣ್ಣ ಪಟ್ಟಣ ವ್ಯಕ್ತಿ, ಅವರು ಚಲನಚಿತ್ರವನ್ನು ಪಡೆಯುವ ಭರವಸೆಯಿಂದ ಹತ್ತಿರದ ಟಿವಿ ಕೇಂದ್ರವೊಂದರಲ್ಲಿ ತಿರುಗುತ್ತಾರೆ - ಮತ್ತು ಅವನು ಆರಂಭದಲ್ಲಿ ನಿರೀಕ್ಷಿಸಿದಂತೆ ಖಂಡಿತವಾಗಿಯೂ ಅಲ್ಲ. ಖ್ಯಾತಿ ಮತ್ತು ಪ್ರಾಮುಖ್ಯತೆಯ ಹೆಚ್ಚಿನ ಭರವಸೆಯೊಂದಿಗೆ ಅವರು ಹ್ಯಾರಿಸ್ ಅವರನ್ನು ತಮ್ಮ town ರಿನಲ್ಲಿ ಆಯೋಜಿಸಿರುವ ನಿಜವಾದ ಭೀಕರವಾದ ಪ್ರತಿಭೆ ಅನ್ವೇಷಣೆಯನ್ನು ಬರಲು ಮತ್ತು ಚಿತ್ರೀಕರಿಸಲು ಆಹ್ವಾನಿಸುತ್ತಾರೆ - ಇದು ಅವರ ಸ್ವಂತ ಡ್ರ್ಯಾಗ್ ಆಕ್ಟ್ "ಒಲಿವಿಯಾ ನ್ಯೂಟನ್-ಡಾನ್" ನಿಂದ ಶೀರ್ಷಿಕೆಯಾಗಿದೆ. ನಿಧಾನವಾಗಿ ವಿಕಸಿಸುತ್ತಿರುವ ಈ ಕಥೆಯೊಂದಿಗೆ ನಿರ್ದೇಶಕ, ಟ್ರೆಂಟ್ ಹ್ಯಾರಿಸ್ ಅದ್ಭುತ ಕೆಲಸ ಮಾಡುತ್ತಾರೆ. ಸಣ್ಣ ಪಟ್ಟಣ ಅಮೆರಿಕದಲ್ಲಿ ದಮನಿತ ಲೈಂಗಿಕ ಗುರುತಿನಿಂದ ಸ್ವಾತಂತ್ರ್ಯದ ಕಥೆಯಂತೆ, ನಂತರದ ಎರಡು ಮರು ವ್ಯಾಖ್ಯಾನಗಳ ಮೂಲಕ ಯಾರಾದರೂ ಮಾರ್ಫ್ ಆಗಲು ಬಯಸುವ ವಿಚಿತ್ರ ಮಗುವಿನ ಕೆಲವು ತುಣುಕನ್ನು. ಹ್ಯಾರಿಸ್ ಏಕಕಾಲದಲ್ಲಿ ಸಣ್ಣ ಪಟ್ಟಣ ಅಮೆರಿಕದ ವರ್ತನೆಗಳು, ಸೆಲೆಬ್ರಿಟಿಗಳ ಆರಾಧನೆ ಮತ್ತು ಚಲನಚಿತ್ರ ಮತ್ತು ದೂರದರ್ಶನ ಉದ್ಯಮದ ಶೋಷಣೆಯ ಅಭ್ಯಾಸಗಳನ್ನು ಟೀಕಿಸುತ್ತಾನೆ. <br /> <br /> ಸೀನ್ ಪೆನ್ ಮತ್ತು ಗ್ರಿಸ್ಪಿನ್ ಗ್ಲೋವರ್ ಇಬ್ಬರೂ ಅದ್ಭುತ ಪ್ರದರ್ಶನಗಳನ್ನು ಹೊರಹಾಕುತ್ತಾರೆ. ಯುವ ಸೀನ್ ಪೆನ್ ಅತ್ಯಂತ ಪ್ರಚೋದಕ - ಅವನು ನಿಜವಾದ 'ಗ್ಯಾರಿ ಫೂಟೇಜ್' ಅನ್ನು ತುಂಬಾ ನಿಕಟವಾಗಿ ಅನುಸರಿಸುತ್ತಾನೆ, ಆದರೆ ಹ್ಯಾರಿಸ್ ಬಯಸಿದ ರೀತಿಯಲ್ಲಿ ಪರಸ್ಪರ ಕ್ರಿಯೆಯ ಅರ್ಥವನ್ನು ತಳ್ಳಲು ಬಲವಾದ ಸೂಕ್ಷ್ಮ ವ್ಯತ್ಯಾಸಗಳನ್ನು ನೀಡಲಾಗುತ್ತದೆ. <br /> <br /> ಅವರ ಪರಿಸ್ಥಿತಿಯ ಈ ಸಂಭಾವ್ಯ ವ್ಯಾಖ್ಯಾನಗಳಿಗೆ ವ್ಯತಿರಿಕ್ತವಾದಾಗ ಮೂಲ ಗ್ಯಾರಿ ನನ್ನನ್ನು ಪ್ರೇರೇಪಿಸಿತು. <br /> <br /> ತಪ್ಪಿಸಿಕೊಳ್ಳಬಾರದು. ನಾನು ಬೇರೆ ಯಾವುದನ್ನೂ ನೋಡಿಲ್ಲ. <br /> <br /> ಜಾಕೋಬ್.#1
ಈ ಚಲನಚಿತ್ರವನ್ನು ನೋಡುವುದಕ್ಕಾಗಿ ನಾನು ಹಿಂಭಾಗದಲ್ಲಿ ಪ್ಯಾಟ್ ಮಾಡಬೇಕು ಏಕೆಂದರೆ ಅದು ನಿಜವಾಗಿಯೂ ನೋವಿನಿಂದ ಕೂಡಿದೆ. ಅಸಮರ್ಥ ವರ್ಣಚಿತ್ರಕಾರನು ಸಂಪೂರ್ಣ ಸಮರ್ಥ ಹಿಟ್ ಮ್ಯಾನ್ ಆಗುತ್ತಾನೆ? ಈ ಚಲನಚಿತ್ರವು ಅಸಂಬದ್ಧತೆಗಳಿಂದ ಕೂಡಿದೆ, ಅದರಲ್ಲಿ ನಾನು ಎಲ್ಲವನ್ನೂ ಉಲ್ಲೇಖಿಸಿದರೆ ನಾನು ಚಲನಚಿತ್ರವನ್ನು ನೀಡುತ್ತೇನೆ. ನಾರ್ಮ್ ಪೀಟರ್ಸನ್ ಅಕಾ ಜಾರ್ಜ್ ವೆಂಡ್ಟ್ ಈ ಚಲನಚಿತ್ರವನ್ನು ಮಾಡಲು ಒಪ್ಪಿಕೊಂಡಿದ್ದಕ್ಕಾಗಿ ನಿಜವಾಗಿಯೂ ಅಸಹ್ಯವಾಗಿರಬೇಕು. ನಟನೆ ಶೋಚನೀಯ ಮತ್ತು ಕಥೆ ಇನ್ನೂ ಕೆಟ್ಟದಾಗಿತ್ತು. ವಿವೇಕಯುತ ಮತ್ತು ತರ್ಕಬದ್ಧ ವ್ಯಕ್ತಿಯಾಗಿ, ಬರಹಗಾರ ಎಲ್ಲಿಂದ ಬಂದಿದ್ದಾನೆ ಅಥವಾ ಈ ಚಲನಚಿತ್ರದೊಂದಿಗೆ ಅವನು ಎಲ್ಲಿಗೆ ಹೋಗುತ್ತಿದ್ದಾನೆ ಎಂದು ನನಗೆ ಅರ್ಥವಾಗಲಿಲ್ಲ. ಪ್ರತಿ ಮುಖ್ಯ ಪಾತ್ರದ ಕಡೆಯಿಂದ ಅಸಮರ್ಥತೆ ಇತ್ತು, ಅದೃಷ್ಟಹೀನ ಮತ್ತು ಹಾಸ್ಯಾಸ್ಪದ ಘಟನೆಗಳ ಸರಮಾಲೆ ಇತ್ತು, ನಂತರ ಚಲನಚಿತ್ರವು ಕೊನೆಗೊಂಡಿತು. ಸಂಭಾಷಣೆಯೊಂದಿಗೆ ಒಂದು ಅಸಂಬದ್ಧ ಕ್ರಿಯೆ ಚಲನಚಿತ್ರವನ್ನು ಮಾಡುವುದಿಲ್ಲ, ಅದು ಕೇವಲ ಮಾತನಾಡುವ ರೈಲು ಹಾಳಾಗುತ್ತದೆ.#0
ತಶಾನ್ ಚಿತ್ರವು ಬಹಳ ಸಂತೋಷದಿಂದ ಉತ್ತಮ ಚಿತ್ರವಾಗಲಿದೆ ಎಂದು ಪ್ರಪಂಚದಾದ್ಯಂತ ಹೇಳಿದರು, ಆದರೆ ಇದು ನಿಜವಲ್ಲ. ವಿಜಯ್ ಕೃಷ್ಣ ಆಚಾರ್ಯ ಅವರು ನಟಿ ಕರೀನಾ ಕಪೂರ್ ಆಗಿ ತೆಗೆದುಕೊಳ್ಳಲು ಗಂಭೀರವಾದ ತಪ್ಪು ಮಾಡಿದ್ದಾರೆ. ಚಿತ್ರದುದ್ದಕ್ಕೂ ಅವಳು ಅಸಹನೀಯಳಾಗಿದ್ದಳು. ಅವಳ ಟಾಮ್-ಬಾಯ್ ನೋಟ ನಿಜವಾಗಿಯೂ ಚೆನ್ನಾಗಿ ಹೋಗುವುದಿಲ್ಲ. ಚಿತ್ರದ ಕಥೆಯೂ ಸಹ ಅರ್ಥವಾಗುತ್ತಿಲ್ಲ. ಭಾರತದ ಕ್ವೆಟಿನ್ ಟ್ಯಾರಟಿನೊ ವಿಜಯ್ ಎಂದು ಎಲ್ಲರೂ ಹೇಳಿದರು ಆದರೆ ಅದು ಕ್ವೆಟಿನ್ ಅಲ್ಲ. ಈ ಅವಿವೇಕಿ ಚಿತ್ರದಲ್ಲಿ ಪ್ರತಿಭೆ ಅನಿಲ್ ಕಪೂರ್ ಭಾಗಿಯಾಗಿದ್ದರು. ಅನಿಲ್ ದೊಡ್ಡ ಕ್ಯಾಲಿಬರ್ ನಟ ಮತ್ತು ಈ ಚಿತ್ರ ಅಲ್ಲ. ಎಲ್ಲರೂ ಸೈಫ್ ಆಗಿರುವುದರಿಂದ ಅಕ್ಷಯ್ ಕುಮಾರ್ ಕೂಡ ಈ ಚಿತ್ರಕ್ಕೆ ಬಲಿಯಾಗಿದ್ದಾರೆ. ನಾನು ನಿರಾಶೆಗೊಂಡ ಈ ಚಿತ್ರದಲ್ಲಿ ಸ್ಟೈಲ್ ಮತ್ತು ಫೂರ್ಮೋಲಾ ನಿಜವಾಗಿಯೂ ಉತ್ತಮವಾಗಿಲ್ಲ#0
ಆರಂಭಿಕರಿಗಾಗಿ, "ಹೊಬ್ಬೊಬ್ಲಿನ್ಸ್" ಹೆಚ್ಚು ಯಶಸ್ವಿ "ಗ್ರೆಮ್ಲಿನ್ಸ್" ಅನ್ನು ಹೆಚ್ಚಿಸಲು ಪ್ರಯತ್ನಿಸುತ್ತದೆ. ಅದು ಸಾಕಷ್ಟು ಕೆಟ್ಟದಾಗಿದೆ ಆದರೆ ಅವರು ಇಲ್ಲಿ ಚಲನಚಿತ್ರವನ್ನು ಹೋಲುವ ಯಾವುದನ್ನೂ ಮಾಡಲು ಪ್ರಯತ್ನಿಸುವುದಿಲ್ಲ. ಬದಲಾಗಿ, ಇದು ಚೌಕಾಶಿ ನೆಲಮಾಳಿಗೆಯಂತಿದೆ, ಎಲ್ಲವೂ-ಮುಜುಗರದ ದೃಶ್ಯಗಳ ಕ್ಲಿಯರೆನ್ಸ್, ಸೂಕ್ತವಲ್ಲದ ಧ್ವನಿ ಎಫ್ಎಕ್ಸ್, ಅಹಿತಕರವಾದ ಟಪಿಯೋಕಾ ಎಂದು ಬ್ಲಾಂಡ್ ಆಗಿ ವರ್ತಿಸುವುದು ಮತ್ತು ಮಾನವರು ತಮ್ಮ ಚಲನೆಯ ಚಿತ್ರಗಳಲ್ಲಿ ಪವಿತ್ರವಾಗಿ ಹಿಡಿದಿಟ್ಟುಕೊಳ್ಳುವ ಎಲ್ಲವನ್ನೂ ತೆಗೆದುಕೊಂಡು ಹಳೆಯ ಟ್ಯೂಬ್ ಕೆಳಗೆ ಎಸೆಯುತ್ತಾರೆ -ಅರೂ. <br /> <br /> ಕಥಾವಸ್ತು? Grrrr .... ಮೆಡ್ಲಿಂಗ್ ಮಕ್ಕಳು ತಮ್ಮ ಕಲ್ಪನೆಗಳನ್ನು ಪ್ರದರ್ಶಿಸುವ ಮೂಲಕ ಜನರನ್ನು ಕೊಲ್ಲುವ ಮೊದಲು ಚಲನಚಿತ್ರದಿಂದ ಗ್ರೆಮ್ಲಿನ್ ತರಹದ ಜೀವಿಗಳನ್ನು ಪತ್ತೆ ಮಾಡುತ್ತಾರೆ. ತಂಪಾಗಿ ಧ್ವನಿಸುತ್ತದೆ, ಆಗುತ್ತದೆಯೇ? ಸರಿ, ನಿಮ್ಮ ಕೋಣೆಯ ಇನ್ನೊಂದು ಬದಿಯಲ್ಲಿರುವ ಗೋಡೆಯನ್ನು ನೋಡಿ? ಅದರತ್ತ ಬಲಕ್ಕೆ ಓಡಿ, ಉನ್ನತ ವೇಗ, ಮೊದಲು ಮುಖ. ನೋಡಿ, ಅದು ಈ ಚಲನಚಿತ್ರಕ್ಕಿಂತ ತಂಪಾಗಿದೆ. <br /> <br /> ನೀವು ಅನುಮಾನಿಸುವ ಧೈರ್ಯವಿದೆಯೇ? ತ್ವರಿತ, ಬೇರೆ ಯಾವುದನ್ನಾದರೂ ಹೆಸರಿಸಿ ಇದನ್ನು ಹೊರತುಪಡಿಸಿ ಬೇರೆ ಯಾವುದಾದರೂ ಒಂದು ಪಾತ್ರವಿದೆ. "ಹೊಬ್ಬೊಬ್ಲಿನ್ಸ್" ನಂತರ ಬರಹಗಾರರು ಬೇರೆ ಯಾವ ಸ್ಕ್ರಿಪ್ಟ್‌ಗಳನ್ನು ಮಾಡಿದ್ದಾರೆ? ಮತ್ತೊಂದು ರಿಕ್ ಸ್ಲೋಯೆನ್ ನಿರ್ದೇಶನದ ಪ್ರಯತ್ನವನ್ನು ಹೆಸರಿಸಿ. ನಿಮ್ಮಲ್ಲಿ ಎಷ್ಟು "ಹೊಬ್ಬೊಬ್ಲಿನ್ಸ್" ಆಕ್ಷನ್ ಫಿಗರ್‌ಗಳಿವೆ? ನೋಡಿ? ಧನ್ಯವಾದಗಳು. <br /> <br /> ಅಂತಹ ಭಯಾನಕ ಚಿತ್ರದ ಬಗ್ಗೆ ಬರೆಯಲು ನಾನು ತುಂಬಾ ಸಮಯ ತೆಗೆದುಕೊಂಡಿದ್ದೇನೆ ಎಂದು ನಂಬಲು ಸಾಧ್ಯವಿಲ್ಲ. ನಾನು ಹೆಚ್ಚು ಮುಖ್ಯವಾದ ವಿಷಯಗಳ ಬಗ್ಗೆ ಬರೆಯುತ್ತೇನೆ; ಚರ್ಚ್ ಮತ್ತು ರಾಜ್ಯವನ್ನು ಬೇರ್ಪಡಿಸುವುದು, ಯುರೋಪಿನಲ್ಲಿ ಆರ್ಥಿಕ ಪುನರ್ರಚನೆ, ಆ ರೀತಿಯ ವಿಷಯ. ಆದರೆ ಇಲ್ಲ, "ಹೊಬ್ಬೊಬ್ಲಿನ್ಸ್" ಅದು ಕೆಟ್ಟದು - ನಿಮ್ಮ ಅಜ್ಜಿಯರ ವಾಲ್‌ಪೇಪರ್‌ನಂತೆ ಕೆಟ್ಟದು, ನಿಮ್ಮ ಹುಲ್ಲುಹಾಸಿನ ಮೇಲೆ ಗುಲಾಬಿ ಫ್ಲೆಮಿಂಗೊಗಳಂತೆ ಕೆಟ್ಟದು, "ಹೋಂಪರ್ ಆಫ್ ದಿ ವಾಪರ್" ಎಂದು ಹೇಳುವ ಒಳ ಉಡುಪುಗಳಂತೆ ಕೆಟ್ಟದು ... ಮತ್ತು ನಾವು ಅಲ್ಲಿ ನಿಲ್ಲುತ್ತೇವೆ ಎಂದು ನಾನು ಭಾವಿಸುತ್ತೇನೆ . <br /> <br /> ಒಳ್ಳೆಯದು, ಮೈಕ್ ಮತ್ತು ರೋಬೋಟ್‌ಗಳು ಧೈರ್ಯದಿಂದ ಹೋರಾಡುತ್ತವೆ ಆದರೆ ಅವರು ಎಷ್ಟು ಸಾಧ್ಯವೋ ಅಷ್ಟು ಪ್ರಯತ್ನಿಸುತ್ತಾರೆ, ಅವರು "ಹಾಬ್‌ಗೋಬ್ಲಿನ್ಸ್" ನೊಂದಿಗೆ ಮಾತ್ರ ಹೆಚ್ಚು ಮಾಡಬಹುದು, ಅವರು ಅರಿತುಕೊಳ್ಳುವ ಮೊದಲು, ಹೌದು, ನಿರ್ದೇಶಕರು ಮೊಣಕಾಲಿನಲ್ಲಿ ಒದೆಯುವ ಅವಶ್ಯಕತೆಯಿದೆ. < br /> <br /> ನೈಜ, ನಿಜವಾದ ಕಠಿಣ. <br /> <br /> "ಹೊಬ್ಬೊಬ್ಲಿನ್ಸ್" ಗಾಗಿ ಒಂದು ನಕ್ಷತ್ರ, MST3K ಆವೃತ್ತಿಗೆ ಏಳು ನಕ್ಷತ್ರಗಳು.#0
ನೀವು 60 ರ ದಶಕದಲ್ಲಿ ವಾಸಿಸುತ್ತಿದ್ದರೆ, ಈ ಚಿತ್ರವು ಕೆಲವೊಮ್ಮೆ ನೋವಿನಿಂದ ಕೂಡಿದೆ ಮತ್ತು ಇತರ ಸಮಯಗಳಲ್ಲಿ ಸಾಕಷ್ಟು ಸಂತೋಷದಾಯಕವಾಗಿರುತ್ತದೆ. ಅದೆಲ್ಲವೂ ಇದೆ ಆದರೆ ಆ ಸಮಯದಲ್ಲಿ ಚಾಲ್ತಿಯಲ್ಲಿರುವ ಕೌಂಟರ್ ಕಲ್ಚರ್ ಟ್ಯಾಬ್ಲಾಯ್ಡ್‌ಗಳಲ್ಲಿನ ಸಣ್ಣ ಮುದ್ರಣ. ಇವುಗಳು ಇನ್ನೂ ಹೊರಹೊಮ್ಮುತ್ತಿರುವ ಸಾಮಾಜಿಕ ಕ್ರಾಂತಿಯ ಬೇರುಗಳಾಗಿವೆ: "ಚಕ್ರವು ಇನ್ನೂ ಸ್ಪಿನ್‌ನಲ್ಲಿದೆ, ಅವರು ಎ-ಚೇಂಜಿಂಗ್ ಆಗಿರುವ ಸಮಯಕ್ಕಾಗಿ ಬೇಗನೆ ಮಾತನಾಡಬೇಡಿ". ಈ ಚಿತ್ರವು ಎಲ್‌ಎಸ್‌ಡಿಯ ಕ್ರಾಂತಿಕಾರಿ ಸ್ವರೂಪವನ್ನು ಕೇಂದ್ರೀಕರಿಸುತ್ತದೆ ಮತ್ತು ಆ ಸಮಯದಲ್ಲಿ ಅದು ಪ್ರಸಾರವಾಗಿದ್ದರೂ, ಅದು ಕೇವಲ ಬುದ್ಧಿಜೀವಿಗಳ ವಿಕಾಸದಲ್ಲಿ ಮಹತ್ತರವಾದ ಪಾತ್ರವನ್ನು ವಹಿಸಿತು, ಎಂಜಿನಿಯರ್‌ಗಳು, ವಿಜ್ಞಾನಿಗಳ ಮೇಲೆ ಪ್ರಭಾವ ಬೀರಿತು ಮತ್ತು ಕಂಪ್ಯೂಟರ್ ಸಂಬಂಧಿತ ಚಟುವಟಿಕೆಗಳ ಹೈಪರ್-ಡೆವಲಪ್‌ಮೆಂಟ್‌ಗೆ ಸಹಾಯ ಮಾಡುತ್ತದೆ. ಅಲ್ಲಿದ್ದ ಒಬ್ಬರಿಂದ ಚಲನಚಿತ್ರ ನಿರ್ಮಾಪಕರಿಗೆ ಒಂದು ಸೆಲ್ಯೂಟ್ - ನಾನು ಮೊದಲು ನೋಡಿದ್ದಕ್ಕಿಂತ ಯುಗವನ್ನು ನೀವು ಚೆನ್ನಾಗಿ ಸೆರೆಹಿಡಿದಿದ್ದೀರಿ.#1
