ಈ ಚಲನಚಿತ್ರವು ತುಂಬಾ ವಿಚಿತ್ರವಾದದ್ದು ಮತ್ತು ತುಂಬಾ ತಮಾಷೆಯಾಗಿತ್ತು. ಎಲ್ಲಾ ನಟರು ಸಾಕಷ್ಟು ನೈಜ ಮತ್ತು ಬೆಸ. ಚಿತ್ರದ ಒಟ್ಟಾರೆ "ನೋಟ" ವಿಭಿನ್ನವಾಗಿತ್ತು, ಇದು ಒಂದು ರೀತಿಯ ಸ್ವಪ್ನಶೀಲ ಮತ್ತು ಬ್ಲೀಚ್- out ಟ್ ಆಗಿದ್ದು, ಇದು ಇಡೀ ವಿಷಯದ ಸ್ಥಳಾವಕಾಶ, ಗೊಂದಲ, ವಿಲಕ್ಷಣ ವೈಬ್ ಅನ್ನು ಮಾತ್ರ ಸೇರಿಸಿತು. <br /> <br /> ಇದು ಎಲ್ಲರಿಗೂ ಅಲ್ಲ, ನನ್ನ ಪ್ರಕಾರ, ನೀವು "ಮುಖ್ಯವಾಹಿನಿಯ" ಎಂದು ಕರೆಯುವದಲ್ಲ ಆದರೆ ಅದರ ಬಗ್ಗೆ ನಾನು ಇಷ್ಟಪಟ್ಟಿದ್ದೇನೆ. ಇದು ನಾನು ಹಿಂದೆಂದೂ ನೋಡದ ಯಾವುದಕ್ಕಿಂತ ಭಿನ್ನವಾಗಿದೆ. . . ಅನಿರೀಕ್ಷಿತ, ವಿಚಿತ್ರವಾದ ಸ್ಥಳಗಳಲ್ಲಿ ವಿಲಕ್ಷಣವಾದ ಲಯ ಮತ್ತು ಪಂಚ್ ರೇಖೆಗಳೊಂದಿಗೆ. ಮಕ್ಕಳು ತುಂಬಾ ಹೃದಯಸ್ಪರ್ಶಿಯಾಗಿ ಅವಿವೇಕಿಗಳಾಗಿದ್ದಾರೆ (ಮತ್ತು ಪಿಂಪ್ಲಿ) ನಿಮಗೆ ಸಹಾಯ ಮಾಡಲು ಸಾಧ್ಯವಿಲ್ಲ ಆದರೆ ಅವರಿಗೆ ಅನುಭವಿಸಬಹುದು. ಬೇರೆ ರೀತಿಯಲ್ಲಿ ಹೇಳುವುದಾದರೆ, ಇವು ಹದಿಹರೆಯದವರ "ಹಾಲಿವುಡ್" ಆವೃತ್ತಿಗಳಿಂದ ದೂರವಿದೆ. <br /> <br /> ಇವೆಲ್ಲವೂ ನನಗೆ ಒಳ್ಳೆಯದು.#1
ನೀವು ಗೋಥಿಕ್ ಭಯಾನಕ ಅಭಿಮಾನಿಯಾಗಿದ್ದರೆ, ಈ ಅದ್ಭುತ ಇಟಾಲಿಯನ್ 60 ರ ಚಲನಚಿತ್ರ "ಕ್ಯಾಸಲ್ ಆಫ್ ಬ್ಲಡ್" ಅನ್ನು ಪ್ರೀತಿಸುವುದನ್ನು ನೀವು ಖಂಡಿತವಾಗಿ ಖಾತರಿಪಡಿಸುತ್ತೀರಿ. ನಾವು ನಿಜವಾಗಿಯೂ ತೆವಳುವ ಬಾಗಿಲುಗಳ ಬಗ್ಗೆ ಮಾತನಾಡುತ್ತಿದ್ದೇವೆ, ಚಲಿಸುತ್ತಿರುವಂತೆ ಕಾಣುವ ವಿಲಕ್ಷಣ ಭಾವಚಿತ್ರಗಳು, ಸ್ವಯಂಪ್ರೇರಿತವಾಗಿ ಸಾಯುತ್ತಿರುವ ಮೇಣದ ಬತ್ತಿಗಳು ಆದರೂ ಭಾರವಾದ ಮರದ ಕೋಣೆಯ ಬಾಗಿಲುಗಳ ಕೆಳಗೆ ಗಾಳಿ ಮತ್ತು ಹೊಗೆ ಬರುವುದಿಲ್ಲ. ವಾತಾವರಣ ಮತ್ತು ಶೈಲಿಯ ವಿಷಯದಲ್ಲಿ ಹೇಳುವುದಾದರೆ, ಗೋಥಿಕ್ ಚಲನಚಿತ್ರ ತಯಾರಿಕೆಯ ಈ ಪ್ರವೀಣ ತುಣುಕು ಅಲ್ಲಿನ ಅತ್ಯುತ್ತಮವಾದದ್ದು; "ಬ್ಲ್ಯಾಕ್ ಸಂಡೇ", "ದಿ ತ್ರೀ ಫೇಸಸ್ ಆಫ್ ಫಿಯರ್" ಮತ್ತು "ಕ್ರೈಸ್ ಆಫ್ ದಿ ಕ್ರೈಯಿಂಗ್ ವುಮನ್" ನಂತಹ ಹೆಗ್ಗುರುತುಗಳ ಕೆಳಗೆ ಕೇವಲ ಒಂದು ಸಣ್ಣ ಲೀಗ್. ಪ್ರಮುಖ ನಿರ್ದೇಶಕರ ಜೋಡಿ ಸೆರ್ಗಿಯೋ ಕಾರ್ಬೂಸಿ ("ದಿ ಗ್ರೇಟ್ ಸೈಲೆನ್ಸ್", "ಜಾಂಗೊ") ಮತ್ತು ಆಂಟೋನಿಯೊ ಮಾರ್ಗರಿಟಿ ("ನರಭಕ್ಷಕ ಅಪೋಕ್ಯಾಲಿಪ್ಸ್", "ಕಿಲ್ಲರ್ ಫಿಶ್") ಪ್ರಬಲವಾದ ಕಥಾವಸ್ತುವನ್ನು ಒಳಗೊಂಡಂತೆ ಎಲ್ಲಾ ಕ್ಷೇತ್ರಗಳಲ್ಲಿ ಯಶಸ್ವಿಯಾಗಿದೆ (ಇದು ನಿಜಕ್ಕೂ ದುಃಸ್ವಪ್ನವನ್ನು ಪ್ರೇರೇಪಿಸುತ್ತದೆ), ಅಲ್ಟ್ರಾ-ಕೆಟ್ಟದಾದ ದೃಶ್ಯಾವಳಿ ಮತ್ತು ಚಿತ್ರೀಕರಣದ ಸ್ಥಳಗಳು, ಸೊಗಸಾದ ಕಪ್ಪು ಮತ್ತು ಬಿಳಿ ography ಾಯಾಗ್ರಹಣ, ಬೆನ್ನುಮೂಳೆಯ ತಣ್ಣಗಾಗಿಸುವ ಸಂಗೀತ ಮತ್ತು ಪ್ರತಿಭಾವಂತ ಪ್ರದರ್ಶಕರ ಅದ್ಭುತ ಸಭೆ. ಮೇಲೆ ತಿಳಿಸಲಾದ "ಬ್ಲ್ಯಾಕ್ ಸಂಡೇ" ಮತ್ತು ಇಟಾಲಿಯನ್ ಗೋಥ್-ಮ್ಯೂಸ್ ನಂಬರ್ ಒನ್ ನ ಸ್ಟಾರ್ಲೆಟ್ ಬಾರ್ಬರಾ ಸ್ಟೀಲ್, ಆಧ್ಯಾತ್ಮಿಕವಾಗಿ ಪೀಡಿಸಿದ ಪಾತ್ರವಾಗಿ ಮತ್ತೆ ಪ್ರಕಾಶಮಾನವಾಗಿ ಹೊಳೆಯುತ್ತಾಳೆ ಮತ್ತು ಅವಳು ಅಕ್ಷರಶಃ ಅತ್ಯುತ್ತಮ ಸಹ ಆಟಗಾರರಿಂದ ಸುತ್ತುವರೆದಿದ್ದಾಳೆ. ಅವುಗಳಲ್ಲಿ ಒಂದು, ಸಿಲ್ವಾನೋ ಟ್ರಾಂಕ್ವಿಲ್ಲಿ, ಲೇಖಕ ಎಡ್ಗರ್ ಅಲನ್ ಪೋ ಅವರ ಸಾಕಷ್ಟು ವಿಶ್ವಾಸಾರ್ಹ ಚಿತ್ರಣವನ್ನು ಸಹ ನೀಡುತ್ತದೆ. ಈ ಕಥೆಯಲ್ಲಿ ಅವನ ಮತ್ತು ಗ್ರಾಮಾಂತರ ಹೋಟೆಲಿನ ಇನ್ನೊಬ್ಬ ಶ್ರೀಮಂತ ಸಂದರ್ಶಕನು ಕ್ರೂರ ಯುವ ಪತ್ರಕರ್ತನನ್ನು ಅಸ್ವಸ್ಥ ಪಂತವನ್ನು ಸ್ವೀಕರಿಸಲು ಸವಾಲು ಹಾಕುತ್ತಾನೆ. ಅವನೇನಾದರು ?? ಅಲನ್ ಫೋಸ್ಟರ್ ?? ಕುಖ್ಯಾತ ಬ್ಲ್ಯಾಕ್‌ವುಡ್ ಕ್ಯಾಸಲ್‌ನಲ್ಲಿ ಒಂದು ರಾತ್ರಿ ಕಳೆಯುವುದರಿಂದ ಅವರು ಬದುಕುಳಿಯುತ್ತಾರೆ, ಅವರು $ 10 ರ ಬೆರಗುಗೊಳಿಸುವ ಬಹುಮಾನ ಮತ್ತು ಪೋ ಅವರೊಂದಿಗಿನ ಪತ್ರಿಕೆಯ ಸಂದರ್ಶನವನ್ನು ಪಡೆಯುತ್ತಾರೆ. ಅಗ್ನಿಪರೀಕ್ಷೆಯು ಅಂದುಕೊಂಡದ್ದಕ್ಕಿಂತ ಹೆಚ್ಚು ಅಪಾಯಕಾರಿ ಎಂದು ಹೇಳಬೇಕಾಗಿಲ್ಲ, ಅಲನ್ ಫೋಸ್ಟರ್ ಅವರಂತಹ ಯಾರಿಗಾದರೂ ದೆವ್ವ ಮತ್ತು ರಕ್ತಪಿಶಾಚಿಗಳಲ್ಲಿ ನಂಬಿಕೆಯಿಲ್ಲದವರು. ರಾತ್ರಿಯು ಅವನಿಗೆ ಉತ್ತಮವಾಗಿ ಪ್ರಾರಂಭವಾಗುತ್ತದೆ, ಏಕೆಂದರೆ ಅವನು ತನ್ನ ಕನಸುಗಳ ಬೆರಗುಗೊಳಿಸುವ ಸುಂದರ ಮಹಿಳೆಯೊಂದಿಗೆ ಭೇಟಿಯಾಗುತ್ತಾನೆ, ಆದರೆ ಕ್ರಮೇಣ ಬ್ಲ್ಯಾಕ್‌ವುಡ್ ಕ್ಯಾಸಲ್ ಒಂದು ನರಕಯಾತಕ ಸ್ಥಳವೆಂದು ತಿಳಿದುಕೊಳ್ಳುತ್ತಾನೆ, ಅಲ್ಲಿ ಹಿಂದೆ ಸತ್ತ ಸಂದರ್ಶಕರ ದೆವ್ವಗಳು ಎಲ್ಲಾ ಶಾಶ್ವತತೆಗಾಗಿ ಸಿಕ್ಕಿಹಾಕಿಕೊಳ್ಳುತ್ತವೆ. ನಿಮ್ಮ ಬಗ್ಗೆ ನನಗೆ ಗೊತ್ತಿಲ್ಲ, ಆದರೆ ಇದು ಸಾರ್ವಕಾಲಿಕವಾಗಿ ನನ್ನ ನೆಚ್ಚಿನ ಭಯಾನಕ ಚಲನಚಿತ್ರ ಆವರಣಗಳಲ್ಲಿ ಒಂದಾಗಿದೆ. ಸಹ-ನಿರ್ದೇಶಕ ಆಂಟೋನಿಯೊ ಮಾರ್ಗರಿಟಿ ಈ ಚಿತ್ರದ ಬಗ್ಗೆಯೂ ಸ್ಪಷ್ಟವಾಗಿ ಹೆಮ್ಮೆಪಟ್ಟರು, ಏಕೆಂದರೆ ಅವರು ಅದನ್ನು ಒಂದೆರಡು ವರ್ಷಗಳ ನಂತರ "ವೆಬ್ ಆಫ್ ದಿ ಸ್ಪೈಡರ್" ಎಂದು ಮರುರೂಪಿಸಿದರು. ಆ ಚಲನಚಿತ್ರವು ಬೆರಳೆಣಿಕೆಯಷ್ಟು ಟ್ರಂಪ್‌ಗಳನ್ನು ಹೊಂದಿತ್ತು, ಉದಾಹರಣೆಗೆ ಎಡ್ಗರ್ ಅಲನ್ ಪೋ ಪಾತ್ರದಲ್ಲಿ ಕ್ಲಾಸ್ ಕಿನ್ಸ್ಕಿಗಿಂತ ಕಡಿಮೆಯಿಲ್ಲ, ಆದರೆ ಸಾಮಾನ್ಯವಾಗಿ ಈ ಮೂಲವು ಹೆಚ್ಚು ಶ್ರೇಷ್ಠವಾಗಿದೆ. "ಕ್ಯಾಸಲ್ ಆಫ್ ಬ್ಲಡ್" ಅಕ್ಷರಶಃ ವಾತಾವರಣದೊಂದಿಗೆ ಹೊರಹೊಮ್ಮುತ್ತದೆ ಮತ್ತು ಉದ್ದಕ್ಕೂ ಸಂಪೂರ್ಣವಾಗಿ ಬಗೆಹರಿಯದ ವಾತಾವರಣವನ್ನು ಕಾಪಾಡಿಕೊಳ್ಳುತ್ತದೆ. ನಿಮ್ಮ ಕೈಗಳಲ್ಲಿ ಮತ್ತು ಕತ್ತಿನ ಹಿಂಭಾಗದಲ್ಲಿ ಕೂದಲನ್ನು ಸರಿಯಾದ ಸಂದರ್ಭಗಳಲ್ಲಿ ನೋಡಿದರೆ ಭಯದಿಂದ ಮೇಲೇರಲು ಸಾಧ್ಯವಾಗುವ ಅಪರೂಪದ ಚಿತ್ರಗಳಲ್ಲಿ ಇದು ನಿಜಕ್ಕೂ ಒಂದು. ತಡರಾತ್ರಿಯಲ್ಲಿ, ಮೇಲಾಗಿ ಏಕಾಂಗಿಯಾಗಿ ಮತ್ತು ಮೇಣದ ಬತ್ತಿ ಬೆಳಗಿದ ಕೋಣೆಯಲ್ಲಿ ಇದನ್ನು ವೀಕ್ಷಿಸಿ, ಮತ್ತು ಭಯಾನಕತೆಯ ನಿಜವಾದ ವ್ಯಾಖ್ಯಾನದ ಬಗ್ಗೆ ನಿಮಗೆ ಒಂದು ಕಲ್ಪನೆ ಬರುತ್ತದೆ.#1
ಮೊದಲು ಕೆಲವು ಹಿನ್ನೆಲೆ; ನಾನು ಇಂಗ್ಲಿಷ್ ಮತ್ತು ನನ್ನ ಜೀವನದುದ್ದಕ್ಕೂ ಲಂಡನ್ನಲ್ಲಿ ವಾಸಿಸುತ್ತಿದ್ದೇನೆ. ನಾನು 'ದಿ ಡೆನ್' ಮತ್ತು ಇತರ ಲಂಡನ್ ಕ್ಲಬ್ ಮೈದಾನಗಳಲ್ಲಿ ಅನೇಕ ಆಟಗಳಿಗೆ ಹೋಗಿದ್ದೇನೆ. ಗೂಂಡಾಗಿರಿಯೊಳಗೆ ಸಿಲುಕುವ ವ್ಯಕ್ತಿಯ ಪ್ರಕಾರ ನನಗೆ ತಿಳಿದಿದೆ ಮತ್ತು ಅವರು ಹೇಗೆ ವರ್ತಿಸುತ್ತಾರೆ ಮತ್ತು ಅವರು ಹೇಗೆ ಮಾತನಾಡುತ್ತಾರೆಂದು ನನಗೆ ತಿಳಿದಿದೆ. ಇದು ಕೆಟ್ಟ, ಕೆಟ್ಟ ಚಿತ್ರ ಎಂದು ಹೇಳಬೇಕು. ಗ್ರೀನ್ ಸ್ಟ್ರೀಟ್ ನಾನು ನೋಡಿದ ಅವಾಸ್ತವಿಕ ಚಲನಚಿತ್ರಗಳಲ್ಲಿ ಒಂದಾಗಿದೆ ಎಂದು ನಾನು ನಿಮಗೆ ಹೇಳಬಲ್ಲೆ. ನಾನು ಚಲನಚಿತ್ರದ ಹೆಚ್ಚಿನ ಭಾಗವನ್ನು ಮುಜುಗರದಿಂದ ಕಳೆದಿದ್ದೇನೆ. ನಾನು ಮಿನಿ ವಿಮರ್ಶೆಯನ್ನು ಬರೆಯಬೇಕು ಎಂದು ನಾನು ಭಾವಿಸಿದ್ದೇನೆ ಏಕೆಂದರೆ ನಾನು ಕೆಲವು ವಿಷಯಗಳನ್ನು ಎತ್ತಿ ತೋರಿಸಬೇಕು ಎಂದು ಭಾವಿಸಿದೆ. <br /> <br /> ಎ) ಜನರು ನಿಜ ಜೀವನದಲ್ಲಿ ಲಂಡನ್‌ನಲ್ಲಿ ಹಾಗೆ ಮಾತನಾಡುವುದಿಲ್ಲ; ಚಲನಚಿತ್ರ ನಿರ್ಮಾಪಕರು ಇಡೀ ಆಡುಭಾಷೆಯನ್ನು ತುಂಬಾ ದೂರ ತೆಗೆದುಕೊಂಡು ಅದನ್ನು ಮೂರ್ಖರನ್ನಾಗಿ ಮಾಡಿದರು. ದುರದೃಷ್ಟವಶಾತ್ ಗೂಂಡಾಗಿರಿ ಪ್ರಕಾರಗಳು ಅಸ್ತಿತ್ವದಲ್ಲಿವೆ, ಆದರೆ ಗ್ರೀನ್ ಸ್ಟ್ರೀಟ್‌ನಲ್ಲಿ ನೀವು ನೋಡುವವರು ವಿಡಂಬನೆಗಳಂತೆ. ಬಿ) ಪೀಟ್ ಡನ್ಹ್ಯಾಮ್ (ಚಾರ್ಲಿ ಹುನ್ನಮ್) ಪಾತ್ರವನ್ನು ನಿರ್ವಹಿಸುವ ನಟ ದುರದೃಷ್ಟವಶಾತ್ ಒಸಾಮಾ ಬಿನ್ ಲಾಡೆನ್ ಪಾತ್ರದಲ್ಲಿ 'ಇಂಗ್ಲಿಷ್' ಅಥವಾ 'ಕಾಕ್ನಿ' ಎಂದು ಧ್ವನಿಸುತ್ತಾನೆ. ಅವರು ನ್ಯೂಕ್ಯಾಸಲ್ನಲ್ಲಿ ಉತ್ತರದಿಂದ ಬಂದವರಾಗಿದ್ದಾರೆ ಮತ್ತು ಇತರ ಯಾವುದೇ ನಟರು ಅವರೊಂದಿಗೆ ನೇರ ಮುಖದ ನಟನೆಯನ್ನು ಇಟ್ಟುಕೊಳ್ಳಬಹುದೆಂದು ನಾನು ಆಶ್ಚರ್ಯಚಕಿತನಾಗಿದ್ದೇನೆ - ನಾವು ಅವನನ್ನು ಹೇಗೆ ಗಂಭೀರವಾಗಿ ಪರಿಗಣಿಸಬೇಕು. ಪೂರ್ವ ಲಂಡನ್‌ನಿಂದ ಯಾರನ್ನಾದರೂ ಅವರು ಆ ಪಾತ್ರವನ್ನು ವಹಿಸಲಿಲ್ಲ ಏಕೆ ನನಗೆ ಮೀರಿದೆ. ನಾನು 'ಬ್ಯಾಂಗ್ ಅಪ್ ಕೆಲಸ' ಮಾಡಬಹುದಿತ್ತು, ಹೀಹೆ. ಸಿ) ಶ್ರೀ ಫ್ರೊಡೊ. ನನ್ನ ಪ್ರಕಾರ ಎಲಿಜಾ ವುಡ್ ತನ್ನ ಕತ್ತೆಗಿಂತ ಎರಡು ಪಟ್ಟು ಮತ್ತು ನಿಜವಾದ ಅಸಹ್ಯ ಗೂಂಡಾಗಿರಿಗಳ ಜನರ ಕತ್ತೆಗೆ ಒದೆಯುವುದು ಹೇಗೆ ಎಂದು ನಾನು ಭಾವಿಸುತ್ತೇನೆ. ಅವನು ಸತ್ತಿದ್ದಾನೆ. ಅದರಂತೆ ಸರಳ. ಪ್ರಾಮಾಣಿಕವಾಗಿ (ಬ್ರಿಟ್‌ನಂತೆ) ಈ ಚಿತ್ರವನ್ನು ನೋಡುವುದು ಕಷ್ಟವಾಗಿತ್ತು. ಈ ಚಿತ್ರವು ಯುಕೆ ನಲ್ಲಿ ಬಾಂಬ್ ಸ್ಫೋಟಿಸುತ್ತದೆ ಎಂದು ನನಗೆ ಬಹಳ ಖಚಿತವಾಗಿದೆ. ಇದು ರಾಜ್ಯಗಳಲ್ಲಿ ಸ್ವಲ್ಪ ಉತ್ತಮವಾಗಿ ಮಾಡಬಹುದು ಏಕೆಂದರೆ ಅಮೆರಿಕನ್ನರು ಅದು ಎಷ್ಟು ನಿಖರವಾಗಿಲ್ಲ ಎಂದು ತಿಳಿದಿರುವುದಿಲ್ಲ (ಅಥವಾ ಕಾಳಜಿ ವಹಿಸುತ್ತಾರೆ). <br /> <br /> ದಯವಿಟ್ಟು ನನ್ನ ಅಮೇರಿಕನ್ ಮತ್ತು ವಿದೇಶಿ ಸ್ನೇಹಿತರು, ಈ ಅಸಂಬದ್ಧ ಪದವನ್ನು ನಂಬಬೇಡಿ. ಹೌದು ಈ ಸಂಸ್ಥೆಗಳು ಅಸ್ತಿತ್ವದಲ್ಲಿವೆ ಆದರೆ ಇದು ಅತ್ಯಂತ ಭೂಗತ ಮತ್ತು ಹಶ್ ಹಶ್, ಮತ್ತು ಬಹಳ ಸಣ್ಣ ಪ್ರಮಾಣದಲ್ಲಿ. ಚಲನಚಿತ್ರವು ನನ್ನಿಂದ 2 ಅನ್ನು ಮಾತ್ರ ಪಡೆಯುತ್ತದೆ ಏಕೆಂದರೆ ಅವರು ಅದರಲ್ಲಿ ಕೆಲವನ್ನು ಲಂಡನ್‌ನಲ್ಲಿ ಚಿತ್ರೀಕರಿಸಿದ್ದಾರೆ. ಸಾಮಾನ್ಯವಾಗಿ ಅವರು ಈ ವಿಷಯಗಳನ್ನು ಕಾರ್ಡಿಫ್ (ವೇಲ್ಸ್) ಅಥವಾ ಯಾವುದನ್ನಾದರೂ ಚಿತ್ರೀಕರಿಸಲು ಪ್ರಯತ್ನಿಸುತ್ತಾರೆ ಮತ್ತು ನಾವೆಲ್ಲರೂ ಗಮನಿಸಬಾರದು ಎಂದು ನಿರೀಕ್ಷಿಸುತ್ತಾರೆ.#0
ಸೂಪರ್ ಮಾರಿಯೋ 64 ನಿಸ್ಸಂದೇಹವಾಗಿ ಇದುವರೆಗೆ ರಚಿಸಿದ ಶ್ರೇಷ್ಠ ಆಟವಾಗಿದೆ. ಇದು ಎಷ್ಟು ವ್ಯಸನಕಾರಿಯಾಗಿದೆಯೆಂದರೆ, ನೀವು ಅದನ್ನು ವಿರಾಮಕ್ಕಾಗಿ ನಿಲ್ಲಿಸದೆ ಗಂಟೆಗಳ ಕಾಲ ಗಂಟೆಗಳವರೆಗೆ ಆಡಬಹುದು. ನಾನು ಆಟವನ್ನು 4 ಬಾರಿ ಸೋಲಿಸಿದ್ದೇನೆ, ಆದರೆ ನಾನು ಎಲ್ಲ 120 ನಕ್ಷತ್ರಗಳನ್ನು ಪಡೆದಿಲ್ಲ ... (ನಾನು 111 ಪಡೆದಿದ್ದೇನೆ) ... ಆದರೆ ಅಂತಿಮವಾಗಿ ಅವುಗಳನ್ನು ಸಾಧಿಸಬೇಕೆಂದು ನಾನು ಭಾವಿಸುತ್ತೇನೆ. ನಾನು ಏಳು ವರ್ಷದ ತನಕ ಅಧಿಕೃತವಾಗಿ ಈ ಆಟವನ್ನು ಆಡದಿದ್ದರೂ, ನನ್ನ ಸಹೋದರಿಯರು ಅದನ್ನು ನೋಡುವುದನ್ನು ನಾನು ಇಷ್ಟಪಟ್ಟೆ. ಈಗ ನನಗೆ 13 ವರ್ಷ ಮತ್ತು ಈಗಲೂ ಇದನ್ನು ಆಡುತ್ತೇನೆ, ಆಟಗಳನ್ನು ಅಳಿಸಿಹಾಕುವುದು ಮತ್ತು ಮತ್ತೆ ಪ್ರಾರಂಭಿಸುವುದು. <br /> <br /> ಆರಂಭಿಕ N64 ಆಟಕ್ಕೆ ಗ್ರಾಫಿಕ್ಸ್ ನಂಬಲಾಗದಂತಿದೆ. ಆಟದ ವ್ಯಸನಕಾರಿ. ನಿಯಂತ್ರಣಗಳು ಅದ್ಭುತವಾಗಿದೆ. ಮಟ್ಟಗಳು ಕಠಿಣ, ಆದರೆ ಅಸಾಧ್ಯವಲ್ಲ. ಬೌಸರ್ ಪಂದ್ಯಗಳು ಸವಾಲಿನವು. <br /> <br /> ನಾನು ನಿಮಗೆ ಹೆಚ್ಚಿನದನ್ನು ಹೇಳಲು ಬಯಸುತ್ತೇನೆ, ಆದರೆ ನೀವು ಅದನ್ನು ನಿಮಗಾಗಿ ಏಕೆ ಪಡೆಯುವುದಿಲ್ಲ? ಎಕ್ಸ್-ಬಾಕ್ಸ್ 360, ಪಿಎಸ್ 3 ಮತ್ತು ವೈ ಅನ್ನು ದೂರವಿರಿಸಿ ಮತ್ತು ನಿಂಟೆಂಡೊ 64 ಅನ್ನು ಹುಡುಕಿ ಮತ್ತು ಈ ಅದ್ಭುತ, ಅದ್ಭುತ ಆಟವನ್ನು ಆಡಿ.#1
ಈ ಚಿತ್ರ ಸಂಪೂರ್ಣವಾಗಿ ಬೆರಗುಗೊಳಿಸುತ್ತದೆ. ಹೊಸ ಬ್ಲೇಡ್ ರನ್ನರ್ - ಭವಿಷ್ಯದ ನಾಯ್ರ್ ಇದು ಅತ್ಯಂತ ಸಮಗ್ರವಾಗಿದೆ. ಪ್ಯಾರಿಸ್ನ ದೃಷ್ಟಿ ಗುರುತಿಸಬಹುದಾದ ಮತ್ತು ದೂರದೃಷ್ಟಿಯಿಂದ ಕೂಡಿದೆ, ವ್ಯಾಪಕವಾದ ವಿಸ್ಟಾಗಳು, ಮುಂಗೋಪದ ಸೆಟ್ ತುಣುಕುಗಳು ಮತ್ತು ಭವಿಷ್ಯದ ವರ್ಚುವಲ್ ರಿಯಾಲಿಟಿ. <br /> <br /> ಕಥೆಯ ಸಾಲು ತುಂಬಾ ಸರಳವಾಗಿದೆ, ಕೆಲವು ಆಶ್ಚರ್ಯಗಳೊಂದಿಗೆ, ಆದರೆ ಅದು ನಾನು ಹೆಚ್ಚು ಇಷ್ಟಪಡುವುದಿಲ್ಲ ಚಿತ್ರದ ಬಗ್ಗೆ. ಇದು ದೃಶ್ಯ .ತಣ. <br /> <br /> 3D ಯಲ್ಲಿ ಮುಗಿದಿದೆ ಮತ್ತು ಕಪ್ಪು ಮತ್ತು ಬಿಳಿ ಬಣ್ಣದಲ್ಲಿ ಪ್ರದರ್ಶಿಸಲಾಗುತ್ತದೆ (ಗ್ರೇ ಇಲ್ಲ!) ಕೇವಲ ಒಂದು ಸಣ್ಣ ಬಣ್ಣದ ಬಣ್ಣವನ್ನು ಹೊಂದಿರುತ್ತದೆ, ಇದು ಶಬ್ದಗಳಿಗಿಂತ ಕಣ್ಣುಗಳ ಮೇಲೆ ಕಡಿಮೆ ಗಟ್ಟಿಯಾಗಿರುತ್ತದೆ. ಅನೇಕ "ಆರ್ಟಿ" ಕ್ಯಾಮೆರಾ ಶಾಟ್‌ಗಳಿವೆ - ಕ್ಲೋಸಪ್‌ಗಳು ಮತ್ತು ಬೆಸ ದೃಷ್ಟಿಕೋನಗಳು - ಆದರೆ ಅದು ಚಿತ್ರದ ಮನೋಧರ್ಮವನ್ನು ಹೆಚ್ಚಿಸುತ್ತದೆ. ಒಟ್ಟಾರೆಯಾಗಿ ನೀವು ತುಣುಕಿನ ರೂಪದಲ್ಲಿ ಗ್ರಾಫಿಕ್ ಕಾದಂಬರಿಯ ಅನಿಸಿಕೆ ಪಡೆಯುತ್ತೀರಿ. <br /> <br /> ನಾನು ಚಲನಚಿತ್ರವನ್ನು ರೊಟೊಸ್ಕೋಪ್ ಮಾಡಿದ್ದೇನೆ ಎಂಬ ಅನಿಸಿಕೆಗೆ ಒಳಗಾಗಿದ್ದೆ, ಪಾತ್ರದ ಮುಖದ ಅಭಿವ್ಯಕ್ತಿಗಳಲ್ಲಿ ಅನಿಮೇಷನ್ ಮತ್ತು ಹೆಚ್ಚಿನ ವಿವರಗಳ ಮಟ್ಟ. ಆದರೆ "ಎ ಸ್ಕ್ಯಾನರ್ ಡಾರ್ಕ್ಲಿ" ಯಂತಲ್ಲದೆ - ಇದು ಅಸಂಗತ ಅಕ್ಷರ ವ್ಯಾಖ್ಯಾನದಿಂದ ಬಳಲುತ್ತಿದೆ (ಅಥವಾ ಕೂದಲಿನಿಂದ ಕೆಲವು ಆಕಾರವನ್ನು ಬದಲಾಯಿಸುವ ವಿಧಾನವನ್ನು ನೋಡಿ!) - ನವೋದಯವು ಸ್ಥಿರ ಮತ್ತು ನಿಖರವಾಗಿರುತ್ತದೆ. ಪಾತ್ರವು ಕ್ಲೋಸ್-ಅಪ್‌ನಲ್ಲಿರುವಾಗ, ಸೇರಿಸಿದ ವಿವರಗಳು ಮತ್ತು ವಿನ್ಯಾಸವನ್ನು ಜೇನುನೊಣವಾಗಿ ಕಾಣಬಹುದು, ಆದರೆ ಮಿಡ್-ಶಾಟ್‌ನಲ್ಲಿ ಅಥವಾ ಹೆಚ್ಚಿನ ದೂರದಲ್ಲಿ ವಿವರಗಳನ್ನು ಬಿಟ್ಟುಬಿಡಲಾಗುತ್ತದೆ, ಆದರೆ ಅಕ್ಷರ ವ್ಯಾಖ್ಯಾನಕ್ಕೆ ಹಾನಿಯಾಗದಂತೆ. <br /> <br /> ನನಗೆ, ಚಿತ್ರದ ಏಕೈಕ ಕೆಳಭಾಗವೆಂದರೆ, ಒಂದು ವ್ಯಾಖ್ಯಾನದಲ್ಲಿ ಇದು ಒಂದು-ಆಫ್ ಪ್ರಾಜೆಕ್ಟ್ ಎಂದು ನಮಗೆ ತಿಳಿಸಲಾಗಿದೆ. ಅಂತಹ ಅವಮಾನ, ನಾನು ಈ ಭವಿಷ್ಯದ ಚಲನಚಿತ್ರ-ನಾಯ್ರ್ ಕಥಾಹಂದರವನ್ನು ಮತ್ತು ವಿಶೇಷವಾಗಿ ಈ ಅತ್ಯಾಧುನಿಕ ಗ್ರಾಫಿಕ್ ಶೈಲಿಯಲ್ಲಿ ನೋಡಲು ಬಯಸುತ್ತೇನೆ. <br /> <br /> ಓಹ್, ಮತ್ತು ಇಂಗ್ಲಿಷ್ ಡಬ್ ಕೂಡ ಅದ್ಭುತವಾಗಿದೆ. <br /> <br /> ಎಲ್ಲಾ ಉತ್ತಮ ಚಲನಚಿತ್ರ ಮತ್ತು ಹೆಚ್ಚು ಶಿಫಾರಸು ಮಾಡಲಾಗಿದೆ.#1
ಫೋಟೋ-ಸೇವೆಯ ಡ್ರಾಪ್-ಆಫ್ ನಿಲ್ದಾಣದ ಅಟೆಂಡೆಂಟ್ ವ್ಯಾಲೇಸ್ ನಪಾಮ್ ಅವರ ಜೀವನಶೈಲಿಯೊಂದಿಗೆ ಚಿತ್ರವು ನಿಧಾನವಾಗಿ ಪ್ರಾರಂಭವಾಗುತ್ತದೆ. ಅಗ್ನಿಸ್ಪರ್ಶದ ಶಿಕ್ಷೆಯ ಪರಿಣಾಮವಾಗಿ ಅವನ ಹೆಂಡತಿಯನ್ನು ಪಾದದ ಕಂಕಣದಿಂದ ತನ್ನ ಮನೆಗೆ ಸೀಮಿತಗೊಳಿಸಲಾಗಿದೆ. ವ್ಯಾಲೇಸ್ ಸ್ವಯಂಸೇವಕ ಅಗ್ನಿಶಾಮಕ ವಿಭಾಗದ ಸದಸ್ಯರಾಗಿದ್ದು, ಅಗ್ನಿಶಾಮಕ ದಳವನ್ನು ಗಂಭೀರವಾಗಿ ಪರಿಗಣಿಸುತ್ತಾರೆ. ಅದರ ನಕ್ಷತ್ರಗಳಲ್ಲಿ ಒಂದು ವ್ಯಾಲೇಸ್‌ನ ಸಹೋದರ ವೈಲ್ಡರ್ ನಪಾಮ್. ಅವನು ಕೋಡಂಗಿ, ಆದರೆ ಅವನಿಗೆ ವಿಶೇಷ ಪ್ರತಿಭೆ ಇದೆ. <br /> <br /> ವ್ಯಾಲೇಸ್ ಕೂಡ ಹಾಗೆ. ಅವರಿಬ್ಬರೂ ಪೈರೋಕಿನೆಟಿಕ್ಸ್ ಅಥವಾ "ಪೈರೋಟಿಕ್ಸ್", ಮಾನಸಿಕ ಶಕ್ತಿಯ ಮೂಲಕ ಬೆಂಕಿಯನ್ನು ಪ್ರಾರಂಭಿಸುವ ಸಾಮರ್ಥ್ಯ ಹೊಂದಿದ್ದಾರೆ. ವ್ಯಾಲೇಸ್ ತನ್ನ ಅಧಿಕಾರವನ್ನು ರಹಸ್ಯವಾಗಿಡುತ್ತಾನೆ; ವೈಲ್ಡರ್ ತನ್ನ ಪರಿಚಯಸ್ಥರಿಗೆ ಅವನು ಏನು ಮಾಡಬಹುದೆಂದು ತಿಳಿಯಲು ಅನುವು ಮಾಡಿಕೊಡುತ್ತಾನೆ. <br /> <br /> ಸ್ಪಾಯ್ಲರ್: ಅವರ ಕೆಲವು ವ್ಯತ್ಯಾಸಗಳು ಬಾಲ್ಯದ ಘಟನೆಯೊಂದಕ್ಕೆ ಹೋಗುತ್ತವೆ, ಅಲ್ಲಿ ಅವರು ಅಜಾಗರೂಕತೆಯಿಂದ ಅಲೆಮಾರಿಗಳ ಸಾವಿಗೆ ಕಾರಣರಾದರು. ವ್ಯಾಲೇಸ್ ತನ್ನ ಅಧಿಕಾರವನ್ನು ಬಳಸದಂತೆ ತಡೆಯುತ್ತಾನೆ; ವೈಲ್ಡರ್ ರಾಷ್ಟ್ರೀಯ ಟಿವಿಯಲ್ಲಿ ಸಾರ್ವಜನಿಕವಾಗಿ ಹೋಗಲು ಬಯಸುತ್ತಾನೆ. ಅವಳು ವಿವಾದದ ಮೂಳೆಯಾಗುತ್ತಾಳೆ, ಮತ್ತು ಸಹೋದರರು ಅಂತಿಮವಾಗಿ ಅಕ್ಷರಶಃ ಗುಂಡಿನ ಚಕಮಕಿಯನ್ನು ಹೊಂದಲು ಒಂದು ಕಾರಣವಾಗಿದೆ. <br /> <br /> ಈ ಚಿತ್ರವು ಮನರಂಜನೆಯಾಗಿದೆ, ಆದರೆ ನಗು-ಜೋರಾಗಿ ತಮಾಷೆಯಾಗಿಲ್ಲ. ನನ್ನ ಲೈಬ್ರರಿಯಲ್ಲಿ ನಕಲು ಹೊಂದಲು ಇದು ಸಾಕಷ್ಟು ಎಂದು ನಾನು ಭಾವಿಸುತ್ತೇನೆ. ಇದು ಉತ್ತಮ ಆಫ್‌ಬೀಟ್ ಚಿತ್ರ.#1
