ಈ "ಸಾಕ್ಷ್ಯಚಿತ್ರ" ಎಂದು ಕರೆಯಲ್ಪಡುವ ಯುಎಸ್ಎ ಚಂದ್ರ-ಇಳಿಯುವಿಕೆಯನ್ನು ನಕಲಿ ಮಾಡಿದೆ ಎಂದು ಹೇಳಲು ಪ್ರಯತ್ನಿಸುತ್ತದೆ. ವರ್ಷ ಸರಿ. <br /> <br /> ನಿಜವಾಗಿ ಪ್ರಕರಣವನ್ನು ಅಧ್ಯಯನ ಮಾಡಿದ ಎಲ್ಲರಿಗೂ ವಿಭಿನ್ನ ತಿಳಿದಿದೆ. <br /> <br /> ಮೊದಲನೆಯದಾಗಿ: ಖಂಡಿತವಾಗಿಯೂ ಪುರಾವೆ ಇದೆ. ಗಗನಯಾತ್ರಿಗಳು ಚಂದ್ರನ ಮೇಲೆ ಇದ್ದಾಗ, ಅವರು ಚಂದ್ರನಿಂದ ಅನೇಕ ಪೌಂಡ್ ಬಂಡೆಯನ್ನು ಮರಳಿ ತಂದರು - ಭೂವೈಜ್ಞಾನಿಕ ಅಧ್ಯಯನಕ್ಕಾಗಿ. ಇವುಗಳು ಪ್ರಪಂಚದಾದ್ಯಂತ ನೂರಾರು ಲ್ಯಾಬ್‌ಗಳಿಗೆ ಹರಡಿತು, ಅವರು ಅವುಗಳನ್ನು ಪರೀಕ್ಷಿಸಿದರು. ಮತ್ತು ಅವರೆಲ್ಲರೂ ಒಂದೇ ಗ್ರಹದಿಂದ ಬಂದವರು, ಭೂಮಿಯಲ್ಲ ಎಂದು ತೀರ್ಮಾನಿಸಿದರು: ಏಕೆಂದರೆ ಮೂಲ ಅಂಶಗಳ ಆಂತರಿಕ ಐಸೊಟೋಪ್‌ಗಳು ಭೂಮಿಯ ಮೇಲೆ ಕಂಡುಬರುವವುಗಳಿಗಿಂತ ಭಿನ್ನವಾಗಿವೆ, ಆದರೆ ಚಂದ್ರನ ಮೇಲೆ ಇರುವ ಲೆಕ್ಕಾಚಾರಕ್ಕೆ ಹೋಲುತ್ತವೆ. I.E. ಪಿತೂರಿ ಸಿದ್ಧಾಂತಿಗಳು ಎಂದಿಗೂ ಏನನ್ನೂ ಅಧ್ಯಯನ ಮಾಡುವುದಿಲ್ಲ: ಅವರು ತಮ್ಮ ಸಿದ್ಧಾಂತಕ್ಕೆ ಸರಿಹೊಂದುವ ವಿಷಯವನ್ನು ಮಾತ್ರ ತೆಗೆದುಕೊಳ್ಳುತ್ತಾರೆ ಮತ್ತು ಉಳಿದದ್ದನ್ನು ನಿರ್ಲಕ್ಷಿಸುತ್ತಾರೆ. ಐಇ ಧ್ವಜ ಚಲಿಸುತ್ತದೆ. ತಾರ್ಕಿಕ ವಿವರಣೆಯಿದೆ: ಗಗನಯಾತ್ರಿ ಅದನ್ನು ತನ್ನ ಕೈಯಿಂದ ಸರಿಸಿದನು, ಆದ್ದರಿಂದ ಅದು ಚಲಿಸಿತು. ಮತ್ತು ಇದು ಏನು ಸಾಬೀತುಪಡಿಸುತ್ತದೆ: ಅಲ್ಲದೆ, ಪಿತೂರಿ ಸಿದ್ಧಾಂತಿಗಳು ತುಣುಕನ್ನು ಸಹ ಅಧ್ಯಯನ ಮಾಡಿದರೆ, ಗಗನಯಾತ್ರಿಗಳ ನಂತರ ಧ್ವಜವು ಎಂದಿಗೂ ಚಲಿಸುವುದಿಲ್ಲ ಎಂದು ಅವರು ನೋಡುತ್ತಾರೆ, ಅಂದರೆ. ಪಿತೂರಿ ಸಿದ್ಧಾಂತಿಗಳು ಕೆಟ್ಟ-ವಿಜ್ಞಾನಿಗಳು, ಅವರು ವಿಷಯವನ್ನು ಸರಿಯಾಗಿ ಅಧ್ಯಯನ ಮಾಡಲು ಸಾಧ್ಯವಿಲ್ಲ, ಅಥವಾ ಅವರು ಬಂದದ್ದನ್ನು ಹೊಂದುವವರೆಗೆ ಮಾತ್ರ ಅದನ್ನು ಅಧ್ಯಯನ ಮಾಡುತ್ತಾರೆ, ಇದರಿಂದ ಅವರು ಅದರಿಂದ ಸುಳ್ಳು ಹೇಳಬಹುದು ಮತ್ತು ಲಾಭ ಗಳಿಸಬಹುದು (ಐಇ ಇದನ್ನು "ಸಾಕ್ಷ್ಯಚಿತ್ರ" ಎಂದು ಕರೆಯಲಾಗುತ್ತದೆ ). <br /> <br /> ಒಂದು ಹೇಳಿಕೆಯು ಚಂದ್ರನ ಮೇಲೆ ಚಿತ್ರೀಕರಿಸಲ್ಪಟ್ಟಿದೆ ಎಂದು ಹೇಳುತ್ತದೆ ಏಕೆಂದರೆ ಎಲ್ಲಾ ನೆರಳುಗಳು ಬೇರೆ ಬೇರೆ ಸ್ಥಳಗಳಿಂದ ಬರುತ್ತವೆ, ಏಕೆಂದರೆ ವಿಭಿನ್ನ ಬೆಳಕಿನ ಮೂಲಗಳಿವೆ, ಸ್ಟುಡಿಯೊದಿಂದ ಕೃತಕ ಬೆಳಕು. ಮತ್ತೊಮ್ಮೆ ಪಿತೂರಿ ಸಿದ್ಧಾಂತಿಗಳು ತಪ್ಪಾಗಿದ್ದಾರೆ (ಎಂದಿನಂತೆ), ರಾತ್ರಿಯಲ್ಲಿ ಭೂಮಿಯ ಮರುಭೂಮಿಯಲ್ಲಿ ಅದೇ ರೀತಿ ಸಂಭವಿಸುತ್ತದೆ, ಯಾವುದೇ ಬೆಳಕಿನ ಮೂಲಗಳಿಲ್ಲ. ಆದರೆ ಯಾವುದೇ ಪಿತೂರಿ ಸಿದ್ಧಾಂತಿಗಳು ತಮ್ಮ ಅಜ್ಜಿಯ ನೆಲಮಾಳಿಗೆಯ ಹೊರಗೆ ಎಷ್ಟು ದಿನಗಳವರೆಗೆ ಸ್ಟಾರ್ ಟ್ರೆಕ್-ಸಮಾವೇಶವನ್ನು ನಡೆಸಿದ್ದಾರೆಂದು ನನಗೆ ಅನುಮಾನವಿದೆ. <br /> <br /> ಪಿತೂರಿ ಸಿದ್ಧಾಂತಿಗಳು ನಿರಾಕರಿಸುತ್ತಿದ್ದಾರೆ, ದೊಡ್ಡ ಸಮಯ. ಅವರು ನೋಡಲು ಬಯಸುವದನ್ನು ಮಾತ್ರ ನೋಡುತ್ತಾರೆ. ಆದ್ದರಿಂದ ಅವರು ಈ ಎಲ್ಲಾ ಸುಳ್ಳುಗಳನ್ನು ಮುಖ್ಯವೆಂದು ತೋರುತ್ತದೆ - ಅದು ಸತ್ಯ.#0
"ಟೇಪ್ಹೆಡ್ಸ್", ಮ್ಯೂಸಿಕ್ ವಿಡಿಯೋ ವ್ಯವಹಾರದ ತಮಾಷೆಯ, ತಮಾಷೆಯ ವಂಚನೆಯಾಗಿದ್ದು, ಇದು ಹಾಸ್ಯಮಯ ಕಿರುಚಿತ್ರವಾಗಿರಬಹುದು ಮತ್ತು ನಕ್ಷತ್ರಗಳಾದ ಜಾನ್ ಕುಸಾಕ್ ಮತ್ತು ಟಿಮ್ ರಾಬಿನ್ಸ್ ಅವರು ಅಸಂಬದ್ಧ ಅವ್ಯವಸ್ಥೆಯ ಸ್ವಿಂಗ್‌ನಲ್ಲಿ ಸಲೀಸಾಗಿರುತ್ತಾರೆ. ಅವರು ಲಾಸ್ ಏಂಜಲೀಸ್‌ನಲ್ಲಿ ಇಬ್ಬರು ಅರೆ-ಬುದ್ಧಿವಂತ ಸೆಕ್ಯುರಿಟಿ ಗಾರ್ಡ್‌ಗಳನ್ನು ಆಡುತ್ತಾರೆ, ಅವರು ತಮ್ಮದೇ ಆದ ವಿಡಿಯೋ ಏಸಸ್ ಅನ್ನು ಪ್ರಾರಂಭಿಸುತ್ತಾರೆ, ಗುಂಪುಗಳು, ಪಾರ್ಟಿಗಳು ಮತ್ತು ಒಂದು ಡೆತ್‌ಬೆಡ್ ಸ್ಟಾರ್‌ಗಾಗಿ ಉಲ್ಲಾಸದ ವೀಡಿಯೊಗಳನ್ನು ತಯಾರಿಸುತ್ತಾರೆ. ಚಾಲನಾ ಸಮಯವನ್ನು ಪ್ಯಾಡ್ ಮಾಡಲು ಚಲನಚಿತ್ರ ನಿರ್ಮಾಪಕರು ಮಂದವಾದ ಕಥಾವಸ್ತುವನ್ನು ಆವಿಷ್ಕರಿಸಬೇಕಾಗಿರುವುದು ತುಂಬಾ ಕೆಟ್ಟದಾಗಿದೆ (ವಕ್ರ ರಾಜಕಾರಣಿ ಮತ್ತು ಅವರ ಸಹಾಯಕರನ್ನು ಒಳಗೊಂಡ ಷೆನಾನಿಗನ್‌ಗಳು ಚಲನಚಿತ್ರದ ಪ್ರಾಥಮಿಕ ಬಲದಿಂದ ದೂರವಿರುವುದನ್ನು ಹೊರತುಪಡಿಸಿ ಹೆಚ್ಚಿನದನ್ನು ಮಾಡುವುದಿಲ್ಲ, ಸಂಗೀತ ಸಂಸ್ಕೃತಿಯನ್ನು ಕಳುಹಿಸುವುದು 80 ರ ದಶಕದ ಕೊನೆಯಲ್ಲಿ). ಇನ್ನೂ, ಕುಸಾಕ್ ಮತ್ತು ರಾಬಿನ್ಸ್ ಇಲ್ಲಿ ಒಂದೆರಡು ಮೂಲಗಳನ್ನು ರಚಿಸುತ್ತಾರೆ: ದಡ್ಡತನದ ಆದರೆ ಸಡಿಲವಾದ, ಹಿಪ್ಸ್ಟರ್ ಅಥವಾ ಪೋಸರ್ ಆಗದೆ ರಸ್ತೆ-ಸ್ಮಾರ್ಟ್, ಈ ವ್ಯಕ್ತಿಗಳು ಒಂದೇ ರೀತಿಯ ತರಂಗಾಂತರದಲ್ಲಿದ್ದಾರೆ ಮತ್ತು ಅವರು ಎಂದಿಗೂ ಒಬ್ಬರನ್ನೊಬ್ಬರು ಕೆಳಗಿಳಿಸುವುದಿಲ್ಲ. ಅವರು ಸ್ನೇಹಿತ-ಹಾಸ್ಯಗಳಲ್ಲಿ ನಿಜವಾದ ವಿಷಯ. * 1/2 ರಿಂದ ****#0
ಅವರ ಸರಿಯಾದ ಮನಸ್ಸಿನಲ್ಲಿ ಯಾರು ಈ ಚಲನಚಿತ್ರದಂತೆ ಮೂರ್ಖತನವನ್ನು ಮಾಡುತ್ತಾರೆ? <br /> <br /> ಸೆಕ್ಯುರಿಟಿ ಗಾರ್ಡ್‌ನ ಆಕಸ್ಮಿಕ ಹತ್ಯೆ ... ಎರಡು ಆಯಾಮದ ಪಾತ್ರಗಳು ಎರಡು ವರ್ಷ ವಯಸ್ಸಿನವರು ಚಿತ್ರಿಸಬಹುದಿತ್ತು ... ಮತ್ತು ಉತ್ತಮ ... <br /> <br /> ಸಾವಿನ ಕೆಂಪು ಟೂಲ್‌ಬಾಕ್ಸ್? ದಯವಿಟ್ಟು .... <br /> <br /> ಲಘೂಷ್ಣ ದುರ್ಬಲ ಕೊಲೆಗಡುಕರು ... <br /> <br /> ನರಕದಿಂದ ವರ್ತಿಸುತ್ತಿದ್ದಾರೆ ... <br /> <br /> ಶೈಲಿಯಲ್ಲಿ ಈ ಚಲನಚಿತ್ರವು ಹದಿಹರೆಯದ ಹಾಸ್ಯ, ಥ್ರಿಲ್ಲರ್ ನಡುವೆ ಬದಲಾಗುತ್ತದೆ , ವಾಯ್ಯುರಿಸಮ್ ಮತ್ತು ... ಹೆಣ್ಣು ... (ಉಹ್ಮ್) ರಾಂಬೊ? <br /> <br /> ನಂಬಲಾಗದ ಮತ್ತು ಇದು ಯಾವುದೇ ಆಲೋಚಿಸುವ ವ್ಯಕ್ತಿಗೆ ಮಾಡಿದ ಅವಮಾನ. ನೋಡಬೇಡಿ, ಹೊರನಡೆಯಿರಿ ಇದು ನೀವು imagine ಹಿಸಿರುವುದಕ್ಕಿಂತ ಭಯಾನಕವಾಗಿದೆ ... <br /> <br /> ಮತ್ತು ಅದರ ಮೇಲೆ ಅದು ಹಿಂಸಾಚಾರದಲ್ಲಿ ಅತಿಯಾಗಿ ಗ್ರಾಫಿಕ್ ಮಾಡುವ ಮೂಲಕ ಸೊಂಟವಾಗಲು ಪ್ರಯತ್ನಿಸುತ್ತಿದೆ ... <br /> < br /> ಶ್ರೀಮತಿ ಮಾಂಟ್ಫೋರ್ಡ್: ಶೂಟ್ ಎಮ್ ಅಪ್ ವಿನೋದ ಮತ್ತು ತಮಾಷೆಯಾಗಿತ್ತು, ಇದು ಕೇವಲ ಕರುಣಾಜನಕ ಮತ್ತು ಭಯಾನಕವಾಗಿದೆ. ಮುಂದಿನ ಬಾರಿ ಅದೃಷ್ಟ. :-(#0
ಈ ಚಿತ್ರಕ್ಕೆ ಕಥೆಯಿಲ್ಲ. ಇದು ಮುಗ್ಧ ಯುವತಿಯನ್ನು ಹಿಂಸಿಸುವ ಹುಡುಗರ ಗುಂಪಿನ ಬಗ್ಗೆ ಮಾತ್ರ. <br /> <br /> !!! ಸ್ಪಾಯ್ಲರ್ಗಳು !!! ಅವಳನ್ನು ಬಲೆಗೆ ಹಾಕಿ ಮತ್ತು ಅವಳನ್ನು ಬರ್ಡ್‌ಫುಡ್‌ನಂತೆ ನೇತುಹಾಕಲು ಬಿಡಿ, ಅವಳು ಚುಚ್ಚುವ ತನಕ ಅವಳನ್ನು ಕುರ್ಚಿಯ ಮೇಲೆ ತಿರುಗಿಸಿ, ಅವಳನ್ನು ದೊಡ್ಡ ಶಬ್ದಕ್ಕೆ ಒಡ್ಡಿಕೊಳ್ಳಿ, ಅವಳ ಮೇಲೆ ಕುದಿಯುವ ಎಣ್ಣೆಯನ್ನು ಸುರಿಯಿರಿ, ಹುಣ್ಣುಗಳಲ್ಲಿ ಹುಳುಗಳನ್ನು ಹಾಕಿ, ಅವಳ ಕೈಯನ್ನು ಸ್ಲೆಡ್ಜ್-ಸುತ್ತಿಗೆಯಿಂದ ಪುಡಿಮಾಡಿ ಮತ್ತು ಅಂತಿಮವಾಗಿ ಅವಳ ಕಣ್ಣಿನ ಮೂಲಕ ಸೂಜಿಯನ್ನು ಇರಿಸುತ್ತದೆ. <br /> <br /> ಈ ಚಲನಚಿತ್ರವು ತುಂಬಾ ವಾಸ್ತವಿಕವಾಗಿದ್ದು, ಅದು ನಕಲಿ ಎಂದು ನನಗೆ ತಿಳಿದಿಲ್ಲದಿದ್ದರೆ ಅದು ಸ್ನಫ್-ಮೂವಿ ಎಂದು ನಾನು ಭಾವಿಸುತ್ತೇನೆ. ಈ ಚಲನಚಿತ್ರದಿಂದ ನನಗೆ ಅಸಹ್ಯವಾಗಿದ್ದರೂ ನಾನು ಅದನ್ನು ನಿಜವಾಗಿಯೂ ಇಷ್ಟಪಟ್ಟೆ. ಅದು ನನ್ನನ್ನು ಹೆದರಿಸಿತ್ತು. ಇದು ಒಂದು ರೀತಿಯ ಉದ್ದೇಶವನ್ನು ತುಂಬುತ್ತದೆ ಎಂದು ನಾನು ess ಹಿಸುತ್ತೇನೆ. ನಾನು ಅದನ್ನು 10/10 ನೀಡುತ್ತೇನೆ.#1
ಇಡೀ ಚಲನಚಿತ್ರವು ತಾಜಾ ಚಿತ್ರಗಳು ಮತ್ತು ಆಸಕ್ತಿದಾಯಕ mat ಾಯಾಗ್ರಹಣದೊಂದಿಗೆ ಸುಂದರವಾಗಿ ಆಡಲ್ಪಟ್ಟಿದೆ ಎಂದು ನಾನು ಭಾವಿಸಿದೆ. ನಟರು ತಮ್ಮ ಪಾತ್ರದ ಬೆನ್ನಿನ ಮೇಲೆ ಸುಮಾರು ಪರಿಪೂರ್ಣ ಸಮಯದಲ್ಲಿದ್ದರು ಮತ್ತು ಉತ್ತಮವಾಗಿ ಕಾಣುತ್ತಿದ್ದರು. ಸಂಗೀತವು ಸೊಂಪಾದ ಮತ್ತು ಚೆನ್ನಾಗಿ ಚಿಂತನೆಯಿಂದ ಕೂಡಿತ್ತು. ಇದು ಅಂತ್ಯದ ಯೋಗ್ಯವಾದ ತಿರುವನ್ನು ಸಹ ಹೊಂದಿತ್ತು. ಹಾಗಾದರೆ ಪ್ರತಿಯೊಬ್ಬರೂ ಅದನ್ನು ಮತ ಚಲಾಯಿಸುವುದರಲ್ಲಿ ಏನಿದೆ? ಈ ಕಥೆಯು ಸಂಪೂರ್ಣವಾಗಿ ತಾಜಾವಾಗಿರಲಿಲ್ಲ (ಇಡೀ ಟೆಲಿವಿಷನ್ ಕಾರ್ಯಕ್ರಮದ ಕಲ್ಪನೆಯೊಂದಿಗೆ "ರನ್ನಿಂಗ್ ಮ್ಯಾನ್" ನ ಅವಶೇಷದಂತೆ ಭಾಸವಾಯಿತು), ಆದರೆ ಸಾರ್ವಜನಿಕರು ತಮ್ಮ ಮೆಸ್ಸೀಯನನ್ನು ಹೇಗೆ ಆರಿಸುತ್ತಾರೆ ಎಂಬುದರ ಬಗ್ಗೆ ಕ್ರಿಶ್ಚಿಯನ್ ಧರ್ಮ ಮತ್ತು ಜುದಾಯಿಸಂನ ಬಗೆಗಿನ ವರ್ತನೆ ಖಂಡಿತವಾಗಿಯೂ ಸಾಕಷ್ಟು ನಿಜವೆಂದು ತೋರುತ್ತದೆ. ಆಧುನಿಕ ಜನಸಮೂಹದ ಮುಂದೆ ಇರಿಸಲ್ಪಟ್ಟ ಈ ಒಬ್ಬ ವ್ಯಕ್ತಿಯನ್ನು ಅನುಸರಿಸಲು ಮತ್ತು ಅವನ ಅವಕಾಶದಿಂದಾಗಿ ಅವನನ್ನು ಪೀಠದ ಮೇಲೆ ಇರಿಸಲು ಇದು ಅರ್ಥಪೂರ್ಣವಾಗಿದೆ. <br /> <br /> ಕ್ರಿಶ್ಚಿಯನ್ನರು ಅಥವಾ ಇತರ ಧಾರ್ಮಿಕ ಜನರು ಇದನ್ನು ತೆಗೆದುಕೊಳ್ಳುವ ಸಾಧ್ಯತೆಯಿದೆ ಏಕೆಂದರೆ ಚಲನಚಿತ್ರವು ಅದರಲ್ಲಿ "ದೇವರು" ಎಂಬ ಪದವಿದೆ, ಆದರೆ ಚಲನಚಿತ್ರ ನಿರ್ಮಾಪಕರು ಏನು ಮಾಡಲು ಪ್ರಯತ್ನಿಸುತ್ತಿದ್ದಾರೆ ಎಂಬುದನ್ನು ಇದು ತೋರಿಸುತ್ತದೆ, ಬಹುಶಃ ಈ ರೀತಿಯ ಜಗತ್ತನ್ನು ಎಂದಿಗೂ ನೋಡದ ಜನರಿಗೆ, ವಿಶೇಷವಾಗಿ ಆಧುನಿಕ ಜಗತ್ತಿನಲ್ಲಿ ಕ್ರಿಶ್ಚಿಯನ್ ಧರ್ಮವು ಹೆಚ್ಚು ಹೆಚ್ಚು ಅಂಗೀಕರಿಸಲ್ಪಟ್ಟಿದೆ ಮತ್ತು ಮರೆತುಹೋಗಿದೆ. ಕೆಲವರ ಮೂಲಕ. <br /> <br /> ನಾನು ಇದನ್ನು ಐಎಮ್‌ಡಿಬಿಯಲ್ಲಿ 7/10 ನಕ್ಷತ್ರಗಳನ್ನು ನೀಡಿದ್ದೇನೆ. ಚಲನಚಿತ್ರದ ಪ್ರತಿ oun ನ್ಸ್ ಮನರಂಜನೆ ಮತ್ತು ಮೂಲ ಎಂದು ನಾನು ಭಾವಿಸಿದೆವು. ಸ್ಪೇನ್‌ನ ಮ್ಯಾಡ್ರಿಡ್‌ನಿಂದ ನಿಮ್ಮ ಹತ್ತಿರವಿರುವ ಟಿವಿಗೆ ಬರುವ ಆಧುನಿಕ ಮೆಸ್ಸೀಯನ ಸಾಧ್ಯತೆಗಳ ಬಗ್ಗೆ ಮನರಂಜನೆಯ ಚಲನಚಿತ್ರವನ್ನು ನೋಡಲು ನೀವು ತುಂಬಾ ಮನನೊಂದಿಲ್ಲದಿದ್ದರೆ ಅದನ್ನು ಪರಿಶೀಲಿಸಿ.#1
ಜಿಯಾರ್ಡೀಸ್ ... ಭೂಮಿಯ ಪಾತ್ರಗಳ ಉಪ್ಪು ... ಇಟ್ಟಿಗೆ ಕಟ್ಟುವವರು ... ಬಿಯರ್ ... ಜಿಯಾರ್ಡೀಸ್ ... ಹ್ಯಾಪಿ ಗೋ ಲಕ್ಕಿ ... ವಿದೇಶದಲ್ಲಿ ಕೆಲಸ ಮಾಡುವ ಸಾಹಸಗಳು ... ಭೂಮಿಯ ಪಾತ್ರಗಳ ಉಪ್ಪು ... ಬೆಚ್ಚಗಿನ ಅದ್ಭುತ ಜನರು ... ಟೈನ್ ಬ್ರಿಡ್ಜ್ (ಕಣ್ಣಿನಲ್ಲಿ ಕಣ್ಣೀರು) ... ಬ್ರೌನ್ ಆಲೆ ... ಭೂಮಿಯ ಪಾತ್ರಗಳ ಉಪ್ಪು ... ಮುದ್ದಾದ ಪುಟ್ಟ ಕೆಂಪು ಭಾರತೀಯರು ನ್ಯೂಕ್ಯಾಸಲ್ ಯುನೈಟೆಡ್ ಮಕ್ಕಳು ಟಾಪ್ಸ್ ... ಎಮೆಟಿಕ್ ... ಜಿಯಾರ್ಡೀಸ್ ... ಭೂಮಿಯ ಪಾತ್ರಗಳ ಉಪ್ಪು. .. <br /> <br /> ಇತ್ಯಾದಿ ಇತ್ಯಾದಿ .... <br /> <br /> ದಯವಿಟ್ಟು. ಇದು ತುಂಬಾ ಕಳಪೆಯಾಗಿದೆ. ಮತ್ತು ನೀವು ತಿಮೋತಿ ಸ್ಪಾಲ್ ಅನ್ನು ಚೆನ್ನಾಗಿ ತಿಳಿದುಕೊಳ್ಳಬೇಕು. ಅವರು ನಿಮಗೆ ಅಷ್ಟು ಹಣವನ್ನು ಪಾವತಿಸಲಾರರು. <br /> <br /> ಜಿಮ್ಮಿ ನೇಲ್‌ನಂತೆ. ಅವರು ಗಾಯಕ ಮತ್ತು ಬರಹಗಾರರಾಗಿರುವುದರಿಂದ ಅವರು ಪ್ರತಿ ಬಿಟ್ ಉತ್ತಮ 'ನಟ' ಎಂದು ಹೇಳಬಹುದು. ಜಿಮ್ಮಿ ಬನ್ನಿ, ಜೋಕ್ ಮುಗಿದಿದೆ. 'ಮೊಸಳೆ ಶೂಸ್' ಮತ್ತು 'ಸ್ಪೆಂಡರ್' ತುಂಬಾ ತಮಾಷೆಯಾಗಿತ್ತು, ದುರದೃಷ್ಟವಶಾತ್ ಅವರು ಇರಬೇಕೆಂದು ನಾನು ಭಾವಿಸುವುದಿಲ್ಲ. 'Uf ಫ್ ವೈಡರ್ಸೆನ್ ಪೆಟ್' ನೊಂದಿಗೆ ಇದಕ್ಕೆ ವಿರುದ್ಧವಾಗಿ ಅನ್ವಯಿಸುತ್ತದೆ.#0
