ಇದು ನಂಬಲಸಾಧ್ಯವಾದದ್ದು, ಅಂದರೆ "ಮರೆತುಹೋದ ಬುಡಕಟ್ಟು" ಈ ಬೆರಗುಗೊಳಿಸುವ ವಲಸೆಯನ್ನು ವರ್ಷಕ್ಕೆ ಎರಡು ಬಾರಿ ಮಾಡುತ್ತದೆ ಮತ್ತು ಚಲನಚಿತ್ರ ನಿರ್ಮಾಪಕರಾದ ಕೂಪರ್ ಮತ್ತು ಷೋಡ್‌ಸಾಕ್ ಕೆಲವು ದೃಶ್ಯಗಳು ಮತ್ತು ಹೊಡೆತಗಳನ್ನು ಪ್ರದರ್ಶಿಸಲಿಲ್ಲ. ಆದರೆ ಅವು ಯಾವ ಹೊಡೆತಗಳಾಗಿವೆ! ಹೆಚ್ಚಾಗಿ ವಿಪರೀತ ಪರಿಸ್ಥಿತಿಗಳಲ್ಲಿ mat ಾಯಾಗ್ರಹಣ ಅದ್ಭುತವಾಗಿದೆ, ಮತ್ತು ವೀಡಿಯೊ ಬಿಡುಗಡೆಗೆ ಸೇರಿಸಲಾದ ಇರಾನಿನ ಸಂಗೀತದ ಸ್ಕೋರ್ ಈ ಸ್ಮರಣೀಯ ಸಾಕ್ಷ್ಯಚಿತ್ರಕ್ಕೆ ಹೆಚ್ಚಿನ ಶ್ರೀಮಂತಿಕೆಯನ್ನು ನೀಡುತ್ತದೆ. <br /> <br /> ಇದನ್ನು ನೋಡಿದ ನನಗೆ ಸಂತೋಷವಾಯಿತು ಮತ್ತು "ಕಾನ್ ಟಿಕಿ" ಅದೇ ವಾರಾಂತ್ಯದಲ್ಲಿ, ಇದು ರೋಮಾಂಚನಕಾರಿಯಾಗಿದೆ ಮತ್ತು ಪ್ರಾಚೀನ ಉಳಿವಿಗಾಗಿ ಅಥವಾ ಸಾಹಸದ ಅವಶ್ಯಕತೆ ಅಥವಾ ವಿಜ್ಞಾನದ ಹೆಸರಿನಲ್ಲಿ ಇರಲಿ, ಎಷ್ಟು ಕಠಿಣ ಮತ್ತು ಕಠಿಣ ಮತ್ತು ಧೈರ್ಯಶಾಲಿ ಜನರು ಇರಬಹುದೆಂದು ನನಗೆ ಖಚಿತವಾಗಿ ನೋಡಿದೆ.#1
ಚಲನಚಿತ್ರವು ಸಾಕಷ್ಟು ಪ್ರಾರಂಭವಾಯಿತು. ಇದು ಹೊಳೆಯುವ ಹಸಿರು ಉಲ್ಕಾಶಿಲೆಗೆ ಅಪ್ಪಳಿಸಿತು, ಮಹಾಶಕ್ತಿಗಳನ್ನು ಪಡೆಯಿತು (ಟೆಲಿಕಿನೆಸಿಸ್, ಎಕ್ಸರೆ ದೃಷ್ಟಿ, ಅವೇಧನೀಯತೆ, ಹಾರಾಟ, ನಾಯಿಗಳೊಂದಿಗೆ ಮಾತನಾಡುವ ಸಾಮರ್ಥ್ಯ, ಸೂಪರ್‌ಸ್ಪೀಡ್, ಶಾಖದ ದೃಷ್ಟಿ ಮತ್ತು ಸಸ್ಯಗಳನ್ನು ದೊಡ್ಡದಾಗಿ ಮತ್ತು ವೇಗವಾಗಿ ಬೆಳೆಯುವಂತೆ ಮಾಡುವ ಸಾಮರ್ಥ್ಯ), ಮತ್ತು ಅಪರಾಧದ ವಿರುದ್ಧ ಹೋರಾಡುವುದು. ಅಲ್ಲಿಂದ ಅದು ಇಳಿಯುವಿಕೆ. <br /> <br /> ಉಲ್ಕೆಯ ಮನುಷ್ಯನು ತನ್ನ ತಾಯಿಯಿಂದ ವೇಷಭೂಷಣವನ್ನು ಪಡೆಯುತ್ತಾನೆ, ನಿವಾಸಿ ಗ್ಯಾಂಗ್‌ಗಳೊಂದಿಗೆ ಹೋರಾಡುತ್ತಾನೆ ಮತ್ತು ಗ್ಯಾಂಗ್ ನಾಯಕರೊಂದಿಗೆ ಅನೇಕ ಸ್ಥಗಿತಗೊಂಡ ಮುಖಾಮುಖಿಗಳನ್ನು ಹೊಂದಿದ್ದಾನೆ, ಅದು ನಿಮ್ಮನ್ನು ನಿರಾಶಾದಾಯಕ, ದೀರ್ಘಾವಧಿಯವರೆಗೆ ಹೊಂದಿಸಲು ಸಹಾಯ ಮಾಡುತ್ತದೆ , ಮತ್ತು ಅಂತ್ಯವನ್ನು ಮೂರ್ಖರನ್ನಾಗಿ ಮಾಡುತ್ತದೆ. <br /> <br /> ಬಾಕ್ಸಿಂಗ್ ಪಂದ್ಯವನ್ನು ನೋಡುವುದು ಇಷ್ಟವಾಗದಿದ್ದರೆ ಅದು ತುಂಬಾ ಕೆಟ್ಟದ್ದಲ್ಲ, ಅಲ್ಲಿ ಇಬ್ಬರು ಹೋರಾಟಗಾರರು ಪರಸ್ಪರ ಹೊಡೆಯುವಂತೆ ನಟಿಸುವಾಗ ಪ್ರೇಕ್ಷಕರು ಮುಂದೆ ನೋಡುತ್ತಿರುವಾಗ ಹೋರಾಟಗಾರರು ಕೇವಲ ನೃತ್ಯವನ್ನು ಮುಂದುವರಿಸಿ. <br /> <br /> ಈ ಎಲ್ಲಾ ಅಸಂಬದ್ಧತೆಯ ಹೊರತಾಗಿಯೂ ಚಲನಚಿತ್ರವು ಉತ್ತಮ ಅಂಕಗಳನ್ನು ಹೊಂದಿದೆ. ನೀವು ಒಬ್ಬ ಗ್ಯಾಂಗ್ ಅನ್ನು ಮಾತ್ರ ತೆಗೆದುಕೊಳ್ಳಲು ಪ್ರಯತ್ನಿಸಿದರೆ ಅವರು ನಿಮ್ಮ ಮನೆಗೆ ಹಿಂತಿರುಗಿ ನಿಮ್ಮನ್ನು ನೋಯಿಸುತ್ತಾರೆ ಎಂದು ಅದು ಸ್ಪಷ್ಟವಾಗಿ ಹೇಳುತ್ತದೆ. ಗ್ಯಾಂಗ್‌ಗಳು ಮತ್ತು ಸಮುದಾಯಗಳು ತಮ್ಮ ನಿಜವಾದ ಶತ್ರುಗಳನ್ನು ನೋಡಬೇಕು ಎಂದು ಅದು ಹೇಳುತ್ತದೆ (ಪ್ರಾಮಾಣಿಕ ಜನರನ್ನು ಘೆಟ್ಟೋ ಅಸ್ತಿತ್ವಕ್ಕೆ ತಳ್ಳಲು ತಮ್ಮ ಸ್ವಂತ ಉದ್ದೇಶಗಳಿಗಾಗಿ ಬಳಸುವ ದೊಡ್ಡ ಮೇಲಧಿಕಾರಿಗಳು). ಸಮುದಾಯವಾಗಿ ಕೆಲಸ ಮಾಡಲು ಸಿದ್ಧರಿದ್ದರೆ ಜನರಿಗೆ ಹಾನಿಕಾರಕ ಪರಭಕ್ಷಕಗಳನ್ನು ನಾಶಮಾಡಿದರೆ ಅವರಿಗೆ ಸೂಪರ್ ಹೀರೋಗಳ ಅಗತ್ಯವಿಲ್ಲ ಎಂದು ಅದು ಹೇಳುತ್ತದೆ. ಇದು ನಿಜವಾಗಿಯೂ ಕೊರತೆಯಿರುವ ಏಕೈಕ ಸಂದೇಶವೆಂದರೆ ಮತದಾರರು ತಮ್ಮ ಚುನಾಯಿತ ಅಧಿಕಾರಿಗಳನ್ನು (ರುಡಾಲ್ಫ್ ಗಿಯುಲಿಯಾನಿ, ಮರಿಯನ್ ಬ್ಯಾರಿ, ರೊನಾಲ್ಡ್ ರೇಗನ್, ಜಾರ್ಜ್ ಡಬ್ಲ್ಯು. ಬುಷ್, ಮತ್ತು ಜಾರ್ಜ್ ಹೆಚ್.ಡಬ್ಲ್ಯೂ. ಬುಷ್) ವಂಚಕರಲ್ಲ ಎಂದು ಖಚಿತಪಡಿಸಿಕೊಳ್ಳಬೇಕು. <br /> <br />#0
ಜಾರ್ಜ್ ವಿಲ್ಹೆಲ್ಮ್ ಪ್ಯಾಬ್ಸ್ಟ್ ಅವರ ಸಾಮಾಜಿಕ ವಾಸ್ತವಿಕ ಅವಧಿಯ ಅತ್ಯುತ್ತಮ ಸಾಧನೆ 1906 ರ ಆರಂಭದಲ್ಲಿ ಸಂಭವಿಸಿದ ದುರಂತವೊಂದನ್ನು ಆಧರಿಸಿದೆ, ಇದು ಸುಮಾರು 1100 ಫ್ರೆಂಚ್ ಗಣಿಗಾರರ ಪ್ರಾಣವನ್ನು ಬಲಿ ತೆಗೆದುಕೊಂಡಿತು, ಉತ್ತರ ಫ್ರಾನ್ಸ್‌ನ ಕೊರಿಯೆರೆಸ್‌ನಲ್ಲಿನ ಗಣಿಗಳಲ್ಲಿ ಆಳವಾದ ಕಲ್ಲಿದ್ದಲು ಧೂಳು ಸ್ಫೋಟ ಸಂಭವಿಸಿದೆ. ಮೂರು ವಾರಗಳು, ಅಂತಿಮವಾಗಿ ಮಾರಣಾಂತಿಕ ಪಿಟ್ ಅನಿಲವನ್ನು ಬಿಡುಗಡೆ ಮಾಡುತ್ತವೆ, ಅದು ಮಾರಣಾಂತಿಕತೆಯನ್ನು ತಂದಿತು. ಅಂದಾಜು ಡಿಸೈನರ್ ಎರ್ನೊ ಮೆಟ್ಜ್ನರ್ ದುರಂತವನ್ನು ಅನುಕರಿಸುವ ಸಂಪೂರ್ಣ ಸೆಟ್ಗಳನ್ನು ರಚಿಸುತ್ತಾನೆ, ವಾಸ್ತವದ ಗ್ರಹಿಕೆಯನ್ನು ಒದಗಿಸುತ್ತಾನೆ, ಸಾಟಿಯಿಲ್ಲದ ಧ್ವನಿ ಸಂಪಾದನೆಯಿಂದ ವರ್ಧಿಸಲ್ಪಟ್ಟಿದ್ದಾನೆ, ಒಂದು ಕೃತಿಯ ಪ್ರಾರಂಭ ಮತ್ತು ಅಂತ್ಯದ ಭಾಗಗಳಲ್ಲಿ ಅವಿಭಾಜ್ಯ ಆರ್ಕೆಸ್ಟ್ರಾಗಳು ಉತ್ಪಾದಿಸುವ ಏಕೈಕ ಸಂಗೀತದೊಂದಿಗೆ ಆರಲ್ ಪರಿಣಾಮಗಳು ಸಮಾನ ಪ್ರಾಮುಖ್ಯತೆಯನ್ನು ಹೊಂದಿವೆ ಪ್ರಖ್ಯಾತ ನಿರ್ದೇಶಕರ ಆಕರ್ಷಕ ದೃಶ್ಯ ಸಂಯೋಜನೆಗಳು. ಆಟಗಾರರ ಚಲನೆಗಳ ಮೂಲಕ ಶಾಟ್‌ನಿಂದ ಶಾಟ್‌ಗೆ ಕ್ರಿಯೆಯನ್ನು ಬೇರ್ಪಡಿಸುವ ಪ್ಯಾಬ್‌ಸ್ಟ್‌ನ "ಅದೃಶ್ಯ ಸಂಪಾದನೆ" ಈ ಹೆಗ್ಗುರುತು ಚಿತ್ರದೊಳಗೆ ಸರಾಗವಾಗಿ ಸಂಯೋಜಿಸಲ್ಪಟ್ಟಿದೆ ಎಂದು ಸಾಬೀತುಪಡಿಸುತ್ತದೆ, ಇದು ವಾಹನಗಳ ಮೇಲೆ ಅಳವಡಿಸಲಾಗಿರುವ ಕ್ಯಾಮೆರಾಗಳನ್ನು ಬಳಸಿಕೊಂಡು ಭವ್ಯವಾದ mat ಾಯಾಗ್ರಹಣವನ್ನು ಸಹ ತೋರಿಸುತ್ತದೆ, ನಿರ್ದೇಶಕರ ಅವಶ್ಯಕತೆಯಿಲ್ಲದೆ ದೃಶ್ಯಗಳ ನಡುವೆ ಸ್ಥಳಾಂತರಗೊಳ್ಳಲು ಸಾಧ್ಯವಾಗುತ್ತದೆ. ಕತ್ತರಿಸುವುದು. ಕೃತಿಯ ಕಾರ್ಡಿನಲ್ ವಿಷಯವು ಸಮಾಜವಾದಿ ಸಿದ್ಧಾಂತಕ್ಕೆ ಸಂಬಂಧಿಸಿದ್ದರೂ, ಈ ಚಿತ್ರದ ಅವಿಸ್ಮರಣೀಯ ಶಕ್ತಿಯನ್ನು ಅದರ ವಿವರಗಳಲ್ಲಿ ಇರಿಸಲಾಗಿದೆ, ಹಲವಾರು ಕಥಾವಸ್ತುವಿನ ಸಾಲುಗಳನ್ನು ಸಿನೆಮಾ ವಸ್ತ್ರದಲ್ಲಿ ನೇಯ್ಗೆ ಮಾಡುವಲ್ಲಿ ಪ್ಯಾಬ್ಸ್ಟ್‌ನ ನಾನ್‌ಪರೀಲ್ ಕೌಶಲ್ಯದಿಂದ ಹುಟ್ಟಿದ್ದು, ಅವರ ಫಾದರ್‌ಲ್ಯಾಂಡ್ ಆಗಿರುವ ಜರ್ಮನ್ ಪಾರುಗಾಣಿಕಾ ತಂಡಗಳಿಗೆ ಮೆಚ್ಚುಗೆಯನ್ನುಂಟುಮಾಡುತ್ತದೆ. ಫ್ರೆಂಚ್ ಬಲಿಪಶುಗಳ ಕುಟುಂಬಗಳಿಗೆ ಹಾನಿಕಾರಕ ನಷ್ಟಗಳ ಬಗ್ಗೆ ನಿರಾಶೆಯಿಲ್ಲದಿದ್ದರೂ ಬಹಳ ಹೆಮ್ಮೆ; ನಿಸ್ಸಂಶಯವಾಗಿ, ಮೊದಲ ಬಿಡುಗಡೆಯ ಸಮಯದಲ್ಲಿ ಇದ್ದಂತೆ ಇಂದು ಸಿನಾಸ್ಟ್‌ಗೆ ಸಂಪೂರ್ಣವಾಗಿ ಉತ್ತೇಜಿಸುವ ಒಂದು ಸೆಮಿನಲ್ ವಿಜಯ.#1
ನೀವು ಕಾರುಗಳನ್ನು ಇಷ್ಟಪಟ್ಟರೆ ನೀವು ಈ ಚಿತ್ರವನ್ನು ಇಷ್ಟಪಡುತ್ತೀರಿ! <br /> <br /> ಈ ಚಿತ್ರದಲ್ಲಿ ಕೆಲವು ಅದ್ಭುತ ನಟರು ಇದ್ದಾರೆ, ವಿಶೇಷವಾಗಿ ವಿನ್ನಿ ಜೋನ್ಸ್, ಅವರ ವಿಶಿಷ್ಟವಾದ ಅಸಂಬದ್ಧ ವರ್ತನೆ ಮತ್ತು ಹಾರ್ಡ್‌ಕೇಸ್ ನೋಟವನ್ನು ಹೊಂದಿದ್ದಾರೆ. ಇತರರು ಕೆಟ್ಟದ್ದಲ್ಲ ... . <br /> <br /> ಈ ಚಿತ್ರಕ್ಕೆ ಕೇವಲ ಎರಡು ಸಣ್ಣ ನ್ಯೂನತೆಗಳಿವೆ. ಮೊದಲನೆಯದಾಗಿ, ಕಳಪೆ ಕಥಾವಸ್ತು, ಆದರೆ ಜನರು ಈ ಚಿತ್ರವನ್ನು ಕಥಾವಸ್ತುವಿಗೆ ನೋಡುವುದಿಲ್ಲ. ಎರಡನೆಯದಾಗಿ, ಗ್ರ್ಯಾಂಡ್ ಥೆಫ್ಟ್ ಆಟೋ (ಕಾರು ಅಪರಾಧ) ಯ ವೈಭವೀಕರಣ. ಹೇಗಾದರೂ ಜನರು ಫೆರಾರಿಯನ್ನು ಕದಿಯಬಹುದು ಮತ್ತು ಅದರಿಂದ ಪಾರಾಗಬಹುದು ಎಂದು ಜನರು ನಿಜವಾಗಿಯೂ ನಂಬಿದರೆ ಅವರಿಗೆ ಉತ್ತಮ ನೋಟ, ನಿಮಗೆ ಜೈಲಿನಲ್ಲಿ ಒಳ್ಳೆಯ ಸಮಯವಿದೆ ಎಂದು ಭಾವಿಸುತ್ತೇವೆ! <br /> <br /> ನಿಕೋಲಸ್ ಕೇಜ್ ಮುಖ್ಯವಾಗಿ ಕಾರ್ಯನಿರ್ವಹಿಸಬೇಕೆಂದು ನಾನು ಮೊದಲು ಓದಿದಾಗ ಪಾತ್ರ, ನಾನು ಮೊದಲು "... ಸ್ವೀಟ್" ಎಂದು ಭಾವಿಸಿದೆವು, ಆದರೆ ನಂತರ ನಾನು "... ನಾವಾ ಯು ಸಕ್!" ಆದರೆ ಅಂತಿಮವಾಗಿ ಚಲನಚಿತ್ರವನ್ನು ನೋಡಿದ ನಂತರ ನಾನು "... ಹೌದು ಅವನು ಹೀರುತ್ತಾನೆ!" ಎಂದು ಅರಿತುಕೊಂಡೆ. ತಮಾಷೆ ಮಾಡುವುದರಿಂದ ಮಾತ್ರ ಅವನು ಈ ಪಾತ್ರವನ್ನು ಚೆನ್ನಾಗಿ ನಿರ್ವಹಿಸುತ್ತಾನೆ. <br /> <br /> "ಅಕಾಲಿಕ ನಿಧನದ ವೇಳೆ ಅಪರಾಧಿಯ ವ್ಯಕ್ತಿಯು ಸಾಮಾನ್ಯ ಸಿನೆಮಾಕ್ಕೆ ಹೋಗುವ ಪ್ರೇಕ್ಷಕರಿಗೆ ಅಪರಾಧ ಜೀವನದ ಹೊಳಪು ತೆರೆಗಿಂತ ಕೆಳಗಿರುವ ಕಠೋರ ಮುಕ್ತಾಯದ ಬಗ್ಗೆ ಜ್ಞಾನೋದಯ ನೀಡಿದ್ದಾನೆ ಮತ್ತು ಅವರ ಮಾರ್ಗಗಳನ್ನು ಬದಲಾಯಿಸಲು ಪ್ರೇರೇಪಿಸಿದನು, ನಂತರ ಈ ಸಾವು ಅದರೊಂದಿಗೆ ಅಂತರ್ಗತ ಕುಲೀನತೆಯನ್ನು ಹೊಂದಿದೆ ಮತ್ತು ಸರ್ವೋಚ್ಚ ವೈಭವ. ನಾವು. ಎಲ್ಲರೂ ತುಂಬಾ ಅದೃಷ್ಟಶಾಲಿಯಾಗಿರಬೇಕು. ನೀವು "ಕಳಪೆ ಅಪರಾಧಿ" ಎಂದು ಹೇಳಬಹುದು. ನಾನು ಹೇಳುತ್ತೇನೆ: "ಬಡವರು". <br /> <br /> ps - ಏಂಜಲೀನಾ ಜೋಲೀ ವಾಯ್ಟ್ ತುಂಬಾ ಚೆನ್ನಾಗಿ ಕಾಣಿಸುತ್ತಾನೆ!#1
ನಾನು 12 ವರ್ಷದವನಿದ್ದಾಗ ಈ ಚಲನಚಿತ್ರವನ್ನು ನೆನಪಿಸಿಕೊಳ್ಳುತ್ತೇನೆ, ಅದು ಆಶ್ಚರ್ಯಕರವಾಗಿತ್ತು .. ನಾನು ಅದನ್ನು ನೆನಪಿಸಿಕೊಂಡಿದ್ದೇನೆ, ನಾನು ಹಿಂದೆ ನೋಡಿದ ಹೆಚ್ಚಿನ ವಿಷಯವನ್ನು ಇಷ್ಟಪಡುವುದಿಲ್ಲ, ನಾನು ಅದನ್ನು ಖರೀದಿಸಲು ಸಹ ಪ್ರಯತ್ನಿಸಿದೆ ಆದರೆ ಅದರಂತೆಯೇ ರಾಕಿಂಗ್ ಕುದುರೆ sh * t! ಹೇಗಾದರೂ, ನಟನೆ ಸ್ವಲ್ಪ ಮೆಲುಕು ಹಾಕುತ್ತದೆ ಆದರೆ ಇದು ಕಡಿಮೆ ಬಜೆಟ್ ಹೊಂದಿರುವ ನೈಜ ಬಿ ಚಲನಚಿತ್ರವೆಂದು ಪರಿಗಣಿಸಿ ಕಥೆ ಅದ್ಭುತವಾಗಿದೆ ಮತ್ತು ಹೋರಾಟದ ದೃಶ್ಯಗಳು ನೋಡಲು ಅದ್ಭುತವಾಗಿದ್ದವು, ನಾನು ಅದನ್ನು ಸುಮಾರು 20 ಬಾರಿ ನೋಡಲೇಬೇಕು. ಇದು ತುಂಬಾ ಚೆನ್ನಾಗಿ ನಿರ್ಮಿಸಲಾದ ಚಲನಚಿತ್ರವಾಗಿತ್ತು ಮತ್ತು ದೈತ್ಯ ಮನುಷ್ಯ ನಿಯಂತ್ರಿತ ರೋಬೋಟ್‌ಗಳ ವಿರುದ್ಧ ಹೋರಾಡುವ ಕಲ್ಪನೆಯನ್ನು ನಾನು ಇಷ್ಟಪಟ್ಟೆ, ಕರುಣೆ ಅವರು "ಕ್ರ್ಯಾಶ್ ಮತ್ತು ಬರ್ನ್" ಅನ್ನು ತಿರುಗಿಸುವ ಮೂಲಕ ಅದನ್ನು ಹಾಳು ಮಾಡಬೇಕಾಗಿತ್ತು, ಆ ಚಲನಚಿತ್ರವನ್ನು ಒಟ್ಟು ಪ್ಯಾಂಟ್‌ಗಳ ಮೂಲಕ ನೋಡಬೇಡಿ ! ನಿಮ್ಮ ನಿಜವಾದ ಸೈ-ಫೈ ಚಲನಚಿತ್ರ ಅಭಿಮಾನಿಯಾಗಿದ್ದರೆ ಇದನ್ನು ವೀಕ್ಷಿಸಿ, ಅದನ್ನು ಇಂದು ಮರು-ನಿರ್ಮಿಸಿದರೆ ಅದು ವಿಜೇತರಾಗಲಿದೆ .. ರಿಮೇಕ್ ನೋಡಲು ಅಥವಾ ಅದರ ಡಿವಿಡಿಯನ್ನು ಬಿಡುಗಡೆ ಮಾಡಲು ನಾನು ನಿಜವಾಗಿಯೂ ಇಷ್ಟಪಡುತ್ತೇನೆ.#1
ನನಗೆ ಹೇಳಲು ಹೊಸದೇನೂ ಇಲ್ಲ: ಒಂದೇ ಬೆಟ್ಟದಲ್ಲಿ 4 ಗಂಟೆಗಳ ಜನರು ಸಾಯುತ್ತಿದ್ದಾರೆ. ಪಾತ್ರವರ್ಗವು ನಾಕ್ಷತ್ರಿಕವಾಗಿತ್ತು, ಆದರೆ ದುರದೃಷ್ಟವಶಾತ್ ನಿರ್ಮಾಪಕ / ನಿರ್ದೇಶಕ / ಸಂಪಾದಕ / ಗಾಡ್ ಗೂಫ್ಡ್. ಅವರು ವಿನಮ್ರ ಪೈ ತಿನ್ನಬೇಕು (ಕಾರ್ಗಿಲ್ನಲ್ಲಿ ಮರಣ ಹೊಂದಿದ ಪುರುಷರಿಗಾಗಿ), ಈ ಅದ್ಭುತ ಬಾಲಿವುಡ್ ನಿರ್ದೇಶಕರಲ್ಲಿ ಒಬ್ಬರನ್ನು ನೇಮಿಸಿಕೊಂಡರು, ನಿಜವಾದ ಚಿತ್ರಕಥೆಗಾರನನ್ನು ನೇಮಿಸಿಕೊಂಡರು, ನಿಜವಾದ ಸಂಪಾದಕರನ್ನು ನೇಮಿಸಿಕೊಂಡರು, ಸಂಬಂಧವಿಲ್ಲದ ಸಂಗೀತಗಾರನನ್ನು ನೇಮಿಸಿಕೊಂಡರು ಅವನನ್ನು ಕೆಲವು ರೀತಿಯಲ್ಲಿ (ಮತ್ತು ಕೆಲವು ಅಗ್ಗದ ಭಾರತೀಯ drug ಷಧಿಗಳಲ್ಲಿ "ಅಪೋಕ್ಯಾಲಿಪ್ಸ್ ನೌ" ನ ಕೆಲವು ಕೆಟ್ಟ ಆವೃತ್ತಿಯನ್ನು ಯಾರು ಕೇಳಿದ್ದಾರೆಂದು ತೋರುತ್ತದೆ), ನಿಜವಾದ ವೃತ್ತಿಪರ ಸಿಬ್ಬಂದಿಯನ್ನು ನೇಮಿಸಿಕೊಂಡರು, ಎಲ್ಲಾ ಪಟಾಕಿಗಳನ್ನು ಎಸೆದು ನಿಜವಾದ ಕಥೆಯನ್ನು ಹೇಳಿದರು. ದುರದೃಷ್ಟವಶಾತ್ ಅವರು ಭಾರತೀಯ ಸೇನೆಯ ದೊಡ್ಡವರಂತೆ ತಮ್ಮ ನಟರಿಗೆ ಭಯಾನಕ ಮತ್ತು ಪ್ರೇಕ್ಷಕರಿಗೆ ಭಯಾನಕ ನಿರ್ಧಾರಗಳನ್ನು ತೆಗೆದುಕೊಂಡರು. ನಾವೆಲ್ಲರೂ ಮತ್ತೆ ಮತ್ತೆ ಸತ್ತೆವು. <br /> <br /> ದಯವಿಟ್ಟು ಅದನ್ನು ಮತ್ತೆ ಮಾಡಬೇಡಿ ಸರ್! ಸುಷ್ಮಾ ಕಠ್ಮಂಡು, ನೇಪಾಳ. <br /> <br /> ಪಿಎಸ್: ಮುಂದಿನ ಬಾರಿ ಭಾರತೀಯ ನಿರ್ದೇಶಕರು ಗೂರ್ಖಾ ರೆಜಿಮೆಂಟ್ ಅನ್ನು ವೈಭವೀಕರಿಸಲು ನಿರ್ಧರಿಸಿದಾಗ, ತಂಡವನ್ನು ಪ್ರತಿನಿಧಿಸಲು ಒಂದಕ್ಕಿಂತ ಹೆಚ್ಚು ನೇಪಾಳಿಗಳನ್ನು ನೇಮಿಸಿಕೊಳ್ಳಲು ನಾನು ಸಲಹೆ ನೀಡುತ್ತೇನೆ. ಖಂಡಿತವಾಗಿಯೂ ಬಾಂಬೆಯಲ್ಲಿ ಸಾಕಷ್ಟು ನೇಪಾಳಿ ಪುರುಷರು ಕೆಲಸ ಮಾಡುತ್ತಿದ್ದಾರೆ - ಕೊನೆಯ ಎಣಿಕೆ 40,000 ದಿಂದ ಅರ್ಧ ಮಿಲಿಯನ್.#0
ನೀವು ಎದ್ದು ನಿಲ್ಲಲು ಇಷ್ಟಪಡುತ್ತೀರಾ? ನಂತರ ಇದರಿಂದ ದೂರವಿರಿ ... <br /> <br /> ಆರಂಭಿಕ ಸುತ್ತುಗಳಲ್ಲಿ, ಒಳ್ಳೆಯ ಕಾಮಿಕ್ಸ್ ಇವೆ, ಆದರೆ ಅವರಿಗೆ ಕೆಲವು ಮುದ್ದಾದ ಗುಣಗಳು ಸಿಗದ ಹೊರತು, ಅವರಿಗೆ ಸ್ನೋಬಾಲ್ಸ್ ಅವಕಾಶ ಸಿಕ್ಕಿತು. ಯಾವುದೇ ವಿವಾದಾತ್ಮಕ ವಸ್ತು ಮತ್ತು ನೀವು ಹೊರಗಿದ್ದೀರಿ! ... ಮತ್ತು ವಕ್ರ ನ್ಯಾಯಾಧೀಶರು ಯಾರನ್ನು ಪ್ರವೇಶಿಸುತ್ತಿದ್ದಾರೆಂದು ನಾನು ನೋಡಿದಾಗ, ತಿರಸ್ಕರಿಸಿದ ಹಾಸ್ಯನಟರಂತೆ ನಾನು ನೋಯಿಸುತ್ತೇನೆ ಎಂದು ನಾನು ಭಾವಿಸುತ್ತೇನೆ. ಅಂತಿಮ + ಅರ್ಧದಷ್ಟು ಜನರು ನನಗೆ 0 ನಗುವನ್ನು ನೀಡಿದ್ದಾರೆ. ಅವರಲ್ಲಿ ಹಲವರು ತಮ್ಮ ವಸ್ತುಗಳನ್ನು ಬೇರೆಡೆ ಎತ್ತಿದ್ದಾರೆ, ನ್ಯಾಯಾಧೀಶರಿಗೆ ಏನಾದರೂ ಸಮಸ್ಯೆಗಳಿಲ್ಲ ಎಂದು ತೋರುತ್ತದೆ. <br /> <br /> ಟಿವಿಯಲ್ಲಿರುವುದಕ್ಕಿಂತ ಹೆಚ್ಚಿನದನ್ನು ಇದು ಹೆಚ್ಚು ಮನರಂಜನೆಯಾಗಿದೆ, ಆದರೆ ಆಲೋಚಿಸದೆ ವೀಕ್ಷಿಸಲು ನಂಬಲಾಗದಷ್ಟು ಕಷ್ಟ ಅದು ಏನು ಆಗಿರಬಹುದು. <br /> <br /> ನಿರ್ಮಾಪಕರು ಸ್ಪರ್ಧೆಯ ಹೆಸರನ್ನು "ಲಾಸ್ಟ್ ಕ್ಲೌನ್ ಸ್ಟ್ಯಾಂಡಿಂಗ್" ಎಂದು ಬದಲಾಯಿಸಿದರೆ, ನನ್ನ ಎಲ್ಲಾ ಟೀಕೆಗಳು ಸಿಂಧುತ್ವವನ್ನು ಕಳೆದುಕೊಳ್ಳುತ್ತವೆ. ಬಹುಶಃ ಒಂದು ಕಲ್ಪನೆ?#0
ಹಲವಾರು ಯುವ ಇರಾನಿನ ಮಹಿಳೆಯರು ಹುಡುಗರಂತೆ ಉಡುಗೆ ತೊಟ್ಟು ಇರಾನ್ ಮತ್ತು ಬಹ್ರೇನ್ ನಡುವಿನ ವಿಶ್ವಕಪ್ ಅರ್ಹತಾ ಪಂದ್ಯಕ್ಕೆ ಪ್ರವೇಶಿಸಲು ಪ್ರಯತ್ನಿಸುತ್ತಾರೆ. ಅವರು ಸಿಕ್ಕಿಬಿದ್ದಾಗ, ಪಂದ್ಯವು ಇಯರ್‌ಶಾಟ್‌ನಲ್ಲಿ ಉಳಿದುಕೊಂಡಿರುವ ಪ್ರದೇಶದಲ್ಲಿ ಅವುಗಳನ್ನು ಬರೆಯಲಾಗುತ್ತದೆ, ಆದರೆ ದೃಷ್ಟಿಗೋಚರವಾಗಿರುತ್ತದೆ. ಕೈದಿಗಳನ್ನು ಬಿಡಬೇಕೆಂದು ಮನವಿ ಮಾಡುತ್ತಾರೆ, ಆದರೆ ನಿಯಮಗಳು ನಿಯಮಗಳಾಗಿವೆ. 1997 ರ ದಿ ಮಿರರ್ ನಲ್ಲಿ, ಪನಾಹಿ ಇರಾನಿನ ಹೆಣ್ಣುಮಕ್ಕಳ ಎರಡು ಆವೃತ್ತಿಗಳನ್ನು ಪ್ರಸ್ತುತಪಡಿಸುತ್ತಾನೆ ಮತ್ತು ಯಾವುದು "ನೈಜ" ಎಂದು ಆಶ್ಚರ್ಯಪಡುವಂತೆ ಪ್ರೇಕ್ಷಕರನ್ನು ಬಿಡುತ್ತಾನೆ. 2000 ರ ದಿ ಸರ್ಕಲ್‌ನಲ್ಲಿ, ಹಲವಾರು ಇರಾನಿನ ಮಹಿಳೆಯರು ವ್ಯವಸ್ಥೆಯ ಹೊರಗೆ ಹೆಜ್ಜೆ ಹಾಕಿದರು; ಅವರ ಉಲ್ಲಂಘನೆಗಳು ವಿಭಿನ್ನವಾಗಿವೆ, ಆದರೆ ಅವೆಲ್ಲವೂ ಒಂದೇ ದುರಂತ ಸ್ಥಳದಲ್ಲಿ ಕೊನೆಗೊಳ್ಳುತ್ತವೆ. <br /> <br /> ಆದಾಗ್ಯೂ, ಈಗ ಆಫ್‌ಸೈಡ್ ಬಗ್ಗೆ ಯೋಚಿಸುವಾಗ, ಇದನ್ನು ಹಾಸ್ಯವಲ್ಲದೆ ಬೇರೆ ಯಾವುದನ್ನಾದರೂ imagine ಹಿಸಿಕೊಳ್ಳುವುದು ಕಷ್ಟ, ಏಕೆಂದರೆ ಅದು ಪ್ರಸ್ತುತಪಡಿಸುವ ಪರಿಸ್ಥಿತಿ ಸ್ಪಷ್ಟವಾಗಿ ಹಾಸ್ಯಾಸ್ಪದ. ಮಹಿಳೆಯರು ಸಾಕರ್ ಪಂದ್ಯವನ್ನು ಏಕೆ ನೋಡಬಾರದು ಮತ್ತು ಅವರ ಸೆರೆಯಾಳುಗಳು ಉತ್ತರಿಸಲು ಹೆಣಗಾಡುತ್ತಿರುವಾಗ, ಏಕೈಕ ಫಲಿತಾಂಶವೆಂದರೆ ಹಾಸ್ಯ. <br /> <br /> ಆಫ್‌ಸೈಡ್ ಅನ್ನು ಹೆಚ್ಚು ಪರಿಣಾಮ ಬೀರುವ ಸಂಗತಿಯೆಂದರೆ ಯುವತಿಯರನ್ನು ಚಿತ್ರಿಸಲಾಗಿಲ್ಲ ಕಾರ್ಯಕರ್ತರು ಸಿಸ್ಟಮ್ ಮೇಲೆ ಆಕ್ರಮಣ ಮಾಡುತ್ತಿರುವಂತೆ. ಅವರು ಕೇವಲ ಸಾಕರ್ ಅಭಿಮಾನಿಗಳು ಮತ್ತು ದೇಶಭಕ್ತರು, ಮತ್ತು ಅವರು ಸ್ಪಷ್ಟವಾಗಿ ಅನ್ಯಾಯವಾಗಿ ಪರಿಗಣಿಸಲ್ಪಟ್ಟಿದ್ದರೂ ಸಹ, ಅವರು ಎಂದಿಗೂ ಪಂದ್ಯದ ಬಗ್ಗೆ ತಮ್ಮ ಗಮನವನ್ನು ಕಳೆದುಕೊಳ್ಳುವುದಿಲ್ಲ ಮತ್ತು ಅವರ ರಾಷ್ಟ್ರದ ಹಿಡಿತದಲ್ಲಿರುವ ಐತಿಹಾಸಿಕ ವಿಜಯ.#1
