ವೇಯ್ನ್ ನೈಟ್ ಸೇರಿದಂತೆ ನಿಕೆಲೋಡೆನ್‌ನಿಂದ ಹೊರಬರಲು ಕ್ಯಾಟ್ಸ್‌ಕ್ರ್ಯಾಚ್ ಅತ್ಯುತ್ತಮ ವಿಷಯ. ಈ ಪ್ರದರ್ಶನವು ಕೇವಲ ಮಾರಿಸ್ ಮತ್ತು ಪಿಐಗಳಿಗೆ ಇಷ್ಟವಾಗುವುದಿಲ್ಲ. ಕೆಲವು ಜನರು ಇದನ್ನು ಪ್ರೀತಿಸುತ್ತಾರೆ, ಮತ್ತು ಅವರೆಲ್ಲರೂ ಆಸೀಸ್. ಮೊದಲ ನೋಟದಲ್ಲಿ ಇದು ಸ್ವಲ್ಪ ಕಚ್ಚಾ ಎಂದು ತೋರುತ್ತದೆ, ಆದರೆ ಅದು ನಿಮ್ಮ ಮೇಲೆ ಅಗಾಧವಾಗಿ ಬೆಳೆಯುತ್ತದೆ. ಅಲ್ಲದೆ, ಇತರ ವಿಮರ್ಶಕರೊಬ್ಬರು ಇನ್_ಕರೆಕ್ಟ್ (ಟಿವಿ.ಕಾಮ್) ಹೇಳಿರುವ ಯಾವುದನ್ನಾದರೂ ಸರಿಪಡಿಸಲು "ಇದರರ್ಥ ನೀವು ಈಗ ಹೋಮೋ ಎಂದು ಅರ್ಥವೇ?" ಅವರು ಹೇಳುತ್ತಾರೆ "ಇದರರ್ಥ ನೀವು ಹೋಮೋ, owww?" ಪ್ರದರ್ಶನದಲ್ಲಿ ಇದು ಅವರ ನುಡಿಗಟ್ಟು. ಮಿಸ್ಟರ್ ಬ್ಲಿಕ್, ಪೆವ್-ವೆವ್ಸ್ ಪ್ಲೇಹೌಸ್ನಂತಹ ಎಲ್ಲಕ್ಕಿಂತ ತಮಾಷೆಯಾಗಿದೆ <br /> <br /> ಮೊದಲನೆಯದಾಗಿ, ಆರಂಭಿಕ ಕಂತು ಸ್ವಲ್ಪ ಉತ್ತಮವಾಗಿದೆ ಎಂದು ನಾನು ಒಪ್ಪಿಕೊಳ್ಳುತ್ತೇನೆ. ಆದರೆ ಸ್ವಲ್ಪ ಸಮಯದ ನಂತರ ಕಂತುಗಳು ಅದ್ಭುತವಾದವು! ಸರಣಿಯು ಅದನ್ನು ಅತಿವಾಸ್ತವಿಕವಾದದ್ದು ಎಂದು ಕಂಡುಕೊಂಡಾಗ, ನಿಕಲೋಡಿಯನ್ ಅದನ್ನು ರದ್ದುಗೊಳಿಸುತ್ತದೆ! <br /> <br /> ನಿಕ್ ಮಕ್ಕಳಿಗಾಗಿ ಎಂದು ನನಗೆ ತಿಳಿದಿದೆ, ಆದರೆ ಪ್ರತಿ ಬಾರಿ ಒಮ್ಮೆ ಅದ್ಭುತ ಪ್ರದರ್ಶನವು ಹದಿಹರೆಯದವರಿಗೆ ಆನಂದಿಸಬಹುದು ಮತ್ತು ವಯಸ್ಕರು. ಈ ಪ್ರದರ್ಶನಗಳಲ್ಲಿ ಮಿಸ್ಟರ್ ಬೀನ್ ದಿ ಆನಿಮೇಟೆಡ್ ಸರಣಿ, ಚಾರ್ಲಿ ಬ್ರೌನ್, ಪೆಲ್ಸ್‌ವಿಕ್, ರಾಕೊಸ್ ಮಾಡರ್ನ್ ಲೈಫ್ (ಕೆಲವೊಮ್ಮೆ), ಮತ್ತು ಇನ್ವೇಡರ್ ಜಿಮ್ ಸೇರಿವೆ. ಕ್ಯಾಟ್‌ಡಾಗ್ ಹೊರತುಪಡಿಸಿ, ಇವೆಲ್ಲವನ್ನೂ ತುಂಬಾ ಒಳ್ಳೆಯದು ಎಂದು ಪರಿಗಣಿಸಿರಬೇಕು, 'ಅವುಗಳನ್ನು ರದ್ದುಗೊಳಿಸುವ ಅವಶ್ಯಕತೆಯಿದೆ ಎಂದು ನಿಕ್ ಭಾವಿಸಿದರು. <br /> <br /> ಗೋರ್ಡಾನ್ ಬಾತುಕೋಳಿಯೊಂದಿಗೆ ಹೋರಾಡುವ ಪ್ರಸಿದ್ಧ ಅಂತಿಮ ಸಂಚಿಕೆಯನ್ನು ನಾನು ಇಷ್ಟಪಡುತ್ತೇನೆ. /> <br /> ನಾನು ಡಿವಿಡಿಯನ್ನು ನೋಡಲು ಬಯಸುತ್ತೇನೆ, ಸಾಕಷ್ಟು ಆಡಿಯೊ-ವ್ಯಾಖ್ಯಾನಗಳು ಮತ್ತು ತೆರೆಮರೆಯಲ್ಲಿರುವ ಡೋಕೋಗಳು ಮತ್ತು ಅಂತಿಮ ಕಂತು ಸೇರಿದಂತೆ. <br /> <br /> ಆದರೆ ಸಹಜವಾಗಿ, ನಾನು ಏನು ಪ್ರದರ್ಶನವು ಮತ್ತೆ ಪ್ರಸಾರವಾಗುವುದನ್ನು ನೋಡಲು ಖಂಡಿತವಾಗಿಯೂ ಇಷ್ಟಪಡುತ್ತೇನೆ. ನಿಕ್! ಎದ್ದೇಳಿ! ಅದು ಅದ್ಭುತವಾಗಿದೆ.#1
ಜೆಟ್ ಲಿ ಎಂಬ ಡೈನಮೋಗೆ ಅಮೇರಿಕನ್ ಪ್ರೇಕ್ಷಕರನ್ನು ಪರಿಚಯಿಸಲು ಅವರು ಈ ಚಿತ್ರವನ್ನು ಬಿಡುಗಡೆ ಮಾಡಲು ಏಕೆ ನಿರ್ಧರಿಸಿದ್ದಾರೆಂದು ನನಗೆ ಅರ್ಥವಾಗುತ್ತಿಲ್ಲ. ಫಿಸ್ಟ್ ಆಫ್ ಲೆಜೆಂಡ್ ಹೆಚ್ಚು ಉತ್ತಮ ಆಯ್ಕೆಯಾಗಿದೆ. ಹೇಗಾದರೂ, ಬ್ಲ್ಯಾಕ್ ಮಾಸ್ಕ್ ಭಯಾನಕವಲ್ಲ, ಆದರೆ ಇದು ಖಂಡಿತವಾಗಿಯೂ ಉತ್ತಮವಾಗಿಲ್ಲ. ಅಂತಿಮ ಹೋರಾಟದ ಅನುಕ್ರಮವನ್ನು ಯುಯೆನ್ ವೂ ಪಿಂಗ್ ಅವರು ದಿ ಮ್ಯಾಟ್ರಿಕ್ಸ್ ಅನ್ನು ಸಂಘಟಿಸಲು ಮುಂದಾಗಿದ್ದಾರೆ. ಆದರೆ ಇಂಗ್ಲಿಷ್ ಬಿಡುಗಡೆಯು ಒರಟು ಸಂಪಾದನೆ ಮತ್ತು ಡಬ್ಬಿಂಗ್‌ನಿಂದ ಬಳಲುತ್ತಿದೆ. (ಈ ಚಲನಚಿತ್ರಗಳನ್ನು ಉಪಶೀರ್ಷಿಕೆಗಳೊಂದಿಗೆ ಕತ್ತರಿಸದೆ ಬಿಡುಗಡೆ ಮಾಡಲು ನಾನು ಹಾಲಿವುಡ್ ಸ್ಟುಡಿಯೋಗಳನ್ನು ಬೇಡಿಕೊಳ್ಳುತ್ತಿದ್ದೇನೆ.) ಜೆಟ್ ಲಿ ತನ್ನ ವಿಶಿಷ್ಟ ವರ್ಚಸ್ಸನ್ನು ಶೀರ್ಷಿಕೆ ಪಾತ್ರದಲ್ಲಿ ತೋರಿಸುತ್ತಾನೆ ಮತ್ತು ಫ್ರಾಂಕೋಯಿಸ್ ಯಿಪ್ ಸ್ತ್ರೀ 701 ರಂತೆ ತಂಪಾದ ಆದರೆ ಸಂಕ್ಷಿಪ್ತ ಪಾತ್ರವನ್ನು ಹೊಂದಿದ್ದಾನೆ. <br /> <br /> ಕಪ್ಪು ಮಾಸ್ಕ್ ವಿಚಿತ್ರವಾದ ಗೋಥ್ ಶೈಲಿಯನ್ನು ಹೊಂದಿದ್ದು ಅದು ಸ್ವಲ್ಪ ಆಸಕ್ತಿಯನ್ನು ಹೆಚ್ಚಿಸುತ್ತದೆ ಆದರೆ ಇದು ಗನ್ ಕದನಗಳು ಮತ್ತು ಸ್ಫೋಟಗಳಿಂದ ತುಂಬಿರುತ್ತದೆ. ಲಿ ಅವರ ಅದ್ಭುತ ದೈಹಿಕ ಕೌಶಲ್ಯಗಳ ಮೇಲೆ ಹೆಚ್ಚಿನ ಗಮನವು ಕ್ರಮದಲ್ಲಿತ್ತು. ಬ್ಲ್ಯಾಕ್ ಮಾಸ್ಕ್ ಯೋಗ್ಯವಾದ ಚಿತ್ರ ಆದರೆ ಲಿ ಅವರ ಕೌಶಲ್ಯಗಳನ್ನು ನಿಜವಾಗಿಯೂ ತೋರಿಸುವ ಪ್ರಚಂಡ ಚಿತ್ರವನ್ನು ನೋಡಲು ನೀವು ಬಯಸಿದರೆ ನೀವೇ ಒಂದು ಉಪಕಾರ ಮಾಡಿ ಮತ್ತು ಫಿಸ್ಟ್ ಆಫ್ ಲೆಜೆಂಡ್ ಅನ್ನು ತೆಗೆದುಕೊಳ್ಳಿ.#1
ಮುಂದಿನ ವಾರಾಂತ್ಯದಲ್ಲಿ ನಾನು ಚಲನಚಿತ್ರ ಮಾಡುತ್ತೇನೆ ಎಂದು ಭಾವಿಸುತ್ತೇನೆ. ಓಹ್ ಕಾಯಿರಿ, ನಾನು ಕೆಲಸ ಮಾಡುತ್ತಿದ್ದೇನೆ..ಹೋ ನಾನು ಅದನ್ನು ಹೊಂದಿಸಬಹುದೆಂದು ನನಗೆ ಖಾತ್ರಿಯಿದೆ. ಈ ಚಿತ್ರವನ್ನು ಯಾರು ಮಾಡಿದರೂ ಅದು ಹೊಂದಿಕೊಳ್ಳುತ್ತದೆ ಎಂದು ತೋರುತ್ತಿದೆ. ಈ ಲದ್ದಿ ತಯಾರಕರು ದಿನದ ಕೆಲಸಗಳನ್ನು ಹೊಂದಿದ್ದಾರೆಂದು ನಾನು ಭಾವಿಸುತ್ತೇನೆ ಏಕೆಂದರೆ ಈ ಚಿತ್ರ ಹೀರಿಕೊಳ್ಳುತ್ತದೆ !!! ಇದು ಯಾರೊಬ್ಬರ ಮನೆ ಚಲನಚಿತ್ರದಂತೆ ತೋರುತ್ತಿದೆ ಮತ್ತು ಅದನ್ನು ತಯಾರಿಸಲು $ 100 ಕ್ಕಿಂತ ಹೆಚ್ಚು ಖರ್ಚು ಮಾಡಲಾಗಿದೆ ಎಂದು ನಾನು ಭಾವಿಸುವುದಿಲ್ಲ !!! ಒಟ್ಟು ಲದ್ದಿ !!! ಈ ವಿಷಯವನ್ನು ಯಾರು ಬಿಡುಗಡೆ ಮಾಡೋಣ?!?!?!#0
ಈ ಚಿತ್ರವು ಭಯಾನಕ ನಟನೆ, ಬರವಣಿಗೆ, ನಿರ್ದೇಶನ ಮತ್ತು ನಿರ್ಮಾಣವಾಗಿದೆ. ಆದರೆ ಅದು ತುಂಬಾ ಕ್ಯಾಂಪಿಯಾಗಿದೆ, ಇದು ನಿಜವಾಗಿ ಅರೆ ವೀಕ್ಷಿಸಬಹುದಾಗಿದೆ. ಅದು ಸೆಮಿ ವೀಕ್ಷಿಸಬಹುದಾದದು. <br /> <br /> ಕಥಾಹಂದರ (ಸ್ವಲ್ಪವೇ ಇದೆ) ವಾಸ್ತವಿಕವಾಗಿ ಯಾವುದೇ ಅರ್ಥವಿಲ್ಲ. ಬಾರ್ನೆ ಡ್ರಮ್ ಪಾತ್ರವು ಚಲನಚಿತ್ರದಲ್ಲಿನ ಏಕೈಕ ನಿಜವಾದ ಕಾಮಿಕ್ ರಿಲೀಫ್ ಆಗಿದೆ ಮತ್ತು ಅದು ಸುಮಾರು 30 ಸೆಕೆಂಡುಗಳ ನಂತರ ದಣಿದಿದೆ. <br /> <br /> ಕೆನಡಾದ ಅನೇಕ ಪೋಷಕ ಪಾತ್ರಗಳನ್ನು ಟಿವಿ ಜಾಹೀರಾತುಗಳಲ್ಲಿ ಕಾಣಬಹುದು .. ಅವುಗಳಲ್ಲಿ ಯಾವುದೂ ನನಗೆ ತಿಳಿದಿರುವ ಬೇರೆ ಯಾವುದಕ್ಕೂ ಹೋಗಲಿಲ್ಲ. ಮತ್ತು ಸಹಜವಾಗಿ ಸ್ಲೈ ಸ್ಟಾಲೋನ್ ಅವರ ಇನ್ನೂ ಕಡಿಮೆ ಪ್ರತಿಭಾವಂತ ಸಹೋದರ ..... = \ <br /> <br /> ಟ್ರಿವಿಯಾ: ಇದನ್ನು ಒಂಟ್ನ ಕ್ಲಾರೆಮಾಂಟ್ ಎಂಬ ಪುಟ್ಟ ಹಳ್ಳಿಯಲ್ಲಿ ಮತ್ತು ಸುತ್ತಮುತ್ತ ಸಂಪೂರ್ಣವಾಗಿ ಚಿತ್ರೀಕರಿಸಲಾಗಿದೆ. (ಟೊರೊಂಟೊದ ಸುಮಾರು 20 ಮೈಲಿಗಳು) ನಾನು ಅನೇಕ ಸ್ಥಳೀಯ ಹೆಗ್ಗುರುತುಗಳು / ers ೇದಕಗಳನ್ನು / ಕಟ್ಟಡಗಳನ್ನು ಗುರುತಿಸಿದೆ. ಡ್ರೈವ್-ಇನ್ ದೃಶ್ಯವನ್ನು ಕಿತ್ತುಹಾಕುವ ಮುನ್ನ ಈಗ ನೆಲಸಮಗೊಂಡ "ಓಶಾವಾ ಡ್ರೈವ್-ಇನ್" ನಲ್ಲಿ ಚಿತ್ರೀಕರಿಸಲಾಗಿದೆ ಎಂದು ನಾನು ಭಾವಿಸುತ್ತೇನೆ.#0
60 ರ ದಶಕವು ಸಾಂದರ್ಭಿಕವಾಗಿ ಮನರಂಜಿಸುವ ಚಿತ್ರವಾಗಿದ್ದು, ಈ ಮನರಂಜನೆಯು ಚಲನಚಿತ್ರವನ್ನು ನೋಡಿ ನಗುವುದರಿಂದ ಆಗಿದೆ. ಇದು ಅತ್ಯಂತ ಅಸಮವಾಗಿದೆ, ಮತ್ತು ಅನೇಕ ಕಿರಿಕಿರಿ ಅಂಶಗಳನ್ನು ಒಳಗೊಂಡಿದೆ. ಉದಾಹರಣೆಗೆ ಕಪ್ಪು ಮತ್ತು ಬಿಳಿ ಮತ್ತು ಬಣ್ಣಗಳ ನಡುವಿನ ಸ್ವಿಚ್ ತೆಗೆದುಕೊಳ್ಳಿ. ಸರಿಯಾಗಿ ಮಾಡಿದರೆ, ಇದು ಸಾಕಷ್ಟು ಪರಿಣಾಮಕಾರಿಯಾಗಬಹುದು, ಆದರೆ ಅದನ್ನು ಸರಿಯಾಗಿ ಮಾಡದ ಕಾರಣ, ಇದು ಒಂದು ಉಪದ್ರವವಾಗಿ ಮಾರ್ಪಟ್ಟಿತು ಮತ್ತು ಈಗಾಗಲೇ ಕೆಟ್ಟ ಅನುಭವದಿಂದ ಮಾತ್ರ ದೂರವಿತ್ತು; ಚಿತ್ರದ ಬಹುಪಾಲು ವಿಚಿತ್ರ ಭಾವನೆಯನ್ನು ಹೊಂದಿತ್ತು. ಟಿವಿ ಫ್ಲಿಕ್ಗಾಗಿ ನಿರ್ಮಿಸಲಾದ ನಟನೆ ತುಂಬಾ ಕೆಟ್ಟದ್ದಲ್ಲ, ಆದರೆ ನಂತರ ಅದು ಇತರ ಸಮಯಗಳಲ್ಲಿ ಸರಳವಾಗಿ ಮುಜುಗರಕ್ಕೊಳಗಾಯಿತು. ಅನೇಕ ಘಟನೆಗಳು ಸುಸಂಬದ್ಧವಾಗಿರಲಿಲ್ಲ ಮತ್ತು ಗೊಂದಲಕ್ಕೊಳಗಾಗುತ್ತವೆ. 1960 ರ ದಶಕದಲ್ಲಿ ಈ ಕುಟುಂಬವು ಅನೇಕ ದೊಡ್ಡ ಘಟನೆಗಳಲ್ಲಿ ಹೇಗೆ ಕೊನೆಗೊಂಡಿತು? ಅಂತ್ಯವು ನನ್ನ ಅಭಿರುಚಿಗೆ ತುಂಬಾ ನೀರಸವಾಗಿತ್ತು; ಏಕೆಂದರೆ ಅದು ಹಾಲಿವುಡ್ ಆಗಿತ್ತು, ಎಲ್ಲವೂ ಕೊನೆಯಲ್ಲಿ ಸರಿಯಾಗಿ ಹೊರಹೊಮ್ಮಬೇಕಾಗಿತ್ತು. 60 ರ ದಶಕದಲ್ಲಿ ನಿಮ್ಮ ಸಮಯವನ್ನು ವ್ಯರ್ಥ ಮಾಡದಂತೆ ಮತ್ತು ನಿಮ್ಮ ಸಮಯದೊಂದಿಗೆ ಬೇರೆ ಏನಾದರೂ ಮಾಡದಂತೆ ನಾನು ನಿಮಗೆ ಸಲಹೆ ನೀಡುತ್ತೇನೆ. ನಾನು ಇದನ್ನು ತರಗತಿಯಲ್ಲಿ ನೋಡಿದ್ದೇನೆ ಮತ್ತು ನನ್ನ ಸ್ವಂತ ಸಮಯಕ್ಕೆ ಅಲ್ಲ ಎಂದು ನನಗೆ ಖುಷಿಯಾಗಿದೆ. ಬಾಬ್ ಡೈಲನ್ ಅವರ ಸಂಗೀತವನ್ನು ಸೇರಿಸುವುದು ಚಿತ್ರದ ಉತ್ತಮ ಭಾಗವಾಗಿದೆ ಎಂದು ನಾನು ಸುರಕ್ಷಿತವಾಗಿ ಹೇಳಬಲ್ಲೆ ಎಂದು ನಾನು ಭಾವಿಸುತ್ತೇನೆ. ಅದು ಫ್ಲಿಕ್ನಲ್ಲಿ ನನ್ನ ಸುತ್ತುವರಿದ ಆಲೋಚನೆಗಳು. ನೀವು ನನ್ನ ಸಲಹೆಯನ್ನು ತೆಗೆದುಕೊಳ್ಳುತ್ತೀರಿ ಎಂದು ನಾನು ಭಾವಿಸುತ್ತೇನೆ ಮತ್ತು ಇದರಿಂದ ದೂರವಿರಿ.#0
ಎರಡನೆಯ ಮಹಾಯುದ್ಧದ ನಂತರದ ದಿನಗಳಲ್ಲಿ, ಹಾಲಿವುಡ್‌ನ ಉತ್ತಮ ಮನಸ್ಸುಗಳು ಯುದ್ಧದ ಪ್ರಯತ್ನದಲ್ಲಿ ನೈಸರ್ಗಿಕ ಅಂಶವಾಗಿರುವ ಬುದ್ದಿಹೀನ ಧ್ವಜ ಬೀಸುವಿಕೆಯಿಂದ ದೂರವಿರಲು ಪ್ರಯತ್ನಿಸಿದವು. "ನಮ್ಮ ಜೀವನದ ಅತ್ಯುತ್ತಮ ವರ್ಷಗಳು" ಮತ್ತು 'ಜಂಟಲ್ಮ್ಯಾನ್ಸ್ ಅಗ್ರಿಮೆಂಟ್' ಸಹ ಯುದ್ಧದ ಹಿನ್ನೆಲೆಯಲ್ಲಿ ಅಮೆರಿಕನ್ನರು ತಮ್ಮನ್ನು ತಾವು ನೋಡುವ ವಿಧಾನವನ್ನು ತನಿಖೆ ಮಾಡಿದ್ದವು, ಆದರೆ ಡೆಲ್ಮರ್ ಡೇವ್ಸ್ ಅವರ "ಪ್ರೈಡ್ ಆಫ್ ದಿ ಮೆರೀನ್" ಅವರನ್ನು ಸೋಲಿಸಿತು. <br /> <br /> ಈ ಚಿತ್ರವು ಫಿಲಡೆಲ್ಫಿಯಾ ಸ್ಮಾರ್ಟ್ ಅಲೆಕ್ ಜಾನ್ ಗಾರ್ಫೀಲ್ಡ್ ಅವರಾಗಿದ್ದು, ಅವರು ನೌಕಾಪಡೆಯಾಗಿ ಯುದ್ಧಕ್ಕೆ ಹೋಗುತ್ತಾರೆ ಮತ್ತು ಫಾಕ್ಸ್ಹೋಲ್ನಲ್ಲಿ ದುಃಸ್ವಪ್ನ ಸಂಜೆಯ ನಂತರ, ಜಪಾನಿನ ಸೈನಿಕರು ಅವನ ಮತ್ತು ಅವನ ಗೆಳೆಯರಾದ "ಮರಿಯೈನ್ಸ್, ಟುನೈಟ್ ಯು ಡೈ!" ಕೈ-ಗ್ರೆನೇಡ್, ಮತ್ತು ಮನೆಗೆ ಬಂದ ನಂತರ ಅವಳನ್ನು ಅವಲಂಬಿಸಬೇಕಾಗಿರುವುದಕ್ಕಿಂತ ಹೆಚ್ಚಾಗಿ ತನ್ನ ಗೆಳತಿಯನ್ನು ಮನೆಗೆ ಹಿಂತಿರುಗಿಸುತ್ತದೆ. <br /> <br /> ಧೈರ್ಯಶಾಲಿ ಈ ಪುರುಷರ ಬಗ್ಗೆ ಡೆಲ್ಮರ್ ಡೇವ್ಸ್ ತನ್ನ ಚಿತ್ರಣದಲ್ಲಿ ರಾಜಿಯಾಗುವುದಿಲ್ಲ, ಅದು ಬಹುತೇಕ ಕಾಕತಾಳೀಯವಾಗಿ . ಅವರು ಅಲ್ಲಿದ್ದಾರೆ, ಫಾಕ್ಸ್‌ಹೋಲ್‌ನಲ್ಲಿ, ಮತ್ತು ಗುಂಡು ಹಾರಿಸಿದಾಗ ಅವರು ಪ್ರತಿಕ್ರಿಯಿಸುತ್ತಾರೆ. ಶೌರ್ಯಕ್ಕಾಗಿ ತುಂಬಾ, ಆದರೆ ಅವರು ಕೆಲಸವನ್ನು ಪೂರೈಸುತ್ತಾರೆ. ತದನಂತರ ಸ್ವಯಂ ಕರುಣೆ, ಗಾ dark ವಾದ, ಕತ್ತಲೆಯಾದ ಹಾಸ್ಯ ಪ್ರಜ್ಞೆ ಬರುತ್ತದೆ. ಗಾರ್ಫೀಲ್ಡ್ ಕೋಪಗೊಂಡ ನಿರಾಕರಣೆಯಲ್ಲಿದ್ದಾರೆ ಅವನ ಕುರುಡುತನ ಮತ್ತು ಚಲನಚಿತ್ರವು "ಈ ಜಗತ್ತಿನಲ್ಲಿ ಯಾರಿಗೂ ಉಚಿತ ಕ್ಯಾಂಡಿ ಇಲ್ಲ" ಎಂದು ಯಾವುದೇ ಕ್ಷಮೆಯನ್ನು ನೀಡುವುದಿಲ್ಲ, ಅವನ ಸ್ನೇಹಿತ ಹೇಳುವಂತೆ. ಡೇನ್ ಕ್ಲಾರ್ಕ್ ನಿರ್ವಹಿಸಿದ ಆಮೆ ​​ವ್ಯಕ್ತಿ, ಯಹೂದಿ, "ಯುದ್ಧದಲ್ಲಿ ಯಾರಾದರೂ ಅದನ್ನು ಪಡೆಯುತ್ತಾರೆ, ಮತ್ತು ನೀವು ಅದು. ಪ್ರತಿಯೊಬ್ಬರಿಗೂ ಸಮಸ್ಯೆಗಳಿವೆ! ನಾನು ಹಿಂತಿರುಗಿದಾಗ, ಕೆಲವು ವ್ಯಕ್ತಿಗಳು ನನ್ನನ್ನು ನೇಮಿಸಿಕೊಳ್ಳುವುದಿಲ್ಲ, ಏಕೆಂದರೆ ನನ್ನ ಹೆಸರು ಡೈಮಂಡ್ ". <br /> <br /> ಈ ರೀತಿಯ ಧೈರ್ಯದಿಂದ ಉತ್ತಮ ಚಲನಚಿತ್ರಗಳನ್ನು ತಯಾರಿಸಲಾಗುತ್ತದೆ, ಮತ್ತು 'ಪ್ರೈಡ್ ಆಫ್ ದಿ ಮೆರೀನ್'ನ ಮೊದಲ ಅರ್ಧ ಘಂಟೆಯ ವೇಳೆ ಈ ಸಂದರ್ಭಕ್ಕೆ ಸಂಪೂರ್ಣವಾಗಿ ಏರಲು ವಿಫಲವಾಗಿದೆ, ಅಂದಿನಿಂದ ಅದು ನಿಜವಾದ ಕಲಾಕೃತಿಯಾಗಿ ವಿಕಸನಗೊಳ್ಳುತ್ತದೆ.ನೀವು ಅಳುತ್ತೀರಿ, ಮತ್ತು ಆಲೋಚಿಸುತ್ತೀರಿ, ನೋವು ಮತ್ತು ನೀವು ಭರವಸೆಯ ವಿರುದ್ಧ ಆಶಿಸುತ್ತೀರಿ. ಸರಿ, ಸರಳವಾಗಿ: ಕಲೆ. <br /> <br />#1
ಸ್ಟಾರ್ ಟ್ರೆಕ್ ಅಭಿಮಾನಿಗಳು ಎಲ್ಲಾ ಸ್ಟಾರ್ ಟ್ರೆಕ್ ಸಿನೆಮಾಗಳಿಗೆ ಹೇಗೆ ಸೇರುತ್ತಾರೆಂದು ನಿಮಗೆ ತಿಳಿದಿದೆಯೇ? ಏಕೆ? ಅವರ ನಾಯಕರನ್ನು ಮತ್ತೊಮ್ಮೆ ನೋಡಲು. ಡಾಕ್ ಸಾವೇಜ್ ಬಗ್ಗೆ ನಾನು ಭಾವಿಸುತ್ತೇನೆ. ನಾನು ಪಾತ್ರಕ್ಕೆ ಪ್ರಮುಖ ಮತಾಂಧ, ಮತ್ತು ಡಾಕ್ ಮತ್ತು ಅವನ ಸಿಬ್ಬಂದಿಯನ್ನು ಸಾಹಸದಲ್ಲಿ ನೋಡುವ ನಿರೀಕ್ಷೆ ಅಗಾಧವಾಗಿತ್ತು. ಮತ್ತು ಚಿತ್ರದ ಮೊದಲ 20 ನಿಮಿಷಗಳು ಆ ನಿರೀಕ್ಷೆಯ ಭಾವನೆಯನ್ನು ಹೆಚ್ಚಿಸಿವೆ. ನಂತರ ಅವರು ಹಲವಾರು ಡಾಕ್ ಸಾಹಸಗಳಿಂದ ಅಂಶಗಳನ್ನು ಕೊಟ್ಟಿಗೆ ಮಾಡಲು ನಿರ್ಧರಿಸಿದರು ಮತ್ತು ಅವುಗಳನ್ನು ಈ ಒಂದು ಚಲನಚಿತ್ರಕ್ಕೆ ಎಸೆಯಲು ನಿರ್ಧರಿಸಿದರು, ಇದರ ಪರಿಣಾಮವಾಗಿ ಸ್ವಲ್ಪ ಅಸಹ್ಯವಾದ ಚಿತ್ರವಾಯಿತು. ಹಲವಾರು ದುರದೃಷ್ಟಕರ ಆಯ್ಕೆಗಳಿಂದ (ಸಂಗೀತ, "ಕ್ಯಾಂಪ್" ಅಂಶಗಳು, ಇತ್ಯಾದಿಗಳಿಂದ ದುರ್ಬಲಗೊಂಡಿರುವ ಇಲ್ಲಿ ಸಾಕಷ್ಟು ಭರವಸೆಗಳಿವೆ) ಆದರೆ ಡಾಕ್‌ನ ಉತ್ಸಾಹವಿದೆ, ಮತ್ತು ಡಾಕ್ ಮತ್ತು ಅವರ ಸಿಬ್ಬಂದಿಯೊಂದಿಗೆ ನಮಗೆ ತಿಳಿದಿರುವವರು ಅದಕ್ಕೆ ಪ್ರತಿಕ್ರಿಯಿಸುತ್ತಾರೆ . ಆದ್ದರಿಂದ, ನನ್ನ ಸುದೀರ್ಘವಾದ ರೀತಿಯಲ್ಲಿ, ನಾನು ಹೇಳಲು ಪ್ರಯತ್ನಿಸುತ್ತಿರುವುದು ಇದು ಕೆಟ್ಟ ಚಲನಚಿತ್ರವಲ್ಲ: ಅದು ಇರಬೇಕಾದಷ್ಟು ಉತ್ತಮವಾಗಿಲ್ಲ. ಮತ್ತು ಸೂಪರ್‌ಮ್ಯಾನ್, ಜೇಮ್ಸ್ ಬಾಂಡ್, ಇಂಡಿಯಾನಾ ಜೋನ್ಸ್, ಬುಕ್ಕಾರೂ ಬನ್ಜೈ ಮತ್ತು ಇತರ ಅನೇಕ ಪಾತ್ರಗಳ ಅಭಿಮಾನಿಯಾಗಿರುವ ಯಾರಾದರೂ ಈ ಚಲನಚಿತ್ರವನ್ನು ಪರಿಶೀಲಿಸಬೇಕಾಗಿರುವುದು ಅವರೆಲ್ಲರಿಗೂ ಸ್ಫೂರ್ತಿ ನೀಡಿದ ನಾಯಕನೊಂದಿಗೆ ಪರಿಚಿತರಾಗಲು.#1
ಒಟ್ಟಾರೆಯಾಗಿ, ಸ್ವಿಸ್ ಚೀಸ್ ಗಿಂತ ಹೆಚ್ಚು ಉದ್ದವಾದ ಮತ್ತು ಹೆಚ್ಚು ಸಬ್‌ಲಾಟ್‌ಗಳಿಂದ ತುಂಬಿರುತ್ತದೆ. ನಿರ್ದೇಶಕ ಮತ್ತು ಸಹ-ಬರಹಗಾರ ಅವರು ಪ್ರಕಾರಗಳನ್ನು ಬೆರೆಸಲು ಬಯಸಿದ್ದಾರೆಂದು ಹೇಳುತ್ತಾರೆ - ಈ ಸಂದರ್ಭದಲ್ಲಿ ನಾಟಕ ಮತ್ತು ಹಾಸ್ಯ. ಸರಿ, ಕನಿಷ್ಠ ಇಲ್ಲಿ, ಈ ಎರಡು ವಿನೆಗರ್ ಮತ್ತು ಎಣ್ಣೆಯಂತೆ ಬೆರೆಯುತ್ತವೆ. ಬೂಟ್ ಮಾಡಲು, ಹಾಸ್ಯವು ತುಂಬಾ ತಮಾಷೆ ಮತ್ತು ಬಾಲಾಪರಾಧಿ ಅಲ್ಲ. ಹೆಚ್ಚುವರಿಯಾಗಿ, ಚಲನಚಿತ್ರವು ನಿಜವಾಗಿಯೂ ವಾಸ್ತವಿಕವಲ್ಲ. ಫ್ರೆಂಚ್ ನಾಗರಿಕರನ್ನು ಅವರ ಇಚ್ will ೆಗೆ ವಿರುದ್ಧವಾಗಿ ಮಾಡುವಲ್ಲಿ ಕಾನೂನು ವ್ಯವಸ್ಥೆ ಮತ್ತು ಫ್ರೆಂಚ್ ಆಸ್ಪತ್ರೆಗಳಲ್ಲಿ ಮಾದಕ ದ್ರವ್ಯಗಳೊಂದಿಗೆ ಪರಾರಿಯಾಗುವುದರ ಬಗ್ಗೆ ಸ್ವಾತಂತ್ರ್ಯವನ್ನು ತೆಗೆದುಕೊಳ್ಳಲಾಗುತ್ತದೆ. ನಾನು ಮನೆಯಲ್ಲಿ ನನ್ನ ದೊಡ್ಡ ಪರದೆಯ ಟಿವಿಯಲ್ಲಿ ಈ ಚಿತ್ರವನ್ನು ನೋಡಿದ್ದೇನೆ ಮತ್ತು ಮುಂದುವರಿಯಲು ಚಲನಚಿತ್ರವನ್ನು ಕೂಗುತ್ತಿದ್ದೇನೆ. ಅಂತಿಮವಾಗಿ ಕೊನೆಯಲ್ಲಿ ನಾನು ಅಂತಿಮ ಸುದೀರ್ಘ ಭಾಷಣವನ್ನು ಮುಖ್ಯ ಪಾತ್ರಗಳಲ್ಲಿ ಒಂದನ್ನು ಅವನ ಮಾಜಿ ಪ್ರೇಮಿಯ ಮಗನಿಗೆ ವೇಗವಾಗಿ ರವಾನಿಸಿದೆ. ಆ ಹೊತ್ತಿಗೆ ನಾನು ಸತ್ತ ಪ್ರೇಮಿ, ಅನುಕೂಲಕರ ಮದುವೆ ಮತ್ತು ಉದ್ಗಾರ ಮಾಜಿ ಪ್ರೇಮಿಯೊಂದಿಗೆ ವ್ಯವಹರಿಸುವ ಪೂರ್ವಭಾವಿ ಗೊಂದಲಮಯ ಕಥಾವಸ್ತುವಿನಿಂದ ಬಳಲುತ್ತಿದ್ದೆ. ಕೆಲವೊಮ್ಮೆ ಕಥಾವಸ್ತುವು ಎರಡು ಪ್ರಮುಖ ಪಾತ್ರಗಳ ಕುಟುಂಬಗಳಿಗೆ ತಿರುಗುತ್ತದೆ ಮತ್ತು ನಂತರ ಅವುಗಳಲ್ಲಿ ಒಂದಕ್ಕೆ ಹಿಂದಿರುಗುತ್ತದೆ - ಇಸ್ಮಾಯಿಲ್ ಅಥವಾ ಪ್ರಾಥಮಿಕವಾಗಿ ನೋರಾ. ಪ್ರೇಕ್ಷಕರ ಹಾನಿಗೆ, ನೋರಾ ಮತ್ತು ಇಸ್ಮಾಯಿಲ್ ಅವರಿಂದ ದೃಷ್ಟಿಕೋನಗಳು ಬದಲಾಗುತ್ತಲೇ ಇರುತ್ತವೆ, ಆಕೆಯ ಮಾಜಿ ಪ್ರೇಮಿ ಮನೋವೈದ್ಯಕೀಯ ಆಸ್ಪತ್ರೆಯಲ್ಲಿ ಅವನ ಇಚ್ will ೆಗೆ ವಿರುದ್ಧವಾಗಿ ಸೀಮಿತವಾಗಿರುತ್ತಾನೆ. ಬಹುಶಃ ಇಲ್ಲಿ ಎರಡು ಆಸಕ್ತಿದಾಯಕ ಚಲನಚಿತ್ರಗಳಿವೆ, ಇವೆರಡೂ ಉತ್ತಮವಾಗಿ ಅಭಿವೃದ್ಧಿ ಹೊಂದಿಲ್ಲ. ಎಪಿಲೋಗ್ ನಿಜವಾಗಿಯೂ ಅನೇಕ ಉಪ-ಪ್ಲಾಟ್‌ಗಳನ್ನು ಸುತ್ತುವರಿಯುವುದಿಲ್ಲ ಮತ್ತು ನೋರಾ ಹೇಗಾದರೂ ಸಂತೋಷವನ್ನು ಪಡೆಯುತ್ತಾನೆ ಎಂದು ವೀಕ್ಷಕರು ನಂಬಬೇಕೆಂದು ಬಯಸುತ್ತಾರೆ, ಆದರೆ ನಿಜ ಜೀವನದಲ್ಲಿ ಅವಳ ಸಂದರ್ಭಗಳನ್ನು ಗಮನಿಸಿದರೆ ಅವಕಾಶಗಳು ನರಕದಲ್ಲಿ ಹಿಮ ಚೆಂಡಿನ ಅವಕಾಶಕ್ಕೆ ಸಮಾನವಾಗಿರುತ್ತದೆ. ನಟರು ತಮ್ಮ ಕೈಲಾದಷ್ಟು ಕೆಲಸ ಮಾಡುತ್ತಾರೆ ಮತ್ತು ಮನಮುಟ್ಟುತ್ತಾರೆ, ಆದರೆ ಕಳಪೆ ಬರವಣಿಗೆ, ಸಂಪಾದನೆ ಮತ್ತು ಗಮನ ಕೊರತೆಯ ಎಲ್ಲಾ ಹೊಳೆಯುವ ದೋಷಗಳನ್ನು ನಿವಾರಿಸಲು ಇದು ಸಾಕಾಗುವುದಿಲ್ಲ.#0
