ಕೋಡ್ ಮೊದಲು "ಮರೆತುಹೋದ" ಚಲನಚಿತ್ರಗಳಲ್ಲಿ ಬೇಬಿ ಫೇಸ್ ಉತ್ತಮವಾಗಿದೆ. ಟರ್ನರ್ ಕ್ಲಾಸಿಕ್ ನೆಟ್‌ವರ್ಕ್‌ನಲ್ಲಿನ ವಾಟರ್ಲೂ ಬ್ರಿಡ್ಜ್‌ನ 1931 ರ ಆವೃತ್ತಿಯ ನಂತರ ಇದನ್ನು ಕಳೆದ ರಾತ್ರಿ ತೋರಿಸಲಾಗಿದೆ, ಹಾಗಾಗಿ ಈಗ ನಾಲ್ಕು ಪ್ಲಸ್ ನಿಮಿಷಗಳನ್ನು ಪುನಃಸ್ಥಾಪಿಸಲಾಗಿರುವುದರಿಂದ ನಾನು ಚಿತ್ರವನ್ನು ವೀಕ್ಷಿಸಲು ಸಾಧ್ಯವಾಯಿತು. <br /> <br /> ಸ್ಟ್ಯಾನ್‌ವಿಕ್ ಪೂರ್ವ ಸೇಂಟ್ ಲೂಯಿಸ್‌ನಲ್ಲಿ ವಾಸಿಸುತ್ತಿದ್ದಾಳೆ (ಅಲ್ಲಿ ಅವಳು "ಮೈರಾ" - ಮೇ ಕ್ಲಾರ್ಕ್ - ವಾಟರ್ಲೂ ಬ್ರಿಡ್ಜ್‌ನಲ್ಲಿ ಕುಡಿದ ಅಮಲನ್ನು ತಿಳಿದಿರಬಹುದು). ಆಕೆಯ ತಂದೆ ರಾಬರ್ಟ್ ಬ್ಯಾರೆಟ್. ಅವಳು ತನ್ನ ತಾಯಿಯ ಮರಣದ ನಂತರ ಅವನೊಂದಿಗೆ ವಾಸಿಸುತ್ತಿದ್ದಳು, ಮತ್ತು (ಪುನಃಸ್ಥಾಪಿಸಿದ ಸಂವಾದದಲ್ಲಿ) ಅವಳು 14 ವರ್ಷದವಳಿದ್ದಾಗಿನಿಂದ ಅವಳನ್ನು ತಳ್ಳುತ್ತಿದ್ದಾಳೆ. ಈಗ ಅವಳು ನಿವಾಸ ಪರಿಚಾರಿಕೆ ಮತ್ತು ಅರೆಕಾಲಿಕ ವೇಶ್ಯೆಯಾಗಿದ್ದಾಳೆ, ಅವಳ ಹತ್ತಿರದ ಸ್ನೇಹಿತ ಚಿಕೋ (ಥೆರೆಸಾ ಹ್ಯಾರಿಸ್), ಆಫ್ರಿಕನ್-ಅಮೇರಿಕನ್ ಸೇವಕ ಬ್ಯಾರೆಟ್ ಬೆದರಿಸುವಿಕೆಯನ್ನು ಮುಂದುವರಿಸುತ್ತಾಳೆ. ಸ್ಟ್ಯಾನ್‌ವಿಕ್‌ನ ವ್ಯಕ್ತಿತ್ವದ ಎರಡು ಉತ್ತಮ ಅಂಶಗಳಲ್ಲಿ ಒಂದಾದ ಅವಳು ಹ್ಯಾರಿಸ್ ಬಗ್ಗೆ ತನ್ನ ತಂದೆಯೊಂದಿಗೆ ನಿಲ್ಲುತ್ತಾ ಇರುತ್ತಾಳೆ, ಹ್ಯಾರಿಸ್‌ನನ್ನು ಕೆಲಸದಿಂದ ತೆಗೆದು ಹಾಕಿದರೆ ಹೊರಟು ಹೋಗುವುದಾಗಿ ಬೆದರಿಕೆ ಹಾಕುತ್ತಾಳೆ (ಮತ್ತು ನ್ಯಾಟ್ ಪೆಂಡಲ್ಟನ್‌ನಂತಹ ಅಸಹ್ಯಕರ ಕೆಲಸಗಾರರಾಗಿದ್ದರಿಂದ, ಸ್ಟ್ಯಾನ್‌ವಿಕ್ ಅವರಿಗೆ ಸೇವೆ ಮಾಡುವುದನ್ನು ನೋಡಿ ಆನಂದಿಸುತ್ತಾರೆ ಅವರು ಸೇವೆ ಸಲ್ಲಿಸುವ ಹೂಚ್‌ನ ಪರಿಮಳವು ಅವರನ್ನು ಕರೆತರುತ್ತದೆ, ಬ್ಯಾರೆಟ್ ಅವಳನ್ನು ಪಾಲಿಸಬೇಕು). <br /> <br /> ಸ್ಟ್ಯಾನ್‌ವಿಕ್ ಇಷ್ಟಪಡುವ ಭಾಷಣಕ್ಕೆ ನಿಯಮಿತವಾಗಿ ಬರುವ ಒಬ್ಬ ವ್ಯಕ್ತಿ ಶೂ ತಯಾರಕ ಮತ್ತು ಬೌದ್ಧಿಕ ಅಡಾಲ್ಫ್ ಕ್ರಾಗ್ (ಅಲ್ಫೋನ್ಸ್ ಎಥಿಯರ್) , ಉತ್ಸಾಹಭರಿತ ಹುಡುಗಿ ತನ್ನ ತ್ಯಜಿಸಿದ ಮನೆಯಿಂದ ಹೊರಟು ಹೋದರೆ ಉತ್ತಮ ಸಾಮರ್ಥ್ಯವನ್ನು ಯಾರು ನೋಡುತ್ತಾರೆ. ಅವರು ಫ್ರೆಡ್ರಿಕ್ ನೀತ್ಸೆ ಅವರ ತತ್ತ್ವಶಾಸ್ತ್ರವನ್ನು ಮತ್ತು ಅಧಿಕಾರಕ್ಕೆ ಇಚ್ will ಾಶಕ್ತಿಯ ಕಲ್ಪನೆಯನ್ನು ಸಹ ಮುಂದೂಡುತ್ತಿದ್ದಾರೆ. ಈ ಬಗ್ಗೆ ಇನ್ನಷ್ಟು ನಂತರ. <br /> <br /> ಅವರು ಸ್ಥಳೀಯ ರಾಜಕೀಯ ಬಿಗ್‌ವಿಗ್ (ಆರ್ಥರ್ ಹೋಲ್) ರನ್ನು ಹೊಡೆದ ನಂತರ, ಮತ್ತು ಈ ಬಗ್ಗೆ ಬ್ಯಾರೆಟ್‌ನೊಂದಿಗೆ ವಾದ ಮಾಡಿದ ನಂತರ, ಇನ್ನೂ ಸ್ಫೋಟವು ಬ್ಯಾರೆಟ್‌ನನ್ನು ಕೊಲ್ಲುತ್ತದೆ ಮತ್ತು ಸ್ಟ್ಯಾನ್‌ವಿಕ್‌ಗೆ ತನ್ನ .ರಿನಿಂದ ಹೊರಹೋಗಲು ಅನುವು ಮಾಡಿಕೊಡುತ್ತದೆ. ಅವಳು ಮತ್ತು ಹ್ಯಾರಿಸ್ ನ್ಯೂಯಾರ್ಕ್ ನಗರಕ್ಕೆ ತೆರಳುತ್ತಾರೆ, ಬ್ರೇಕ್‌ಮ್ಯಾನ್ (ಜೇಮ್ಸ್ ಮುರ್ರೆ) ಅವರೊಂದಿಗೆ ಮಲಗುವ ಮೂಲಕ ರೈಲ್ರೋಡ್ ಸರಕು ಕಾರಿನ ಮೂಲಕ ಉಚಿತ ಸಾರಿಗೆಯನ್ನು ಪಡೆಯಲು ನಿರ್ವಹಿಸುತ್ತಿದ್ದಾರೆ. ಅವರು ನ್ಯೂಯಾರ್ಕ್ ತಲುಪುತ್ತಾರೆ, ಮತ್ತು ಅವರು ನಡೆದಾಡಿದ ನಂತರ ಅವರು ಗೊಥಮ್ ಟ್ರಸ್ಟ್ ಕಂಪನಿಯನ್ನು (1873 ರಲ್ಲಿ ಸ್ಥಾಪಿಸಿದರು) ನೋಡುತ್ತಾರೆ, ಮತ್ತು ಸಿಬ್ಬಂದಿ ಕ office ೇರಿ ಎಲ್ಲಿದೆ ಎಂದು ಸ್ನೇಹಪರ ಸಿಬ್ಬಂದಿ ಅವಳಿಗೆ ತಿಳಿಸುತ್ತಾರೆ. <br /> <br /> ನಾವು ನಿಧಾನವಾಗಿ ಸ್ಟ್ಯಾನ್‌ವಿಕ್ ಕಾರ್ಪೊರೇಟ್ ಏಣಿಗೆ ಏರುವುದನ್ನು ನೋಡುತ್ತೇವೆ ರಾಬರ್ಟ್ ಮೋರ್ಸ್‌ಗಿಂತಲೂ ಹೆಚ್ಚು, ಹೋಲುತ್ತದೆ (ಆದರೆ ಸ್ಲೀಜಿಯರ್) ನಿಜವಾಗಿಯೂ ಪ್ರಯತ್ನಿಸದೆ ವ್ಯವಹಾರದಲ್ಲಿ ಹೇಗೆ ಯಶಸ್ವಿಯಾಗಬಹುದು ಎಂದು ಧೈರ್ಯಮಾಡಿದರು. ಆದರೆ ಮೋರ್ಸ್ ಮನುಷ್ಯ ಪ್ರಾಬಲ್ಯದ ಕಂಪನಿಯಲ್ಲಿ ಒಬ್ಬ ವ್ಯಕ್ತಿ. ಸ್ಟ್ಯಾನ್ವಿಕ್ ತನ್ನ ಲೈಂಗಿಕ ಆಕರ್ಷಣೆಯನ್ನು ತನ್ನ ಆಯುಧವೆಂದು ತಿಳಿದಿದ್ದಾನೆ. ಅವಳು ಜಾನ್ ವೇನ್, ಡೌಗ್ಲಾಸ್ ಡಂಬ್ರಿಲ್ (ಚಿತ್ರದ ಒಂದು ಭಾಗವು ಅತ್ಯಂತ ಆಘಾತಕಾರಿ ಎಂದು ನಾನು ಭಾವಿಸಿದ್ದೇನೆ - ಕುತೂಹಲದಿಂದ ಸಾಕಷ್ಟು - ನಾನು ಅದನ್ನು ನೋಡಿದಾಗ), ಡೌಗ್ಲಾಸ್ ವುಡ್, ಹೆನ್ರಿ ಕೋಲ್ಕರ್ ಮತ್ತು ಅಂತಿಮವಾಗಿ ಜಾರ್ಜ್ ಬ್ರೆಂಟ್. ಪ್ರತಿಯೊಂದೂ ಅವಳಿಗೆ ಬೀಳುತ್ತದೆ, ಮತ್ತು ಇನ್ನು ಮುಂದೆ ಉಪಯುಕ್ತವಾಗದಿದ್ದಾಗ ಪಕ್ಕಕ್ಕೆ ತಳ್ಳಲ್ಪಡುತ್ತದೆ, ಅಥವಾ ಅವಳಿಂದ ನಾಶವಾಗುತ್ತದೆ. ತನ್ನ ಅಜ್ಜ ಸ್ಥಾಪಿಸಿದ ಬ್ಯಾಂಕಿನ ಹೊಸ ಅಧ್ಯಕ್ಷ ಬ್ರೆಂಟ್ ಅಂತಿಮವಾಗಿ ಅವಳನ್ನು ಮದುವೆಯಾಗುತ್ತಾನೆ - ಮತ್ತು ಬ್ಯಾಂಕಿನ ಆರ್ಥಿಕ ಪರಿಸ್ಥಿತಿ ಅಲುಗಾಡಿದಾಗ ಚಿತ್ರದ ಬಿಕ್ಕಟ್ಟು ಉಂಟಾಗುತ್ತದೆ (ವಿಶೇಷವಾಗಿ ಬ್ರೆಂಟ್ ಆಭರಣಗಳಲ್ಲಿ ಅವಳ ಸಂಪತ್ತನ್ನು ಖರೀದಿಸಿ ಅವಳ ಅಮೂಲ್ಯವಾದ ಬಾಂಡ್‌ಗಳನ್ನು ನೀಡಿದ ನಂತರ). ಬ್ರೆಂಟ್ ವಿರುದ್ಧ ದೋಷಾರೋಪಣೆ ಮಾಡಲಾಗಿದೆ. ಅವಳು ಅವನಿಗೆ ಅಂಟಿಕೊಳ್ಳುತ್ತಾನಾ? <br /> <br /> ಸ್ಪಾಯ್ಲರ್ ಬರಲಿದೆ: <br /> <br /> ಒಪ್ಪಿಕೊಳ್ಳದ ಈ ಚಲನಚಿತ್ರಗಳ ಬಗ್ಗೆ ಒಂದು ವಿಷಯವೆಂದರೆ ಆ ಕಾಲದ ನಾಟಕೀಯ ಮತ್ತು ನೈತಿಕ ಸಂಪ್ರದಾಯಗಳು ಇನ್ನೂ ಅಂತ್ಯಗಳನ್ನು ನಿರ್ದೇಶಿಸುತ್ತವೆ. ಮೂಲ ಅಂತ್ಯದಲ್ಲಿ ಸ್ಟಾಂವಿಕ್ ಯುರೋಪ್‌ಗೆ ಹಡಗಿನಲ್ಲಿ ಬ್ರೆಂಟ್‌ನನ್ನು ತನ್ನ ಹಣೆಬರಹವನ್ನು ತ್ಯಜಿಸಿದನು, ಆದರೆ ಅವಳು ಅವನಿಗೆ ಅದನ್ನು ಮಾಡಲು ಸಾಧ್ಯವಿಲ್ಲವೆಂದು ಅರಿತುಕೊಂಡು, ಅವರ ಅಪಾರ್ಟ್‌ಮೆಂಟ್ ಮನೆಗೆ ಹಿಂದಿರುಗಿದನು ಮತ್ತು ಅವನು ಸ್ವತಃ ಗುಂಡು ಹಾರಿಸಿದ್ದನ್ನು ಕಂಡುಕೊಂಡನು. ಅದು ಮುಗಿಯುತ್ತಿದ್ದಂತೆ ಅವಳು ಅವನೊಂದಿಗೆ ಆಸ್ಪತ್ರೆಗೆ ಸವಾರಿ ಮಾಡುತ್ತಿದ್ದಾಳೆ. ಈಗ ಮರುಶೋಧಿಸಲಾದ ತುಣುಕನ್ನು ಕಂಡುಹಿಡಿಯುವ ಮೊದಲು, ಚಲನಚಿತ್ರವು ಅವರೊಂದಿಗೆ ಉಳಿತಾಯ ಮಾಡಲು ತಮ್ಮ ಹಣವನ್ನು ಬ್ಯಾಂಕಿಗೆ ಬಿಟ್ಟುಕೊಟ್ಟಿತು ಮತ್ತು ಬಡವರಾಗಿದ್ದರೆ ಸಂತೋಷದಿಂದ ಬದುಕಲು ಪೂರ್ವ ಸೇಂಟ್ ಲೂಯಿಸ್‌ಗೆ ನಿವೃತ್ತರಾದರು. <br /> <br /> ಇವುಗಳಲ್ಲಿ ಉತ್ತಮ ಅಂತ್ಯಗಳಿವೆ. ಸ್ಟ್ಯಾನ್ವಿಕ್ ತನ್ನ ವಿನಾಶಕಾರಿ ಹಾದಿಯಲ್ಲಿ ಮುಂದುವರಿಯಬೇಕು, ಬ್ರೆಂಟ್ ತನ್ನ ಬಲಿಪಶುಗಳಲ್ಲಿ ಕೊನೆಯವನು. ಆದರೆ ಬ್ರೀನ್ ಆಫೀಸ್ ಇಲ್ಲದೆ ಸ್ಕ್ರಿಪ್ಟ್ ಬರಹಗಾರರು (ಒಬ್ಬರು ಡಾರಿಲ್ an ಾನಕ್, ಅವರು ನೈತಿಕ ಕೇಂದ್ರವನ್ನು ಕಂಡುಕೊಳ್ಳಲು ಯೋಗ್ಯರಾಗಿದ್ದಾರೆ). ಅವಳು ಯಾರೂ ಇಲ್ಲ - ಶಕ್ತಿಯುತ ಪುರುಷರಿಗೆ ಕನಿಷ್ಠ ಯಾರೂ ಇಲ್ಲ (ಅವಳು ದ್ವೇಷಿಸುತ್ತಾಳೆ). ಖಿನ್ನತೆಯ ಪ್ರೇಕ್ಷಕರು ಆ ರೀತಿಯ ತೀರ್ಮಾನವನ್ನು ಸಹಿಸಬಹುದೆಂದು ನಾನು ಭಾವಿಸುವುದಿಲ್ಲ. <br /> <br /> ಸಾರ್ವಜನಿಕ ಅಭಿಪ್ರಾಯದ ಬದಲಾಗುತ್ತಿರುವ ಶೈಲಿಗಳು ಮತ್ತು ಸಮಾಜದಲ್ಲಿನ ಬದಲಾವಣೆಗಳಿಂದಾಗಿ ಇತರ ಸಮಸ್ಯೆಗಳಿವೆ. ಇದು ಕಾರ್ಪೊರೇಟ್ ಜಗತ್ತಿನಲ್ಲಿ 1933 ರಲ್ಲಿ ಮನುಷ್ಯನ ಜಗತ್ತು, ಆದ್ದರಿಂದ ಸ್ಟ್ಯಾನ್ವಿಕ್ ತನ್ನ ಕೆಲಸವನ್ನು ಅವಳಿಗೆ ಕತ್ತರಿಸಿದ್ದಾನೆ. ವುಡ್ (ಅವನೊಂದಿಗೆ ವಿವೇಚನೆಗಾಗಿ ಅವಳನ್ನು ವಜಾ ಮಾಡಲು ಹೋದಾಗ) ಅವಳು ಕೆಲಸ ಮಾಡಲು ಇಷ್ಟಪಡುವುದಿಲ್ಲ ಎಂದು ಒಪ್ಪಿಕೊಳ್ಳುತ್ತಾನೆ. <br /> <br /> ಆದರೆ 2006 ರಲ್ಲಿ, ಸ್ಟ್ಯಾನ್‌ವಿಕ್ ಎಲ್ಲೆಡೆ ಮಹಿಳೆಯನ್ನು ಹುಡುಕುತ್ತಿದ್ದ. ಚಿತ್ರದಲ್ಲಿ ಸ್ಟ್ಯಾನ್‌ವಿಕ್‌ನ ಬಗ್ಗೆ ಅಸಹ್ಯವಾದ, ಬೆಕ್ಕಿನ ಟೀಕೆಗಳು (ಸ್ಪಷ್ಟವಾಗಿ ಕೆಲವು ಅಸೂಯೆ ಆಧರಿಸಿವೆ) ಇತರ ಕಾರ್ಯದರ್ಶಿಗಳು ಮತ್ತು ಮಹಿಳಾ ಉದ್ಯೋಗಿಗಳಿಂದ ಶೀಘ್ರವಾಗಿ ಏರಿಕೆಯಾಗಿದೆ. 2006 ರಲ್ಲಿ, ಅವರು ಆಗಾಗ್ಗೆ ಮಹಿಳಾ ಮೇಲಧಿಕಾರಿಗಳನ್ನು ಎದುರಿಸುತ್ತಿದ್ದಾರೆ, ಮತ್ತು ಅವರು ಅವಳನ್ನು ಕಾಲುಗಳಲ್ಲಿ ಬೇಗನೆ ಕತ್ತರಿಸುತ್ತಾರೆ. ಸಹಜವಾಗಿ, ಅವಳು ಒಬ್ಬರು ಅಥವಾ ಇಬ್ಬರು ಸಲಿಂಗಕಾಮಿಗಳು ಎಂದು ಕಂಡುಕೊಂಡರೆ ಅವಳು ಆ ರಸ್ತೆಯನ್ನು ಪ್ರಯತ್ನಿಸಬಹುದು ಆದರೆ ಇದು ಅನುಮಾನಾಸ್ಪದವಾಗಿದೆ. ಮತ್ತು ಅವಳು ಸಲಿಂಗಕಾಮಿಗಳಾದ ಯಾವುದೇ ಪುರುಷರನ್ನು ಭೇಟಿಯಾಗುವುದಿಲ್ಲ. ಅವರು ವ್ಯವಹಾರದಲ್ಲಿ ಸಲಿಂಗಕಾಮಿ ಪುರುಷ ಕಾರ್ಯನಿರ್ವಾಹಕರನ್ನು ಹೊಂದಿದ್ದಾರೆ, ಅವರು ಅವಳ ಕಾಲುಗಳು ಅಥವಾ ಸ್ತನಗಳ ಬಗ್ಗೆ ಕೆಟ್ಟದ್ದನ್ನು ನೀಡುವುದಿಲ್ಲ. <br /> <br /> ನಂತರ ಅವರ ಮಾರ್ಗದರ್ಶಕ ಶ್ರೀ ಕ್ರಾಗ್ ಇದ್ದಾರೆ. ಕ್ರಾಗ್ ಅವರನ್ನು "ಬೌಡ್ಲೈರೈಸ್ಡ್" ಆವೃತ್ತಿಯಲ್ಲಿ ರೀಮೇಕ್ ಮಾಡಲಾಗಿದ್ದು, ಅವಳನ್ನು ನೈತಿಕ ಕೇಂದ್ರವನ್ನಾಗಿ ಮಾಡಲು ಪ್ರಯತ್ನಿಸುತ್ತಿದೆ. ವಾಸ್ತವದಲ್ಲಿ ಅವನು ನೀತ್ಸೆ ಅವರನ್ನು ತಳ್ಳುತ್ತಾನೆ, ಆದರೆ ದಾರಿ (ವಿಶಾಲ ಅರ್ಥದಲ್ಲಿ) ನಾಜಿಗಳು ನೀತ್ಸೆ ಅವರನ್ನು ತಳ್ಳಿದರು - ಅಧಿಕಾರಕ್ಕೆ ನಿಮ್ಮ ದಾರಿ ಕಂಡುಕೊಳ್ಳಿ ಮತ್ತು ಅದನ್ನು ತಳ್ಳಿರಿ. ನೀತ್ಸೆ ಕೆಲವೊಮ್ಮೆ ಒತ್ತಡದ ಶಕ್ತಿಯನ್ನು ಮಾಡಿದರೂ, ಅದು ಅವರ ಎಲ್ಲ ಸಿದ್ಧಾಂತಗಳಲ್ಲ. ಇಲ್ಲದಿದ್ದರೆ ಇಂದು ಕಾಲೇಜು ಕೋರ್ಸ್‌ಗಳಲ್ಲಿ ಯಾರೂ ಅವನನ್ನು ಓದುವುದಿಲ್ಲ. ಕ್ರಾಗ್ ಸ್ಪಷ್ಟವಾಗಿ ಸ್ವಯಂ-ವಿದ್ಯಾವಂತ, ಆದರೆ ಅರ್ಧ-ವಿದ್ಯಾವಂತರು ಮಾತ್ರ. ಸಂಕ್ಷಿಪ್ತವಾಗಿ ಹೇಳುವುದಾದರೆ, ನೀತ್ಸೆ ಅವರನ್ನು ಕೂಲಂಕಷವಾಗಿ ಅಧ್ಯಯನ ಮಾಡಿದ ಯಾರಾದರೂ ಕ್ರಾಗ್‌ನನ್ನು ಎದುರಿಸಿದರೆ ಅವನು ಅವನನ್ನು ಅರ್ಧ-ವಿದ್ಯಾವಂತ ಮೂರ್ಖನಂತೆ ಕಾಣುವಂತೆ ಮಾಡುತ್ತಾನೆ. ಮತ್ತು ಇದು ಸ್ಟ್ಯಾನ್‌ವಿಕ್‌ನ ಮಾರ್ಗದರ್ಶಕ! ಒಳ್ಳೆಯ ಚಿತ್ರ, ಮತ್ತು ಇದು 10 ರ ಮೌಲ್ಯದ ದಿನವಾಗಿದೆ ... ಆದರೆ ಗಂಭೀರವಾಗಿ ದೋಷಪೂರಿತವಾಗಿದೆ.#1
ನಾನು ಸುಳ್ಳು ಹೇಳಲು ಹೋಗುವುದಿಲ್ಲ. ಆಸಕ್ತಿದಾಯಕವಾಗಿ ಕಾಣುತ್ತಿದ್ದರೂ, ನಾನು ದಿ ನಟೋರಿಯಸ್ ಬೆಟ್ಟಿ ಪುಟವನ್ನು ನೋಡಿದ್ದೇನೆ ಏಕೆಂದರೆ ನಾನು ಕೇಳಿದ್ದೇನೆ (ಮತ್ತು ಚಿತ್ರದ ಸಾರಾಂಶ ಅಥವಾ ಯಾವುದನ್ನಾದರೂ ನೋಡುವ ಮೂಲಕ ಇದು ಸ್ಪಷ್ಟವಾಗಿತ್ತು), ಗ್ರೆಚೆನ್ ಮೋಲ್ ಅದರಲ್ಲಿ ಬೆತ್ತಲೆಯಾಗಿದ್ದಾನೆ. ನಾನು ಎಂದಿಗೂ ಮೋಲ್ನ ಅಭಿಮಾನಿಯಾಗಲಿಲ್ಲ, ಆದರೆ ಆಕರ್ಷಕ ಮಹಿಳೆ ತನ್ನ ಬಟ್ಟೆಗಳನ್ನು ತೆಗೆಯುವುದನ್ನು ನಾನು ವಿರೋಧಿಸಲು ಸಾಧ್ಯವಿಲ್ಲ. ಹೌದು, ಅದು ವಿಕೃತವಾಗಬಹುದು, ಆದರೆ ಇದು ಒಂದು ಥೀಮ್ ಮತ್ತು ಚಲನಚಿತ್ರದ ಅತ್ಯಂತ ಮುಖ್ಯವಾದ ಕೇಂದ್ರವಾಗಿದೆ, ಮತ್ತು ಚಲನಚಿತ್ರವು ಬಹುಶಃ ಇರಬೇಕಾದದ್ದಕ್ಕಿಂತ ಹೆಚ್ಚು ಬಲಶಾಲಿಯಾಗಲು ಸಹಾಯ ಮಾಡುತ್ತದೆ. <br /> <br /> ಈ ಚಿತ್ರವು ಬೆಟ್ಟಿ ಪೇಜ್ ಅನ್ನು ನಿರೂಪಿಸುತ್ತದೆ (ಮೋಲ್) ​​ದಕ್ಷಿಣದ ಪ್ರೌ school ಶಾಲೆಯಲ್ಲಿ ಮಗುವಾಗಿದ್ದಾಗ ದೈಹಿಕ ಮತ್ತು ಲೈಂಗಿಕ ಕಿರುಕುಳದ ದಿನಗಳಿಂದ ಮತ್ತು ನ್ಯೂಯಾರ್ಕ್ನಲ್ಲಿ ಅವಳ ಹೊಸ ಜೀವನಕ್ಕೆ ಜೀವನ. ಅವಳು ನಟಿಯಾಗಬೇಕೆಂದು ಬಯಸುತ್ತಾಳೆ, ಆದರೆ ಅವಳು ಬಿಲ್‌ಗಳನ್ನು ಸಹ ಪಾವತಿಸಬೇಕಾಗುತ್ತದೆ. ಸ್ಥಳೀಯ ಕಡಲತೀರದಲ್ಲಿ ಕೆಲವು ಮುಗ್ಧ ಹೊಡೆತಗಳನ್ನು ತೆಗೆದುಕೊಂಡ ನಂತರ, ಪುಟ ನಿಧಾನವಾಗಿ ಮಾಡೆಲಿಂಗ್ ಸಂವೇದನೆಯಾಗುತ್ತದೆ, ಮತ್ತು ಸೂಚಿಸುವ ಫೋಟೋಗಳಿಂದ ಲೈಂಗಿಕವಾಗಿ ಪ್ರಚೋದಿಸುವ ಪಿನ್-ಅಪ್ s ಾಯಾಚಿತ್ರಗಳಿಗೆ ತ್ವರಿತವಾಗಿ ಜಿಗಿಯುತ್ತದೆ. <br /> <br /> ಚಿತ್ರದ ಸಂಕ್ಷಿಪ್ತತೆಯನ್ನು ನಾನು ಅನುಭವಿಸುತ್ತೇನೆ (ಕೇವಲ ತೊಂಬತ್ತು ನಿಮಿಷಗಳಿಗಿಂತ ಹೆಚ್ಚು) ಇದು ಶಾಪ ಮತ್ತು ಆಶೀರ್ವಾದ ಎರಡೂ ಆಗಿದೆ. ಒಂದೆಡೆ, ಚಲನಚಿತ್ರವು ತನ್ನ ಸ್ವಾಗತವನ್ನು ಎಂದಿಗೂ ಮೀರಿಸುವುದಿಲ್ಲ. ಕೆಲವೇ ನಿಮಿಷಗಳಲ್ಲಿ ನೀವು ಪುಟವನ್ನು ತಿಳಿದುಕೊಳ್ಳುತ್ತೀರಿ, ಮತ್ತು ಅದು ಅವಳ ಮಾಡೆಲಿಂಗ್ ವೃತ್ತಿಜೀವನಕ್ಕೆ ಸರಿಯಾಗಿ ಸಿಗುತ್ತದೆ ಮತ್ತು ಹಿಂತಿರುಗಿ ನೋಡುವುದಿಲ್ಲ. ಆದರೆ ಅದು ಚಲನಚಿತ್ರವನ್ನು ಶಪಿಸುತ್ತದೆ, ಏಕೆಂದರೆ ನಡೆಯುತ್ತಿರುವ ಎಲ್ಲವನ್ನೂ ಗ್ರಹಿಸಲು ನಮಗೆ ಎಂದಿಗೂ ಅವಕಾಶ ಸಿಗುವುದಿಲ್ಲ. ಮಾಡೆಲಿಂಗ್ ಚಿಗುರುಗಳು ಮತ್ತು ಪ್ರಮುಖ ಸೆನೆಟ್ ತನಿಖೆಗೆ ಹಾರಿಹೋಗುವ ಮೊದಲು ಅವರು ರಚಿಸುವ ವಿವಾದಗಳ ನಡುವೆ ಅವಳು ಕೇವಲ ಒಂದು ರೀತಿಯ ಜಿಗಿತಗಳನ್ನು ಮಾಡುತ್ತಾಳೆ, ಅದು ಚಿತ್ರದ ಅಂತಿಮ ಕಾರ್ಯವನ್ನು ತೆಗೆದುಕೊಳ್ಳುತ್ತದೆ. ನೀವು ಅಲ್ಲಿಯೇ ಕುಳಿತುಕೊಳ್ಳಿ, ಮತ್ತು ಎಲ್ಲವನ್ನೂ ಹೀರಿಕೊಳ್ಳಲು ಪ್ರಯತ್ನಿಸಿ, ಮತ್ತು ಹೆಚ್ಚು ನಿಮ್ಮ ಬಳಿಗೆ ಬರುತ್ತದೆ. ಚಲನಚಿತ್ರ ನಿರ್ಮಾಪಕರು ತುಂಬಾ ಚಿಕ್ಕದಾದ ಚಲನಚಿತ್ರದಲ್ಲಿ ಹೆಚ್ಚು ವಸ್ತುಗಳನ್ನು ಸಂಕ್ಷಿಪ್ತಗೊಳಿಸಲು ಬಯಸಿದಂತೆ ಭಾಸವಾಗುತ್ತದೆ. ಇದು ದೀರ್ಘ ಅನುಕ್ರಮಗಳಿಗಾಗಿ ಬೇಡಿಕೊಳ್ಳುತ್ತದೆ ಮತ್ತು ಇನ್ನೂ ಹೆಚ್ಚಿನ ವಿವರಣೆಗಳಿಗಾಗಿ ಹೆಚ್ಚು ಬೇಡಿಕೊಳ್ಳುತ್ತದೆ. ಇದು ಧಾವಿಸಿಲ್ಲ; ಅದು ಎಲ್ಲವನ್ನು ಅನುಭವಿಸುವುದಿಲ್ಲ. <br /> <br /> ಮತ್ತೊಂದು ಕುತೂಹಲ, ಸ್ವಲ್ಪ ಹೆಚ್ಚು ಕುತೂಹಲವಿದ್ದರೂ, ಚಿತ್ರದುದ್ದಕ್ಕೂ ಬಣ್ಣವನ್ನು ಬಳಸುವುದು. ಬಹುಪಾಲು ಕಪ್ಪು ಮತ್ತು ಬಿಳಿ ಬಣ್ಣದಲ್ಲಿದೆ, ಆದರೆ ಆಗಾಗ್ಗೆ, ಸ್ಪ್ಲಾಶ್ಗಳು ಮತ್ತು ಬಣ್ಣದ ಅನುಕ್ರಮಗಳು ಹೊರಹೊಮ್ಮುತ್ತವೆ. ಆದರೆ ಇದನ್ನು ಮೊದಲಿನಿಂದಲೂ ಸಾಂಕೇತಿಕ ಗೆಸ್ಚರ್ ಆಗಿ ಮಾಡಬಹುದಾದರೂ, ಇದು ಕಪ್ಪು ಮತ್ತು ಬಿಳುಪು ಬಣ್ಣಕ್ಕೆ ಕತ್ತರಿಸುವ ಮೊದಲು ನಿರಂತರವಾಗಿ ನಂತರ ಕಾಣಿಸಿಕೊಳ್ಳುವುದರಿಂದ ಇದು ಸ್ವಲ್ಪ ವಿಚಲಿತವಾಗುತ್ತದೆ. ಇದು ಗೊಂದಲಕ್ಕೊಳಗಾಗುತ್ತದೆ, ಮತ್ತು ಚಲನಚಿತ್ರವು ಮುಂದುವರೆದಂತೆ ಎಲ್ಲಕ್ಕಿಂತ ಹೆಚ್ಚು ಬೇಸರದ ಹಸ್ತಕ್ಷೇಪವಾಗುತ್ತದೆ. <br /> <br /> ಇದು ಕ್ರಿಯೆಗಳೊಂದಿಗೆ ಸ್ವಲ್ಪ ಗೊಂದಲಕ್ಕೊಳಗಾಗಬಹುದಾದರೂ, ಚಲನಚಿತ್ರವು ಅದರ ವಿಷಯಗಳೊಂದಿಗೆ ಸತ್ತುಹೋಗುತ್ತದೆ. ನನಗೆ ಏನೂ ತಿಳಿದಿಲ್ಲದ ಪುಟವನ್ನು ಮುಗ್ಧವಾಗಿ ಆಡಲಾಗುತ್ತದೆ, ಮತ್ತು ಅವಳ ಪ್ರಪಂಚವು ಒಂದೇ ಆಗಿರುತ್ತದೆ. ತನ್ನ ಹದಿಹರೆಯದ ವರ್ಷಗಳಲ್ಲಿ ಕೆಲವು ಮೋಸದ ಪಾತ್ರಗಳಿಗಾಗಿ ಉಳಿಸಿ, ಅವಳು ಎದುರಿಸುವ ಪ್ರತಿಯೊಬ್ಬರೂ ಮುಗ್ಧರು, ಮತ್ತು ಅವಳು ಮಾಡುವ ಪ್ರತಿಯೊಂದಕ್ಕೂ ಅದಕ್ಕೆ ಮುಗ್ಧತೆ ಇರುತ್ತದೆ. ನಾನು ಪೂರ್ಣ ಮುಂಭಾಗದ ನಗ್ನತೆಯನ್ನು ಅಶ್ಲೀಲ ಮತ್ತು ಅಧಃಪತನದ ಹೊರತಾಗಿ ನೋಡುತ್ತೇನೆ ಎಂದು ನಾನು ಎಂದಿಗೂ ಯೋಚಿಸಲಿಲ್ಲ, ಆದರೆ ಇಲ್ಲಿ, ಇದು ನಿಜಕ್ಕೂ ಆಶ್ಚರ್ಯಪಡುವ ಸಂಗತಿಯಾಗಿದೆ. ಒಂದೇ ಬಾರಿಗೆ, ಇದು ಸುಂದರ ಮತ್ತು ಮುಗ್ಧವಾಗಿದೆ. ಚಿತ್ರದಲ್ಲಿನ ಅತ್ಯಂತ ಲೈಂಗಿಕವಾಗಿ ವಿಕೃತ ಕ್ಷಣಗಳು (ಇಂದಿನ ಮಾನದಂಡಗಳಿಗೆ ಹೋಲಿಸಿದರೆ ಪಳಗಿದರೂ ಸಹ) ಅವರಿಗೆ ಮುಗ್ಧ ಮತ್ತು ದೇವದೂತರ ಭಾವನೆ ಇದೆ. ಮೋಲ್ನ ನಗ್ನ ದೇಹವನ್ನು ಚಿತ್ರಿಸಿದ ವಿಧಾನದ ಬಗ್ಗೆ ಏನಾದರೂ ಇದೆ, ಅದು ಇತರ ಚಿತ್ರಗಳಲ್ಲಿನ ನಗ್ನ ದೇಹಗಳಿಗಿಂತ ವಿಭಿನ್ನವಾದ ಸ್ವರಮೇಳವನ್ನು ಹೊಡೆಯುತ್ತದೆ. ಇದು ತುಂಬಾ ಸ್ವಾಭಾವಿಕ ಮತ್ತು ಆಶ್ಚರ್ಯಕರವಾಗಿದೆ ಎಂದು ಭಾವಿಸುತ್ತದೆ, ಚಿತ್ರವನ್ನು ನೋಡಲು ಯಾವುದೇ ಕಾರಣವಿದ್ದಲ್ಲಿ, ಬೆಟ್ಟಿ ಪುಟವನ್ನು ಆಡುವಾಗ ಮೋಲ್ ಅವರ ದೇಹದ ಅದ್ಭುತ ಚಿತ್ರಣಗಳನ್ನು ನೋಡುವುದು. <br /> <br /> ಇತರ ಕಾರಣ ಮೋಲ್ ಸ್ವತಃ. ಪುಟದಂತೆ, 1950 ರ ದಕ್ಷಿಣದ ಬೆಲ್ಲೆ ಎಲ್ಲರಿಗೂ ತಿಳಿದಿದೆ (ಅಥವಾ ಕನಿಷ್ಠ .ಹಿಸಬಲ್ಲದು) ಎಂದು ಅವರು ಉದಾಹರಣೆಯಾಗಿ ತೋರಿಸುತ್ತಾರೆ. ತನ್ನ ವೃತ್ತಿಯ ಹೊರತಾಗಿಯೂ, ಅವಳು ಇನ್ನೂ ಸಾಮಾನ್ಯ ವ್ಯಕ್ತಿಯಾಗಿದ್ದು, ತನ್ನನ್ನು ತಾನು ಧಾರ್ಮಿಕ ಎಂದು ನೋಡುತ್ತಾಳೆ. 1950 ರ ದಶಕದಿಂದ ಈ ಪಾತ್ರವನ್ನು ದೃ he ವಾಗಿ ಅನುಭವಿಸಲು ಮೋಲ್ ಅವಳನ್ನು ಸರಿಯಾದ ಪ್ರಮಾಣದ ಸ್ವಚ್ -ತೆಗಾಗಿ ನಿರ್ವಹಿಸುತ್ತಾನೆ. ಮೋಲ್ ವಾಸ್ತವವಾಗಿ ಬೆಟ್ಟಿ ಪೇಜ್ ಎಂದು ನೀವು ಭಾವಿಸದಿರಲು ನೀವು ಕಷ್ಟಪಡುವಂತಹ ವಾಸ್ತವಿಕತೆಯೊಂದಿಗೆ ಅವಳು ಅವಳನ್ನು ಆಡುತ್ತಾಳೆ. <br /> <br /> ದುರದೃಷ್ಟವಶಾತ್, ಪೋಷಕ ಪಾತ್ರಗಳು ಹೊಳೆಯಲು ಬಹಳ ಕಡಿಮೆ ಕ್ಷಣಗಳನ್ನು ಹೊಂದಿವೆ, ಮತ್ತು ಮೋಲ್ ಅವರ ಅದ್ಭುತ ಪ್ರದರ್ಶನದಿಂದ ಸಂಪೂರ್ಣವಾಗಿ ಮುಚ್ಚಿಹೋಗಿದೆ. ಅವರಲ್ಲಿ ಯಾರೊಬ್ಬರೂ ವಿಶೇಷವಾಗಿ ಆಹ್ಲಾದಕರವಾದ ಏನನ್ನೂ ಮಾಡುವುದಿಲ್ಲ, ಮತ್ತು ಮೋಲ್ ಮಾಡುವಂತೆ ಅವರಲ್ಲಿ ಯಾರೊಬ್ಬರೂ ಅದೇ ಪಾತ್ರವನ್ನು ಹೊಂದಿಲ್ಲ. ಇದು ನಿಜವಾಗಿಯೂ ನಟರ ತಪ್ಪು ಅಲ್ಲ, ಆದರೆ ಅವರೊಂದಿಗೆ ಕೆಲಸ ಮಾಡಲು ಹೆಚ್ಚು ಇಲ್ಲದಿರುವುದು ಹೆಚ್ಚು. ಅವುಗಳಲ್ಲಿ ಹಲವು ಸಂಪೂರ್ಣವಾಗಿ ಗುರುತಿಸಲ್ಪಡುತ್ತವೆ, ಉದಾಹರಣೆಗೆ ಆಸ್ಕರ್-ನಾಮಿನಿ ಡೇವಿಡ್ ಸ್ಟ್ರಾಥೈರ್ನ್ (ಒಂದು ಪಾತ್ರದಲ್ಲಿ ಅವರ ಒಂದು ಉತ್ತಮ ಪ್ರದರ್ಶನಕ್ಕೆ ಸ್ವಲ್ಪ ಹತ್ತಿರದಲ್ಲಿದೆ), ಸಾರಾ ಪಾಲ್ಸನ್ (ಸನ್ಸೆಟ್ ಸ್ಟ್ರಿಪ್‌ನಲ್ಲಿ ಸ್ಟುಡಿಯೋ 60 ಗಾಗಿ ಇತ್ತೀಚಿನ ಗೋಲ್ಡನ್ ಗ್ಲೋಬ್ ನಾಮಿನಿ), ಮತ್ತು ಪಾತ್ರ ನಟ ಲಿಲಿ ಟೇಲರ್, ಆದರೆ ನೀವು ಅವರ ಕಾರ್ಯಕ್ಷಮತೆಯನ್ನು ಸರಿ ಹೊರತುಪಡಿಸಿ ಬೇರೆ ಯಾವುದನ್ನಾದರೂ ಇರಿಸಲು ಕಷ್ಟಪಡುತ್ತೀರಿ. ಈ ಯಾವುದೇ ಪಾತ್ರಗಳು ನಿಜವಾಗಿಯೂ ಅಭಿವೃದ್ಧಿಗೊಂಡಿಲ್ಲ, ಮತ್ತು ಮೋಲ್ ತನ್ನ ಅದ್ಭುತ ಅಭಿನಯದಲ್ಲಿ ಉಗಿಯನ್ನು ಎತ್ತಿಕೊಂಡಾಗ ಸುತ್ತಲೂ ಕುಣಿಕೆಗಳನ್ನು ಓಡಿಸುವ ಅಕ್ಷರ ಕಟ್- as ಟ್‌ಗಳಾಗಿ ನಿಲ್ಲುತ್ತಾರೆ. <br /> <br /> ನಿಜವಾಗಿಯೂ, ಈ ಚಿತ್ರವು ಅದರ ಚಿತ್ರಣಕ್ಕೆ ಯೋಗ್ಯವಾಗಿದೆ ನಗ್ನತೆ, ಮತ್ತು ಬೆಟ್ಟಿ ಪುಟದ ಗ್ರೆಚೆನ್ ಮೋಲ್ ಅವರ ಅತ್ಯುತ್ತಮ ಪ್ರದರ್ಶನಕ್ಕಾಗಿ. ಉಳಿದಂತೆ ಸ್ವಲ್ಪ ಗೊಂದಲಮಯವಾಗಿದೆ ಮತ್ತು ಅದು ಇರಬೇಕು. ಕಥೆಯ ಮೂಲಕ ಸ್ಫೋಟಗೊಳ್ಳದೆ ಪೋಷಕ ಪಾತ್ರಗಳನ್ನು ಅಭಿವೃದ್ಧಿಪಡಿಸಲು ಹೆಚ್ಚಿನ ಕೆಲಸಗಳನ್ನು ಮಾಡಿದ್ದರೆ, ಈ ಚಿತ್ರವು ಹೆಚ್ಚು ಉತ್ತಮ ಜೀವನಚರಿತ್ರೆಯ ಚಿತ್ರವಾಗುತ್ತಿತ್ತು. ಇದು ನಿಂತಂತೆ, ನಟಿಯಾಗಿ ಮೋಲ್ ನಿಜವಾಗಿಯೂ ಜನಪ್ರಿಯತೆಯ ವಾಯುಮಂಡಲಕ್ಕೆ ಏರಲು ಕೇವಲ ಒಂದು ವಾಹನವಾಗಿದೆ. <br /> <br /> 7/10.#1
