ಗ್ರಿಂಚ್ ಕ್ರಿಸ್‌ಮಸ್ ಅನ್ನು ಹೇಗೆ ಕದ್ದಿದೆ ಎಂಬುದು ಯಾರಿಗಾದರೂ ಸುಲಭವಾಗಿ ಆನಂದಿಸಬಹುದಾದ ಅದ್ಭುತವಾದ ಚಿಕ್ಕ ಕ್ರಿಸ್‌ಮಸ್ ಕಾರ್ಟೂನ್ ಆಗಿತ್ತು, ರಿಮೇಕ್‌ಗೆ ಕಾರಣವನ್ನು ನಾನು ಎಂದಿಗೂ ನೋಡಲಿಲ್ಲ. ಮಾನವರೊಂದಿಗೆ ಮಾಡಿದ ರೀಮೇಕ್ ಅನ್ನು ನಮೂದಿಸಬಾರದು, ಕಾರ್ಟೂನ್ ಸಾಕಷ್ಟು ಪರಿಪೂರ್ಣವಾಗಿದೆ, ಈ ಚಿತ್ರದ ಉದ್ದೇಶವೇನು? ಆದರೆ ಜಿಮ್ ಕ್ಯಾರಿಯು ಗ್ರಿಂಚ್ ಆಗಿರುವುದು ಸ್ವಲ್ಪ ವಿಚಿತ್ರವೆನಿಸಿತು. ನನ್ನ ಪ್ರಕಾರ ಅವರು ಉತ್ತಮ ಹಾಸ್ಯ ನಟ, ಆದರೆ ಅವರನ್ನು ಗ್ರಿಂಚ್ ಆಗಿ? ಇದು ನನಗೆ ಯಾವುದೇ ಅರ್ಥವಾಗಲಿಲ್ಲ. ಅವರ ಅಭಿನಯವು ಮೇಲಿಂದ ಮೇಲೆ ಮತ್ತು ಉದ್ದೇಶಪೂರ್ವಕವಾಗಿ ಕ್ಷಣಗಳಲ್ಲಿ ನಕ್ಕಿತು. ಸೇರಿಸಿದ ಕೆಲವು ಸಂವಾದವು ಸ್ವಲ್ಪ ಬಾಲಿಶ ಮತ್ತು ಆನಂದದಾಯಕವಲ್ಲ ಎಂದು ನಮೂದಿಸಬಾರದು. ಗ್ರಿಂಚ್ ಮತ್ತು ಸಿಂಡಿ ಲೌ-ಹೂ ಅವರ ಸಂಪೂರ್ಣ ಕಥೆ ಮುಗಿದಿದೆ ಮತ್ತು ಅಗತ್ಯವಿಲ್ಲ. ಅವರು ನಿಜವಾಗಿಯೂ ಕಥೆಯನ್ನು, ಅವಧಿಯನ್ನು ನಾಶಪಡಿಸಿದ್ದಾರೆ. <br /> <br /> ವೊವಿಲ್ಲೆಯಲ್ಲಿರುವವರೆಲ್ಲರೂ ತಮ್ಮ ಅತ್ಯುತ್ತಮ ಕ್ರಿಸ್‌ಮಸ್ for ತುವಿಗೆ ತಯಾರಾಗುತ್ತಿದ್ದಾರೆ, ಆದರೆ ಎಲ್ಲವೂ ಸಂಪೂರ್ಣವಾಗಿ ಹೋಗಲು ಉದ್ದೇಶಿಸಲಾಗಿದೆ. ಆದರೆ ಸಿಂಡಿ ಲೌ-ಹೂ ಅವರ ಮೇಲೆ ವಾಸಿಸುವ ಗ್ರಿಂಚ್ ಬಗ್ಗೆ ಕುತೂಹಲ ಮತ್ತು ಆತಂಕದಲ್ಲಿದ್ದಾನೆ ಮತ್ತು ಅವನು ಕ್ರಿಸ್‌ಮಸ್‌ನಷ್ಟು ಒಳ್ಳೆಯದನ್ನು ಇತರರಂತೆ ಪಡೆಯುವುದಿಲ್ಲ. ಅವನು ಅವಳನ್ನು ಹೊರಹಾಕುತ್ತಾನೆ ಮತ್ತು ಈ ವರ್ಷ ಕ್ರಿಸ್‌ಮಸ್ ಬೇಡವೆಂದು ನಿರ್ಧರಿಸುತ್ತಾನೆ ಮತ್ತು ವಾಸ್ತವವಾಗಿ ಅವನು ಕ್ರಿಸ್‌ಮಸ್‌ನ ಎಲ್ಲ ಆವೃತ್ತಿಯ ಬಗ್ಗೆ ಯಾರೆಂದು ತೋರಿಸಲು ಅವನು ಒಟ್ಟಿಗೆ ಕ್ರಿಸ್‌ಮಸ್ ಅನ್ನು ಕದಿಯಬೇಕು. ಆದರೆ ಕ್ರಿಸ್‌ಮಸ್‌ನ ವಸ್ತುನಿಷ್ಠ ಆವೃತ್ತಿಗಿಂತ ಸ್ವಲ್ಪ ಹೆಚ್ಚು ಎಂದು ಯಾರು ತಿಳಿದಿರಬಹುದು ಎಂದು ಅವರು ಶೀಘ್ರದಲ್ಲೇ ಅರಿತುಕೊಳ್ಳುತ್ತಾರೆ. <br /> <br /> ಗ್ರಿಂಚ್ ಕ್ರಿಸ್‌ಮಸ್ ಅನ್ನು ಹೇಗೆ ಕದ್ದಿದ್ದಾರೆ ಮತ್ತು ಅದು ಸ್ವಲ್ಪಮಟ್ಟಿಗೆ ಮೇಲಿತ್ತು. ನನ್ನ ಅಭಿಪ್ರಾಯದಲ್ಲಿ, ಇದು ಬಹಳ ಗೊಂದಲದ ಆವೃತ್ತಿಯಾಗಿದೆ ಎಂಬ ಸರಳ ಸಂಗತಿಗಾಗಿ ನೀವು ಕಾರ್ಟೂನ್‌ನೊಂದಿಗೆ ಅಂಟಿಕೊಳ್ಳಬೇಕೆಂದು ನಾನು ನಿಜವಾಗಿಯೂ ಶಿಫಾರಸು ಮಾಡುತ್ತೇವೆ. ಇಡೀ ಚಿತ್ರದ ಮೇಕಪ್ ಮತ್ತು ಪ್ರಸ್ತುತಿ ಸ್ವಲ್ಪ ಮುಗಿದಿದೆ, ಗ್ರಿಂಚ್ ಕ್ರಿಸ್‌ಮಸ್ ಅನ್ನು ಹೇಗೆ ಕದ್ದಿದ್ದಾರೆಂದು ನಮೂದಿಸಬಾರದು! ಜಿಮ್ ಕ್ಯಾರಿ ನಟಿಸಿದ ಆವೃತ್ತಿಯ ಬದಲು ವ್ಯಂಗ್ಯಚಿತ್ರದಂತೆ ಹೆಚ್ಚು ಅರ್ಥೈಸಲಾಗಿತ್ತು. ಆದರೆ ಕನಿಷ್ಠ ಈ ಆವೃತ್ತಿಯು ಪ್ರತಿ ಕ್ರಿಸ್‌ಮಸ್‌ನಲ್ಲಿ ಆಡುವ ಬೋರಿಸ್ ಕಾರ್ಲೋಫ್ ಆವೃತ್ತಿಗೆ ಕೃತಜ್ಞರಾಗಿರಬೇಕು. <br /> <br /> 1/10#0
ನಾನು ಸ್ಟೀಫನ್ ಕಿಂಗ್ ಅವರ ಪುಸ್ತಕಗಳನ್ನು ಆಧರಿಸಿದ ಹೆಚ್ಚಿನ ಚಲನಚಿತ್ರಗಳ ಸಾಕಷ್ಟು ದೊಡ್ಡ ಅಭಿಮಾನಿಯಾಗಿದ್ದೇನೆ - ಇದು ಭಯಾನಕ ಮತ್ತು ಸ್ಮರಣೀಯವಾದದ್ದು ಎಂದು ರೇಟ್ ಮಾಡಿದೆ. <br /> <br /> ನಾನು ಅದನ್ನು ಹತ್ತನೇ ಒಂದು ಭಾಗದವರೆಗೆ ಮರುಪರಿಶೀಲಿಸುವುದನ್ನು ಮುಗಿಸಿದ್ದೇನೆ ಸಮಯ ಮತ್ತು ನಾನು ಇನ್ನೂ ಹೃದಯ ಕದಡುವ ಮತ್ತು ಭಯಾನಕವಾಗಿದೆ. <br /> <br /> ಗೇಜ್ ದೈತ್ಯಾಕಾರದ ಟ್ರಕ್‌ನೊಂದಿಗೆ ಖಚಿತವಾಗಿ ಘರ್ಷಣೆಯ ಹಾದಿಯಲ್ಲಿರುವ ದೃಶ್ಯವು ಎದ್ದು ಕಾಣುತ್ತದೆ. ಮತ್ತು ಕೊನೆಯಲ್ಲಿ ಸ್ವಲ್ಪ ಮೈಕೊ ಹ್ಯೂಸ್ ಉಚ್ಚರಿಸಿದ "ನ್ಯಾಯೋಚಿತವಲ್ಲ" ಎಂಬುದು ತೇಜಸ್ಸಿನ ಸ್ಪರ್ಶವಾಗಿದೆ. <br /> <br />#1
ಈ ಚಲನಚಿತ್ರದ ಬಗ್ಗೆ ಏನು ಇಷ್ಟಪಡಬಾರದು? ಪ್ರತಿ ವರ್ಷ ನೀವು ಕ್ರಿಸ್‌ಮಸ್ ಸಮಯದಲ್ಲಿ ಒಂದು ಅಥವಾ ಎರಡು ಯೂಲ್ ಉಬ್ಬರವಿಳಿತದ ಚಲನಚಿತ್ರಗಳನ್ನು ಪಡೆಯಲಿದ್ದೀರಿ ಮತ್ತು ಅವುಗಳಲ್ಲಿ ಹೆಚ್ಚಿನವು ಭಯಾನಕವಾಗಲಿವೆ ಎಂದು ನಿಮಗೆ ತಿಳಿದಿದೆ. ಈ ಚಲನಚಿತ್ರವು ಖಂಡಿತವಾಗಿಯೂ ಹೊಸ ಹೊಸ ಆಲೋಚನೆಯಾಗಿದ್ದು ಅದನ್ನು ಚೆನ್ನಾಗಿ ಎಳೆಯಲಾಗಿದೆ. ಶ್ರೀಮಂತ ಯುವಕನಿಗೆ ನಿಜವಾದ ಕ್ರಿಸ್‌ಮಸ್ ಅನ್ನು ಅನುಕರಿಸಲು ಕುಟುಂಬವನ್ನು ಪಾವತಿಸುವ ತಮಾಷೆಯ ಟೇಕ್. ನೀವು ಅದರೊಂದಿಗೆ ಮೋಜಿನ ಕೆಲಸಗಳನ್ನು ಮಾಡಲು ಸಾಧ್ಯವಾಗದಿದ್ದರೆ ಅಂತಹ ಹಣವನ್ನು ಹೊಂದಲು ಏನು ಒಳ್ಳೆಯದು. ಇದು ಗೆಲುವು-ಗೆಲುವಿನ ಪರಿಸ್ಥಿತಿ. ಸಾಮಾನ್ಯ ಕುಟುಂಬವು ಆರು ಅಂಕಿಗಳನ್ನು ಪಡೆಯುತ್ತದೆ ಮತ್ತು ಶ್ರೀಮಂತ ವ್ಯಕ್ತಿ ಕ್ರಿಸ್‌ಮಸ್ ಅನ್ನು ಅವನು .ಹಿಸಿದಂತೆ ಅನುಭವಿಸುತ್ತಾನೆ. ಒಂದು ವೇಳೆ ಮಾತ್ರ. ಇದು ಒಂದು ಮೋಜಿನ ಮತ್ತು ತಮಾಷೆಯ ಚಲನಚಿತ್ರವಾಗಿತ್ತು.#1
ಈ ಬಿಡ್-ಬಜೆಟ್ ಉತ್ಪಾದನೆಯ ography ಾಯಾಗ್ರಹಣ ಆಶ್ಚರ್ಯಕರವಾಗಿ ಕೆಟ್ಟದ್ದಾಗಿದೆ. ಬಣ್ಣಗಳು ಕೆಸರು ಮತ್ತು ಕಂದು ಬಣ್ಣದ್ದಾಗಿರುತ್ತವೆ ಮತ್ತು ography ಾಯಾಗ್ರಹಣವು 80 80 ನೋಟವನ್ನು ಹೊಂದಿದೆ. ನಿರ್ದೇಶನ ಮತ್ತು ಸಂಪಾದನೆ ಸಾಮಾನ್ಯವಾಗಿ ಸಾಕಷ್ಟು ಉತ್ಸಾಹವಿಲ್ಲದ ಮತ್ತು ಟಿವಿ-ಚಲನಚಿತ್ರದಂತೆಯೂ ಸಹ. * ಮತ್ತು * ಮೊದಲಿಗೆ ಚಲನಚಿತ್ರವು ತನ್ನ ವೀಕ್ಷಕರನ್ನು ಲೈಂಗಿಕ ಮತ್ತು ಹಿಂಸಾಚಾರದ ಚಿತ್ರಗಳೊಂದಿಗೆ ಚಿತ್ರಹಿಂಸೆ ನೀಡಲು ಬಯಸುತ್ತದೆ. ಹ್ಯಾನ್ಸ್ mer ಿಮ್ಮರ್ ಅವರ ಸ್ಕೋರ್ ಈ ಅತಿಯಾದ, ಪ್ರತಿಭಾನ್ವಿತ ಸಂಯೋಜಕರ ವಿಶಿಷ್ಟ ಮತ್ತು ಸರಳವಾದ ಕೆಲಸವಾಗಿದೆ. <br /> <br /> ಆದರೆ ನೀವು ಚಲನಚಿತ್ರವನ್ನು ಮತ್ತಷ್ಟು ನೋಡಲು ಸಿದ್ಧರಿದ್ದರೆ ನಿಮಗೆ ಬಹಳ ಚಲಿಸುವ ಕುಟುಂಬ ಕಥೆ, ಒಂದು ರೀತಿಯ ಯುರೋಪಿಯನ್ ಎಡ್ನಾ ಫೆರ್ಬರ್ ಅವರ ಕುಟುಂಬ ಎಪೋಸ್ ಜೈಂಟ್ನ ಆವೃತ್ತಿ. ಕ್ಲಾರಾ ಈ ಮೂರ್ಖ ವ್ಯಕ್ತಿಯನ್ನು ಏಕೆ ಮದುವೆಯಾದನೆಂದು ಮೊದಲಿಗೆ ನೀವು ಆಶ್ಚರ್ಯ ಪಡುತ್ತೀರಿ, ಅವನ ಪಾತ್ರವು ಹೆಚ್ಚು ಆಳವನ್ನು ಪಡೆಯುತ್ತದೆ ಮತ್ತು ಹೆಚ್ಚು ಹಿನ್ನೆಲೆ ಪಡೆಯುತ್ತದೆ. ಕ್ಲಾರಾ ಚಲನಚಿತ್ರದ ಆಧ್ಯಾತ್ಮಿಕ ಪಾಠವನ್ನು ನೀಡುತ್ತಾಳೆ, ತನ್ನ ದೇಶದಲ್ಲಿನ ಭಯಾನಕ ಘಟನೆಗಳ ವಿರುದ್ಧದ ಒಂದು ದೊಡ್ಡ ಮತ್ತು ಚಲಿಸುವ ಹೇಳಿಕೆ. ಅವರ ಅಂತರರಾಷ್ಟ್ರೀಯ ವೃತ್ತಿಜೀವನದ ಆರಂಭದಲ್ಲಿ ಯುವ ಆಂಟೋನಿಯೊ ಬಾಂಡೆರಾಸ್ ಅವರ ಪ್ರೇಮಿ ಅವರ ಮಗಳು ಆ ಪಾಠವನ್ನು ಅರ್ಥಮಾಡಿಕೊಂಡಳು ಮತ್ತು ಅಂತಿಮವಾಗಿ ಅದರಿಂದ ಬದುಕಲು ಪ್ರಯತ್ನಿಸುತ್ತಾಳೆ. ಆರಂಭವನ್ನು ಪ್ರತಿಬಿಂಬಿಸುವ ಅಂತ್ಯದೊಂದಿಗೆ ಕಥಾವಸ್ತುವನ್ನು ನಿರ್ಮಿಸಿದ ರೀತಿ ಅದ್ಭುತವಾಗಿದೆ. ನಟರೆಲ್ಲರೂ ದೊಡ್ಡ ಕೆಲಸ ಮಾಡುತ್ತಾರೆ. ನಾನು "ಬ್ಲಾಂಕಾ ಪಾತ್ರದಲ್ಲಿ ನಟಿಸುವ ನಟಿ ಯಾರು?" ಸಾರ್ವಕಾಲಿಕ, ಆದರೆ ಸಹಜವಾಗಿ, ಇದು ನಿಜವಾಗಿಯೂ ಯುವ ವಿನೋನಾ ರೈಡರ್! <br /> <br /> ಒಟ್ಟಾರೆಯಾಗಿ, ಈ ಚಲನಚಿತ್ರವು ನಿಜವಾಗಿಯೂ ಪುಸ್ತಕವನ್ನು ಓದುವಂತೆ ಮಾಡಿದೆ.#1
ನಾನು ಇದನ್ನು ಹೇಳಲು ಕಾರಣವೆಂದರೆ ನಾನು ಚಿತ್ರಕಥೆಯನ್ನು ಬರೆದಿದ್ದೇನೆ ಮತ್ತು ಚಿತ್ರವನ್ನು ನೋಡಲು ಕೇಳುವವರೆಗೂ ಅದರ ಬಗ್ಗೆ ಬಹಳ ಕಡಿಮೆ ತಿಳಿದಿತ್ತು. ನನಗೆ ಹೇಳದೆ ಅದನ್ನು ಮಾರಾಟ ಮಾಡಿದ ಕೆಲವು ನಿರ್ಮಾಪಕರಿಗೆ ನಾನು ಬರೆದಿದ್ದೇನೆ. ಅಲನ್ ಡೋಬಿ ನನ್ನ ಸ್ನೇಹಿತನಾಗಿದ್ದರಿಂದ, ನಾನು ಅದರ ಬಗ್ಗೆ ಕೇಳಬೇಕಾಯಿತು. ನಾನು ಮೊದಲ ಡ್ರಾಫ್ಟ್ ಅನ್ನು ಮಾತ್ರ ಬರೆದಿದ್ದೇನೆ ಆದ್ದರಿಂದ ಅದು ನೆಲದ ಮೇಲೆ ಇದೆ ಎಂದು ಕೇಳಿದಾಗ ನನಗೆ ಅರ್ಥವಾಗುವಂತೆ ಆತಂಕವಾಯಿತು. ನಾನು ಪೀಟರ್ ಕಾಲಿನ್ಸನ್ ಅವರನ್ನು ನನ್ನ ದಳ್ಳಾಲಿ ಮೂಲಕ ಕೇಳಿದೆ, ಅವನು ಇನ್ನೊಂದು ಕರಡು ಮಾಡಲು ನಾನು ಇಷ್ಟಪಡುತ್ತೀಯಾ ಎಂದು. ನನ್ನ ಮೂಲ ಸ್ಕ್ರಿಪ್ಟ್ ಅನ್ನು ನಾನು ಕಳೆದುಕೊಂಡಿರುವುದರಿಂದ ಅದನ್ನು ನೋಡಬಹುದೇ ಎಂದು ನಾನು ಕೇಳಿದೆ. ನನಗೆ ತಡವಾಗಿ ಹೇಳಲಾಯಿತು. ಹಾಗಾಗಿ ಸಂದರ್ಭಗಳಲ್ಲಿ ನಾನು ಮಾಡಬಹುದಾದ ಏಕೈಕ ಕೆಲಸವನ್ನು ನಾನು ಮಾಡಿದ್ದೇನೆ ಮತ್ತು ನನ್ನ ಹೆಸರನ್ನು ತೆಗೆದುಕೊಂಡೆ. ನನ್ನ ಚಿತ್ರಕಥೆಗೆ ಅವರು ಏನು ಮಾಡಿರಬಹುದು ಎಂದು ನನಗೆ ತಿಳಿದಿರಲಿಲ್ಲ. ನಂತರ ಮುಗಿದ ಚಿತ್ರ ನೋಡಲು ನನ್ನನ್ನು ಆಹ್ವಾನಿಸಲಾಯಿತು. ನಾನು ತುಂಬಾ ಪ್ರಭಾವಿತನಾಗಿದ್ದೇನೆ ಮತ್ತು ನನ್ನ ಹೆಸರನ್ನು ಮತ್ತೆ ಹಾಕಬೇಕೆಂದು ನಾನು ಬೇಗನೆ ಕೇಳಿದೆ. ಇದು ಸುಂದರವಾಗಿ ತಯಾರಿಸಿದ ತುಣುಕು, ಅವಸರದಿಂದ ಬರೆದ ಮೊದಲ ಡ್ರಾಫ್ಟ್‌ನಿಂದ, ಅದರ ಮೇಲೆ ಹೆಚ್ಚಿನ ಕೆಲಸ ಮಾಡಲು ಕೇಳಲಾಗುವುದು ಎಂದು ನಾನು ನಿರೀಕ್ಷಿಸಿದೆ; ಬಹುಶಃ ನಾನು ಹೊಂದಿದ್ದರೆ ಅದು ತುಂಬಾ ಒಳ್ಳೆಯದಲ್ಲ. ನನ್ನ ಮೂಲ ಸ್ಕ್ರಿಪ್ಟ್ ಎಲ್ಲಿದೆ ಎಂದು ಯಾರಿಗಾದರೂ ತಿಳಿದಿದ್ದರೆ ಅದನ್ನು ಮತ್ತೆ ನೋಡಲು ನಾನು ಇಷ್ಟಪಡುತ್ತೇನೆ? ನಾನು ಮತ್ತೆ ಚಿತ್ರವನ್ನು ನೋಡಲು ಇಷ್ಟಪಡುತ್ತೇನೆ, ಸೋಹೋದಲ್ಲಿನ ಸ್ವಲ್ಪ ವೀಕ್ಷಣೆ ರಂಗಮಂದಿರದಲ್ಲಿ ಒಮ್ಮೆ ಮಾತ್ರ ನೋಡಿದ್ದೇನೆ.#1
ಕಡಿಮೆ ರೇಟಿಂಗ್‌ನ ಹೊರತಾಗಿಯೂ ನೋಡುವುದಕ್ಕಿಂತ ಹೆಚ್ಚಿನದಾಗಿದೆ ಎಂಬ ಚಿತ್ರಕ್ಕೆ ಇದು ಉತ್ತಮ ಉದಾಹರಣೆಯಾಗಿದೆ. ಕಥೆ ಆಕರ್ಷಕವಾಗಿದೆ ಮತ್ತು ನಿಕೋಲ್ ಕಿಡ್ಮನ್ ಮತ್ತು ಬೆನ್ ಚಾಪ್ಲಿನ್ ನಡುವಿನ ರಸಾಯನಶಾಸ್ತ್ರವು ನಿಮ್ಮ ಗಮನವನ್ನು ಸೆಳೆಯಲು ಹೆಚ್ಚು ಸಮಯ ತೆಗೆದುಕೊಳ್ಳುವುದಿಲ್ಲ. ನಟನೆ ಪ್ರಥಮ ದರ್ಜೆ ಮತ್ತು ಪಾತ್ರಗಳನ್ನು ಚೆನ್ನಾಗಿ ನಿರೂಪಿಸಲಾಗಿದೆ. ನಾಟಕ ಮತ್ತು ರೊಮ್ಯಾಂಟಿಕ್ ಹಾಸ್ಯದ ನಡುವೆ ನಿರ್ದೇಶಕರು ತಮ್ಮನ್ನು ನಿರ್ಧರಿಸಲು ಸಾಧ್ಯವಿಲ್ಲ ಎಂದು ಕೆಲವೊಮ್ಮೆ ಅನಿಸುತ್ತದೆ. ಬೆನ್ ಚಿಲ್ಲರ್ ಅವರ ಕಾನೂನು ಪಾಲನೆ ಮತ್ತು ನಾಚಿಕೆಪಡುವ ಇಂಗ್ಲಿಷ್‌ನ ಅಶ್ಲೀಲ ಎಸ್.ಎಂ. ಮಲಗುವ ಕೋಣೆಯಲ್ಲಿ ಮರೆಮಾಡಲಾಗಿರುವ ನಿಯತಕಾಲಿಕೆಗಳು ನಗುವಿಗೆ ಸಾಕಷ್ಟು ಕ್ಷಣಗಳನ್ನು ಸೃಷ್ಟಿಸುತ್ತವೆ! ದೀರ್ಘಕಾಲದವರೆಗೆ ಜಾನ್‌ಗೆ ತನ್ನ ಮೊದಲ ಅನ್ಯೋನ್ಯತೆಯ ರುಚಿಯನ್ನು ನೀಡುತ್ತಿರುವಾಗ ನಿಕೋಲ್ ಕಿಡ್‌ಮನ್‌ನ ದೃಷ್ಟಿಯಲ್ಲಿರುವ ನೋಟದಂತೆ ... ಇತರ ಸಮಯಗಳಲ್ಲಿ ನಟರು ಮತ್ತು ವಿಶೇಷವಾಗಿ ನಿಕೋಲ್ ಕಿಡ್‌ಮನ್ ಈ ಹಾಸ್ಯವನ್ನು ಸಾಕಷ್ಟು ಕೌಶಲ್ಯದಿಂದ ನಾಟಕೀಯ ಓರೆಯಾಗಿ ನೀಡುತ್ತಾರೆ.#1
ಪ್ರಮುಖ ವಕೀಲ ವಾಲ್ಟರ್ ಪಿಡ್ಗಾನ್ ಕೊಲೆ ಪ್ರಕರಣವನ್ನು ಪರವಾಗಿ ತೆಗೆದುಕೊಳ್ಳುತ್ತಾನೆ, ಖುಲಾಸೆಗೊಳಿಸುತ್ತಾನೆ ಮತ್ತು ಅವನ ಕ್ಲೈಂಟ್ (ಕೀಫೆ ಬ್ರಾಸೆಲ್) ತಪ್ಪಿತಸ್ಥನೆಂದು ಕಂಡುಹಿಡಿದನು ಆದರೆ ಸುಲಿಗೆ ಉಂಗುರದ ಒಂದು ಭಾಗವು ನಗರದ ಅತ್ಯುನ್ನತ ಸ್ಥಾನಗಳಿಗೆ ತಲುಪುತ್ತದೆ. ತನ್ನದೇ ಆದ ಜಟಿಲತೆಯಿಂದ ಆತಂಕಕ್ಕೊಳಗಾದ ಅವನು ತನಿಖೆಯನ್ನು ಕೈಗೊಳ್ಳುತ್ತಾನೆ, ಸಿಂಡಿಕೇಟ್‌ನ ಮುಖ್ಯಸ್ಥನಾಗಿರುವ "ಅಪರಿಚಿತ ವ್ಯಕ್ತಿ" ಯ ಗುರುತಿನ ಮೇಲೆ ಎಡವಿ ಅವನನ್ನು ಕೊಲೆ ಮಾಡುತ್ತಾನೆ. <br /> <br /> ಬ್ರಾಸೆಲ್ಲೆ ಈ ಎರಡನೆಯ ಕೊಲೆ ಆರೋಪ ಹೊರಿಸಿದಾಗ ವಿಪರ್ಯಾಸಗಳು ತೊಡಗುತ್ತವೆ ಪಿಡ್ಜನ್ ಇನ್ನೊಬ್ಬ "ಅಪರಿಚಿತ ಮನುಷ್ಯ" ನ ಅಸ್ತಿತ್ವವನ್ನು ಸೂಚಿಸುವ ಮೂಲಕ ಅವನನ್ನು ರಕ್ಷಿಸಬೇಕು - ಸ್ವತಃ. ನಗರ ಗ್ರಿಟ್‌ನಿಂದ ಸ್ವಲ್ಪ ಕಡಿಮೆ ಮತ್ತು ವಾಕ್ಚಾತುರ್ಯದ ದೀರ್ಘವಾಗಿದ್ದರೂ, ಯುದ್ಧಾನಂತರದ ವರ್ಷಗಳಲ್ಲಿ ಬೆಳಕಿಗೆ ಬಂದ ಅಮೇರಿಕನ್ ಮುನ್ಸಿಪಲ್ ರಾಜಕಾರಣದ ವ್ಯಾಪಕ ಭ್ರಷ್ಟಾಚಾರದ ಅಂಗೀಕಾರಕ್ಕಿಂತ ಅಜ್ಞಾತ ಮನುಷ್ಯ ಶೈಲಿ ಅಥವಾ ರಚನೆಯಿಂದ ಕಡಿಮೆ ನಾಯ್ರ್ ಚಕ್ರಕ್ಕೆ ಸೇರಿದವನು.#1
ನಾನು ಇಷ್ಟಪಟ್ಟ ಈ ಚಿತ್ರದ ಬಗ್ಗೆ ಏನೂ ಇರಲಿಲ್ಲ. ಕೆಟ್ಟ ಬೆಳಕು ಮತ್ತು ಕ್ಯಾಮೆರಾ ಕೆಲಸಗಳೊಂದಿಗೆ ಇದು ಸ್ಪಷ್ಟವಾಗಿ ಕಡಿಮೆ-ಬಜೆಟ್ ಆಗಿತ್ತು (ಬಹುತೇಕ ಬ್ಲೇರ್ ವಿಚ್ ಪ್ರಾಜೆಕ್ಟ್ನಂತೆ, ಅದು ಮಾತ್ರ ಆ ರೀತಿ ಇರಬಾರದು). ಕಥಾವಸ್ತುವಿಗೆ ನಿಜವಾಗಿಯೂ ಹೆಚ್ಚು ಇರಲಿಲ್ಲ, ಮತ್ತು ಚಲನಚಿತ್ರವು ಕೇವಲ drug ಷಧಿ ಮತ್ತು ಆನ್ ಆಗಿದೆ. ಕೊನೆಯ 1/3 ಚಲನಚಿತ್ರಗಳ ಮೂಲಕ ನಾನು ನಿಜವಾಗಿಯೂ ವೇಗವಾಗಿ ಫಾರ್ವರ್ಡ್ ಮಾಡಿದ್ದೇನೆ, ಆದರೆ ಅದು ಹೆಚ್ಚು ವಿಷಯಗಳಿಗೆ ಸಹಾಯ ಮಾಡಲಿಲ್ಲ. ಇದು ಪೆಟ್ಟಿಗೆಯಿಂದ ಉತ್ತಮವಾಗಿರಬಹುದು ಎಂದು ತೋರುತ್ತಿದೆ, ಆದರೆ ನಾನು ಮತ್ತೆ ಹೇಳಲೇಬೇಕು: ಈ ಚಲನಚಿತ್ರದ ಬಗ್ಗೆ ಏನೂ ಒಳ್ಳೆಯದನ್ನು ಹೋಲುವಂತಿಲ್ಲ. ಒಳ್ಳೆಯ ನಟರಿಲ್ಲ, ವಿಶೇಷ ಪರಿಣಾಮಗಳು ತುಂಬಾ ನಕಲಿ, ಕ್ಯಾಮೆರಾ ಕೆಲಸ ಭಯಾನಕ ಮತ್ತು ಸಂಭಾಷಣೆ ನೋವಿನಿಂದ ಭೀಕರವಾಗಿತ್ತು. ನನ್ನ ಸ್ವಂತ ಪ್ರಮಾಣದಲ್ಲಿ, ನಾನು ಈ ಚಲನಚಿತ್ರವನ್ನು 10 ರಲ್ಲಿ 0 ನೀಡುತ್ತೇನೆ. ಅಯ್ಯೋ!#0
ನಾನು ಮೊದಲ ಎರಡು for ತುಗಳಲ್ಲಿ ಅಪ್ರೆಂಟಿಸ್ ಅನ್ನು ಇಷ್ಟಪಟ್ಟೆ. <br /> <br /> ಆದರೆ ಈಗ 5 ನೇ with ತುವಿನೊಂದಿಗೆ? (ಅಥವಾ 6? ನೀವು ಕೆಲಸ ಮಾಡುತ್ತಿರುವ ತನ್ನ ಕಂಪನಿಗೆ ಅನುಮತಿ ನೀಡಿದ್ದೀರಿ, ಆದರೆ ಬನ್ನಿ! ಕೆಲವು ವಿಷಯಗಳು "ನೀವು ಫೈರ್ಡ್" ಕೇವಲ ಅವಮಾನಕರವಾಗಿದೆ ಎಂದು ಹೇಳುತ್ತದೆ. <br /> <br /> ಪ್ರದರ್ಶನವನ್ನು ನೋಡಿದ ನಂತರ, ನಾನು ಅವನಿಗೆ ಕೆಲಸ ಮಾಡಲು ಬಯಸುವುದಿಲ್ಲ. ಅವನು ಸೊಕ್ಕಿನ, ಆಡಂಬರದ ಅಥವಾ ಅಂತಹವನಲ್ಲ. ಪ್ರದರ್ಶನವು ಅವಾಸ್ತವಿಕವಾಗಿದೆ ಮತ್ತು ಅವನು ವಿಷಯಗಳನ್ನು ನಿಭಾಯಿಸುವ ವಿಧಾನವು ನನ್ನನ್ನು ಕಠಿಣಗೊಳಿಸುತ್ತದೆ. ಉತ್ತಮ ಮನರಂಜನೆ? ಹೌದು, ಆದರೆ ಬೆನ್ನಿನ ಇರಿತವು ತುಂಬಾ ಆಯಾಸಗೊಳ್ಳುತ್ತದೆ .. ಅದು ತಂಡದ ಕೆಲಸವಲ್ಲ, ಅದು ವೈಯಕ್ತಿಕವಲ್ಲ, ಕೇವಲ ವ್ಯವಹಾರವಾಗಿದೆ. ನಿಮ್ಮ ಹಿಂದಿನ ಜ್ಯಾಕ್ ವೀಕ್ಷಿಸಿ.#0
ದಿ ಪೇಟ್ರಿಯಾಟ್ ಅನ್ನು ನಿಖರವೆಂದು ಕಾಮೆಂಟ್ ಮಾಡಿದವರಿಗೆ, (ಇದು ಮೂಲತಃ ಇಂಗ್ಲಿಷ್ ಅನ್ನು ಸೈತಾನಗೊಳಿಸಿತು), ಈ ಚಿತ್ರವನ್ನು ನೋಡಲು ಆಸಕ್ತಿದಾಯಕವಾಗಿದೆ. ಎಲ್ಲಾ ಖಾತೆಗಳ ಪ್ರಕಾರ ಇದು ಅಮೆರಿಕನ್ನರು ಇದುವರೆಗೆ ನಡೆಸಿದ ರಕ್ತಪಾತದ ಯುದ್ಧ, ಮತ್ತು ಅವರು ಪ್ರಸ್ತುತ ರಾಷ್ಟ್ರೀಯತೆ ಮಾತ್ರ. ಆದ್ದರಿಂದ ಅಟ್ಲಾಂಟಿಕ್‌ನ ಆ ಕಡೆಯಿಂದ ಬರುವ ಐತಿಹಾಸಿಕ ನಿಖರತೆಯನ್ನು ಹೋಲುವಂತಹದ್ದನ್ನು ನೋಡುವುದು ತುಂಬಾ ಉಲ್ಲಾಸಕರವಾಗಿತ್ತು, ಅದು ಅಮೆರಿಕವನ್ನು ಹುತಾತ್ಮರು ಅಥವಾ ರಕ್ಷಕರು ಎಂದು ಚಿತ್ರಿಸಲಿಲ್ಲ. ಒಟ್ಟಾರೆಯಾಗಿ ಈ ಚಿತ್ರವು ಮನೆಗೆ ತಂದದ್ದು ಯಾವುದೇ ಸಂಘರ್ಷದ ನಿಜವಾದ ಭಯಾನಕತೆ, ಮತ್ತು ಯುದ್ಧದಲ್ಲಿ ಯಾವುದೇ ಕೃತ್ಯಗಳು ಹೇಗೆ ಕೆಟ್ಟ ಕೃತ್ಯಗಳನ್ನು ಮಾತ್ರ ಬೆಳೆಸುತ್ತವೆ, ಆಗಾಗ್ಗೆ ಮುಗ್ಧರ ದುಃಖದಲ್ಲಿ ಪರಾಕಾಷ್ಠೆಯಾಗುತ್ತವೆ. ಇದು ನೀವು ಯಾರನ್ನೂ ಹುರಿದುಂಬಿಸಿದ ಚಿತ್ರವಲ್ಲ ಆದರೆ ಎಲ್ಲರೂ ಕರುಣೆ ಮತ್ತು ಅಸಹ್ಯ ವ್ಯಕ್ತಪಡಿಸಿದರು.#1
